Page ID,Page name,Disclaimer,Amount spent (USD)
421104621589691,Cristian Flores,Presidencia de la República de El Salvador,≤100
162379173778716,Alcaldía de San Salvador,Alcaldía de San Salvador,≤100
167878593236712,UNICEF en español,UNICEF con créditos publicitarios de Facebook,≤100
643513979193133,Unidos por Beatriz,Neuma,≤100
100863028914298,Unidad Sindical Salvadoreña,These ads ran without a disclaimer,≤100
68793499001,UNICEF,UNICEF with Facebook Ad Credits,≤100
2352061638400121,JAAM Producciones,Avalos Monge Jose Atilio,≤100
166178460072395,اليونيسف بالعربية - UNICEF in Arabic,اليونيسف باستخدام اعتمادات الإعلان على الفيسبوك,≤100
108213030904997,Ricardo Rivas,Ricardo Rivas,≤100
385385178182941,SIGNUS Ecovalor,These ads ran without a disclaimer,≤100