Page ID,Page name,Disclaimer,Amount spent (VND)
105845511087981,TRUYỀN HÌNH AN VIÊN,TRUYỀN HÌNH AN VIÊN,5050
104640271243082,Bách Hóa Ăn Dặm,Bách Hóa Ăn Dặm,3141
109432751532773,Lương Y Phạm Văn Thanh 166 Hàm Nghi Lào Cai,These ads ran without a disclaimer,2265
105062615490802,Thượng Tọa Thích Đức Thiện,Thượng Tọa Thích Đức Thiện,1053
117399794624246,Đầu Tư Thông Minh,These ads ran without a disclaimer,780
919479674872321,Báo Nghệ An,Báo Nghệ An,125
1635246696802970,Tuyển sinh trong nước và lao động,These ads ran without a disclaimer,≤100
101865258169428,ĐEN Secondhand,ĐEN Secondhand,≤100
100538306165371,Chìa Khóa Dẫn Đến Thành Công,These ads ran without a disclaimer,≤100