Page ID,Page name,Disclaimer,Amount spent (VND)
101071576108959,An Viên Hà Nội - Chuyên Khoa Suy Giãn Tĩnh Mạch Hàng Đầu Việt Nam,These ads ran without a disclaimer,9144
111831663772285,BOMvn,BOMvn,3287
105845511087981,TRUYỀN HÌNH AN VIÊN,TRUYỀN HÌNH AN VIÊN,1840
919479674872321,Báo Nghệ An,Báo Nghệ An,465
105062615490802,Thượng Tọa Thích Đức Thiện,Thượng Tọa Thích Đức Thiện,451
104640271243082,Bách Hóa Ăn Dặm,Bách Hóa Ăn Dặm,167
1813090249021573,Nguyễn Trọng Quỳnh,These ads ran without a disclaimer,124
101865258169428,ĐEN Secondhand,ĐEN Secondhand,≤100