Page ID,Page name,Disclaimer,Amount spent (USD)
274141766381712,Conseil National de la Transition GN,Conseil National de la Transition GN,≤100
222308671116355,International Higher Education Teaching and Learning Association,These ads ran without a disclaimer,≤100
1107005629310630,American English for Educators,These ads ran without a disclaimer,≤100
1773120186304678,ESC Mali School Of Management,These ads ran without a disclaimer,≤100
109452985104987,Officialjombo1,These ads ran without a disclaimer,≤100