Page ID,Page name,Disclaimer,Amount spent (USD)
348470785241655,Ministerio de Agricultura y Ganadería de El Salvador,Ministerio de Agricultura y Ganadería de El Salvador,≤100
421104621589691,Cristian Flores,Presidencia de la República de El Salvador,≤100
1935947973198237,Alcaldía El Paraíso Chalatenango,Alexi Antonio Escalante Galdamez,≤100
1617491818475341,Operación 2024 San Miguel,Operación 2024 San Miguel,≤100
100568368335023,Fatima Esmeralda Ascencio,Esmeralda Asencio,≤100
318820991498689,G-22,These ads ran without a disclaimer,≤100
160720010711227,Panel Rey,These ads ran without a disclaimer,≤100