Page ID,Page name,Disclaimer,Amount spent (VND)
105845511087981,TRUYỀN HÌNH AN VIÊN,TRUYỀN HÌNH AN VIÊN,37153
106476091689860,Bartra Wealth Advisors,Bartra Wealth Advisors,20248
103383185670834,Phật Pháp Chùa Long Hương,These ads ran without a disclaimer,4141
360608664680973,Mỡ BabyStore,These ads ran without a disclaimer,3746
199803143390683,Oxfam in Vietnam,Oxfam in Vietnam,≤100
1196196390526965,Facebook Surveys,These ads ran without a disclaimer,≤100
112210295510027,World Zionist Organization - ההסתדרות הציונית העולמית,These ads ran without a disclaimer,≤100