Page ID,Page name,Disclaimer,Amount spent (VND)
108390095364515,Phạm Văn Thanh- Đặc Trị Xương Khớp,These ads ran without a disclaimer,856
108715314693314,Tài Liệu Thi Viên Chức Giáo Dục TP.HCM - Bình Dương,Tài Liệu Thi Viên Chức Giáo Dục TP.HCM - Bình Dương,401
112333804853338,Cửa Sổ Vàng - Nguyễn Duy Cương,These ads ran without a disclaimer,267
112658478485413,"Gia Huy - Cà Phê, Trà Sửa, Trà Trái Cây",These ads ran without a disclaimer,≤100
107706102295108,Wire Tool,These ads ran without a disclaimer,≤100