Page ID,Page name,Disclaimer,Amount spent (THB)
149079361791677,พรรคเพื่อไทย,พรรคเพื่อไทย,197
101673076131930,พรรคเปลี่ยน,พรรคเปลี่ยน,154
110325891388981,พิมพกาญจน์ พลสมัคร,พิมพกาญจน์ พลสมัคร,≤100
110362667973472,สรวิศ เดชเสน - Sorawit Dessen,สรวิศ เดชเสน - Sorawit Dessen,≤100
933748876827175,ปิยะมาศ บัวแก้ว,ปิยะมาศ บัวแก้ว,≤100
109239188766815,ดร. วิทยา อินาลา พรรคไทยพร้อม,Klod Sawadputsra,≤100
104963151112166,การเมือง kanmuang.com,การเมือง kanmuang.com,≤100
157659344260788,จุรินทร์ ลักษณวิศิษฏ์ Aoodda,Jurin Laksanawisit,≤100
104427797605274,พี่ต่อ ดร.เฉลิมชัย ศรีอ่อน “คำไหน-คำนั้น”,พี่ต่อ ดร.เฉลิมชัย ศรีอ่อน “คำไหน-คำนั้น”,≤100
182657125936067,พรรคภูมิใจไทย,พรรคภูมิใจไทย,≤100
101535845426970,พรรคไทยสร้างไทย,พรรคไทยสร้างไทย,≤100
241115389300595,คุณหญิงสุดารัตน์ เกยุราพันธุ์ Sudarat Keyuraphan,คุณหญิงสุดารัตน์ เกยุราพันธุ์ Sudarat Keyuraphan,≤100
161651553861945,Amnesty International Thailand,Amnesty International Thailand,≤100
102807719039442,พรรครวมไทยสร้างชาติ United Thai Nation Party,พรรครวมไทยสร้างชาติ United Thai Nation Party,≤100
183238185051108,อรรถวิชช์ สุวรรณภักดี,อรรถวิชช์ สุวรรณภักดี,≤100
113023081702937,ธีระ สลักเพชร,ธีระ สลักเพชร,≤100
118262094560156,ทนายสมชัย คำเพราะ เบอร์7 เขต1 ยโสธร,Tittaya Lueapjumroen,≤100
118563167838903,พรรคถิ่นกาขาวชาววิไล l Thinkakaochaovilai Party,Prawta Khongto,≤100
283908908680102,พรรคพลังธรรมใหม่,พรรคพลังธรรมใหม่,≤100
118757751143686,อิทธิพล ชลธราศิริ - Itthiphon Chontharasiri - แบงค์ชัย,Itthiphon Chontharasiri,≤100
617620494922400,PPTV HD 36,PPTV HD 36,≤100
114698194879802,ก้าวไกล เขต2 อำนาจเจริญ,These ads ran without a disclaimer,≤100
1105604039583762,Line One สว.นท. ขอเชิญส่งประวัติ ส่วนตัว องค์กร เพื่อเข้ารับรางวัลประจำปี,Suksan Booran,≤100
104879999243950,พลชัย พิพิธวรกุล เบอร์ 2 เขต 4 ขอนแก่น พรรคประชาธิปัตย์,Ponchai Pipitvorakul,≤100
296508406790,"Democrat Party, Thailand พรรคประชาธิปัตย์","Democrat Party, Thailand พรรคประชาธิปัตย์",≤100
404324999681547,ดร. ศุภชัย ศรีหล้า,Narit Kanjana-asawa,≤100
2046265545683549,เชียร์ลุง,เชียร์ลุง,≤100
137188693021815,สืบจากข่าว,สืบจากข่าว,≤100
107569661842229,หน่อย-ศุภนาถลดา รัตนาธนัชภัค,หน่อย-ศุภนาถลดา รัตนาธนัชภัค,≤100
104645182578478,นิรันดร์ วัฒนศาสตร์สาธร,Supakit Ngoenkaew,≤100
204016840519336,ศ.ดร.นฤมล ภิญโญสินวัฒน์,ศ.ดร.นฤมล ภิญโญสินวัฒน์,≤100
103003377726705,เสื้อผ้าแฟชั่นNaPa,Threeramate Artkongharn,≤100
103983981304937,พรรคเสมอภาค-Equality Party,Nalinphas Ongkunaruk,≤100
108973424916162,เกาปากการเมือง,เกาปากการเมือง,≤100
275507006405211,Padipat Suntiphada - ปดิพัทธ์ สันติภาดา,Padipat Suntiphada - ปดิพัทธ์ สันติภาดา,≤100
2147269921986413,ธนัญญา พันธุ์การรุ่ง พรรคเพื่อไทย นครปฐม,Pang Thanakulchotikan,≤100
1633051440333187,FTE หลักสูตรเพื่อพัฒนาเจ้าของธุรกิจรุ่นใหม่ ครบเครื่อง ทันใจ แบบเร่งรัด,"VP group infinity Co.,Ltd.",≤100
2086963124904186,พรรคก้าวไกล แม่ฮ่องสอน,พรรคก้าวไกล แม่ฮ่องสอน,≤100
789991318125212,พงศกร รัตนเรืองวัฒนา,พงศกร รัตนเรืองวัฒนา,≤100
1008069346052207,วีระ รูปคม-weera roopkom,วีระ รูปคม-weera roopkom,≤100
108261230583781,เอิร์ธ พงศกร ขวัญเมือง - Earth Pongsakorn Kwanmuang,เอิร์ธ พงศกร ขวัญเมือง - Earth Pongsakorn Kwanmuang,≤100
110398018491526,สุทิน นพขำ พรรคเพื่อไทย จังหวัดปทุมธานี,สุทิน นพขำ พรรคเพื่อไทย จังหวัดปทุมธานี,≤100
161052211196800,พรรคเสรีรวมไทย,พรรคเสรีรวมไทย,≤100
159570997481890,พลตำรวจเอกเสรีพิศุทธ์ เตมียเวส,พลตำรวจเอกเสรีพิศุทธ์ เตมียเวส,≤100
1519792571651641,The NEXT Real,These ads ran without a disclaimer,≤100
107668691460508,ดรุณี พูนประสิทธิ์ อดีต สจ.สระแก้ว,Narong Thongphantha,≤100
116668478038395,โด่ง ชัชวาล พรอมรธรรม เพื่อไทย ขอนแก่น เขต 1,โด่ง ชัชวาล พรอมรธรรม,≤100
110730818172510,ดร.ต่อพงษ์ วรกุล - Dr.Toapong worakul,Toapong Worakul,≤100
109479500554299,เชียร์ลุง 2,เชียร์ลุง 2,≤100
108553605171587,อ้อ อรทัย เกิดทรัพย์ - ภูเก็ต,อ้อ อรทัย เกิดทรัพย์ - ภูเก็ต,≤100
102119372069250,สจ. ธานินท์ นวลวัฒน์,Studio415,≤100
109404485235732,ศิริวัฒน์ ขจรประศาสน์-ยอด,Supharat Sirisawat,≤100
107016601863148,ยุทธศักดิ์ ชูประเสริฐ - จ่ายุทธ,ยุทธศักดิ์ ชูประเสริฐ - จ่ายุทธ,≤100
345127652279503,มูลนิธิสากลเพื่อคนพิการ,มูลนิธิสากลเพื่อคนพิการ,≤100
2222987881148969,อดีต ส.ส. กรณิศ งามสุคนธ์รัตนา เขตวัฒนา เขตคลองเตย เบอร์ 1 บัตร สีม่วง,อดีต ส.ส. กรณิศ งามสุคนธ์รัตนา เขตวัฒนา เขตคลองเตย เบอร์ 1,≤100
117849264601668,วิษณุ กรองกันภัย พรรคไทยพร้อม เบอร์ 28,ลลดา อมาตยกุล,≤100
107945618934003,ธนูชยานันท์ ปั้นบริสุทธิ์,ธนูชยานันท์ ปั้นบริสุทธิ์,≤100
109132222106497,เอฟ ชนัตถ์ นันทปัญญา,Katakorn Phukhaow,≤100
102544175903371,เบ๊นซ์ นิธิพล  เพื่อคนสมุทรปราการ,เบ๊นซ์ นิธิพล  เพื่อคนสมุทรปราการ,≤100
106561034744198,ลอรี่ - พงศ์พล ยอดเมืองเจริญ,ลอรี่ - พงศ์พล ยอดเมืองเจริญ,≤100
115922723434700,ครูเจพีสรุปย่อ for Teacher,ครูเจพีสรุปย่อ for Teacher,≤100
622674297897819,Screenshirt2020,Screenshirt2020,≤100
2105350112863264,ร้อยเอก ดร.จองชัย วงศ์ทรายทอง - ผู้กองเบิร์ด,ร้อยเอก ดร.จองชัย วงศ์ทรายทอง - ผู้กองเบิร์ด,≤100
100761582502948,จารุพล เรืองสุวรรณ - อาจารย์จา,Charupol Ruangsuwan,≤100
104554835726206,พรรคท้องที่ไทย,Tanongsak Sirirat,≤100
972019486321939,บู้ จเด็ศ จันทรา,จเด็ด จันทรา,≤100
480222865705980,สรรเพชญ บุญญามณี,สรรเพชญ บุญญามณี,≤100
103863149219273,นิธิกร วุฒินันชัย เอก พรรคเพื่อไทย,เอก นิธิกร วุฒินันชัย,≤100
2151302718520482,ธิดารัตน์ ยิ่งเจริญ Tidarat Yingcharoen,ธิดารัตน์ ยิ่งเจริญ Tidarat Yingcharoen,≤100
111341764925564,สำนักสนับสนุนการพัฒนาระบบสุขภาพ - สำนัก 7 สสส.,สำนักสนับสนุนการพัฒนาระบบสุขภาพ - สำนัก 7 สสส.,≤100
3080161418691131,Thailand FACT Today,Thailand FACT Today,≤100
108201828409912,ณัฐวัฒน์ พอใช้ได้,Atirit Dechasiniwat,≤100
451864701523507,Infographic Thailand,Infographic Thailand,≤100
108515294626891,สอบข้าราชการท้องถิ่น By Thurakan,Chiraphorn Thuree,≤100
248894542265760,90นาที,These ads ran without a disclaimer,≤100
104342402244178,อารุม ตุ้มน้อย - Arum Tumnoi,อารุม ตุ้มน้อย - Arum Tumnoi,≤100
101386439318479,วรัญญา แอนดาริส - ช่างแอนโยธา,วรัญญา แอนดาริส - ช่างแอนโยธา,≤100
352318098651383,โตโต้ ปิยรัฐ - Piyarat Chongthep,โตโต้ ปิยรัฐ - Piyarat Chongthep,≤100
112343717773740,Betapetonline,ชัชญา พานิช,≤100
101504656149099,Peace Sasipatra  - พีซ ศศิร์ภัทรา,Peace Sasipatra  - พีซ ศศิร์ภัทรา,≤100
101673076131930,พรรคเปลี่ยน,นอท พันธ์ธวัช นาควิสุทธิ์,≤100
107448364979874,ศิริพงศ์ นานคงแนบ - Siripong Nankongnab,Siripong Nankongnab,≤100
2168746286721705,Nirun Return Pattaya,These ads ran without a disclaimer,≤100
106027778579885,น้องแพน จิตพลอย จิตจักรวาลทอง,Jitploy Jitjakkawantong,≤100
200549683453601,Themizlaw สถาบันติวสอบตรงนิติศาสตร์ ธรรมศาสตร์,These ads ran without a disclaimer,≤100
104908418629549,EnableSurvey,"Excellent Digital Development Co.,Ltd.",≤100
102949686071401,ทศพล แก้วทิมา ราชบุรีต้องดีกว่าเดิม,ทศพล แก้วทิมา ราชบุรีต้องดีกว่าเดิม,≤100
135827909783631,beartai แบไต๋,SHOW NO LIMIT COMPANY LIMITED,≤100
107612328588715,The Voters,สันติสุข กาญจนประกร,≤100
152665702176493,Ringsideการเมือง,Ringsideการเมือง,≤100
104393812499502,ชีทสรุปกฎหมาย สำหรับสอบราชการ พนักงานราชการ by.kantap,ชีทสรุปกฎหมาย สำหรับสอบราชการ พนักงานราชการ by.kantap,≤100
112073738279329,สิงโต - ศักดิ์สิทธิ์ ขาวทอง,สิงโต - ศักดิ์สิทธิ์ ขาวทอง,≤100
111852360177624,วิวัฒน์ จินดาพล สจ.ต้อม,วิวัฒน์ จินดาพล สจ.ต้อม,≤100
118461507889714,พิชิตข้อสอบตม.- เพจใหม่,These ads ran without a disclaimer,≤100
101755712680612,รัก ณิชาภา โกวิทานนท์ ผู้สมัคร ส.ส.สมุทรสงคราม พรรคเพื่อไทย,รัก ณิชาภา โกวิทานนท์ ผู้สมัคร ส.ส.สมุทรสงคราม พรรคเพื่อไทย,≤100
104129959181229,อี๊ฟ กัญธนา,These ads ran without a disclaimer,≤100
101982757860392,Cinemysis,These ads ran without a disclaimer,≤100
146007617136671,พลสิทธิ์ พงศ์พัฒนะกิจ -Ponlasit Pongpattanakit,พลสิทธิ์ พงศ์พัฒนะกิจ -Ponlasit Pongpattanakit,≤100
107664694510311,อริย์ธัช ชาติอาริยะพงศ์,Arithach Chartariyapong,≤100
1241410716007401,ทศพล เพ็งส้ม,Thosaphol Pengsom,≤100
159926697949888,ทันข่าว Today,These ads ran without a disclaimer,≤100
111331191880453,วินัย วิจิตรโสภณ - Winai Wijitsophon,วินัย วิจิตรโสภณ - Winai Wijitsophon,≤100
102907691595016,เชิดศักดิ์ โภคกุลกานนท์ - ตี๋เล็ก,These ads ran without a disclaimer,≤100
2230596726985945,ฮาย ปวิศรัฐฐ์ ติยะไพรัช,บริษัท เวิร์ค 360 จำกัด,≤100
110204590612663,ธีรัจชัย พันธุมาศ - Teerajchai Phunthumas,ธีรัจชัย พันธุมาศ,≤100
100298682713615,เสื้อวินเทจ ลายมัน ผ้าดำ,เสื้อวินเทจ ลายมัน ผ้าดำ,≤100
113001706909463,สส.เป้ นภาพร เพ็ชร์จินดา Dr.Napaporn Petchinda,สส.เป้ นภาพร เพ็ชร์จินดา Dr.Napaporn Petchinda,≤100
873902519623943,พงศพัศ  กตคุณวิสิทธิ์,พงศพัศ  กตคุณวิสิทธิ์,≤100
111835635195108,รับซื้อสายไฟและแอร์เก่า,These ads ran without a disclaimer,≤100
105546651850693,วีรนันท์ ฮวดศรี-Weeranan Huadsri-ทนายป๊อก,Weeranan Huadsri,≤100
111872548439787,เพื่อนอุทัย,Attapon  Mingkwan,≤100
146822255731958,Fast Travel Games,These ads ran without a disclaimer,≤100
106000477573537,圍爐 Warm Talking,These ads ran without a disclaimer,≤100