Page ID,Page name,Disclaimer,Amount spent (HNL)
221798457888029,World Vision Honduras,ASOCIACION VISION MUNDIAL HONDURAS,≤100
1392592317738074,Jorge Cálix,Jorge Cálix,≤100
112333800693678,Hugo Noé Pino Diputado F.M,Daniel Andres Casula Salinas,≤100
349524351841734,Cárlenton Dávila,Jose Carlenton Davila Mondragon,≤100
153003381515332,Cespad - Centro de Estudio para la Democracia,Centro de Estudio para la Democracia (Cespad),≤100
1929548187145934,Ashanty Crisanto,These ads ran without a disclaimer,≤100
131602424169035,Oxfam en Español,These ads ran without a disclaimer,≤100
104989885631462,Formación Católica - Heraldos del Evangelio,These ads ran without a disclaimer,≤100
104599735671754,Goberna Honduras,Goberna Honduras,≤100