Page ID,Page name,Disclaimer,Amount spent (VND)
101914358044085,Tài Liệu Ôn Thi Viên Chức Giáo Dục,Tài Liệu Ôn Thi Viên Chức Giáo Dục,122338
192195994956428,Tài Liệu Thi Viên Chức Giáo Viên,Tài Liệu Thi Viên Chức Giáo Viên,47027
105062615490802,Thượng Tọa Thích Đức Thiện,Thượng Tọa Thích Đức Thiện,3006
105845511087981,TRUYỀN HÌNH AN VIÊN,TRUYỀN HÌNH AN VIÊN,2991
103462819259532,Xuất Khẩu Lao Động Nước Ngoài Phí Rẻ,These ads ran without a disclaimer,2538
101865258169428,ĐEN Secondhand,ĐEN Secondhand,1001
919479674872321,Báo Nghệ An,Báo Nghệ An,790
105845511087981,TRUYỀN HÌNH AN VIÊN,These ads ran without a disclaimer,598
101957285428877,Thức Tỉnh,These ads ran without a disclaimer,301