Page ID,Page name,Disclaimer,Amount spent (GTQ)
187073013532,Partido VIVA,Partido Político Visión con Valores,≤100
1630952833827354,Armando Castillo,Armando  Damian Castillo Alvarado,≤100
331961940541181,Partido Victoria,Partido Político Victoria,≤100
103940842615369,armandocastillogt,These ads ran without a disclaimer,≤100
754661271544464,El Sol de Mixco,El Sol de Mixco,≤100
142556265766634,Guatemala Visible,Guatemala Visible,≤100
473451232707178,Abogado Federico Barrios Aldana,Federico Javier Barrios Aldana,≤100
109189810962889,Comunidad Elefante,Shorik Yann Mejia Blanco,≤100
633533543959309,Noticias la Red Gt San Pedro Sacatepéquez,Jennifer Lopez,≤100
210285783754038,Noticias la Red Gt San Raymundo,Jennifer Lopez,≤100
595815224429068,Noticias la Red Gt San Juan Sacatepéquez,Jennifer Lopez,≤100
233924424332703,Noticias la Red Gt Mixco,Jennifer Lopez,≤100
219877565979325,Noticias la Red Gt Amatitlán,Jennifer Lopez,≤100
421202078786833,Noticias la Red Gt Villa Nueva,Jennifer Lopez,≤100
628157001170109,Noticias la Red Gt San Miguel Petapa,Jennifer Lopez,≤100
588158355209670,Noticias la Red Gt Chinautla,Jennifer Lopez,≤100
100990022892856,Movimiento Político WINAQ Totonicapán,Ricardo Mazariegos,≤100
121459656029157,Noticias la Red Gt Santa Catarina Pinula,Jennifer Lopez,≤100
651269412155421,Noticias la Red Gt San Pedro Ayampuc,Jennifer Lopez,≤100
627328211242735,Noticias la Red Gt Villa Canales,Jennifer Lopez,≤100
641793966455459,Noticias La Red Guatemala,Jennifer Lopez,≤100
666054530693537,Noticias La Red Gt Chuarrancho,Jennifer Lopez,≤100
575450466481682,Noticias la Red Gt Fraijanes,Jennifer Lopez,≤100
281554395331686,República,"Republica GT, S.A.",≤100
1552532851481889,Buckner Guatemala,Buckner Guatemala,≤100
106908785419555,Goberna Guatemala,Goberna,≤100