Page ID,Page name,Disclaimer,Amount spent (VND)
280124715749325,Sự Thật Về Pháp Luân Công,Sự Thật Về Pháp Luân Công,1458
1507429892822619,BOM Money,BOM Money,377
919479674872321,Báo Nghệ An,Báo Nghệ An,319
102072649355268,Nguyễn Lê,These ads ran without a disclaimer,118
110207030499510,𝙉𝙝𝙖𝙘 𝙣𝙖𝙮 𝙘𝙝𝙞𝙡𝙡 𝙥𝙝𝙚𝙩,These ads ran without a disclaimer,≤100
102972191878399,191 Barber House,These ads ran without a disclaimer,≤100
102414379189801,Phạm Văn Thanh - Đặc Trị Tiểu Đường,These ads ran without a disclaimer,≤100