Page ID,Page name,Disclaimer,Amount spent (USD)
105497721784216,Филин. Оперативная аналитика и публицистика,Филин. Оперативная аналитика и публицистика,≤100
179167545479394,Салідарнасць,Онлайн-медиа «Салiдарнасць»,≤100
340577086006224,CRI German,These ads ran without a disclaimer,≤100
118935227866681,Никита Юсупов - Физика,These ads ran without a disclaimer,≤100
322865159833,RCD Espanyol de Barcelona,These ads ran without a disclaimer,≤100
119366159459299,Смяротнае пакаранне ў Беларусі,These ads ran without a disclaimer,≤100