Page ID,Page name,Disclaimer,Amount spent (VND)
101914358044085,Tài Liệu Ôn Thi Viên Chức Giáo Dục,Tài Liệu Ôn Thi Viên Chức Giáo Dục,79585
105062615490802,Thượng Tọa Thích Đức Thiện,Thượng Tọa Thích Đức Thiện,21699
106476091689860,Bartra Wealth Advisors,Bartra Wealth Advisors,455
100536392691359,Học Giỏi Tiếng Anh,These ads ran without a disclaimer,289
101865258169428,ĐEN Secondhand,ĐEN Secondhand,190
548398018590693,UNDP in Việt Nam,These ads ran without a disclaimer,≤100
107996315091233,月旦港事,These ads ran without a disclaimer,≤100
101576356154191,Rain On The Red Flag,These ads ran without a disclaimer,≤100