Page ID,Page name,Disclaimer,Amount spent (VEF)
105428965854403,Comisión Nacional de Primaria VE,an advertiser in Venezuela,750000
110530401611698,real.termometronacional,an advertiser in Venezuela,250000
102909028767557,Nabil Maalouf,an advertiser in Venezuela,52500
108259318940861,TD_Ln2_Cuidado Cariñoso,These ads ran without a disclaimer,≤100
102782479525394,comitededamasfedeagro,These ads ran without a disclaimer,≤100
37896015468,"Embajada de los EE.UU., Venezuela",an advertiser in Venezuela,≤100