Page ID,Page name,Disclaimer,Amount spent (VND)
114075063569561,Lương Y Phạm Văn Thanh - Việc Tử Tế VTV1,These ads ran without a disclaimer,4931
106476091689860,Bartra Wealth Advisors,Bartra Wealth Advisors,4599
105845511087981,TRUYỀN HÌNH AN VIÊN,TRUYỀN HÌNH AN VIÊN,2987
507957476037004,NC Network Vietnam - Vì sự phát triển ngành chế tạo,These ads ran without a disclaimer,1269
120235188603455,Thiên Mộc Hương - Agarwood Jewelry,These ads ran without a disclaimer,1103
106999758895840,Tập Đoàn Hưng Thịnh - Đầu Tư Phát Triển,These ads ran without a disclaimer,873
101865258169428,ĐEN Secondhand,ĐEN Secondhand,102