Page ID,Page name,Disclaimer,Amount spent (USD)
162379173778716,Alcaldía de San Salvador,Alcaldía de San Salvador,≤100
167878593236712,UNICEF en español,UNICEF con créditos publicitarios de Facebook,≤100
421104621589691,Cristian Flores,Presidencia de la República de El Salvador,≤100
110788865179686,Douglas Najarro,Douglas Najarro,≤100
147858435252169,Embajada de los Estados Unidos en El Salvador,Embajada de Estados Unidos en El Salvador,≤100
68793499001,UNICEF,UNICEF with Facebook Ad Credits,≤100
211001456327934,Walter Alemán,Erick Rico,≤100
100568368335023,Fatima Esmeralda Ascencio,Esmeralda Asencio,≤100
1727280190891954,FRANCE 24 Español,These ads ran without a disclaimer,≤100
856012741442139,Ipas LAC,Neuma,≤100
111826817167364,Nuevas Ideas Municipal Ciudad Delgado,Ernesto Antonio Ortiz,≤100
100478844819736,Alexander Guardado,Jonatan Fuentes,≤100
100357715349653,Noticias del Oso,These ads ran without a disclaimer,≤100
260505207474088,Libélula Cambio Climático,These ads ran without a disclaimer,≤100
34440108608,Net Impact,These ads ran without a disclaimer,≤100
124252504303223,UNICEF (FR),UNICEF avec des crédits publicitaires Facebook,≤100
152914224736727,Banco Mundial,These ads ran without a disclaimer,≤100