Page ID,Page name,Disclaimer,Amount spent (USD)
1584183878552505,Institute for Strategy and Policy- Myanmar,an advertiser in Myanmar,≤100
117345531293941,,These ads ran without a disclaimer,≤100
111508197374332,ADB Southeast Asia Development Solutions - SEADS,These ads ran without a disclaimer,≤100
103760818568298,B book,an advertiser in Myanmar,≤100
118592938221174,ZTE Corporation,These ads ran without a disclaimer,≤100
100994765608411,INN WORD Revival Now,These ads ran without a disclaimer,≤100