Page ID,Page name,Disclaimer,Amount spent (EUR)
122344957784863,Amnistia Internacional Portugal,Amnistia Internacional Portugal,≤100
104972635505947,Galp,Galp,≤100
197936253581591,Fundação Francisco Manuel dos Santos,Fundação Francisco Manuel dos Santos,≤100
347829038571812,Aldeias de Crianças SOS Portugal,Aldeias de Crianças SOS Portugal,≤100
54779960819,United Nations,United Nations with Facebook Ad Credits,≤100
863284277093093,Pingo Doce,Pingo Doce,≤100
104802472139778,Juntos Pela Ordem que Queremos,Fernanda de Almeida Pinheiro,≤100
147547541961576,Council of the European Union,Council of the European Union,≤100