Page ID,Page name,Disclaimer,Amount spent (UYU)
105372794744976,Intendencia de Paysandú,Intendencia Departamental de Paysandú,≤100
225968600759645,Andrés Lima,Ernesto Dario Castro Rodriguez,≤100
102337244995366,Prudencia Uruguay,Santiago Raffo Arias,≤100
292074670808351,Frente Amplio,Frente Amplio,≤100
2341341112595761,Ana Clara Viñar Martinez,These ads ran without a disclaimer,≤100
1496397947313142,Edil Diego Guevara,Diego Enmanuel Guevara Crosi,≤100
101325199267025,F & M Brands Global Full,These ads ran without a disclaimer,≤100