Page ID,Page name,Disclaimer,Amount spent (VND)
103462819259532,Xuất Khẩu Lao Động Nước Ngoài Phí Rẻ,These ads ran without a disclaimer,3965
919479674872321,Báo Nghệ An,Báo Nghệ An,3216
105845511087981,TRUYỀN HÌNH AN VIÊN,TRUYỀN HÌNH AN VIÊN,3090
105062615490802,Thượng Tọa Thích Đức Thiện,Thượng Tọa Thích Đức Thiện,2599
101957285428877,Thức Tỉnh,These ads ran without a disclaimer,377
105845511087981,TRUYỀN HÌNH AN VIÊN,These ads ran without a disclaimer,186
101865258169428,ĐEN Secondhand,ĐEN Secondhand,148