Page ID,Page name,Disclaimer,Amount spent (VND)
108390095364515,Phạm Văn Thanh- Đặc Trị Xương Khớp,These ads ran without a disclaimer,6118
1406400379669708,Đại Học Đại Nam,These ads ran without a disclaimer,5965
112333804853338,Cửa Sổ Vàng - Nguyễn Duy Cương,These ads ran without a disclaimer,824
105536822279236,Huyền phi spa- mỹ phẩm chính hãng,These ads ran without a disclaimer,192
108715314693314,Tài Liệu Thi Viên Chức Giáo Dục TP.HCM - Bình Dương,Tài Liệu Thi Viên Chức Giáo Dục TP.HCM - Bình Dương,101
112658478485413,"Gia Huy - Cà Phê, Trà Sửa, Trà Trái Cây",These ads ran without a disclaimer,≤100
106562111326233,Sách Cổ - Tri Thức Trường Tồn,These ads ran without a disclaimer,≤100