Page ID,Page name,Disclaimer,Amount spent (CRC)
856012741442139,Ipas LAC,Neuma,2119
643513979193133,Unidos por Beatriz,Neuma,1620
161538647202796,David Segura - Diputado,David Lorenzo Segura Gamboa,869
116150003163125,Fundación Pollitos de Hierro - Ayuda a niños con cáncer - Costa Rica,Fundación Pollitos de Hierro,866
105299712285609,Otra Visión,Otra Visión,636
1540070352761579,Leslye Bojorges,Leslye Ruben Bojorges Leon,600
168286823190319,Cámara de Industrias de Costa Rica,Cámara de Industrias de Costa Rica,600
110229697990927,Pablo Sibaja - Diputado,Pablo Sibaja Jiménez,431
209596159055433,Clase Ejecutiva UC,These ads ran without a disclaimer,≤100
117702158266385,Antonio Álvarez Desanti,Antonio Alvarez Desanti,≤100
108625789179165,Soi Dog Foundation,These ads ran without a disclaimer,≤100
123279176118,DHgate,These ads ran without a disclaimer,≤100
101128242614247,Dr. Rodolfo Brenes Vargas,Rodolfo Brenes Vargas,≤100