Page ID,Page name,Disclaimer,Amount spent (COP)
1988052664633312,Maria Fernanda Hidalgo,Edwin Narváez Suarez,8879
257401965136834,Carlos Marroquín Luna Diputado,Carlos Andres Marroquin Luna,8790
101071764864119,Dulce Veneno,Dulce Veneno,5650
1803279899993382,"Ni Una Palmadita, Fernanda Restrepo",These ads ran without a disclaimer,4604
101769386141297,Congreso Nacional de Actualización Tributaria y Laboral,Julian Chuchoque,2148
130834367164,Red PaPaz,Red PaPaz,2122
106592632188718,Yolanda Rivera Bravo,Yolanda Rivera Bravo,1123
1622001728047397,Harman Alcalde,Harman Alcalde,844
381464961911270,Cruz Roja Antioquia,Cruz Roja Colombiana Seccional Antioquia,797
350160788433059,Proclama Cauca y Valle,Proclama Cauca y Valle,650
78522143212,Fucsia,These ads ran without a disclaimer,641
113149344929527,Loly Montañez,Loly Montañez,595
131161704260384,Carlos Ardila,Hugo Andrés Galindo Palacio,562
103833791361048,El Legado de Álvaro Uribe Vélez,Centro Democrático - Comunidad Oficial,555
765302097170348,Línea Cero,Linea Cero,530
1823807254333065,Soy Más País,Soy Mas Pais,506
787232315012598,Cristian Barragán Correcha - Tol,Cristhian Andres Barragán Correcha,437
140451182823675,Edwin Palma Egea,Edwin Palma Egea,398
237316706446146,Alianza Francesa de Pereira,Alianza Francesa de Pereira,384
122989028111811,Alexander Ruiz,Edgar Alexander Ruiz Garcia,343
201504926957834,Luis M. Carvajalino,Luis Manuel Carvajalino Quin,298
108875804858437,Antimilitantes,Antimilitantes,225
267198759973201,Bairon Enrique Muñoz Lizarazo,Bairon Enrique Muñoz Lizarazo,218
102332121627586,Alcaldia Municipal de Morelia Caquetá,Tuto Gonzalez,199
109810958651903,Daniel Duarte Pabón candidato a Representante de los Egresados UIS 2023,Daniel F Duarte Pabón,192
251228522239952,Andrés Vásquez González,These ads ran without a disclaimer,181
1519006894853848,El Quindiano,EL QUINDIANO SAS,164
179003239458192,Jorge Humberto Rangel,Jorge Rangel,≤100
109244682035411,Primero el empleo,Camilo Alfredo Vieco Merlano,≤100
1242864402475742,BC Noticias,Oscar Javiar Bayona Villada,≤100
1529335724037224,Aeropuerto del Café,INTUAL,≤100
126901709108132,Yturielvalenciatallerdearte,These ads ran without a disclaimer,≤100
1666714230240447,Por el Derecho a Morir con Dignidad A.C.,These ads ran without a disclaimer,≤100
100304338642614,Toro Digital 1972,Joseph Ferney Galvis Gonzalez,≤100
106904622236202,허니루,These ads ran without a disclaimer,≤100
389976681048925,ECMIA,These ads ran without a disclaimer,≤100
2009798972471052,Gabriel de Carvalho - Espanol,These ads ran without a disclaimer,≤100
85147586731,Julio César Triana,Julio César Triana,≤100