Page ID,Page name,Disclaimer,Amount spent (VND)
165600847322369,Tài Liệu Thi Viên Chức Giáo Dục Bình Định-Phú Yên,Tài Liệu Thi Viên Chức Giáo Dục Bình Định-Phú Yên,48805
1129525727077234,Herbalife Nutrition,These ads ran without a disclaimer,6144
102249956133487,Poljot Int VN,These ads ran without a disclaimer,3992
280124715749325,Sự Thật Về Pháp Luân Công,Sự Thật Về Pháp Luân Công,3673
112384128441198,Nhà Sách Như Ý,These ads ran without a disclaimer,484
919479674872321,Báo Nghệ An,Báo Nghệ An,307