Page ID,Page name,Disclaimer,Amount spent (HNL)
113279288457664,Quintin AMIGO,Quintin AMIGO,319
481781965172466,Aquafinca St Peter Fish,Aquafinca St Peter Fish,247
483441215141189,ASJ Honduras,Asociación para una Sociedad más Justa,≤100
113933318391304,Centro Religioso Amores Eternos,These ads ran without a disclaimer,≤100
118388357942994,Ingenieros en acción,These ads ran without a disclaimer,≤100
115591005188475,Global Times,These ads ran without a disclaimer,≤100
108259318940861,TD_Ln2_Cuidado Cariñoso,These ads ran without a disclaimer,≤100