Page ID,Page name,Disclaimer,Amount spent (USD)
343780273395073,"Hon. George Mireku Duker - MP, Tarkwa-Nsuaem.","Hon. George Mireku Duker - MP, Tarkwa-Nsuaem.",≤100
1885114401706195,Dr. Matthew Opoku Prempeh,Dr. Matthew Opoku Prempeh,≤100
102179325363565,Samuel A. Jinapor,Samuel A. Jinapor,≤100
113634921611422,Ernest Adomako,Ernest Adomako,≤100
110790230485026,NPP Ghana Government,NPP Ghana Government,≤100
1027626217435226,Richouses,These ads ran without a disclaimer,≤100
123465590650551,Allied Health Group USA,These ads ran without a disclaimer,≤100
802090139805877,Tony Marioghae,These ads ran without a disclaimer,≤100
1500408980220264,Emmanuel Addo,These ads ran without a disclaimer,≤100