Page ID,Page name,Disclaimer,Amount spent (USD)
115610190354167,Maguette Sène Officiel,Maguette Sène Officiel,≤100
1495287077369181,"Killé Sakho, Maire de Diawara","Killé Sakho, Maire de Diawara",≤100
299227550122220,Radio Cina Internazionale,These ads ran without a disclaimer,≤100
111679394767549,المشروع القومي لمشتقات البلازما,These ads ran without a disclaimer,≤100
1919192811663245,My Voice For The Poor,These ads ran without a disclaimer,≤100
1667032750082613,Daniel Desjardins,These ads ran without a disclaimer,≤100