Page ID,Page name,Disclaimer,Amount spent (VND)
101865258169428,ĐEN Secondhand,ĐEN Secondhand,13852
105845511087981,TRUYỀN HÌNH AN VIÊN,TRUYỀN HÌNH AN VIÊN,6952
105062615490802,Thượng Tọa Thích Đức Thiện,Thượng Tọa Thích Đức Thiện,6513
106823432074875,An Viên Sự Kiện,An Viên Sự Kiện,627
1655053987872024,Bloomberg Green,These ads ran without a disclaimer,≤100
1991495041106641,Teaching English with Cambridge,These ads ran without a disclaimer,≤100
1891933867730555,"Fujian, China",These ads ran without a disclaimer,≤100