Page ID,Page name,Disclaimer,Amount spent (VND)
114658477052849,Lương Y Việc Tử Tế VTV 1 - Phạm Văn Thanh,These ads ran without a disclaimer,33859
110734615258316,Trung Tâm Điều Trị U - Triệt Tiêu Các Tế Bào Ung Thư Số 2,These ads ran without a disclaimer,30980
106475068390652,Thầy Phạm Văn Thanh - Hiệu Thuốc Hoàng Liên Sơn,These ads ran without a disclaimer,22128
108390095364515,Phạm Văn Thanh- Đặc Trị Xương Khớp,These ads ran without a disclaimer,6276
106864984981716,Tài liệu ôn thi viên chức giáo viên TP. HCM,Tài liệu ôn thi viên chức giáo viên TP. HCM,2296
101013847927879,Hoàng Minh Quân - Xổ Số Miền Nam,These ads ran without a disclaimer,676
108277165511545,Công nghệ Giảm Béo Ultra-Maxburn Hoa Kỳ,These ads ran without a disclaimer,≤100
953482191475322,Cảnh Báo Chứng Khoán 68 - CK68,These ads ran without a disclaimer,≤100