Page ID,Page name,Disclaimer,Amount spent (VND)
105062615490802,Thượng Tọa Thích Đức Thiện,Thượng Tọa Thích Đức Thiện,10299
113614244649513,Quà Tặng Doanh Nghiệp - Khắc Tên Theo Yêu Cầu - Cơ sở 10,These ads ran without a disclaimer,2335
1403725043191074,Cổng Thông Tin Tuyển Sinh Melbourne Polytechnic Việt Nam,These ads ran without a disclaimer,1755
103543005987724,Mỹ phẩm đông anh trang cty chính chủ,These ads ran without a disclaimer,182
176104589110851,IEEE,These ads ran without a disclaimer,≤100