Page ID,Page name,Disclaimer,Amount spent (USD)
272535046654,HESPRESS,HESPRESS,≤100
147084112022235,La Nouvelle Tribune,La Nouvelle Tribune,≤100
578201022242371,MJCC وزارة الشباب والثقافة والتواصل,"Ministère de la Jeunesse, de la Culture et de la Communication",≤100
117281538350746,حزب التجمع الوطني للأحرار -Rassemblement National des Indépendants -RNI,Rassemblement National des Indépendants,≤100
1117512094962616,Ministère de l’Industrie et du Commerce,Ministère de l’Industrie et du Commerce,≤100
103180295526797,Ministère de l’Equipement et de l’Eau - وزارة التجهيز والماء,M Equipement Maroc,≤100
107627395144123,الحكومة المغربية,الحكومة المغربية,≤100
1081434028658964,وزارة الانتقال الطاقي والتنمية المستدامة,وزارة الانتقال الطاقي والتنمية المستدامة,≤100
123393171111656,Mehdi Bensaid   المهدي بنسعيد,Mohammed Mehdi Bensaid,≤100
161637767281862,LE MATIN.ma,Groupe Le Matin,≤100
438771642823963,الإيسيسكو,ICESCO,≤100
2065056783567420,Hespress Français,HESPRESS,≤100
108842875028489,المستشار البرلماني السالك الموساوي,Aimad Eddine Abouhou,≤100
328835903834763,اشرف مسياح Achraf Msiah,Achraf Mohamed Msiah,≤100
100194852696708,"Rabat, Capital of African Culture 2022","Ministère de la Jeunesse, de la Culture et de la Communication",≤100
107953965624121,Ali Talks,These ads ran without a disclaimer,≤100
334353136587648,L'Observateur du Maroc et d'Afrique,Mehdi Farhi,≤100
605527566303955,القناة,al9anat.com,≤100
1580222042261049,JIDAR - Rabat Street Art Festival,These ads ran without a disclaimer,≤100
108048218871996,Média Afrique News,These ads ran without a disclaimer,≤100
102998939765184,Persian bms,These ads ran without a disclaimer,≤100
226651620746109,Mike Jocktane,These ads ran without a disclaimer,≤100
102281796055155,Almoharir media,Almoharir media,≤100