Page ID,Page name,Disclaimer,Amount spent (BOB)
100301178044225,Viralcom,ViralComtv,≤100
167878593236712,UNICEF en español,UNICEF con créditos publicitarios de Facebook,≤100
964080723662055,Carlos Subirana Responde,Editorial CSS,≤100
162964977170060,Solidar Suiza Bolivia - Doctora Edilicia,Doctora Edilicia,≤100
101029268584854,José Carlos Sánchez Verazaín,Boris Christian Lehm Murillo,≤100
620287951432994,Ministerio de Hidrocarburos y Energías,These ads ran without a disclaimer,≤100
68793499001,UNICEF,UNICEF with Facebook Ad Credits,≤100
856012741442139,Ipas LAC,NEUMA,≤100
128692467209771,Visita Cochabamba,Smart Group,≤100
1428408544046887,Flacso Uruguay,These ads ran without a disclaimer,≤100
105941541719195,Concejo Municipal de El Alto,Ronald Wilson Morales Llerena,≤100
100393048247870,Daniela Cabrera Concejal,Daniela Cabrera Guillén,≤100
551042328560128,AtivaTrade,These ads ran without a disclaimer,≤100
102199795319206,Pablo Marçal Oficial,These ads ran without a disclaimer,≤100
124252504303223,UNICEF (FR),UNICEF avec des crédits publicitaires Facebook,≤100
166178460072395,اليونيسف بالعربية - UNICEF in Arabic,اليونيسف باستخدام اعتمادات الإعلان على الفيسبوك,≤100
109982148114856,Construyamos Bolivia,These ads ran without a disclaimer,≤100
305828002808516,INHOPE - International Association of Internet Hotlines,These ads ran without a disclaimer,≤100