Page ID,Page name,Disclaimer,Amount spent (VND)
105845511087981,TRUYỀN HÌNH AN VIÊN,TRUYỀN HÌNH AN VIÊN,15022
101865258169428,ĐEN Secondhand,ĐEN Secondhand,533
101957285428877,Thức Tỉnh,These ads ran without a disclaimer,459
919479674872321,Báo Nghệ An,Báo Nghệ An,417
105062615490802,Thượng Tọa Thích Đức Thiện,Thượng Tọa Thích Đức Thiện,344
106462131736105,Thanh Binh Investment,These ads ran without a disclaimer,278
192195994956428,Tài Liệu Thi Viên Chức Giáo Viên,Tài Liệu Thi Viên Chức Giáo Viên,≤100