Page ID,Page name,Disclaimer,Amount spent (THB)
101673076131930,พรรคเปลี่ยน,พรรคเปลี่ยน,3398
399190156841695,อนุวัตร์ ชาติพัฒนากล้า สุราษฎร์ธานี,อนุวัตร์ ชาติพัฒนากล้า สุราษฎร์ธานี,1483
157659344260788,จุรินทร์ ลักษณวิศิษฏ์ Aoodda,Jurin Laksanawisit,767
102807719039442,พรรครวมไทยสร้างชาติ United Thai Nation Party,พรรครวมไทยสร้างชาติ United Thai Nation Party,723
215836908565280,ส.ส. ชินวรณ์ บุณยเกียรติ - Chinnaworn Boonyakiat,ส.ส. ชินวรณ์ บุณยเกียรติ - Chinnaworn Boonyakiat,707
104074131792878,ทนายแชมป์ - Olan Suttanaka - โอฬาร สุตตะนาคา,Pattanapong Seenoi,591
100340359064602,ธนชาต ศรีเปารยะ - Thanachart Sripaurya,Thanachart Sripaurya,456
105289357813967,ปุณณ์สิริ บุณยเกียรติ - บีท - Punsiri Boonyakiat,ปุณณ์สิริ บุณยเกียรติ - บีท - Punsiri Boonyakiat,318
111119268085115,อนงค์นาถ จ่าแก้ว,Chadapon Maksuwan,292
104963151112166,การเมือง kanmuang.com,การเมือง kanmuang.com,277
109426527988876,ดร ปรเมษฐ์ จินา อดีตรองนายก อบจ.สุราษฎร์ธานี,ปรเมษฐ์ จินา,260
109239188766815,ดร. วิทยา อินาลา พรรคไทยพร้อม,Klod Sawadputsra,209
101535845426970,พรรคไทยสร้างไทย,พรรคไทยสร้างไทย,194
258984171484737,นนท์ นนทิวรรธน์,วรรณชัย เรือนแก้ว,191
161651553861945,Amnesty International Thailand,Amnesty International Thailand,146
114323247935240,ดร.อาร์ เธียรทัศน์ เอี่ยมตระกูล,ดร.อาร์ เธียรทัศน์ เอี่ยมตระกูล,138
296508406790,"Democrat Party, Thailand พรรคประชาธิปัตย์","Democrat Party, Thailand พรรคประชาธิปัตย์",137
183238185051108,อรรถวิชช์ สุวรรณภักดี,อรรถวิชช์ สุวรรณภักดี,133
283908908680102,พรรคพลังธรรมใหม่,พรรคพลังธรรมใหม่,128
107197071737032,คมสิน แก้วปลายคลอง ไทยภักดี นครศรีธรรมราช,คมสิน แก้วปลายคลอง,113
101493419239768,สุรธัช เณรภักดี - เณรปอน ไทยภักดี นครศรีธรรมราช,สุรธัช เณรภักดี - เณรปอน ไทยภักดี นครศรีธรรมราช,105
118563167838903,พรรคถิ่นกาขาวชาววิไล l Thinkakaochaovilai Party,Prawta Khongto,≤100
357567608297722,ดร.สฤษฏ์พงษ์ เกี่ยวข้อง,ดร.สฤษฏ์พงษ์ เกี่ยวข้อง,≤100
182657125936067,พรรคภูมิใจไทย,พรรคภูมิใจไทย,≤100
383969052150419,ชาญชัย อิสระเสนารักษ์,Assawin Issarasenarak,≤100
225483931284436,ณัฐวรันธร ทองคำ  - อาทิตย์ บางใหญ่รถยก,ยุทธวีร์ ทองคำ,≤100
115653434840464,พรรคประชาธิปัตย์ นาย ไพบูลย์ ศิริมา เบอร์ 7 จ.สุรินทร์ เขต 8,Pooky Kham-Oun,≤100
276537859877842,FC ผู้ใหญ่ตาน คนบ้านเรา,FC ผู้ใหญ่ตาน คนบ้านเรา,≤100
368356080442700,กำนันพงษ์ศักดิ์ จ่าแก้ว - คนรักสุราษฎร์,Chadapon Maksuwan,≤100
107146294523649,พันธ์ศักดิ์ บุญแทน,พันธ์ศักดิ์ บุญแทน,≤100
2230596726985945,ฮาย ปวิศรัฐฐ์ ติยะไพรัช,บริษัท เวิร์ค 360 จำกัด,≤100
2046265545683549,เชียร์ลุง,เชียร์ลุง,≤100
204016840519336,ศ.ดร.นฤมล ภิญโญสินวัฒน์,ศ.ดร.นฤมล ภิญโญสินวัฒน์,≤100
112073738279329,สิงโต - ศักดิ์สิทธิ์ ขาวทอง,สิงโต - ศักดิ์สิทธิ์ ขาวทอง,≤100
110925395241605,พรรครักษ์ผืนป่าประเทศไทย,พรรครักษ์ผืนป่าประเทศไทย,≤100
352441548459901,พูดพูดไปงั้น,These ads ran without a disclaimer,≤100
105955949137073,ติดตามกระแสคนดัง,Narat Thanyaratmetee,≤100
108261230583781,เอิร์ธ พงศกร ขวัญเมือง - Earth Pongsakorn Kwanmuang,เอิร์ธ พงศกร ขวัญเมือง - Earth Pongsakorn Kwanmuang,≤100
103003377726705,เสื้อผ้าแฟชั่นNaPa,Threeramate Artkongharn,≤100
104879999243950,พลชัย พิพิธวรกุล เบอร์ 2 เขต 4 ขอนแก่น พรรคประชาธิปัตย์,Ponchai Pipitvorakul,≤100
131777330175392,MGR Online Politics,MGR Online Politics,≤100
117849264601668,วิษณุ กรองกันภัย พรรคไทยพร้อม เบอร์ 28,ลลดา อมาตยกุล,≤100
241115389300595,คุณหญิงสุดารัตน์ เกยุราพันธุ์ Sudarat Keyuraphan,คุณหญิงสุดารัตน์ เกยุราพันธุ์ Sudarat Keyuraphan,≤100
101831726085555,พรรครวมแผ่นดิน,พรรครวมแผ่นดิน,≤100
102108535240880,สมบัติ ยะสินธุ์,สมบัติ ยะสินธุ์,≤100
1145461482239023,SMART ENERGY,These ads ran without a disclaimer,≤100
113023081702937,ธีระ สลักเพชร,ธีระ สลักเพชร,≤100
567028733726812,ต่อศักดิ์  อัศวเหม,ต่อศักดิ์  อัศวเหม,≤100
513741371997112,Amarin TV,อมรินทร์ เทเลวิชั่น,≤100
100454798870209,พรรคเส้นด้าย - Zendai Party,พรรคเส้นด้าย - Zendai Party,≤100
102661302788490,กานต์ กฤตินี รุณแสง,วรรณชัย เรือนแก้ว,≤100
112667281187463,ถิรเดช ตั้งมั่นก่อกิจ สจ.ม้อ,ถิรเดช ตั้งมั่นก่อกิจ สจ.ม้อ,≤100
110199735129147,ทวี สุระบาล,ทวี สุระบาล,≤100
149079361791677,พรรคเพื่อไทย,พรรคเพื่อไทย,≤100
103983981304937,พรรคเสมอภาค-Equality Party,Nalinphas Ongkunaruk,≤100
1633051440333187,FTE หลักสูตรเพื่อพัฒนาเจ้าของธุรกิจรุ่นใหม่ ครบเครื่อง ทันใจ แบบเร่งรัด,"VP group infinity Co.,Ltd.",≤100
115922723434700,ครูเจพีสรุปย่อ for Teacher,ครูเจพีสรุปย่อ for Teacher,≤100
103742482695590,เจมส์ สรรเพ็ชญ ศรีสวัสดิ์ - James Sanphet Srisawat,เกริกกฤษดา ทองแก้วสวัสดิ์,≤100
407194015987067,Ch7HD News,Ch7HD News,≤100
102949686071401,ทศพล แก้วทิมา ราชบุรีต้องดีกว่าเดิม,ทศพล แก้วทิมา ราชบุรีต้องดีกว่าเดิม,≤100
104554835726206,พรรคท้องที่ไทย,Tanongsak Sirirat,≤100
102869035843440,อนุชา ขวัญคาวิน เขต 2 นครศรีธรรมราช,Sunisa Phanklang,≤100
194806671454828,นายศาสตรา ศรีปาน - Sarttra Sripan,นายศาสตรา ศรีปาน - Sarttra Sripan,≤100
118757751143686,อิทธิพล ชลธราศิริ - Itthiphon Chontharasiri - แบงค์ชัย,Itthiphon Chontharasiri,≤100
283155375658667,"จ่าสิบเอกพัฒณปกรณ์   ดอนตุ้มไพร ""จ่าเจี๊ยบ""",Sueb Supachai,≤100
105308564750704,ณัฏฐ์ มงคลนาวิน,ณัฏฐ์ มงคลนาวิน,≤100
2086963124904186,พรรคก้าวไกล แม่ฮ่องสอน,พรรคก้าวไกล แม่ฮ่องสอน,≤100
116668478038395,โด่ง ชัชวาล พรอมรธรรม เพื่อไทย ขอนแก่น เขต 1,โด่ง ชัชวาล พรอมรธรรม,≤100
1423854681069294,สาคร เกี่ยวข้อง,สาคร เกี่ยวข้อง,≤100
109263155401195,นายกประเทศ บุญยงค์,นายกประเทศ บุญยงค์,≤100
2232486313631668,อนุรักษ์ จุรีมาศ,ธวัชชานลล์ ทำขุรู,≤100
159570997481890,พลตำรวจเอกเสรีพิศุทธ์ เตมียเวส,พลตำรวจเอกเสรีพิศุทธ์ เตมียเวส,≤100
214450406158935,สุรชาติ เทียนทอง,These ads ran without a disclaimer,≤100
106439615083259,ธนวัช ภูเก้าล้วน  เคี่ยงกระบี่,ธนวัช ภูเก้าล้วน  เคี่ยงกระบี่,≤100
161052211196800,พรรคเสรีรวมไทย,พรรคเสรีรวมไทย,≤100
112343717773740,Betapetonline,ชัชญา พานิช,≤100
107945618934003,ธนูชยานันท์ ปั้นบริสุทธิ์,ธนูชยานันท์ ปั้นบริสุทธิ์,≤100
110672681521491,พรรคชาติรุ่งเรือง - Chat Rung Rueang Party,พรรคชาติรุ่งเรือง - Chat Rung Rueang Party,≤100
100761582502948,จารุพล เรืองสุวรรณ - อาจารย์จา,Charupol Ruangsuwan,≤100
108515294626891,สอบข้าราชการท้องถิ่น By Thurakan,Chiraphorn Thuree,≤100
108201828409912,ณัฐวัฒน์ พอใช้ได้,Atirit Dechasiniwat,≤100
362673720528997,พรรครวมแผ่นดิน,พรรครวมแผ่นดิน,≤100
1105604039583762,Line One สว.นท. ขอเชิญส่งประวัติ ส่วนตัว องค์กร เพื่อเข้ารับรางวัลประจำปี,Suksan Booran,≤100
109132222106497,เอฟ ชนัตถ์ นันทปัญญา,Katakorn Phukhaow,≤100
113067400607487,กันตพงศ์ ดีชัยยะ - แมพ,กันตพงศ์ ดีชัยยะ - แมพ,≤100
111485468432921,พรรคเปลี่ยนอนาคต Changefuture party,พรรคเปลี่ยนอนาคต Changefuture party,≤100
789991318125212,พงศกร รัตนเรืองวัฒนา,พงศกร รัตนเรืองวัฒนา,≤100
104224665030349,สุราษฎร์ต้องไปต่อ Go To The Future,ศิวัตม์ ใจเอื้อ,≤100
117756427935556,อนุชา ขวัญคาวิน,Sunisa Phanklang,≤100
106509022056657,สุนิตย์ แก้วจินดา,Wijuk Pruksuriya,≤100
116688364727210,เพื่อนแท้ Trader By.hua,These ads ran without a disclaimer,≤100
112706641077875,สจ.ดนุภัทร์ เชียงชุม,สจ.ดนุภัทร์ เชียงชุม,≤100
104393812499502,ชีทสรุปกฎหมาย สำหรับสอบราชการ พนักงานราชการ by.kantap,ชีทสรุปกฎหมาย สำหรับสอบราชการ พนักงานราชการ by.kantap,≤100
251576523395330,Peerapol Thatom พีรพล ทะต่อม,Peerapol Thatom,≤100
622674297897819,Screenshirt2020,Screenshirt2020,≤100
102099148270519,เเนวข้อสอบราชการออนไลน์,These ads ran without a disclaimer,≤100
104342402244178,อารุม ตุ้มน้อย - Arum Tumnoi,อารุม ตุ้มน้อย - Arum Tumnoi,≤100
107648367788852,วงศกร ชนะกิจ,วงศกร ชนะกิจ,≤100
107612328588715,The Voters,สันติสุข กาญจนประกร,≤100
106561034744198,ลอรี่ - พงศ์พล ยอดเมืองเจริญ,ลอรี่ - พงศ์พล ยอดเมืองเจริญ,≤100
112562765084856,หนึ่ง ธนิท กิตติจารุรักษ์,Sueb Supachai,≤100
101993912231730,Dime,These ads ran without a disclaimer,≤100
111341764925564,สำนักสนับสนุนการพัฒนาระบบสุขภาพ - สำนัก 7 สสส.,สำนักสนับสนุนการพัฒนาระบบสุขภาพ - สำนัก 7 สสส.,≤100
101504656149099,Peace Sasipatra  - พีซ ศศิร์ภัทรา,Peace Sasipatra  - พีซ ศศิร์ภัทรา,≤100
100813082276696,สมบูรณ์วรรณ ตรีสินธุ์ไชย,Somboonwan Nong Treesinchai,≤100
107448364979874,ศิริพงศ์ นานคงแนบ - Siripong Nankongnab,Siripong Nankongnab,≤100
345127652279503,มูลนิธิสากลเพื่อคนพิการ,มูลนิธิสากลเพื่อคนพิการ,≤100
104299218601490,กระชังบก อธิวัฒน์ การประมง,These ads ran without a disclaimer,≤100
1803047169945046,หรอยหาดใหญ่,These ads ran without a disclaimer,≤100
111331191880453,วินัย วิจิตรโสภณ - Winai Wijitsophon,วินัย วิจิตรโสภณ - Winai Wijitsophon,≤100
110398018491526,สุทิน นพขำ พรรคเพื่อไทย จังหวัดปทุมธานี,สุทิน นพขำ พรรคเพื่อไทย จังหวัดปทุมธานี,≤100
2147269921986413,ธนัญญา พันธุ์การรุ่ง พรรคเพื่อไทย นครปฐมเขต2,Pang Thanakulchotikan,≤100
109698034792248,Shambhala Bookstore,These ads ran without a disclaimer,≤100
1241410716007401,ทศพล เพ็งส้ม,Thosaphol Pengsom,≤100
2151302718520482,ธิดารัตน์ ยิ่งเจริญ Tidarat Yingcharoen,ธิดารัตน์ ยิ่งเจริญ Tidarat Yingcharoen,≤100
3080161418691131,Thailand FACT Today,Thailand FACT Today,≤100
116679231319335,ตุ๊ก - กานสินี,Dunyawat  Bamrungchan,≤100
340110720173014,SaveThaiCuts,SaveThaiCuts,≤100
111852360177624,วิวัฒน์ จินดาพล สจ.ต้อม,วิวัฒน์ จินดาพล สจ.ต้อม,≤100
102544175903371,เบ๊นซ์ นิธิพล  เพื่อคนสมุทรปราการ,เบ๊นซ์ นิธิพล  เพื่อคนสมุทรปราการ,≤100
1123326217727200,อุดรมาร์เก็ตเพลส,อุดรมาร์เก็ตเพลส,≤100
105797342104349,พี่ตาเล็ก โรจน์พิศาล อินทรักษ์,ทศวรรษ คงรอด,≤100
110863091226908,เสวก ประเสริฐสุข,เสวก ประเสริฐสุข,≤100
104570329236348,Nungrutai Hasdin,These ads ran without a disclaimer,≤100
119419651090796,ธงพลิ้ว เจนสมบูรณ์สิน - Thongpleew Jansomboonsin,These ads ran without a disclaimer,≤100
206494963551681,สุนทรี ชัยวิรัตนะ,These ads ran without a disclaimer,≤100
101673076131930,พรรคเปลี่ยน,นอท พันธ์ธวัช นาควิสุทธิ์,≤100
101755712680612,รัก ณิชาภา โกวิทานนท์ ผู้สมัคร ส.ส.สมุทรสงคราม พรรคเพื่อไทย,รัก ณิชาภา โกวิทานนท์ ผู้สมัคร ส.ส.สมุทรสงคราม พรรคเพื่อไทย,≤100
972019486321939,บู้ จเด็ศ จันทรา,จเด็ด จันทรา,≤100
114574341574903,อิทธิเดช สุพงษ์ - Itthidej Suphong,Tanapat Srisontiyakun,≤100
112151181255165,สมยศ พลายด้วง,Nichapha Sriwilai,≤100
119181906609798,หมอเฉลิมชัย กุลาเลิศ ผู้สมัคร ส.ส. พรรคก้าวไกล เขตห้วยขวาง วังทองหลาง,Chalermchai Kulalert,≤100
101963962655058,พรรคพลังสหกรณ์,These ads ran without a disclaimer,≤100
108635927540997,เทมส์ ไกรทัศน์ - ภูเก็ต,เทมส์ ไกรทัศน์ - ภูเก็ต,≤100
102119372069250,สจ. ธานินท์ นวลวัฒน์,Studio415,≤100
114043631615331,ชานิสรา ภูวิจิตร บอสโอ๋เพื่อไทย,ชานิสรา,≤100
115009281539131,ทรงศักดิ์ แซ่ลี้ - ดร.บอล,Songsak Saelee,≤100
100805332971737,พรชัย อรรถปรียางกูร Pornchai Atthapreyangkul,พรชัย อรรถปรียางกูร Pornchai Atthapreyangkul,≤100
107938394191198,สิริลภัส กองตระการ,วรันธร กองแก้ว,≤100
103465462538992,ภูมิใจไทย ภูเก็ต,ภูมิใจไทย ภูเก็ต,≤100
118384374541874,มงคล ศรีคำแหง พรรคเพื่อไทย,มงคล ศรีคำแหง,≤100
104179515944602,ประชาธิปัตย์ จันทบุรี-ตราด,Unicronet - Digital Marketing Solution,≤100
106018291054558,พลังประชารัฐ ภูเก็ต สุทา ประทีป ณ ถลาง,พลังประชารัฐ ภูเก็ต สุทา ประทีป ณ ถลาง,≤100
101636186123234,ไชยพล เดชตระกูล,ไชยพล เดชตระกูล,≤100
107648367788852,วงศกร ชนะกิจ,Wongsakorn Chanakit,≤100