Page ID,Page name,Disclaimer,Amount spent (VND)
102726939281075,Đồ bộ đẹp trung niên 2,These ads ran without a disclaimer,10389
105456375620326,Phòng Tuyển Sinh - Vilaco,These ads ran without a disclaimer,9889
105845511087981,TRUYỀN HÌNH AN VIÊN,TRUYỀN HÌNH AN VIÊN,2806
919479674872321,Báo Nghệ An,Báo Nghệ An,1113
105062615490802,Thượng Tọa Thích Đức Thiện,Thượng Tọa Thích Đức Thiện,500
192195994956428,Tài Liệu Thi Viên Chức Giáo Viên,Tài Liệu Thi Viên Chức Giáo Viên,231
101865258169428,ĐEN Secondhand,ĐEN Secondhand,≤100
106476091689860,Bartra Wealth Advisors,Bartra Wealth Advisors,≤100