Page ID,Page name,Disclaimer,Amount spent (PYG)
106445798441972,Pasión Pilsen,These ads ran without a disclaimer,7270
278226125974096,El Paraguayo Independiente,Paraguayo Independiente,3928
100157179072061,Financiera ueno SAECA,These ads ran without a disclaimer,727
118397948223791,Oscar Tuma,Óscar Luis Tuma Bogado,339
270180246326694,Nestor Hugo Valenzuela Portillo,Nestor Hugo Valenzuela Portillo,287
2271652869544024,"Ygnacio  ""Nacho"" Sánchez.",Ygnacio Daniel Sanchez Duarte,236
363306313879750,Marle Chispita Orue,Marlene Tatiana Orue Leon,≤100
106438588789107,Luis Palacios Intendente,Viviano Baez Gonzalez,≤100
359307964420456,Terere Cómplice,Centro Interdisciplinario de Investigación Social,≤100
265586906915675,En Efecto,These ads ran without a disclaimer,≤100
106008797475136,Nicolás Verón,Gilberto Nicolas Veron Benitez,≤100