Page ID,Page name,Disclaimer,Amount spent (THB)
101274425792459,กิตติพงศ์ รวยฟูพันธ์ - ส.ก.ไอซ์ เขตทุ่งครุ,กิตติพงศ์ รวยฟูพันธ์ - ส.ก.ไอซ์ เขตทุ่งครุ,1354
1545656555649588,ดร.ยุ้ย เกษรา ธัญลักษณ์ภาคย์,These ads ran without a disclaimer,1245
100624122148338,โรงพยาบาลรวมใจรักษ์ สุขุมวิท 62 Ruamjairak Hospital Sukhumvit 62,โรงพยาบาลรวมใจรักษ์ สุขุมวิท 62 Ruamjairak Hospital Sukhumvit 62,1014
345127652279503,มูลนิธิสากลเพื่อคนพิการ,มูลนิธิสากลเพื่อคนพิการ,786
157659344260788,จุรินทร์ ลักษณวิศิษฏ์ Aoodda,Ruthaikan Tanomkerd,600
414100949350619,ณัฐนันท์ กัลยาศิริ - ทนายบอน,ณัฐนันท์ กัลยาศิริ,450
103943018154038,บุญสืบ จันทร์แจ่มศรี ปุ๊,บุญสืบ จันทร์แจ่มศรี,362
102807719039442,พรรครวมไทยสร้างชาติ United Thai Nation Party,พรรครวมไทยสร้างชาติ United Thai Nation Party,344
108508377637861,มุ้งจีบพระราม2 โรงงานผลิตมุ้งจีบ มุ้งลวด เหล็ดดัดทุกชนิด,กุหลาบ บัวสด,342
622674297897819,Screenshirt2020,Screenshirt2020,324
296508406790,"Democrat Party, Thailand พรรคประชาธิปัตย์","Democrat Party, Thailand พรรคประชาธิปัตย์",320
112969264517494,เพ็ญพิสุทธิ์ จินตโสภณ - Penpisut Jintasophon,Vatcharapong Wongkom,317
626952517700280,ลิ้ม ศรัณยสัณฑ์ วีรกุลสุนทร ว่าที่ผู้สมัคร ส.ส. เขตจอมทอง พรรคเพื่อไทย,ลิ้ม ศรัณยสัณฑ์ วีรกุลสุนทร ว่าที่ผู้สมัคร ส.ส. เขตจอมทอง พรรคเพื่อไทย,257
241115389300595,คุณหญิงสุดารัตน์ เกยุราพันธุ์ Sudarat Keyuraphan,คุณหญิงสุดารัตน์ เกยุราพันธุ์ Sudarat Keyuraphan,213
107535498701936,ธาม สมุทรานนท์ - Tharm Smuthranond,Yonlapat Wangsarn,200
715838732136310,ธนเดช เพ็งสุข - Tanadej Pengsuk,Tanadej Pengsuk,191
101372342567471,ต้นกล้า จรยุทธ จตุรพรประสิทธิ์ - TonKla Chorayuth Chaturapornprasit,Chorayuth Chaturapornprasit,183
107449532000210,ธิติวัฐ อดิศรพันธ์กุล - Thitiwat Adisornphankul,ธิติวัฐ อดิศรพันธ์กุล - Thitiwat Adisornphankul,140
111341764925564,สำนักสนับสนุนการพัฒนาระบบสุขภาพ - สำนัก 7 สสส.,สำนักสนับสนุนการพัฒนาระบบสุขภาพ - สำนัก 7 สสส.,110
103986582301984,เนื้อ นา บุญ,Phrathanakrit Upachai,≤100
101535845426970,พรรคไทยสร้างไทย,พรรคไทยสร้างไทย,≤100
106561034744198,ลอรี่ - พงศ์พล ยอดเมืองเจริญ,ลอรี่ - พงศ์พล ยอดเมืองเจริญ,≤100
2091153520919518,อนุทิน ชาญวีรกูล,อนุทิน ชาญวีรกูล,≤100
115922723434700,ครูเจพีสรุปย่อ for Teacher,ครูเจพีสรุปย่อ for Teacher,≤100
567743816917663,The Article,The Article,≤100
104427797605274,ดร.เฉลิมชัย ศรีอ่อน รัฐมนตรีว่าการกระทรวงเกษตรและสหกรณ์,ดร.เฉลิมชัย ศรีอ่อน รัฐมนตรีว่าการกระทรวงเกษตรและสหกรณ์,≤100
106918888863637,Veterinary Sciences MDPI,These ads ran without a disclaimer,≤100
257083724467673,ยุทธพล  อังกินันทน์,ยุทธพล อังกินันทน์,≤100
601953326929372,ธัญวัจน์ กมลวงศ์วัฒน์ - Tunyawaj Kamolwongwat,Tunyawaj Kamolwongwat,≤100
985820164804495,ธนาคารพัฒนาวิสาหกิจขนาดกลางและขนาดย่อมแห่งประเทศไทย,ธนาคารพัฒนาวิสาหกิจขนาดกลางและขนาดย่อมแห่งประเทศไทย,≤100
493026767870664,พรรคพลังประชารัฐ,พรรคพลังประชารัฐ,≤100
161651553861945,Amnesty International Thailand,Amnesty International Thailand,≤100
113780154676973,เครื่องมือช่างไฟฟ้า เครื่องมือช่างไม้ เครื่องมือช่างยนต์ by Pro tool,Surin Phothiphoksampan,≤100
107612328588715,The Voters,สันติสุข กาญจนประกร,≤100
2263098807292933,ทนายศฤงคาร  ข่ายสุวรรณ์,Saringkan Khaisuwon,≤100
100240152175449,ป้าโส FC by Tacina,Dunyawat  Bamrungchan,≤100
190923294988741,สอบครูผู้ช่วยนะ,สอบครูผู้ช่วยนะ,≤100
207416296817756,พรรคก้าวไกลราชบุรี - Move Forward Party,Unnop Sricharoenchai,≤100
101421095191733,รางวัลเพชรรัตนชาติ 2021 และ รางวัลสุบรรณกาย,These ads ran without a disclaimer,≤100
112394371483043,เครื่องมือไฟฟ้า และเครื่องมือช่าง ราคาถูก by HomeLink V.1,Surin Phothiphoksampan,≤100
1508206212743325,สภาองค์กรเยาวชนคนสร้างชาติ  มูลนิธิคุ้มเกล้าเยาวชนคนสร้างชาติ,These ads ran without a disclaimer,≤100
338495743979473,สภาองค์กรวัฒนธรรมไทย อาเซียน,These ads ran without a disclaimer,≤100
418729291509368,สถาบันปรีดี พนมยงค์ Pridi Banomyong Institute,สถาบันปรีดี พนมยงค์ Pridi Banomyong Institute,≤100
110144991464196,กรอบลอยไวนิล แคนวาส บอร์ดไดคัท 99 บาท มีเก็บปลายทาง,Sakawtip Utha,≤100
613689015307999,ส.ส.แมน ฉัตรพันธ์ เดชกิจสุนทร,ส.ส.แมน ฉัตรพันธ์ เดชกิจสุนทร,≤100
106013405453487,"""นายกโต้ง"" นายนพพร อุสิทธิ์ นายก อบจ.ชุมพร","""นายกโต้ง"" นายนพพร อุสิทธิ์ นายก อบจ.ชุมพร",≤100
1834384523535066,จันทร์เพ็ญ ประเสริฐศรี - เพจประชาสัมพันธ์กิจกรรม,These ads ran without a disclaimer,≤100
104763178714577,Gels MDPI,These ads ran without a disclaimer,≤100
100417379468020,Agronomy MDPI,These ads ran without a disclaimer,≤100
107419398838282,Global Digital Inclusion Partnership,These ads ran without a disclaimer,≤100
188842724507690,مفوضية اللاجئين,These ads ran without a disclaimer,≤100
526327500799853,China.org.cn,These ads ran without a disclaimer,≤100
31292782350,Deutschland.de,These ads ran without a disclaimer,≤100
216311481960,Bill Gates,These ads ran without a disclaimer,≤100