Page ID,Page name,Disclaimer,Amount spent (VND)
105845511087981,TRUYỀN HÌNH AN VIÊN,TRUYỀN HÌNH AN VIÊN,4646
101865258169428,ĐEN Secondhand,ĐEN Secondhand,1104
104640271243082,Bách Hóa Ăn Dặm,Bách Hóa Ăn Dặm,811
105062615490802,Thượng Tọa Thích Đức Thiện,Thượng Tọa Thích Đức Thiện,690
109432751532773,Lương Y Phạm Văn Thanh 166 Hàm Nghi Lào Cai,These ads ran without a disclaimer,603
117399794624246,Đầu Tư Thông Minh,These ads ran without a disclaimer,525
919479674872321,Báo Nghệ An,Báo Nghệ An,285
1635246696802970,Tuyển sinh trong nước và lao động,These ads ran without a disclaimer,≤100
100538306165371,Chìa Khóa Dẫn Đến Thành Công,These ads ran without a disclaimer,≤100