Page ID,Page name,Disclaimer,Amount spent (VND)
101914358044085,Tài Liệu Ôn Thi Viên Chức Giáo Dục,Tài Liệu Ôn Thi Viên Chức Giáo Dục,27407
100763306140572,Đầu Tư Tài Chính 5.0,These ads ran without a disclaimer,13118
100910152992671,Thầy Thanh Chữa Xương Khớp,These ads ran without a disclaimer,3289
1507429892822619,BOM Money,BOM Money,630
103783255897108,Glow Books - Hành Trình Tỏa Sáng,These ads ran without a disclaimer,246
139336407890,"StellarNet, Inc.",These ads ran without a disclaimer,≤100