Page ID,Page name,Disclaimer,Amount spent (VND)
105845511087981,TRUYỀN HÌNH AN VIÊN,TRUYỀN HÌNH AN VIÊN,2746
104640271243082,Bách Hóa Ăn Dặm,Bách Hóa Ăn Dặm,1545
109432751532773,Lương Y Phạm Văn Thanh 166 Hàm Nghi Lào Cai,These ads ran without a disclaimer,549
105062615490802,Thượng Tọa Thích Đức Thiện,Thượng Tọa Thích Đức Thiện,380
101865258169428,ĐEN Secondhand,ĐEN Secondhand,≤100
919479674872321,Báo Nghệ An,Báo Nghệ An,≤100
1635246696802970,Tuyển sinh trong nước và lao động,These ads ran without a disclaimer,≤100