Page ID,Page name,Disclaimer,Amount spent (USD)
100524251686344,Gustavo Acevedo,Gustavo Jose Acevedo Berganza,≤100
147858435252169,Embajada de los Estados Unidos en El Salvador,Embajada de Estados Unidos en El Salvador,≤100
643513979193133,Unidos por Beatriz,Neuma,≤100
92681788070,Caja de Crédito de Sonsonate,CAJA DE CREDITO DE SONSONATE,≤100
100541468870287,Alcaldía Municipal de Mejicanos,Alcaldía Municipal de Mejicanos,≤100
100456328373090,Samuel Martínez,Erick Erazo,≤100
269601400112823,Raúl Chamagua,Jose Raúl Chamagua Noyola,≤100
421104621589691,Cristian Flores,Presidencia de la República de El Salvador,≤100
1935947973198237,Alcaldía El Paraíso Chalatenango,Alexi Antonio Escalante Galdamez,≤100
111684638235538,Soyapango UNIDO,Jacob Josafat Benitez Carrillo,≤100
108447974942666,Instituto de Bienestar Animal - El Salvador,Instituto de Bienestar Animal,≤100
131602424169035,Oxfam en Español,These ads ran without a disclaimer,≤100
152914224736727,Banco Mundial,These ads ran without a disclaimer,≤100
112731733833728,Familias: Ahora,These ads ran without a disclaimer,≤100
384422538296426,United Palestinian Appeal - UPA,These ads ran without a disclaimer,≤100
101710084928516,Dr. Bryan Orellana,Dr. Bryan Orellana,≤100
103822974904636,Guía de Sexo Seguro,These ads ran without a disclaimer,≤100
101801685891012,Revista Knowable,These ads ran without a disclaimer,≤100
1917715138510680,Follow Your Legend,These ads ran without a disclaimer,≤100
319549428716940,Maria Luisa Lima,These ads ran without a disclaimer,≤100