Page ID,Page name,Disclaimer,Amount spent (USD)
519608978084713,Ghana Education Trust Fund,Ghana Education Trust Fund (GETFund),≤100
105713881570703,Ernest Kobeah,Ernest Kobeah,≤100
102179325363565,Samuel A. Jinapor,Samuel Abdulai Jinapor,≤100
1885114401706195,Dr. Matthew Opoku Prempeh,Dr. Matthew Opoku Prempeh,≤100
102618778592624,Come Unto Christ In West Accra,Come Unto Christ In West Accra,≤100
103610990981859,Hon. Samuel Atta Mills,Esther Ayensu,≤100
1914748762150141,R-Kuzy TV,These ads ran without a disclaimer,≤100