Page ID,Page name,Disclaimer,Amount spent (USD)
293384094915450,جريدة الحراك الإخباري,جريدة الحراك الإخباري,≤100
243385523091421,Competent Boards,These ads ran without a disclaimer,≤100
698038864352935,الصفحة الرسمية للسيد براهمية عبد الرفيق - نائب بالمجلس الشعبي الوطني,الصفحة الرسمية للسيد براهمية عبد الرفيق - نائب بالمجلس الشعبي الوطني,≤100
104140320927199,قناة النصر TV,قناة النصر TV,≤100
106684228815847,Africa's Green Economy Summit,These ads ran without a disclaimer,≤100
310943025606302,World Cancer Day,These ads ran without a disclaimer,≤100