Page ID,Page name,Disclaimer,Amount spent (USD)
339646519820476,Garden City хотхон,Garden City хотхон,≤100
1632521350369406,САЙН онлайн дэлгүүр,Tsatsral Tumen,≤100
109352650803239,"Улсын эрх ашиг, тусгаар тогтнолын нам FB page",Batjargal Gochoosuren,≤100
101252088988452,Шоовдорын ТӨМӨРСҮХ/Эрх Чөлөөг Хэрэгжүүлэгч  Нам/,Шоовдорын Төмөрсүх,≤100
110766893779395,Одон орон зурхай судлал Д.Жавхлан,Одон орон зурхай судлал Д.Жавхлан,≤100
2071749836256302,Ирмүүнстар Хэвлэл,These ads ran without a disclaimer,≤100
161666143844859,Sandvik,These ads ran without a disclaimer,≤100