Page ID,Page name,Disclaimer,Amount spent (VND)
101914358044085,Tài Liệu Ôn Thi Viên Chức Giáo Dục,Tài Liệu Ôn Thi Viên Chức Giáo Dục,55164
102726939281075,Đồ bộ đẹp trung niên 2,These ads ran without a disclaimer,8306
105845511087981,TRUYỀN HÌNH AN VIÊN,TRUYỀN HÌNH AN VIÊN,1287
106476091689860,Bartra Wealth Advisors,Bartra Wealth Advisors,1248
919479674872321,Báo Nghệ An,Báo Nghệ An,722
100190251454228,Bình Bán Book,These ads ran without a disclaimer,≤100
108354147624545,natfarouz,These ads ran without a disclaimer,≤100
111508197374332,ADB Southeast Asia Development Solutions - SEADS,These ads ran without a disclaimer,≤100