Page ID,Page name,Disclaimer,Amount spent (HNL)
114601521910,Jorge Aldana,Jorge Aldana,762
349524351841734,Cárlenton Dávila,Cárlenton Dávila,298
153003381515332,Cespad - Centro de Estudio para la Democracia,Centro de Estudio para la Democracia (Cespad),≤100
1619479898324505,Partido Liberal de Honduras,Partido Liberal de Honduras,≤100
119036229501004,Fruitful Harvesters International,These ads ran without a disclaimer,≤100
102948998654217,Baking Haven,These ads ran without a disclaimer,≤100
152914224736727,Banco Mundial,These ads ran without a disclaimer,≤100