Page ID,Page name,Disclaimer,Amount spent (VND)
105062615490802,Thượng Tọa Thích Đức Thiện,Thượng Tọa Thích Đức Thiện,2895
105845511087981,TRUYỀN HÌNH AN VIÊN,TRUYỀN HÌNH AN VIÊN,2685
103462819259532,Xuất Khẩu Lao Động Nước Ngoài Phí Rẻ,These ads ran without a disclaimer,2354
101865258169428,ĐEN Secondhand,ĐEN Secondhand,1357
105845511087981,TRUYỀN HÌNH AN VIÊN,These ads ran without a disclaimer,511
919479674872321,Báo Nghệ An,Báo Nghệ An,297
101957285428877,Thức Tỉnh,These ads ran without a disclaimer,188