Page ID,Page name,Disclaimer,Amount spent (USD)
114653269155,Peoples Progressive Party/Civic,Peoples Progressive Party/Civic,≤100
176166462478584,Vice President  Bharrat Jagdeo,Vice President  Bharrat Jagdeo,≤100
111068872040824,Super Quiz,These ads ran without a disclaimer,≤100
371227786709544,Refund Express LLC,These ads ran without a disclaimer,≤100
123465590650551,Allied Health Group USA,These ads ran without a disclaimer,≤100
101793669214903,Lili Almeida,These ads ran without a disclaimer,≤100