Page ID,Page name,Disclaimer,Amount spent (USD)
102041322886335,مولاي أشرف حمود الشيخ Moulaye Achraf Hamoud Cheikh,Bah Abdellahi,≤100
110631788681313,تواصل/ الحملة الإنتخابية 2023 - معا نصنع التغيير,Abdallahi Saleck Mohamed Alem,≤100
114012888341133,"حملة اللائحة الوطنية المختلطة ل""تواصل""",Abdallahi Saleck Mohamed Alem,≤100
2021715831452421,مناصرو الميتر العيد محمدن - محامي وحقوقي ونائب في البرلمان,مناصرو الميتر العيد محمدن - محامي وحقوقي ونائب في البرلمان,≤100
112996045035943,حملة مرشح الشباب: محمد ولد يحيى,اطول عمر المصطف,≤100
330841846933183,حزب التجمع الوطني للإصلاح والتنمية - تواصل,Mohamed Soueidi,≤100
271202350087390,النائب البرلماني : محمد بوي ولد الشيخ محمد فاضل - خيار الحق,النائب البرلماني : محمد بوي ولد الشيخ محمد فاضل - خيار الحق,≤100
122582320814095,فاطمة سيدأحمد المختار السالم,Ely Dendou Mohamed,≤100
116420348100139,السعد ولد أفلواط,NEJAHPROJECT,≤100
112362735177936,محمد عبد الله الشيخان,NEJAHPROJECT,≤100
101523669605768,Sid’Ahmed Bolle Cheibany - سيد أحمد بلّه الشيباني,Abdellahi Ahmed El Mostapha,≤100
118834241181417,النائب سهام محمد يحي,These ads ran without a disclaimer,≤100