Page ID,Page name,Disclaimer,Amount spent (PEN)
101665683225827,José Luna Gálvez - Pepe Luna,Laidy Diana Peceros Espinoza,≤100
317113615022843,César Acuña,Cesar Acuña Peralta,≤100
109019574560600,Aula Gaceta,Joel V. Supo Baldo,≤100
102312877849712,MiNo S1 Vitaliy,These ads ran without a disclaimer,≤100
462790453744032,Sutep,Sindicato Unitario de Trabajadores en la Educación del Perú - SUTEP,≤100
101053675911037,Fabri & Asociados Consultoría Política y de Mercadeo,Whilber Eugenio Huallanca Conde,≤100
111414617139812,Centro de Capacitación y Desarrollo - CCD,These ads ran without a disclaimer,≤100
100868325382148,Elizabeth Taipe Coronado - Congresista,Daniel Franklin Quispe Aguilar,≤100
1818909191687776,KOMART,These ads ran without a disclaimer,≤100
109808225725403,DAR Perú,DAR Perú,≤100
103874242354782,Mayra Katarina Barck,These ads ran without a disclaimer,≤100
282155638822410,Jóvenes de Acción Popular,Ivette Paola Mendoza Hurtado,≤100
110017409083497,"""Area Para el Desarrollo en Valores Humanos"" (Instituto Sai Peru)",Juan Carlos Ponce de León Aguirre,≤100
316564475960113,Estudio Jurídico Tarazona & Asociados,Diego Alberto Isla Yengle,≤100
501011359923743,IDL-Instituto de Defensa Legal,Jose Del Carmen Rojas Chuya,≤100
345598702466568,Prensatur Callao,These ads ran without a disclaimer,≤100
417661094920749,Mas Que Consumidores,Abdon César Augusto Delgado La Cotera,≤100
196140697656186,Len Corell,Ricardo Felix Coral,≤100
104723341438240,EnRumbo Noticias,EnRumbo Noticias,≤100
1805183599788143,Silvia Monteza,Héctor Melgar Sandoval,≤100
253518258580731,Pucallpa 2.0 - Noticias,Pucallpa 2.0 - Noticias,≤100
152306641494958,BBVA,These ads ran without a disclaimer,≤100
264223880347121,Lampadia Oficial,LAMPADIA,≤100
454363287967300,Elvis Cezar,These ads ran without a disclaimer,≤100
141796229342716,Comexperu,These ads ran without a disclaimer,≤100
101068718301342,Lecturas Con Propósito,These ads ran without a disclaimer,≤100
142062936237878,Goberna,Goberna,≤100
107113751924466,Energía solar - CIA,These ads ran without a disclaimer,≤100