Page ID,Page name,Disclaimer,Amount spent (VND)
111649914996393,Viên đại tràng Nhất Nhất,These ads ran without a disclaimer,4294
106476091689860,Bartra Wealth Advisors,Bartra Wealth Advisors,1290
114075063569561,Lương Y Phạm Văn Thanh - Việc Tử Tế VTV1,These ads ran without a disclaimer,675
105845511087981,TRUYỀN HÌNH AN VIÊN,TRUYỀN HÌNH AN VIÊN,663
919479674872321,Báo Nghệ An,Báo Nghệ An,224
155460521146066,RFI Tiếng Việt,These ads ran without a disclaimer,≤100
117741954907367,TeachingEnglish - British Council,These ads ran without a disclaimer,≤100