Page ID,Page name,Disclaimer,Amount spent (USD)
214225965275748,وكالة وطن للأنباء,وكالة وطن للأنباء,≤100
109385678758312,حملة لأجل فلسطين,These ads ran without a disclaimer,≤100
568444166596807,Social Developmental Forum- SDF,Atta Khaled Hammouda,≤100
592121074146775,Roles for Social Change Association-ADWAR مؤسسة أدوار للتغيير الاجتماعي,These ads ran without a disclaimer,≤100
100268935176128,Horizon Center,Horizon Center,≤100
1662250870723179,PCPD Center,Wattan TV,≤100
112757083778788,"Economic Daily, China",These ads ran without a disclaimer,≤100
103789762224168,Xender emmanuel the  Internet Analyst,These ads ran without a disclaimer,≤100