Page ID,Page name,Disclaimer,Amount spent (THB)
102807719039442,พรรครวมไทยสร้างชาติ United Thai Nation Party,พรรครวมไทยสร้างชาติ United Thai Nation Party,≤100
137188693021815,สืบจากข่าว,สืบจากข่าว,≤100
104427797605274,ดร.เฉลิมชัย ศรีอ่อน รัฐมนตรีว่าการกระทรวงเกษตรและสหกรณ์,ดร.เฉลิมชัย ศรีอ่อน รัฐมนตรีว่าการกระทรวงเกษตรและสหกรณ์,≤100
345127652279503,มูลนิธิสากลเพื่อคนพิการ,มูลนิธิสากลเพื่อคนพิการ,≤100
111341764925564,สำนักสนับสนุนการพัฒนาระบบสุขภาพ - สำนัก 7 สสส.,สำนักสนับสนุนการพัฒนาระบบสุขภาพ - สำนัก 7 สสส.,≤100
101535845426970,พรรคไทยสร้างไทย,พรรคไทยสร้างไทย,≤100
161651553861945,Amnesty International Thailand,Amnesty International Thailand,≤100
157659344260788,จุรินทร์ ลักษณวิศิษฏ์ Aoodda,Jurin Laksanawisit,≤100
101178062238439,ณณัฏฐ์ หงษ์ชูเวช กิ๊ก,ณณัฏฐ์ หงษ์ชูเวช กิ๊ก,≤100
103986582301984,เนื้อ นา บุญ,Phrathanakrit Upachai,≤100
115922723434700,ครูเจพีสรุปย่อ for Teacher,ครูเจพีสรุปย่อ for Teacher,≤100
110263854646061,กฤตทัศชญา ดิษฐเนตร,กฤตทัศชญา ดิษฐเนตร,≤100
241115389300595,คุณหญิงสุดารัตน์ เกยุราพันธุ์ Sudarat Keyuraphan,คุณหญิงสุดารัตน์ เกยุราพันธุ์ Sudarat Keyuraphan,≤100
296508406790,"Democrat Party, Thailand พรรคประชาธิปัตย์","Democrat Party, Thailand พรรคประชาธิปัตย์",≤100
1635406246730420,วรงค์ เดชกิจวิกรม - Warong Dechgitvigrom,วรงค์ เดชกิจวิกรม - Warong Dechgitvigrom,≤100
183238185051108,อรรถวิชช์ สุวรรณภักดี,อรรถวิชช์ สุวรรณภักดี,≤100
1105604039583762,Line One สว.นท. ขอเชิญส่งประวัติ ส่วนตัว องค์กร เพื่อเข้ารับรางวัลประจำปี,Suksan Booran,≤100
107612328588715,The Voters,สันติสุข กาญจนประกร,≤100
100298682713615,เสื้อวินเทจ ลายมัน ผ้าดำ,เสื้อวินเทจ ลายมัน ผ้าดำ,≤100
622674297897819,Screenshirt2020,Screenshirt2020,≤100
2263098807292933,ทนายศฤงคาร  ข่ายสุวรรณ์,Saringkan Khaisuwon,≤100
494189467277672,Agenda,บริษัท ดิ อาเจนด้า จำกัด,≤100
100240152175449,ป้าโส FC by Tacina,Dunyawat  Bamrungchan,≤100
530945957405983,Nitipon Piwmow - นิติพล ผิวเหมาะ,Nitipon Piwmow,≤100
102530815945359,ชูชีพ ตรีโภคา,Areeya Namdokmai,≤100
105597688839784,เครื่องมือช่างไม้ เครื่องมือช่างไฟฟ้า เครื่องมือช่างยนต์ V.1,Surin Phothiphoksampan,≤100
567743816917663,The Article,The Article,≤100
100545119426784,พีระพันธุ์ FC,Bunsong Rodyo,≤100
110144991464196,กรอบลอยไวนิล แคนวาส บอร์ดไดคัท 99 บาท มีเก็บปลายทาง,Sakawtip Utha,≤100
785483514984398,ร้านหนังสือของหญิงสาว,These ads ran without a disclaimer,≤100
277320192288594,โอม จิรชาติ,โอม จิรชาติ,≤100
190923294988741,สอบครูผู้ช่วยนะ,สอบครูผู้ช่วยนะ,≤100
613689015307999,ส.ส.แมน ฉัตรพันธ์ เดชกิจสุนทร,ส.ส.แมน ฉัตรพันธ์ เดชกิจสุนทร,≤100
601953326929372,ธัญวัจน์ กมลวงศ์วัฒน์ - Tunyawaj Kamolwongwat,Tunyawaj Kamolwongwat,≤100
106561034744198,ลอรี่ - พงศ์พล ยอดเมืองเจริญ,ลอรี่ - พงศ์พล ยอดเมืองเจริญ,≤100
215836908565280,ส.ส. ชินวรณ์ บุณยเกียรติ - Chinnaworn Boonyakiat,These ads ran without a disclaimer,≤100
108228864108957,2read,These ads ran without a disclaimer,≤100
316346342626678,MP2 Vintage เสื้อผ้าแฟชั่นมือสอง ราคาถูกสุดคุ้ม,These ads ran without a disclaimer,≤100
281219962357397,Architecture & Design Community,These ads ran without a disclaimer,≤100