Page ID,Page name,Disclaimer,Amount spent (PYG)
105545157610039,Euclides Acevedo,Euclides Roberto Acevedo Candia,10103
430961180344844,EVER VILLALBA,Ever Federico Villalba Martinez,7215
114448232558658,Jorge Querey,Jorge Osvaldo Querey Rojas,5877
103040788902949,Concertación Nacional 2023,Rocio Magali Moreno Vera,4897
420279778178605,Adelaida Diputada 2023,Adelaida Cantero De Torres,2073
441529192988697,Rubén Penayo Senador 40/44,Rubén Penayo Senador 40/44,1806
1832577620365172,Eusebio Ramón Ayala Senador 2023,Manu Nuñez Franco,1275
114574908102864,Alianza VAMOS Por Boquerón,Alianza Vamos Por Boquerón,1258
100192941401740,Arturo Toñanez Benitez,Arturo Arnaldo Toñanez Benitez,1060
107558844100122,Pastor Filártiga,Pastor Filártiga,593
468846806618050,Hugo Cabrera,Hugo Javier Cabrera Franco,518
517426394969535,Ricardo Canese,Ricardo Canese,431
105872245439208,Pelusa Senadora,Maria Yolanda Del Rosario Moreno de Ruíz,392
1365651890238610,Soberanía Paraguay,Prensa_Py,300
646939832039958,Hugo Ibarra - Diputado Nacional,Eladio Ortiz Gayoso,297
107706177740738,Periodismo 29,Periodismo 29,284
278226125974096,El Paraguayo Independiente,Paraguayo Independiente,216
724051717643013,Miguel Prieto,Celso Kevin Ramon Sánchez Florentin,197
109400298573862,Dr. Víctor Ocampos Gobernador Paraguarí,Victor Luis Ocampos Gómez,137
108935934579454,Carlos Mencia,These ads ran without a disclaimer,≤100
363306313879750,Marle Chispita Orue,Marlene Tatiana Orue Leon,≤100
292129440851133,CropLife Latin America,These ads ran without a disclaimer,≤100
1753251591598763,Dani Mujica,Celso Kevin Ramon Sánchez Florentin,≤100
120061519391875,César Paredes,César Paredes,≤100
100432322646591,Magnom Properties,These ads ran without a disclaimer,≤100
132846400218886,ILAC International College,These ads ran without a disclaimer,≤100
1727280190891954,FRANCE 24 Español,These ads ran without a disclaimer,≤100
532716330164048,Sole Núñez,Soledad Núñez,≤100
131189377574,MDPI,These ads ran without a disclaimer,≤100
1310731702357133,GEN,GEN,≤100
1810962229216340,Fidel Zavala,Laura Lorena Meaurio Paniagua,≤100