Page ID,Page name,Disclaimer,Amount spent (THB)
101274425792459,กิตติพงศ์ รวยฟูพันธ์ - ส.ก.ไอซ์ เขตทุ่งครุ,กิตติพงศ์ รวยฟูพันธ์ - ส.ก.ไอซ์ เขตทุ่งครุ,1644
115905241390909,เนเน่ รัดเกล้า สุวรรณคีรี,Rudklao Intawong Suwankiri,1225
104427797605274,ดร.เฉลิมชัย ศรีอ่อน รัฐมนตรีว่าการกระทรวงเกษตรและสหกรณ์,ดร.เฉลิมชัย ศรีอ่อน รัฐมนตรีว่าการกระทรวงเกษตรและสหกรณ์,1119
414100949350619,ณัฐนันท์ กัลยาศิริ - ทนายบอน,ณัฐนันท์ กัลยาศิริ,722
490715381426766,บิลลี่ - Jirawat Arunyakanon - จิรวัฒน์ อรัณยกานนท์,บิลลี่ - Jirawat Arunyakanon - จิรวัฒน์ อรัณยกานนท์,656
106872458897954,ระพีพัฒน์ สุเมธโชติเมธา,ระพีพัฒน์ สุเมธโชติเมธา,496
626952517700280,ลิ้ม ศรัณยสัณฑ์ วีรกุลสุนทร ว่าที่ผู้สมัคร ส.ส. เขตจอมทอง พรรคเพื่อไทย,ลิ้ม ศรัณยสัณฑ์ วีรกุลสุนทร ว่าที่ผู้สมัคร ส.ส. เขตจอมทอง พรรคเพื่อไทย,451
622674297897819,Screenshirt2020,Screenshirt2020,382
101178062238439,ณณัฏฐ์ หงษ์ชูเวช กิ๊ก,ณณัฏฐ์ หงษ์ชูเวช กิ๊ก,338
107449532000210,ธิติวัฐ อดิศรพันธ์กุล - Thitiwat Adisornphankul,ธิติวัฐ อดิศรพันธ์กุล - Thitiwat Adisornphankul,315
296508406790,"Democrat Party, Thailand พรรคประชาธิปัตย์","Democrat Party, Thailand พรรคประชาธิปัตย์",306
102807719039442,พรรครวมไทยสร้างชาติ United Thai Nation Party,พรรครวมไทยสร้างชาติ United Thai Nation Party,284
104014285798198,กานต์ กิตติอำพน,กานต์ กิตติอำพน,279
100624122148338,โรงพยาบาลรวมใจรักษ์ สุขุมวิท 62 Ruamjairak Hospital Sukhumvit 62,โรงพยาบาลรวมใจรักษ์ สุขุมวิท 62 Ruamjairak Hospital Sukhumvit 62,250
183238185051108,อรรถวิชช์ สุวรรณภักดี,อรรถวิชช์ สุวรรณภักดี,234
101372342567471,ต้นกล้า จรยุทธ จตุรพรประสิทธิ์ - TonKla Chorayuth Chaturapornprasit,Chorayuth Chaturapornprasit,183
113516956981172,ขจรศักดิ์ ประดิษฐาน,ขจรศักดิ์ ประดิษฐาน,145
216147078543372,สำนักงานคณะกรรมการการเลือกตั้ง,สำนักงานคณะกรรมการการเลือกตั้ง,138
106337912336664,ปั้น ณัทกร แก้วพิจิตร,ปั้น ณัทกร แก้วพิจิตร,130
268359690956,Danai Chanchaochai,These ads ran without a disclaimer,124
241115389300595,คุณหญิงสุดารัตน์ เกยุราพันธุ์ Sudarat Keyuraphan,คุณหญิงสุดารัตน์ เกยุราพันธุ์ Sudarat Keyuraphan,117
102530815945359,ชูชีพ ตรีโภคา,Areeya Namdokmai,111
345127652279503,มูลนิธิสากลเพื่อคนพิการ,มูลนิธิสากลเพื่อคนพิการ,110
157659344260788,จุรินทร์ ลักษณวิศิษฏ์ Aoodda,Jurin Laksanawisit,103
107612328588715,The Voters,สันติสุข กาญจนประกร,≤100
102264295456894,Sirin Sanguansin - สิริน สงวนสิน,Sirin Sanguansin,≤100
112969264517494,เพ็ญพิสุทธิ์ จินตโสภณ - Penpisut Jintasophon,Vatcharapong Wongkom,≤100
104134765098843,ทศพล โชติคุตร์ - ผกก.หนุ่ย,ทศพล โชติคุตร์ - ผกก.หนุ่ย,≤100
111203087295386,ดร.ทวนชัย นิยมชาติ,Thuanchai Niyomchart,≤100
106561034744198,ลอรี่ - พงศ์พล ยอดเมืองเจริญ,ลอรี่ - พงศ์พล ยอดเมืองเจริญ,≤100
102477654678259,Givegoody,Pitiphat Sangngam,≤100
108508377637861,มุ้งจีบพระราม2 โรงงานผลิตมุ้งจีบ มุ้งลวด เหล็ดดัดทุกชนิด,กุหลาบ บัวสด,≤100
103628755716305,Shoe Kids Jeab Shop,These ads ran without a disclaimer,≤100
103493019318704,เพิ่มพงศ์ วงศ์ทรายทอง - เบลล์,เพิ่มพงศ์ วงศ์ทรายทอง,≤100
695064483920958,看見泰國 Vision Thai,"Lee, Chih - Te",≤100
204016840519336,ศ.ดร.นฤมล ภิญโญสินวัฒน์,ศ.ดร.นฤมล ภิญโญสินวัฒน์,≤100
100545119426784,พีระพันธุ์ FC,Bunsong Rodyo,≤100
109293730978064,พรรคก้าวไกล เชียงใหม่ - Move Forward Party Chiangmai,Visarut Sankham,≤100
115922723434700,ครูเจพีสรุปย่อ for Teacher,ครูเจพีสรุปย่อ for Teacher,≤100
108515294626891,สอบข้าราชการท้องถิ่น By Thurakan,Chiraphorn Thuree,≤100
101391206118142,อุ๋งอิ๋ง - ปานรดา ปัณณธรวรเมธ - Panrada pannathonworameth,Panrada Pannathornworameth,≤100
2263098807292933,ทนายศฤงคาร  ข่ายสุวรรณ์,Saringkan Khaisuwon,≤100
229178137856991,ประเสริฐศรี ฮ้อแสงชัย ปทุมธานี,ประเสริฐศรี ฮ้อแสงชัย ปทุมธานี,≤100
601953326929372,ธัญวัจน์ กมลวงศ์วัฒน์ - Tunyawaj Kamolwongwat,Tunyawaj Kamolwongwat,≤100
100298682713615,เสื้อวินเทจ ลายมัน ผ้าดำ,เสื้อวินเทจ ลายมัน ผ้าดำ,≤100
985820164804495,ธนาคารพัฒนาวิสาหกิจขนาดกลางและขนาดย่อมแห่งประเทศไทย,ธนาคารพัฒนาวิสาหกิจขนาดกลางและขนาดย่อมแห่งประเทศไทย,≤100
112073738279329,สิงโต - ศักดิ์สิทธิ์ ขาวทอง,สิงโต - ศักดิ์สิทธิ์ ขาวทอง,≤100
100240152175449,ป้าโส FC by Tacina,Dunyawat  Bamrungchan,≤100
114914794432449,กฎหมายใช้สอบราชการ by Æ+,กฎหมายใช้สอบราชการ by Æ+,≤100
190923294988741,สอบครูผู้ช่วยนะ,สอบครูผู้ช่วยนะ,≤100
2091153520919518,อนุทิน ชาญวีรกูล,อนุทิน ชาญวีรกูล,≤100
104362182571499,ภาษาไทยเพื่อครูไทย by ครูตัวกลม,Wanida Wanpakdee,≤100
110144991464196,กรอบลอยไวนิล แคนวาส บอร์ดไดคัท 99 บาท มีเก็บปลายทาง,Sakawtip Utha,≤100
105668122332322,บ้านสวน ควายไทย หนองบัวลำภู ในเครือ หจก เกษทองมา กรุ๊ป,These ads ran without a disclaimer,≤100
962818234084161,จิม จักรพันธ์ จินตนาพากานนท์,Chatchai Boonmee,≤100
319932354389,Revolution,These ads ran without a disclaimer,≤100