Page ID,Page name,Disclaimer,Amount spent (PYG)
325540631525675,En La Tecla,En la Tecla,≤100
141678063114851,Ruben Velazquez,Dalva Natividad Acosta Vallejos,≤100
1575743279360941,Carlos Cáceres Sarubbi Senador 2023,Carlos Agustin Caceres Sarubbi,≤100
114448232558658,Jorge Querey,Jorge Osvaldo Querey Rojas,≤100
1608625919447826,Blanca Ovelar Senadora Nacional,Blanca Ovelar Senadora Nacional,≤100
1403603539906921,Manu Morínigo Chaparro PY,Manu Morínigo Chaparro,≤100
517426394969535,Ricardo Canese,Ricardo Canese,≤100
118397948223791,Oscar Tuma,Óscar Luis Tuma Bogado,≤100
102467002671611,Jorge Heisecke,Jorge Heisecke,≤100