Page ID,Page name,Disclaimer,Amount spent (VEF)
114588254559934,Concejo Municipal de San Francisco,an advertiser in Venezuela,16250000
108236238428619,Concejo Municipal de Maracaibo,an advertiser in Venezuela,11000000
11449543593,Carlos Ocariz,an advertiser in Venezuela,6005718
564188034075673,Roberto Enriquez,an advertiser in Venezuela,1250000
116093674518,César Pérez Vivas,an advertiser in Venezuela,500000
31121558686,BBVA Careers,These ads ran without a disclaimer,271438
19740928752,World Animal Protection,These ads ran without a disclaimer,≤100
342910153967,Upata al Día TV,an advertiser in Venezuela,≤100
107329544831360,Commission on Human Rights Region 02,These ads ran without a disclaimer,≤100