Page ID,Page name,Disclaimer,Amount spent (JPY)
239558679475625,株式会社トマス技術研究所,Kenji Fukutomi,3069
475681929154100,国連UNHCR協会,国連UNHCR協会,1441
1904070096535109,スマート選挙,株式会社センキョ,550
208661552479830,日本財団,Shigeru Fujita,439
298060150283457,大分県日出町,帆足吉美,103
544702409046206,手相の見方大事典テソペディア,株式会社Qu Creation,≤100
486499008189961,Inspire（インスパイア）：地方創生イノベータープラットフォーム,一般社団法人INSPIRE,≤100
104533215755145,ZOE_Japan,ZOE Japan,≤100
1397074863864450,Fair Finance Guide Japan,Fair Finance Guide Japan,≤100
1410243545774903,一般社団法人日本wpa,Ogawa Yuzo,≤100
151214938794853,ミエセン,ジャッグジャパン株式会社,≤100
881025135256351,Japan In-depth,Japan In-depth,≤100
579187028792625,社長と会社の手元現金を増やす仕組みづくりの専門家,These ads ran without a disclaimer,≤100
108260075086726,無理ゲー社会を賢く生き抜く方法,These ads ran without a disclaimer,≤100
100199881840737,Minghui Japan（ミンフイ　ジャパン）ー明慧日本,明慧日本,≤100
102345105947737,選挙しか勝たん！どぶ板を業者に任せる楽ちん候補予定者のための「ポスターPR党」by 選挙ドットウィン「03-6915-2310」,僕俺株式会社,≤100
1672330153015605,透明アクリル業者票,アドアチーブ株式会社,≤100
1607696895913679,日経プラス９サタデー　ニュースの疑問,Takamasa Kikawa,≤100