Page ID,Page name,Disclaimer,Amount spent (USD)
104309632509206,يوسف المرافي,These ads ran without a disclaimer,≤100
103323581486845,النائب سليمان موسى ابو يحيى,Sleman Abuyahia,≤100
521303771314889,وزارة الصناعة و التجارة و التموين الاردنية Mit.gov.jo,Muhanad Alomyan,≤100
905208189574429,We Rise Center for Sustainable development- مركز نحن ننهض للتنمية المستدامة,We Rise Center for Sustainable development- مركز نحن ننهض للتنمية المستدامة,≤100
107141858896307,Rewell Society,Rewell Society,≤100
413390475437832,راصد الأردن _ RASED Jordan,راصد الأردن _ RASED Jordan,≤100