Page ID,Page name,Disclaimer,Amount spent (HNL)
112724021787834,Por Nuestros Hijos,Con Mis Hijos No Te Metas HN,240
481781965172466,Aquafinca St Peter Fish,Aquafinca St Peter Fish,123
153003381515332,Cespad - Centro de Estudio para la Democracia,Centro de Estudio para la Democracia (Cespad),≤100
102542938464803,Naun Turcios Alcalde 2022-2026,Naun Turcios Alcalde 2022-2026,≤100
101854739433772,ihss-Olanchito,These ads ran without a disclaimer,≤100
483441215141189,ASJ Honduras,Asociación para una Sociedad más Justa,≤100
1591865517769660,Fundación Kafie,Fundación Kafie,≤100
105260558775032,Fuera de Línea,These ads ran without a disclaimer,≤100
1619479898324505,Partido Liberal de Honduras,Partido Liberal de Honduras,≤100