Page ID,Page name,Disclaimer,Amount spent (THB)
105347558390671,นริสสร แสงแก้ว,Attaporn Pohkaew,1726
102807719039442,พรรครวมไทยสร้างชาติ United Thai Nation Party,พรรครวมไทยสร้างชาติ United Thai Nation Party,1372
104014285798198,กานต์ กิตติอำพน,กานต์ กิตติอำพน,1063
101274425792459,กิตติพงศ์ รวยฟูพันธ์ - ส.ก.ไอซ์ เขตทุ่งครุ,กิตติพงศ์ รวยฟูพันธ์ - ส.ก.ไอซ์ เขตทุ่งครุ,1061
414100949350619,ณัฐนันท์ กัลยาศิริ - ทนายบอน,ณัฐนันท์ กัลยาศิริ,909
626952517700280,ลิ้ม ศรัณยสัณฑ์ วีรกุลสุนทร ว่าที่ผู้สมัคร ส.ส. เขตจอมทอง พรรคเพื่อไทย,ลิ้ม ศรัณยสัณฑ์ วีรกุลสุนทร ว่าที่ผู้สมัคร ส.ส. เขตจอมทอง พรรคเพื่อไทย,738
157659344260788,จุรินทร์ ลักษณวิศิษฏ์ Aoodda,Jurin Laksanawisit,642
101178062238439,ณณัฏฐ์ หงษ์ชูเวช กิ๊ก,ณณัฏฐ์ หงษ์ชูเวช กิ๊ก,485
106872458897954,ระพีพัฒน์ สุเมธโชติเมธา,ระพีพัฒน์ สุเมธโชติเมธา,419
102264295456894,Sirin Sanguansin - สิริน สงวนสิน,Sirin Sanguansin,317
107449532000210,ธิติวัฐ อดิศรพันธ์กุล - Thitiwat Adisornphankul,ธิติวัฐ อดิศรพันธ์กุล - Thitiwat Adisornphankul,290
296508406790,"Democrat Party, Thailand พรรคประชาธิปัตย์","Democrat Party, Thailand พรรคประชาธิปัตย์",262
715838732136310,ธนเดช เพ็งสุข - Tanadej Pengsuk,Tanadej Pengsuk,252
104427797605274,ดร.เฉลิมชัย ศรีอ่อน รัฐมนตรีว่าการกระทรวงเกษตรและสหกรณ์,ดร.เฉลิมชัย ศรีอ่อน รัฐมนตรีว่าการกระทรวงเกษตรและสหกรณ์,218
103943018154038,บุญสืบ จันทร์แจ่มศรี ปุ๊,บุญสืบ จันทร์แจ่มศรี,191
183238185051108,อรรถวิชช์ สุวรรณภักดี,อรรถวิชช์ สุวรรณภักดี,184
101372342567471,ต้นกล้า จรยุทธ จตุรพรประสิทธิ์ - TonKla Chorayuth Chaturapornprasit,Chorayuth Chaturapornprasit,160
109253101480638,วรท ศิริรักษ์ - Warot Sirirak,วรท ศิริรักษ์ - Warot Sirirak,154
877369462441031,ปูอัด ไชยามพวาน ว่าที่ผู้สมัคร ส.ส. เขตจอมทอง พรรคก้าวไกล,Chaiyamparwaan Manpianjit,151
530945957405983,Nitipon Piwmow - นิติพล ผิวเหมาะ,Nitipon Piwmow,139
112969264517494,เพ็ญพิสุทธิ์ จินตโสภณ - Penpisut Jintasophon,Vatcharapong Wongkom,136
102530815945359,ชูชีพ ตรีโภคา,Areeya Namdokmai,125
216147078543372,สำนักงานคณะกรรมการการเลือกตั้ง,สำนักงานคณะกรรมการการเลือกตั้ง,117
1105604039583762,Line One สว.นท. ขอเชิญส่งประวัติ ส่วนตัว องค์กร เพื่อเข้ารับรางวัลประจำปี,Suksan Booran,113
106337912336664,ปั้น ณัทกร แก้วพิจิตร,ปั้น ณัทกร แก้วพิจิตร,107
100530401779420,พรรคไทยภักดี,พรรคไทยภักดี,≤100
103093255305223,Be Worth Shop,Sureerat Mankannan,≤100
109008738745779,3ต,Bunsong Rodyo,≤100
106561034744198,ลอรี่ - พงศ์พล ยอดเมืองเจริญ,ลอรี่ - พงศ์พล ยอดเมืองเจริญ,≤100
116222464404274,999 ประมูลเสื้อ,These ads ran without a disclaimer,≤100
104134765098843,ทศพล โชติคุตร์ - ผกก.หนุ่ย,ทศพล โชติคุตร์ - ผกก.หนุ่ย,≤100
107612328588715,The Voters,สันติสุข กาญจนประกร,≤100
104156305593898,Tranquillity Liberty,These ads ran without a disclaimer,≤100
100403625993896,Next cracker,These ads ran without a disclaimer,≤100
177948972256358,เอกนัฏ พร้อมพันธุ์ (ขิง),Chonticha Mahachai,≤100
111341764925564,สำนักสนับสนุนการพัฒนาระบบสุขภาพ - สำนัก 7 สสส.,สำนักสนับสนุนการพัฒนาระบบสุขภาพ - สำนัก 7 สสส.,≤100
113001706909463,สส.เป้ นภาพร เพ็ชร์จินดา Dr.Napaporn Petchinda,สส.เป้ นภาพร เพ็ชร์จินดา Dr.Napaporn Petchinda,≤100
264065496937763,My Chavapol (ชวพล วัฒนพรมงคล),My Chavapol (ชวพล วัฒนพรมงคล),≤100
108508377637861,มุ้งจีบพระราม2 โรงงานผลิตมุ้งจีบ มุ้งลวด เหล็ดดัดทุกชนิด,กุหลาบ บัวสด,≤100
106424334608064,กาลครั้งหนึ่ง By โค้กซีโร่,These ads ran without a disclaimer,≤100
972019486321939,บู้ จเด็ศ จันทรา,จเด็ด จันทรา,≤100
204016840519336,ศ.ดร.นฤมล ภิญโญสินวัฒน์,ศ.ดร.นฤมล ภิญโญสินวัฒน์,≤100
115922723434700,ครูเจพีสรุปย่อ for Teacher,ครูเจพีสรุปย่อ for Teacher,≤100
108515294626891,สอบข้าราชการท้องถิ่น By Thurakan,Chiraphorn Thuree,≤100
100545119426784,พีระพันธุ์ FC,Bunsong Rodyo,≤100
103668907891539,การเมือง Kanmuang,การเมือง Kanmuang,≤100
152665702176493,Ringsideการเมือง,Ringsideการเมือง,≤100
112706641077875,สจ.ดนุภัทร์ เชียงชุม,สจ.ดนุภัทร์ เชียงชุม,≤100
601953326929372,ธัญวัจน์ กมลวงศ์วัฒน์ - Tunyawaj Kamolwongwat,Tunyawaj Kamolwongwat,≤100
229178137856991,ประเสริฐศรี ฮ้อแสงชัย ปทุมธานี,ประเสริฐศรี ฮ้อแสงชัย ปทุมธานี,≤100
101391206118142,อุ๋งอิ๋ง - ปานรดา ปัณณธรวรเมธ - Panrada pannathonworameth,Panrada Pannathornworameth,≤100
108626025473239,ฐีรทรัพย์ อภิญญาภรณ์ เขตบางเขน,These ads ran without a disclaimer,≤100
2091153520919518,อนุทิน ชาญวีรกูล,อนุทิน ชาญวีรกูล,≤100
100240152175449,ป้าโส FC by Tacina,Dunyawat  Bamrungchan,≤100
190923294988741,สอบครูผู้ช่วยนะ,สอบครูผู้ช่วยนะ,≤100
112073738279329,สิงโต - ศักดิ์สิทธิ์ ขาวทอง,สิงโต - ศักดิ์สิทธิ์ ขาวทอง,≤100
102477654678259,Givegoody,Pitiphat Sangngam,≤100
114914794432449,กฎหมายใช้สอบราชการ by Æ+,กฎหมายใช้สอบราชการ by Æ+,≤100
103493019318704,เพิ่มพงศ์ วงศ์ทรายทอง - เบลล์,เพิ่มพงศ์ วงศ์ทรายทอง,≤100
108733008364786,The Emissary,These ads ran without a disclaimer,≤100
112820291638276,สุทัศน์ บุญเพ็ง,These ads ran without a disclaimer,≤100
1964681493614060,ดาวแปดแฉก,These ads ran without a disclaimer,≤100
172057439546202,พันโท สินธพ แก้วพิจิตร (เสธ.แก้ว),พันโท สินธพ แก้วพิจิตร (เสธ.แก้ว),≤100
100624122148338,โรงพยาบาลรวมใจรักษ์ สุขุมวิท 62 Ruamjairak Hospital Sukhumvit 62,โรงพยาบาลรวมใจรักษ์ สุขุมวิท 62 Ruamjairak Hospital Sukhumvit 62,≤100
105724181833988,ชวาล พลเมืองดี,ชวาล พลเมืองดี,≤100
107917895398532,Lawyeryai-ทนายใหญ่,These ads ran without a disclaimer,≤100
110144991464196,กรอบลอยไวนิล แคนวาส บอร์ดไดคัท 99 บาท มีเก็บปลายทาง,Sakawtip Utha,≤100