Page ID,Page name,Disclaimer,Amount spent (VND)
101914358044085,Tài Liệu Ôn Thi Viên Chức Giáo Dục,Tài Liệu Ôn Thi Viên Chức Giáo Dục,53943
106476091689860,Bartra Wealth Advisors,Bartra Wealth Advisors,13859
105845511087981,TRUYỀN HÌNH AN VIÊN,TRUYỀN HÌNH AN VIÊN,6720
106596131892463,Trầm Hương Thiên Mộc Hương - Hà Nội,These ads ran without a disclaimer,6184
101865258169428,ĐEN Secondhand,ĐEN Secondhand,667
1647630882127400,Nhân đạo VTV1,These ads ran without a disclaimer,≤100
100190251454228,Bình Bán Book,These ads ran without a disclaimer,≤100
974896235961055,UPL-Ltd,These ads ran without a disclaimer,≤100