Page ID,Page name,Disclaimer,Amount spent (USD)
421104621589691,Cristian Flores,Presidencia de la República de El Salvador,≤100
167878593236712,UNICEF en español,UNICEF con créditos publicitarios de Facebook,≤100
102681318100638,Juan Carlos Zepeda Marroquín,Juan Carlos Zepeda Marroquin,≤100
147858435252169,Embajada de los Estados Unidos en El Salvador,Embajada de Estados Unidos en El Salvador,≤100
1000448716779262,Esau Serpas,Esau Serpas,≤100
108213030904997,Ricardo Rivas,Ricardo Rivas,≤100
111826817167364,Nuevas Ideas Municipal Ciudad Delgado,Ernesto Antonio Ortiz,≤100
100568368335023,Fatima Esmeralda Ascencio,Esmeralda Asencio,≤100
68793499001,UNICEF,UNICEF with Facebook Ad Credits,≤100