Page ID,Page name,Disclaimer,Amount spent (USD)
137539960243807,Melliphant Sermons,These ads ran without a disclaimer,≤100
108275235192359,የኢትዮጵያ ፌዴራል ጠበቆች ማኅበር - Ethiopian Federal Bar Association,These ads ran without a disclaimer,≤100
109809008715550,የድሬዳዋ ፍትህ ፀጥታና ህግ ጉዳዮች ቢሮ  Diredawa Justice Security and Law Affairs Office,an advertiser in Ethiopia,≤100
103780749105731,Dire Dawa Adminstration Transport And Logistics,an advertiser in Ethiopia,≤100
1027626217435226,Richouses,These ads ran without a disclaimer,≤100