Page ID,Page name,Disclaimer,Amount spent (VND)
108390095364515,Phạm Văn Thanh- Đặc Trị Xương Khớp,These ads ran without a disclaimer,30869
112333804853338,Cửa Sổ Vàng - Nguyễn Duy Cương,These ads ran without a disclaimer,11183
1406400379669708,Đại Học Đại Nam,These ads ran without a disclaimer,6859
105536822279236,Huyền phi spa- mỹ phẩm chính hãng,These ads ran without a disclaimer,3738
109355531341941,Milo Steam - Cha mẹ thông thái nuôi con thành tài,These ads ran without a disclaimer,1214
108715314693314,Tài Liệu Thi Viên Chức Giáo Dục TP.HCM - Bình Dương,Tài Liệu Thi Viên Chức Giáo Dục TP.HCM - Bình Dương,457
105310469026814,Nhật Bản Chờ Tôi Nhé,These ads ran without a disclaimer,≤100