Page ID,Page name,Disclaimer,Amount spent (THB)
157659344260788,จุรินทร์ ลักษณวิศิษฏ์ Aoodda,Jurin Laksanawisit,≤100
2126012024327620,สมบูรณ์ หนูนวล,These ads ran without a disclaimer,≤100
622674297897819,Screenshirt2020,Screenshirt2020,≤100
296508406790,"Democrat Party, Thailand พรรคประชาธิปัตย์","Democrat Party, Thailand พรรคประชาธิปัตย์",≤100
102807719039442,พรรครวมไทยสร้างชาติ United Thai Nation Party,พรรครวมไทยสร้างชาติ United Thai Nation Party,≤100
111341764925564,สำนักสนับสนุนการพัฒนาระบบสุขภาพ - สำนัก 7 สสส.,สำนักสนับสนุนการพัฒนาระบบสุขภาพ - สำนัก 7 สสส.,≤100
100240152175449,ป้าโส FC by Tacina,Dunyawat  Bamrungchan,≤100
104427797605274,ดร.เฉลิมชัย ศรีอ่อน รัฐมนตรีว่าการกระทรวงเกษตรและสหกรณ์,ดร.เฉลิมชัย ศรีอ่อน รัฐมนตรีว่าการกระทรวงเกษตรและสหกรณ์,≤100
101535845426970,พรรคไทยสร้างไทย,พรรคไทยสร้างไทย,≤100
241115389300595,คุณหญิงสุดารัตน์ เกยุราพันธุ์ Sudarat Keyuraphan,คุณหญิงสุดารัตน์ เกยุราพันธุ์ Sudarat Keyuraphan,≤100
2091153520919518,อนุทิน ชาญวีรกูล,อนุทิน ชาญวีรกูล,≤100
115922723434700,ครูเจพีสรุปย่อ for Teacher,ครูเจพีสรุปย่อ for Teacher,≤100
1635406246730420,วรงค์ เดชกิจวิกรม - Warong Dechgitvigrom,วรงค์ เดชกิจวิกรม - Warong Dechgitvigrom,≤100
567743816917663,The Article,The Article,≤100
103986582301984,เนื้อ นา บุญ,Phrathanakrit Upachai,≤100
107612328588715,The Voters,สันติสุข กาญจนประกร,≤100
108508377637861,มุ้งจีบพระราม2 โรงงานผลิตมุ้งจีบ มุ้งลวด เหล็ดดัดทุกชนิด,กุหลาบ บัวสด,≤100
103815855888467,โกหม่อง เพื่อไทย ภูเก็ต,โกหม่อง เพื่อไทย ภูเก็ต,≤100
152665702176493,Ringsideการเมือง,Ringsideการเมือง,≤100
418729291509368,สถาบันปรีดี พนมยงค์ Pridi Banomyong Institute,สถาบันปรีดี พนมยงค์ Pridi Banomyong Institute,≤100
105421542338383,ไทม์ ดุลยวัฒน์ - หัวใจสีฟ้า,Dunyawat  Bamrungchan,≤100
985820164804495,ธนาคารพัฒนาวิสาหกิจขนาดกลางและขนาดย่อมแห่งประเทศไทย,ธนาคารพัฒนาวิสาหกิจขนาดกลางและขนาดย่อมแห่งประเทศไทย,≤100
113780154676973,เครื่องมือช่างไฟฟ้า เครื่องมือช่างไม้ เครื่องมือช่างยนต์ by Pro tool,Surin Phothiphoksampan,≤100
100298682713615,เสื้อวินเทจ ลายมัน ผ้าดำ,เสื้อวินเทจ ลายมัน ผ้าดำ,≤100
106561034744198,ลอรี่ - พงศ์พล ยอดเมืองเจริญ,ลอรี่ - พงศ์พล ยอดเมืองเจริญ,≤100
110144991464196,กรอบลอยไวนิล แคนวาส บอร์ดไดคัท 99 บาท มีเก็บปลายทาง,Sakawtip Utha,≤100
277320192288594,โอม จิรชาติ,โอม จิรชาติ,≤100
2263098807292933,ทนายศฤงคาร  ข่ายสุวรรณ์,Saringkan Khaisuwon,≤100
104220275003310,ชนินทร์ รุ่งธนเกียรติ - หนุ่ม,ชนินทร์ รุ่งธนเกียรติ - หนุ่ม,≤100
110145498515798,นักสะสมของเก่า,These ads ran without a disclaimer,≤100