Page ID,Page name,Disclaimer,Amount spent (USD)
117281538350746,حزب التجمع الوطني للأحرار -Rassemblement National des Indépendants -RNI,Rassemblement National des Indépendants,≤100
2065056783567420,Hespress Français,HESPRESS,≤100
1081434028658964,وزارة الانتقال الطاقي والتنمية المستدامة,وزارة الانتقال الطاقي والتنمية المستدامة,≤100
103180295526797,Ministère de l’Equipement et de l’Eau - وزارة التجهيز والماء,M Equipement Maroc,≤100
147084112022235,La Nouvelle Tribune,La Nouvelle Tribune,≤100
578201022242371,MJCC وزارة الشباب والثقافة والتواصل,"Ministère de la Jeunesse, de la Culture et de la Communication",≤100