Page ID,Page name,Disclaimer,Amount spent (PYG)
105545157610039,Euclides Acevedo,Euclides Roberto Acevedo Candia,21857
114448232558658,Jorge Querey,Jorge Osvaldo Querey Rojas,17499
430961180344844,EVER VILLALBA,Ever Federico Villalba Martinez,14430
103040788902949,Concertación Nacional 2023,Rocio Magali Moreno Vera,9892
102467002671611,Jorge Heisecke,Jorge Heisecke,8868
1810962229216340,Fidel Zavala,Laura Lorena Meaurio Paniagua,7215
532716330164048,Sole Núñez,Soledad Núñez,7215
105587720883344,Bettina Aguilera,Bettina Rosmary Aguilera Paniagua,6395
420279778178605,Adelaida Diputada 2023,Adelaida Cantero De Torres,4913
108935934579454,Carlos Mencia,These ads ran without a disclaimer,4702
441529192988697,Rubén Penayo Senador 40/44,Rubén Penayo Senador 40/44,4066
100192941401740,Arturo Toñanez Benitez,Arturo Arnaldo Toñanez Benitez,3533
112117597952835,Municipalidad de San Cristóbal Alto Paraná,These ads ran without a disclaimer,3245
468846806618050,Hugo Cabrera,Hugo Javier Cabrera Franco,2377
1727280190891954,FRANCE 24 Español,These ads ran without a disclaimer,1863
107558844100122,Pastor Filártiga,Pastor Filártiga,1544
1832577620365172,Eusebio Ramón Ayala Senador 2023,Manu Nuñez Franco,1519
517426394969535,Ricardo Canese,Ricardo Canese,1050
646939832039958,Hugo Ibarra - Diputado Nacional,Eladio Ortiz Gayoso,1040
105872245439208,Pelusa Senadora,Maria Yolanda Del Rosario Moreno de Ruíz,872
1365651890238610,Soberanía Paraguay,Prensa_Py,662
109400298573862,Dr. Víctor Ocampos Gobernador Paraguarí,Victor Luis Ocampos Gómez,640
107706177740738,Periodismo 29,Periodismo 29,569
278226125974096,El Paraguayo Independiente,Paraguayo Independiente,527
724051717643013,Miguel Prieto,Celso Kevin Ramon Sánchez Florentin,458
120061519391875,César Paredes,César Paredes,348
1753251591598763,Dani Mujica,Celso Kevin Ramon Sánchez Florentin,123
363306313879750,Marle Chispita Orue,Marlene Tatiana Orue Leon,118
292129440851133,CropLife Latin America,These ads ran without a disclaimer,≤100
131189377574,MDPI,These ads ran without a disclaimer,≤100
132846400218886,ILAC International College,These ads ran without a disclaimer,≤100
100432322646591,Magnom Properties,These ads ran without a disclaimer,≤100
1310731702357133,GEN,GEN,≤100