Page ID,Page name,Disclaimer,Amount spent (VND)
109874745174543,Vàng Bạc Kim Ngọc Anh,These ads ran without a disclaimer,3819
111267731617802,Lương Y Phạm Văn Thanh - Người Thầy Y Đức,These ads ran without a disclaimer,2822
105845511087981,TRUYỀN HÌNH AN VIÊN,Truyền hình Bchannel - BTV9 An Viên,1654
121005457662407,Ấn kích Vào Nhận Ngay Kết Quả Miền Nam Chuẩn,These ads ran without a disclaimer,1353
105062615490802,Thượng Tọa Thích Đức Thiện,Thượng Tọa Thích Đức Thiện,494
108685817326606,Truther Piece Official,These ads ran without a disclaimer,339
100501456174615,Kho Tàng Sách Cổ Xưa,These ads ran without a disclaimer,137