Page ID,Page name,Disclaimer,Amount spent (USD)
327804570952589,Partido Alianza,Partido Alianza,≤100
105740931681717,Centro de Excelencia Educativa de Panamá,Natalia Endara,≤100
106775568769729,Goberna Panamá,Goberna Panamá,≤100
268188644057058,Global Technologies and Supplies SA de CV,These ads ran without a disclaimer,≤100
101301475981407,rubenmedi14,These ads ran without a disclaimer,≤100
105441678504703,Crea tu nueva realidad con Roxy,These ads ran without a disclaimer,≤100
267264199961398,Change the World Model United Nations,These ads ran without a disclaimer,≤100