Page ID,Page name,Disclaimer,Amount spent (USD)
102093112700975,مكتب الإعلام الأمني بوزارة الداخلية الليبية,Aeshah Meehat,≤100
103408078398525,محمد ابولموشه,محمد ابولموشه,≤100
665485696851210,الدكتور عبد الرحمن السويحلي,Khaleel Sewehli,≤100
113731081600670,معرض اركان البيت,These ads ran without a disclaimer,≤100
102697318856209,حزب السلام والازدهار,السلام والازدهار,≤100
102570761484258,Asharq Business اقتصاد الشرق,These ads ran without a disclaimer,≤100
222957571664804,StudentHub,These ads ran without a disclaimer,≤100
107424440982021,Eekad - إيكاد,These ads ran without a disclaimer,≤100