Page ID,Page name,Disclaimer,Amount spent (VND)
100662756259026,Thanh Vân Hugo,These ads ran without a disclaimer,43199
1507429892822619,BOM Money,BOM Money,2693
104640271243082,Bách Hóa Ăn Dặm,Bách Hóa Ăn Dặm,1932
100190251454228,Bình Bán Book,These ads ran without a disclaimer,499
107713842237310,SÁCH HAY GIÁ RẺ,These ads ran without a disclaimer,266
103504685839697,SÁCH TỔNG HỢP,These ads ran without a disclaimer,109
101865258169428,ĐEN Secondhand,ĐEN Secondhand,102
105062615490802,Thượng Tọa Thích Đức Thiện,Thượng Tọa Thích Đức Thiện,≤100