Page ID,Page name,Disclaimer,Amount spent (HNL)
113279288457664,Quintin AMIGO,Quintin AMIGO,392
1686957124956109,Cristian de Jesus Hernandez,These ads ran without a disclaimer,≤100
153003381515332,Cespad - Centro de Estudio para la Democracia,Centro de Estudio para la Democracia (Cespad),≤100
113933318391304,Centro Religioso Amores Eternos,These ads ran without a disclaimer,≤100
496839213786593,"Secretaría Nacional de Ciencia, Tecnología e Innovación","Secretaría Nacional de Ciencia, Tecnología e Innovación",≤100
459107311130639,Dr. Luther Harry,Dr. Luther Harry,≤100
108259318940861,TD_Ln2_Cuidado Cariñoso,These ads ran without a disclaimer,≤100