Page ID,Page name,Disclaimer,Amount spent (USD)
764871770212314,مكتب رئيس الوزراء- دولة فلسطين,Palestinian Prime Minister Office,≤100
214225965275748,وكالة وطن للأنباء,وكالة وطن للأنباء,≤100
100268935176128,Horizon Center,Horizon Center,≤100
1569688113329878,Evony - The King's Return,These ads ran without a disclaimer,≤100
111014438406253,Trendyspread shop1,These ads ran without a disclaimer,≤100
114769837785591,Mada News مدى الأخبار,Mada News مدى الأخبار,≤100
427648547297783,Hasan Ismaik - حسن إسميك,These ads ran without a disclaimer,≤100