Page ID,Page name,Disclaimer,Amount spent (PYG)
242259253120490,Igualdad de Genero SÍ,Igualdad de Genero SÍ,12940
140457539356382,Gabinete Social Presidencia de la República del Paraguay,Gabinete Social Presidencia de la República del Paraguay,7270
101209788723937,Dr. Omar Gonzalez,Dr. Omar Gonzalez,1259
100157179072061,Financiera ueno SAECA,These ads ran without a disclaimer,1023
278226125974096,El Paraguayo Independiente,Paraguayo Independiente,696
1733149113467717,Basic In,These ads ran without a disclaimer,408
111914656998808,Dr. Dionisio Ortega,Dr. Dionisio Ortega,≤100
100570355996366,raquelcalue,These ads ran without a disclaimer,≤100