Page ID,Page name,Disclaimer,Amount spent (VND)
639916136087914,Ywines Mart & Restaurant,These ads ran without a disclaimer,38625
105062615490802,Thượng Tọa Thích Đức Thiện,Thượng Tọa Thích Đức Thiện,29898
108715314693314,Tài Liệu Thi Viên Chức Giáo Dục TP.HCM - Bình Dương,Tài Liệu Thi Viên Chức Giáo Dục TP.HCM - Bình Dương,25407
1507429892822619,BOM Money,BOM Money,9047
111831663772285,BOMvn,BOMvn,7713
105951195472249,Xu Hướng Đầu Tư 4.0,These ads ran without a disclaimer,3625
108376414976742,NKN Hà Nội,These ads ran without a disclaimer,196