Page ID,Page name,Disclaimer,Amount spent (USD)
107835218863981,MBT PROD,MBT PROD,≤100
425683267536132,The Abolition Institute,These ads ran without a disclaimer,≤100
104549069276016,الشـعب - El Chaab,الشـعب - El Chaab,≤100
104201725324650,أنصار معالي الوزير الداه ولد سيد أعمر طالب,أنصار معالي الوزير الداه ولد سيد أعمر طالب,≤100
113414308041611,Great Arab Minds,These ads ran without a disclaimer,≤100
111679394767549,المشروع القومي لمشتقات البلازما,These ads ran without a disclaimer,≤100
117352551390847,DQS: SEAT of POWER,These ads ran without a disclaimer,≤100