Page ID,Page name,Disclaimer,Amount spent (VND)
165600847322369,Tài Liệu Thi Viên Chức Giáo Dục Bình Định-Phú Yên,Tài Liệu Thi Viên Chức Giáo Dục Bình Định-Phú Yên,50573
192195994956428,Tài Liệu Thi Viên Chức Giáo Viên,Tài Liệu Thi Viên Chức Giáo Viên,46662
108530718699692,Thầy Thuốc Phạm Văn Thanh,These ads ran without a disclaimer,8917
102219442450208,Chứng Chỉ Đào Tạo Liên Tục - CME,These ads ran without a disclaimer,1046
100378019218044,Nhà Sách Anh Khang 1,These ads ran without a disclaimer,308
106864984981716,Tài liệu ôn thi viên chức giáo viên TP. HCM,Tài liệu ôn thi viên chức giáo viên TP. HCM,≤100
1831330046916094,Tuyển Dụng Giáo Viên Hà Nội,Tuyển Dụng Giáo Viên Hà Nội,≤100
101478189323986,Thầy Phạm Văn Thanh Lào Cai,These ads ran without a disclaimer,≤100
155460521146066,RFI Tiếng Việt,These ads ran without a disclaimer,≤100