Page ID,Page name,Disclaimer,Amount spent (VND)
280124715749325,Sự Thật Về Pháp Luân Công,Sự Thật Về Pháp Luân Công,5606
289040404770754,DẠY CẮT MAY THỜI TRANG LINKmode,These ads ran without a disclaimer,1531
919479674872321,Báo Nghệ An,Báo Nghệ An,1066
107940495397632,Tiệm sách lịch sử,These ads ran without a disclaimer,1062
103403077832667,Hóng Express,Hóng Express,252
105390405730263,Kiến thức thời 5.0,These ads ran without a disclaimer,130
1044899408950043,May Space,These ads ran without a disclaimer,≤100