Page ID,Page name,Disclaimer,Amount spent (VND)
192195994956428,Tài Liệu Thi Viên Chức Giáo Viên,Tài Liệu Thi Viên Chức Giáo Viên,48866
101914358044085,Tài Liệu Ôn Thi Viên Chức Giáo Dục,Tài Liệu Ôn Thi Viên Chức Giáo Dục,19076
105845511087981,TRUYỀN HÌNH AN VIÊN,TRUYỀN HÌNH AN VIÊN,9842
105062615490802,Thượng Tọa Thích Đức Thiện,Thượng Tọa Thích Đức Thiện,2407
1405109439725034,Toyota Việt Nam,These ads ran without a disclaimer,2096
919479674872321,Báo Nghệ An,Báo Nghệ An,1274
1507429892822619,BOM Money,BOM Money,1152
101865258169428,ĐEN Secondhand,ĐEN Secondhand,717