Page ID,Page name,Disclaimer,Amount spent (THB)
105347558390671,นริสสร แสงแก้ว,Attaporn Pohkaew,2401
101274425792459,กิตติพงศ์ รวยฟูพันธ์ - ส.ก.ไอซ์ เขตทุ่งครุ,กิตติพงศ์ รวยฟูพันธ์ - ส.ก.ไอซ์ เขตทุ่งครุ,1263
102807719039442,พรรครวมไทยสร้างชาติ United Thai Nation Party,พรรครวมไทยสร้างชาติ United Thai Nation Party,734
101372342567471,ต้นกล้า จรยุทธ จตุรพรประสิทธิ์ - TonKla Chorayuth Chaturapornprasit,Chorayuth Chaturapornprasit,666
345127652279503,มูลนิธิสากลเพื่อคนพิการ,มูลนิธิสากลเพื่อคนพิการ,637
104427797605274,ดร.เฉลิมชัย ศรีอ่อน รัฐมนตรีว่าการกระทรวงเกษตรและสหกรณ์,ดร.เฉลิมชัย ศรีอ่อน รัฐมนตรีว่าการกระทรวงเกษตรและสหกรณ์,532
101535845426970,พรรคไทยสร้างไทย,พรรคไทยสร้างไทย,502
103943018154038,บุญสืบ จันทร์แจ่มศรี ปุ๊,บุญสืบ จันทร์แจ่มศรี,473
107449532000210,ธิติวัฐ อดิศรพันธ์กุล - Thitiwat Adisornphankul,ธิติวัฐ อดิศรพันธ์กุล - Thitiwat Adisornphankul,414
296508406790,"Democrat Party, Thailand พรรคประชาธิปัตย์","Democrat Party, Thailand พรรคประชาธิปัตย์",373
108508377637861,มุ้งจีบพระราม2 โรงงานผลิตมุ้งจีบ มุ้งลวด เหล็ดดัดทุกชนิด,กุหลาบ บัวสด,360
241115389300595,คุณหญิงสุดารัตน์ เกยุราพันธุ์ Sudarat Keyuraphan,คุณหญิงสุดารัตน์ เกยุราพันธุ์ Sudarat Keyuraphan,356
622674297897819,Screenshirt2020,Screenshirt2020,263
104134765098843,ทศพล โชติคุตร์ - ผกก.หนุ่ย,ทศพล โชติคุตร์ - ผกก.หนุ่ย,224
183238185051108,อรรถวิชช์ สุวรรณภักดี,อรรถวิชช์ สุวรรณภักดี,197
1105604039583762,Line One สว.นท. ขอเชิญส่งประวัติ ส่วนตัว องค์กร เพื่อเข้ารับรางวัลประจำปี,Suksan Booran,155
100530401779420,พรรคไทยภักดี,พรรคไทยภักดี,144
112969264517494,เพ็ญพิสุทธิ์ จินตโสภณ - Penpisut Jintasophon,Vatcharapong Wongkom,144
109663858375725,"ต่อบัตรต่างด้าว,ต่อวีซ่า,ทำพาสปอร์ต",These ads ran without a disclaimer,135
567743816917663,The Article,The Article,132
1635406246730420,วรงค์ เดชกิจวิกรม - Warong Dechgitvigrom,วรงค์ เดชกิจวิกรม - Warong Dechgitvigrom,122
103986582301984,เนื้อ นา บุญ,Phrathanakrit Upachai,≤100
493026767870664,พรรคพลังประชารัฐ,พรรคพลังประชารัฐ,≤100
1891686011063722,J กพ Tutor ติวสอบ ก.พ. ท้องถิ่น ราชการ 65,These ads ran without a disclaimer,≤100
111341764925564,สำนักสนับสนุนการพัฒนาระบบสุขภาพ - สำนัก 7 สสส.,สำนักสนับสนุนการพัฒนาระบบสุขภาพ - สำนัก 7 สสส.,≤100
106561034744198,ลอรี่ - พงศ์พล ยอดเมืองเจริญ,ลอรี่ - พงศ์พล ยอดเมืองเจริญ,≤100
494189467277672,Agenda,บริษัท ดิ อาเจนด้า จำกัด,≤100
418729291509368,สถาบันปรีดี พนมยงค์ Pridi Banomyong Institute,สถาบันปรีดี พนมยงค์ Pridi Banomyong Institute,≤100
157659344260788,จุรินทร์ ลักษณวิศิษฏ์ Aoodda,Jurin Laksanawisit,≤100
105546651850693,วีรนันท์ ฮวดศรี-Weeranan Huadsri-ทนายป๊อก,Weeranan Huadsri,≤100
119405895873,Huawei,These ads ran without a disclaimer,≤100
103067905825537,Love Story Now,These ads ran without a disclaimer,≤100
985820164804495,ธนาคารพัฒนาวิสาหกิจขนาดกลางและขนาดย่อมแห่งประเทศไทย,ธนาคารพัฒนาวิสาหกิจขนาดกลางและขนาดย่อมแห่งประเทศไทย,≤100
161651553861945,Amnesty International Thailand,Amnesty International Thailand,≤100
601953326929372,ธัญวัจน์ กมลวงศ์วัฒน์ - Tunyawaj Kamolwongwat,Tunyawaj Kamolwongwat,≤100
277320192288594,โอม จิรชาติ,โอม จิรชาติ,≤100
105405824468911,Thari.0811,These ads ran without a disclaimer,≤100
112073738279329,สิงโต - ศักดิ์สิทธิ์ ขาวทอง,สิงโต - ศักดิ์สิทธิ์ ขาวทอง,≤100
2091153520919518,อนุทิน ชาญวีรกูล,อนุทิน ชาญวีรกูล,≤100
100761582502948,จารุพล เรืองสุวรรณ - อาจารย์จา,Charupol Ruangsuwan,≤100
149878535813571,สำนักงาน คปภ.ภาค 1 (เชียงใหม่),These ads ran without a disclaimer,≤100
107612328588715,The Voters,สันติสุข กาญจนประกร,≤100
100298682713615,เสื้อวินเทจ ลายมัน ผ้าดำ,เสื้อวินเทจ ลายมัน ผ้าดำ,≤100
129602281218084,Pongwat T. - ผู้สมัคร สส กทม เขต 6 พรรคเสรีรวมไทย,Pongwat Tunnukul,≤100
190923294988741,สอบครูผู้ช่วยนะ,สอบครูผู้ช่วยนะ,≤100
285093372087639,ผ้าแต่งบ้าน สไตล์วินเทจ,These ads ran without a disclaimer,≤100
103668907891539,การเมือง Kanmuang,การเมือง Kanmuang,≤100
105711950893323,The Modernist,บริษัท โอพีเนียน มีเดีย จำกัด,≤100
101636186123234,ไชยพล เดชตระกูล,ไชยพล เดชตระกูล,≤100
100479418960559,ดร.สฤษดิ์ ไพรทอง,These ads ran without a disclaimer,≤100
100240152175449,ป้าโส FC by Tacina,Dunyawat  Bamrungchan,≤100
217749605072300,ICONSIAM,These ads ran without a disclaimer,≤100
105416035606705,กิตติภณ  ปานพรหมมาศ,These ads ran without a disclaimer,≤100
326770580739640,Revive Israel Tikkun Global,These ads ran without a disclaimer,≤100
19595510126,Annual Reviews,These ads ran without a disclaimer,≤100
1281617518611911,Ясно,These ads ran without a disclaimer,≤100