Page ID,Page name,Disclaimer,Amount spent (THB)
161651553861945,Amnesty International Thailand,Amnesty International Thailand,260
345127652279503,มูลนิธิสากลเพื่อคนพิการ,มูลนิธิสากลเพื่อคนพิการ,≤100
177948972256358,เอกนัฏ พร้อมพันธุ์ (ขิง),เอกนัฏ พร้อมพันธุ์ (ขิง),≤100
651699931624315,Techsauce,Techsauce,≤100
108515294626891,สอบข้าราชการท้องถิ่น By Thurakan,สอบข้าราชการท้องถิ่น By Thurakan,≤100
1105604039583762,Line One สว.นท. ขอเชิญส่งประวัติ ส่วนตัว องค์กร เพื่อเข้ารับรางวัลประจำปี,Line One สว.นท. ขอเชิญส่งประวัติ ส่วนตัว องค์กร เพื่อเข้ารับรางวัลประจำปี,≤100
105992549162758,ข่าวชีวิตติดกระแส,บริษัท เดนิส แอดส์ จำกัด,≤100
231701717614410,ชายโช วินเทจ,These ads ran without a disclaimer,≤100
100624122148338,โรงพยาบาลรวมใจรักษ์ สุขุมวิท 62 Ruamjairak Hospital Sukhumvit 62,โรงพยาบาลรวมใจรักษ์ สุขุมวิท 62 Ruamjairak Hospital Sukhumvit 62,≤100
539119526485380,ทนายใหญ่ ธิมาชัย,ทนายใหญ่ ธิมาชัย,≤100
715838732136310,ธนเดช เพ็งสุข - Tanadej Pengsuk,ธนเดช เพ็งสุข - Tanadej Pengsuk,≤100
106664485191987,EDGE Invest,EDGE Invest,≤100
1551751431783222,The Momentum,The Momentum,≤100
172924186944709,GeneusDNA : จีเนียส ดีเอ็นเอ - ดูแลสุขภาพระดับ DNA,These ads ran without a disclaimer,≤100
622674297897819,Screenshirt2020,Screenshirt2020,≤100
102000355765413,ธันย์ชนน ศรีอัษฎาวุธกุล - Thanchanon Sriusadawutkul,ธันย์ชนน ศรีอัษฎาวุธกุล - Thanchanon Sriusadawutkul,≤100
105711950893323,The Modernist,บริษัท โอพีเนียน มีเดีย จำกัด,≤100
108480414745082,Spotlight,Spotlight,≤100
1438893919482996,MB Copy ถ่ายเอกสาร เข้าเล่มวิทยานิพนธ์ ราคาถูก พระราม7,These ads ran without a disclaimer,≤100
365100400205685,Logitech,These ads ran without a disclaimer,≤100
102839468523186,APEX อันดับหนึ่งเลเซอร์ขน,These ads ran without a disclaimer,≤100
106804542303183,สำนักงานกฎหมายทนายใหญ่,สำนักงานกฎหมายทนายใหญ่,≤100
111341764925564,สำนักสนับสนุนการพัฒนาระบบสุขภาพ - สำนัก 7 สสส.,สำนักสนับสนุนการพัฒนาระบบสุขภาพ - สำนัก 7 สสส.,≤100
100771725640770,พุทธกัลยา,These ads ran without a disclaimer,≤100
101596418909602,Nuuw นัว ผงนมซินไบโอติก ที่ไม่ได้มาจากสัตว์ หอม มัน อร่อย ไฟเบอร์เน้นๆ,These ads ran without a disclaimer,≤100
107612328588715,The Voters,The Voters,≤100
104393812499502,ชีทสรุปกฎหมาย สำหรับสอบราชการ พนักงานราชการ by.kantap,ชีทสรุปกฎหมาย สำหรับสอบราชการ พนักงานราชการ by.kantap,≤100
104769961794110,อินทรัตน์ ยอดบางเตย,อินทรัตน์ ยอดบางเตย,≤100
418729291509368,สถาบันปรีดี พนมยงค์ Pridi Banomyong Institute,สถาบันปรีดี พนมยงค์ Pridi Banomyong Institute,≤100
2046265545683549,เชียร์ลุง,เชียร์ลุง,≤100
1344829249007634,คนบันดาลไฟ,These ads ran without a disclaimer,≤100
451864701523507,Infographic Thailand,Infographic Thailand,≤100
101903785231136,นายกไก่กังวาล ศักดิ์ชัย พิศาลผล,นายกไก่กังวาล ศักดิ์ชัย พิศาลผล,≤100
190744968374504,British Council Thailand English,These ads ran without a disclaimer,≤100
856383837771145,รับสมัครนักศึกษา มหาวิทยาลัยกรุงเทพธนบุรี by ดร.หวาน,These ads ran without a disclaimer,≤100
530945957405983,Nitipon Piwmow - นิติพล ผิวเหมาะ,Nitipon Piwmow - นิติพล ผิวเหมาะ,≤100
106500602280120,เตรียมสอบข้อราชการท้องถิ่น อปท. กพ.,เตรียมสอบข้อราชการท้องถิ่น อปท. กพ.,≤100
110766468644579,อนันต์ ปรีดาสุทธิจิตต์,อนันต์ ปรีดาสุทธิจิตต์,≤100
108876478142078,Maxtive Banana,These ads ran without a disclaimer,≤100
134501584479,The 1,These ads ran without a disclaimer,≤100
190923294988741,สอบครูผู้ช่วยนะ,สอบครูผู้ช่วยนะ,≤100
115169894791381,90นาที,These ads ran without a disclaimer,≤100
113063131150452,Y8 ศาสตร์แห่งรางวัลโนเบล,These ads ran without a disclaimer,≤100
197893846914616,"NIA : National Innovation Agency, Thailand",These ads ran without a disclaimer,≤100
107480552415822,สวยครบในงบ 290.- นารีญาพลัส,These ads ran without a disclaimer,≤100
101876555117469,OT Design รับออกแบบและผลิตเสื้อพิมพ์ลาย เสื้อบริษัท เสื้อกีฬา ราคาโรงงาน,These ads ran without a disclaimer,≤100
114914794432449,กฎหมายใช้สอบราชการ by Æ+,กฎหมายใช้สอบราชการ by Æ+,≤100
107693982363714,เรียนรู้ตลอดชีวิต - Lifelong Learning,These ads ran without a disclaimer,≤100
104553005992573,Short Note & Sheet สรุปสอบข้าราชการ และใบงาน,Short Note & Sheet สรุปสอบข้าราชการ และใบงาน,≤100
102551619283775,,These ads ran without a disclaimer,≤100
104770617920248,Dr.Pong Hypoallergenic ดอกเตอร์พงศ์ เวชสำอางสำหรับผิวแพ้ง่าย,These ads ran without a disclaimer,≤100
102965485781275,Fashion & Shoes  รองเท้ามือสอง รองเท้าแฟชั่น,These ads ran without a disclaimer,≤100
1443478292598907,Skinsista,These ads ran without a disclaimer,≤100
344838563349739,14Mar.Clothes,These ads ran without a disclaimer,≤100
107406281857759,Graph Dental คลินิกทันตกรรมกราฟ สุขาภิบาล5-สายไหม,These ads ran without a disclaimer,≤100
108462898838116,Glucon สมุนไพรรวม ต้านเบาหวาน,These ads ran without a disclaimer,≤100
1466273283637782,XChange English ติว TOEIC TOEFL,These ads ran without a disclaimer,≤100
147998405256852,Karnkanok Property,These ads ran without a disclaimer,≤100
575650389288407,Toyota Motor Thailand,These ads ran without a disclaimer,≤100
2263098807292933,ทนายศฤงคาร  ข่ายสุวรรณ์,These ads ran without a disclaimer,≤100
133289766719450,Chewathai PLC,These ads ran without a disclaimer,≤100
494189467277672,Agenda,บริษัท ดิ อาเจนด้า จำกัด,≤100
189649487736819,IPD Forum - ภาษาไทย,These ads ran without a disclaimer,≤100
141363092729703,DP World,These ads ran without a disclaimer,≤100