Page ID,Page name,Disclaimer,Amount spent (USD)
182548242181379,Олон улсын хөдөлмөрийн байгууллага - International Labour Organization,Олон улсын хөдөлмөрийн байгууллага - International Labour Organization,≤100
218413031955878,ЭЛБЭТ ус халаагчтай угаалтуур,ЭЛБЭТ ус халаагчтай угаалтуур,≤100
103471868972939,Нийгмийн Ардчилал Залуучуудын Сан - SDYF,Нийгмийн Ардчилал Залуучуудын Сан - SDYF,≤100
171521449877169,Жамбалын Ганбаатар,Ganbaatar Jambal,≤100
101252088988452,Шоовдорын ТӨМӨРСҮХ/Эрх Чөлөөг Хэрэгжүүлэгч  Нам/,Шоовдорын Төмөрсүх,≤100
110119455074346,Callisto Cocktail Bar,These ads ran without a disclaimer,≤100