Page ID,Page name,Disclaimer,Amount spent (HNL)
349524351841734,Cárlenton Dávila,Jose Carlenton Davila Mondragon,124
491553204198958,Revistazo.com,Revistazo.com,≤100
130202453827085,Asociacion Calidad de Vida,Asociación Calidad de Vida,≤100
153003381515332,Cespad - Centro de Estudio para la Democracia,Centro de Estudio para la Democracia (Cespad),≤100
496839213786593,"Secretaría Nacional de Ciencia, Tecnología e Innovación","Secretaría Nacional de Ciencia, Tecnología e Innovación",≤100
112333800693678,Hugo Noé Pino Diputado F.M,Daniel Andres Casula Salinas,≤100
285530825204,Klitschko,These ads ran without a disclaimer,≤100