Page ID,Page name,Disclaimer,Amount spent (VND)
101914358044085,Tài Liệu Ôn Thi Viên Chức Giáo Dục,Tài Liệu Ôn Thi Viên Chức Giáo Dục,51065
192195994956428,Tài Liệu Thi Viên Chức Giáo Viên,Tài Liệu Thi Viên Chức Giáo Viên,48459
105845511087981,TRUYỀN HÌNH AN VIÊN,TRUYỀN HÌNH AN VIÊN,13192
105062615490802,Thượng Tọa Thích Đức Thiện,Thượng Tọa Thích Đức Thiện,10944
106823432074875,An Viên Sự Kiện,An Viên Sự Kiện,2054
101865258169428,ĐEN Secondhand,ĐEN Secondhand,152
1655053987872024,Bloomberg Green,These ads ran without a disclaimer,≤100