Page ID,Page name,Disclaimer,Amount spent (USD)
167878593236712,UNICEF en español,These ads ran without a disclaimer,≤100
147858435252169,Embajada de los Estados Unidos en El Salvador,Embajada de Estados Unidos en El Salvador,≤100
890916994384759,Rafael Arévalo,Rafael Edgardo Arévalo González,≤100
108213030904997,Ricardo Rivas,Ricardo Rivas,≤100
111826817167364,Nuevas Ideas Municipal Ciudad Delgado,Ernesto Antonio Ortiz,≤100
116600879781959,Cayetano Cruz,These ads ran without a disclaimer,≤100
152914224736727,Banco Mundial,These ads ran without a disclaimer,≤100
116155101806729,CATIE (Centro Agronómico Tropical de Investigación y Enseñanza),These ads ran without a disclaimer,≤100