Page ID,Page name,Disclaimer,Amount spent (VND)
106128284947266,Lương Y Phạm Văn Thanh Xương Khớp - Việc Tử Tế VTV1,These ads ran without a disclaimer,11778
111649914996393,Viên đại tràng Nhất Nhất,These ads ran without a disclaimer,3758
105845511087981,TRUYỀN HÌNH AN VIÊN,TRUYỀN HÌNH AN VIÊN,2091
114075063569561,Lương Y Phạm Văn Thanh - Việc Tử Tế VTV1,These ads ran without a disclaimer,1184
106476091689860,Bartra Wealth Advisors,Bartra Wealth Advisors,1136
919479674872321,Báo Nghệ An,Báo Nghệ An,880
101865258169428,ĐEN Secondhand,ĐEN Secondhand,707
155460521146066,RFI Tiếng Việt,These ads ran without a disclaimer,≤100