Page ID,Page name,Disclaimer,Amount spent (UYU)
860395507438977,Compromiso con el Cambio,Compromiso con el Cambio,≤100
225968600759645,Andrés Lima,Andrés Lima,≤100
308762172579887,Rodrigo Goñi Reyes,Rodrigo Goñi Reyes,≤100
721629447857727,567 El Espacio,Partido por la Victoria del Pueblo - Espacio 567 - Frente Amplio,≤100
108259318940861,TD_Ln2_Cuidado Cariñoso,These ads ran without a disclaimer,≤100
530640683655093,President,These ads ran without a disclaimer,≤100
150990768265776,Alex de Marcos,These ads ran without a disclaimer,≤100