Page ID,Page name,Disclaimer,Amount spent (VND)
102726939281075,Đồ bộ đẹp trung niên 2,These ads ran without a disclaimer,60218
105845511087981,TRUYỀN HÌNH AN VIÊN,TRUYỀN HÌNH AN VIÊN,5312
105456375620326,Phòng Tuyển Sinh - Vilaco,These ads ran without a disclaimer,4000
106476091689860,Bartra Wealth Advisors,Bartra Wealth Advisors,1625
919479674872321,Báo Nghệ An,Báo Nghệ An,1254
105062615490802,Thượng Tọa Thích Đức Thiện,Thượng Tọa Thích Đức Thiện,896
101865258169428,ĐEN Secondhand,ĐEN Secondhand,671
19740928752,World Animal Protection,These ads ran without a disclaimer,≤100
111361091313,NICABM,These ads ran without a disclaimer,≤100