Page ID,Page name,Disclaimer,Amount spent (USD)
330841846933183,حزب التجمع الوطني للإصلاح والتنمية - تواصل,Mohamed Soueidi,≤100
271202350087390,النائب البرلماني : محمد بوي ولد الشيخ محمد فاضل - خيار الحق,النائب البرلماني : محمد بوي ولد الشيخ محمد فاضل - خيار الحق,≤100
116299361448743,صفحة المرشح باب ولد خطري,أحمد موسى,≤100
100913698651427,الإنصاف  INSAF,المختار القاسم,≤100
118809651194004,حملة حزب الإنصاف في الشامي,Abdallahi Saleck Mohamed Alem,≤100
430258463820053,International School of Ministry with Pastor Chris,These ads ran without a disclaimer,≤100