Page ID,Page name,Disclaimer,Amount spent (THB)
108635927540997,เทมส์ ไกรทัศน์ - ภูเก็ต,เทมส์ ไกรทัศน์ - ภูเก็ต,1939
108553605171587,อ้อ อรทัย เกิดทรัพย์ - ภูเก็ต,อ้อ อรทัย เกิดทรัพย์ - ภูเก็ต,1735
107648367788852,วงศกร ชนะกิจ,Wongsakorn Chanakit,233
106212605666715,กวี ตันสุคตานนท์ - โก๊กวี คนตงห่อหยัดได้,Kaweejaiphuket,219
177438153830567,พลอยทะเล ลักษมีแสงจันทร์,พลอยทะเล ลักษมีแสงจันทร์,128
277143792910800,เฉลิมพงศ์ แสงดี - Chalermpong Saengdee,เฉลิมพงศ์ แสงดี - Chalermpong Saengdee,128
103465462538992,ภูมิใจไทย ภูเก็ต,Wongsakorn Chanakit,122
2083379161750953,ชัยยศ ปัญญาไวย ประชาธิปัตย์ภูเก็ต,ชัยยศ ปัญญาไวย ประชาธิปัตย์ภูเก็ต,118
108839095327193,โก้จ๋าย เอกวานิช,โก้จ๋าย เอกวานิช,≤100
161651553861945,Amnesty International Thailand,Amnesty International Thailand,≤100
102807719039442,พรรครวมไทยสร้างชาติ United Thai Nation Party,พรรครวมไทยสร้างชาติ United Thai Nation Party,≤100
157659344260788,จุรินทร์ ลักษณวิศิษฏ์ Aoodda,Jurin Laksanawisit,≤100
101749882528477,Nunnisa.linen,Kritanun Temkirungraung,≤100
108625789179165,Soi Dog Foundation,These ads ran without a disclaimer,≤100
104427797605274,ดร.เฉลิมชัย ศรีอ่อน รัฐมนตรีว่าการกระทรวงเกษตรและสหกรณ์,ดร.เฉลิมชัย ศรีอ่อน รัฐมนตรีว่าการกระทรวงเกษตรและสหกรณ์,≤100
622674297897819,Screenshirt2020,Screenshirt2020,≤100
296508406790,"Democrat Party, Thailand พรรคประชาธิปัตย์","Democrat Party, Thailand พรรคประชาธิปัตย์",≤100
467424870040934,ปกรณ์ อารีกุล,ปกรณ์ อารีกุล,≤100
113001706909463,สส.เป้ นภาพร เพ็ชร์จินดา Dr.Napaporn Petchinda,สส.เป้ นภาพร เพ็ชร์จินดา Dr.Napaporn Petchinda,≤100
100530401779420,พรรคไทยภักดี,พรรคไทยภักดี,≤100
115922723434700,ครูเจพีสรุปย่อ for Teacher,ครูเจพีสรุปย่อ for Teacher,≤100
111341764925564,สำนักสนับสนุนการพัฒนาระบบสุขภาพ - สำนัก 7 สสส.,สำนักสนับสนุนการพัฒนาระบบสุขภาพ - สำนัก 7 สสส.,≤100
345127652279503,มูลนิธิสากลเพื่อคนพิการ,มูลนิธิสากลเพื่อคนพิการ,≤100
107680428496756,ttb advisory,These ads ran without a disclaimer,≤100
216147078543372,สำนักงานคณะกรรมการการเลือกตั้ง,สำนักงานคณะกรรมการการเลือกตั้ง,≤100
102530815945359,องอาจ วชิรพงศ์,Areeya Namdokmai,≤100
1635406246730420,วรงค์ เดชกิจวิกรม - Warong Dechgitvigrom,วรงค์ เดชกิจวิกรม - Warong Dechgitvigrom,≤100
107612328588715,The Voters,สันติสุข กาญจนประกร,≤100
285515698197744,Thai Dental Council,These ads ran without a disclaimer,≤100
204016840519336,ศ.ดร.นฤมล ภิญโญสินวัฒน์,ศ.ดร.นฤมล ภิญโญสินวัฒน์,≤100
174674890018644,นายเดชอิศม์ ขาวทอง นายกชาย,Phetai Sretrairat,≤100
101535845426970,พรรคไทยสร้างไทย,พรรคไทยสร้างไทย,≤100
100240152175449,ป้าโส FC by Tacina,Dunyawat  Bamrungchan,≤100
108515294626891,สอบข้าราชการท้องถิ่น By Thurakan,Chiraphorn Thuree,≤100
103668907891539,การเมือง Kanmuang,การเมือง Kanmuang,≤100
152665702176493,Ringsideการเมือง,Ringsideการเมือง,≤100
109008738745779,2ต,Bunsong Rodyo,≤100
100545119426784,พีระพันธุ์ FC,Bunsong Rodyo,≤100
114914794432449,กฎหมายใช้สอบราชการ by Æ+,กฎหมายใช้สอบราชการ by Æ+,≤100
103074628240336,Sound Screen  Solution โปรเจคเตอร์ จอ LED   บริการดี จัดส่งไว,กฤติกานต์ ทองหอม,≤100
2263098807292933,ทนายศฤงคาร  ข่ายสุวรรณ์,Saringkan Khaisuwon,≤100
3080161418691131,Thailand FACT Today,Thailand FACT Today,≤100
106561034744198,ลอรี่ - พงศ์พล ยอดเมืองเจริญ,ลอรี่ - พงศ์พล ยอดเมืองเจริญ,≤100
190923294988741,สอบครูผู้ช่วยนะ,สอบครูผู้ช่วยนะ,≤100
105125715202609,ส.ส.ไผ่ ลิกค์,ส.ส.ไผ่ ลิกค์,≤100
601953326929372,ธัญวัจน์ กมลวงศ์วัฒน์ - Tunyawaj Kamolwongwat,Tunyawaj Kamolwongwat,≤100
424656394256795,Cartoonomics: เศรษฐศาสตร์ฉบับการ์ตูน,Cartoonomics: เศรษฐศาสตร์ฉบับการ์ตูน,≤100
2151302718520482,ธิดารัตน์ ยิ่งเจริญ Tidarat Yingcharoen,ธิดารัตน์ ยิ่งเจริญ Tidarat Yingcharoen,≤100
106887332334214,BK CPT 87,These ads ran without a disclaimer,≤100
2091153520919518,อนุทิน ชาญวีรกูล,อนุทิน ชาญวีรกูล,≤100
110144991464196,กรอบลอยไวนิล แคนวาส บอร์ดไดคัท 99 บาท มีเก็บปลายทาง,Sakawtip Utha,≤100
103196441433955,ครอบครัวคนรักหมู,These ads ran without a disclaimer,≤100
112104454582801,กิน เที่ยว นอน By นครนายก,These ads ran without a disclaimer,≤100
102843029153516,Social News,These ads ran without a disclaimer,≤100
103145762546765,Jrlei kepzc,These ads ran without a disclaimer,≤100