Page ID,Page name,Disclaimer,Amount spent (USD)
102681318100638,Juan Carlos Zepeda Marroquín,Juan Carlos Zepeda Marroquin,≤100
100524251686344,Gustavo Acevedo,Gustavo Jose Acevedo Berganza,≤100
147858435252169,Embajada de los Estados Unidos en El Salvador,Embajada de Estados Unidos en El Salvador,≤100
162379173778716,Alcaldía de San Salvador,Alcaldía de San Salvador,≤100
1935947973198237,Alcaldía El Paraíso Chalatenango,Alexi Antonio Escalante Galdamez,≤100
108213030904997,Ricardo Rivas,Ricardo Rivas,≤100
107660984785868,LPT Noticias,Rodrigo Alejandro,≤100
103892629262378,Qué está pasando Sonsonate?,These ads ran without a disclaimer,≤100
100568368335023,Fatima Esmeralda Ascencio,Esmeralda Asencio,≤100
105624122356019,libertarios_dominicanos,These ads ran without a disclaimer,≤100