Page ID,Page name,Disclaimer,Amount spent (USD)
1858589940884127,ROBO TECH  العمالقة سكيكدة,ROBO TECH  العمالقة سكيكدة,≤100
985246578276059,هشام صفر Hichem Sifer,هشام صفر Hichem Sifer,≤100
243713825764151,NoonPost نون بوست,These ads ran without a disclaimer,≤100
995765983772115,Dzair Tube,Dzair Tube,≤100
103393035778315,Alotofstylewe.com,These ads ran without a disclaimer,≤100
104140320927199,قناة الإنتصار TV,قناة الإنتصار TV,≤100
1036370886478455,النائب البرلماني قوارطة يزيد,النائب البرلماني قوارطة يزيد,≤100
100857675472522,ScreeN+,These ads ran without a disclaimer,≤100
111679394767549,المشروع القومي لمشتقات البلازما,These ads ran without a disclaimer,≤100