Page ID,Page name,Disclaimer,Amount spent (VND)
1517088885216557,AIG,These ads ran without a disclaimer,1418
111831663772285,BOMvn,BOMvn,1016
192195994956428,Tài Liệu Thi Viên Chức Giáo Viên,Tài Liệu Thi Viên Chức Giáo Viên,994
105062615490802,Thượng Tọa Thích Đức Thiện,Thượng Tọa Thích Đức Thiện,785
105845511087981,TRUYỀN HÌNH AN VIÊN,TRUYỀN HÌNH AN VIÊN,728
919479674872321,Báo Nghệ An,Báo Nghệ An,205
100584342403453,Chùa Long Hương - Thượng Tọa Thầy Thích Tuệ Hải,These ads ran without a disclaimer,≤100