Page ID,Page name,Disclaimer,Amount spent (USD)
179167545479394,Салідарнасць,Онлайн-медиа «Салiдарнасць»,≤100
1386091578286558,ARX,These ads ran without a disclaimer,≤100
110617105032980,Gorgeous poplar,These ads ran without a disclaimer,≤100
105497721784216,Филин. Оперативная аналитика и публицистика,Филин. Оперативная аналитика и публицистика,≤100
478670012154037,Think Then Choose Wisely,These ads ran without a disclaimer,≤100
112671178768918,German Design Council,These ads ran without a disclaimer,≤100