Page ID,Page name,Disclaimer,Amount spent (UYU)
721629447857727,567 El Espacio,Sol Ines Pereyra Zunin,≤100
721629447857727,567 El Espacio,Partido por la Victoria del Pueblo - Espacio 567 - Frente Amplio,≤100
225968600759645,Andrés Lima,Ernesto Dario Castro Rodriguez,≤100
100492222711808,Somos Todos Uruguayos,Somos Todos Uruguayos,≤100
308762172579887,Rodrigo Goñi Reyes,Maria Florencia Porro,≤100
110543258724648,Movimiento Blanco 2025,Cristian Damian Borges Manisse,≤100
1633909283493941,Ert Bps,Director Representante del Sector Trabajadores Ramón Ruiz,≤100