Page ID,Page name,Disclaimer,Amount spent (CRC)
1540070352761579,Leslye Bojorges,Leslye Ruben Bojorges Leon,2368
643513979193133,Unidos por Beatriz,Neuma,1068
116150003163125,Fundación Pollitos de Hierro - Ayuda a niños con cáncer - Costa Rica,Fundación Pollitos de Hierro,715
265843867173714,La Revista,La Revista,534
1840427712720136,Bruno Acosta,These ads ran without a disclaimer,≤100
365493950497394,Sustainable & Social Tourism Summit,These ads ran without a disclaimer,≤100
101128242614247,Dr. Rodolfo Brenes Vargas,Rodolfo Brenes Vargas,≤100
164976050747050,Planeta Sano,These ads ran without a disclaimer,≤100