Page ID,Page name,Disclaimer,Amount spent (FJD)
100874186277500,Strengthening Pacific Intra-Regional & International Trade,Strengthening Pacific Intra-Regional & International Trade,≤100
117039841320523,Big Pink Youth Dialogue,These ads ran without a disclaimer,≤100
130136833750497,IELTS Official,These ads ran without a disclaimer,≤100
292780334633,International Christian Embassy Jerusalem (ICEJ),These ads ran without a disclaimer,≤100
430258463820053,International School of Ministry with Pastor Chris,These ads ran without a disclaimer,≤100