Page ID,Page name,Disclaimer,Amount spent (THB)
101673076131930,พรรคเปลี่ยน,พรรคเปลี่ยน,7565
2105350112863264,ร้อยเอก ดร.จองชัย วงศ์ทรายทอง - ผู้กองเบิร์ด,ร้อยเอก ดร.จองชัย วงศ์ทรายทอง - ผู้กองเบิร์ด,3304
107637862235181,แอ้ สุภีพันธุ์ หอมหวล,แอ้ สุภีพันธุ์ หอมหวล,1730
103519619366975,รวมไทยสร้างชาติ ชลบุรี,รวมไทยสร้างชาติ ชลบุรี,993
322329881713130,ขวัญเลิศ พานิชมาท - Kwanlerd Panichmath,ขวัญเลิศ พานิชมาท - Kwanlerd Panichmath,807
120566510971339,พรรคเพื่อไทยจังหวัดชลบุรี,Aready ads,787
514800142336756,ดร. นิพนธ์ แจ่มจำรัส ชลบุรี เขตเจ็ด เบอร์ 11,Kevin Maltig,767
110954691955005,ณภัสนันท์ อรินทคุณวงษ์ - Napassanan Arintakunawong,ninety two tech ads,759
110146992036788,ภานุพงศ์ คำมูลอามาตย์,Phanuphong Kammoonarmart,662
103493019318704,เพิ่มพงศ์ วงศ์ทรายทอง - เบลล์,เพิ่มพงศ์ วงศ์ทรายทอง,642
104596302550566,สุรพงศ์ นำชัยรุจิพงศ์ - ชลบุรี,สุรพงศ์ นำชัยรุจิพงศ์ - ชลบุรี,514
102532004821260,ยอดชาย พึ่งพร - Yodchai Peungporn,Kevin Maltig,465
707294083039692,เบียร์ พนธกร,เบียร์ พนธกร,453
104645182578478,นิรันดร์ วัฒนศาสตร์สาธร,Supakit Ngoenkaew,261
121896457497775,ส.ส.ประมวล เอมเปีย,ประมวล เอมเปีย,241
241115389300595,คุณหญิงสุดารัตน์ เกยุราพันธุ์ Sudarat Keyuraphan,คุณหญิงสุดารัตน์ เกยุราพันธุ์ Sudarat Keyuraphan,204
109794888685584,สมเจตน์ เกตุวัตถา,สมเจตน์ เกตุวัตถา,201
182657125936067,พรรคภูมิใจไทย,พรรคภูมิใจไทย,200
111680063837704,สหัสวัต คุ้มคง,สหัสวัต คุ้มคง,197
109239188766815,ดร. วิทยา อินาลา พรรคไทยพร้อม,Klod Sawadputsra,196
102807719039442,พรรครวมไทยสร้างชาติ United Thai Nation Party,พรรครวมไทยสร้างชาติ United Thai Nation Party,181
109253101480638,วรท ศิริรักษ์ - Warot Sirirak,วรท ศิริรักษ์ - Warot Sirirak,119
101535845426970,พรรคไทยสร้างไทย,พรรคไทยสร้างไทย,104
2046265545683549,เชียร์ลุง,เชียร์ลุง,≤100
116903218021802,ลิขิต อัศวจารุวรรณ-พรรคประชาธิปัตย์,ลิขิต อัศวจารุวรรณ,≤100
157659344260788,จุรินทร์ ลักษณวิศิษฏ์ Aoodda,Jurin Laksanawisit,≤100
2131398436998925,ชนินทร์ รุ่งแสง ปชป.,ชนินทร์ รุ่งแสง ปชป.,≤100
100454798870209,พรรคเส้นด้าย - Zendai Party,พรรคเส้นด้าย - Zendai Party,≤100
243465416352138,พรรคเพื่อชาติ,These ads ran without a disclaimer,≤100
108261230583781,เอิร์ธ พงศกร ขวัญเมือง - Earth Pongsakorn Kwanmuang,เอิร์ธ พงศกร ขวัญเมือง - Earth Pongsakorn Kwanmuang,≤100
149079361791677,พรรคเพื่อไทย,พรรคเพื่อไทย,≤100
104427797605274,พี่ต่อ ดร.เฉลิมชัย ศรีอ่อน “คำไหน-คำนั้น”,พี่ต่อ ดร.เฉลิมชัย ศรีอ่อน “คำไหน-คำนั้น”,≤100
183238185051108,อรรถวิชช์ สุวรรณภักดี,อรรถวิชช์ สุวรรณภักดี,≤100
115905241390909,เนเน่ รัดเกล้า สุวรรณคีรี,Rudklao Intawong Suwankiri,≤100
1635406246730420,วรงค์ เดชกิจวิกรม - Warong Dechgitvigrom,วรงค์ เดชกิจวิกรม - Warong Dechgitvigrom,≤100
2230596726985945,ฮาย ปวิศรัฐฐ์ ติยะไพรัช,บริษัท เวิร์ค 360 จำกัด,≤100
102530815945359,องอาจ วชิรพงศ์,Areeya Namdokmai,≤100
296508406790,"Democrat Party, Thailand พรรคประชาธิปัตย์","Democrat Party, Thailand พรรคประชาธิปัตย์",≤100
103528932296276,พรชัย วงศ์ล้อมนิล,Phurin Wonglomnil,≤100
352318098651383,โตโต้ ปิยรัฐ - Piyarat Chongthep,โตโต้ ปิยรัฐ - Piyarat Chongthep,≤100
118757751143686,อิทธิพล ชลธราศิริ - Itthiphon Chontharasiri - แบงค์ชัย,Itthiphon Chontharasiri,≤100
103983981304937,พรรคเสมอภาค-Equality Party,Nalinphas Ongkunaruk,≤100
111341764925564,สำนักสนับสนุนการพัฒนาระบบสุขภาพ - สำนัก 7 สสส.,สำนักสนับสนุนการพัฒนาระบบสุขภาพ - สำนัก 7 สสส.,≤100
204016840519336,ศ.ดร.นฤมล ภิญโญสินวัฒน์,ศ.ดร.นฤมล ภิญโญสินวัฒน์,≤100
467424870040934,ปกรณ์ อารีกุล,ปกรณ์ อารีกุล,≤100
345127652279503,มูลนิธิสากลเพื่อคนพิการ,มูลนิธิสากลเพื่อคนพิการ,≤100
101322409600860,ดร.ชาย สิทธิพล วิบูลย์ธนากุล,Move Forward Party,≤100
104908418629549,EnableSurvey,"Excellent Digital Development Co.,Ltd.",≤100
2222987881148969,อดีต ส.ส. กรณิศ งามสุคนธ์รัตนา เขตวัฒนา เขตคลองเตย เบอร์ 1,อดีต ส.ส. กรณิศ งามสุคนธ์รัตนา เขตวัฒนา เขตคลองเตย เบอร์ 1,≤100
116668478038395,โด่ง ชัชวาล พรอมรธรรม เพื่อไทย ขอนแก่น เขต 1,โด่ง ชัชวาล พรอมรธรรม,≤100
2147269921986413,ธนัญญา พันธุ์การรุ่ง พรรคเพื่อไทย นครปฐม,Pang Thanakulchotikan,≤100
107668691460508,ดรุณี พูนประสิทธิ์ อดีต สจ.สระแก้ว,Narong Thongphantha,≤100
108201828409912,ณัฐวัฒน์ พอใช้ได้,Atirit Dechasiniwat,≤100
1633051440333187,FTE หลักสูตรเพื่อพัฒนาเจ้าของธุรกิจรุ่นใหม่ ครบเครื่อง ทันใจ แบบเร่งรัด,"VP group infinity Co.,Ltd.",≤100
109479500554299,เชียร์ลุง 2,เชียร์ลุง 2,≤100
114043631615331,ชานิสรา ภูวิจิตร บอสโอ๋เพื่อไทย,ชานิสรา,≤100
622674297897819,Screenshirt2020,Screenshirt2020,≤100
115816738136127,มนตรี บุญจรัส Montree  Boonjarat,พลรักษ์ รักษาพล,≤100
112343717773740,Betapetonline,ชัชญา พานิช,≤100
193566374877998,กษิติ กมลนาวิน,กษิติ กมลนาวิน,≤100
135827909783631,beartai แบไต๋,SHOW NO LIMIT COMPANY LIMITED,≤100
104342402244178,อารุม ตุ้มน้อย - Arum Tumnoi,อารุม ตุ้มน้อย - Arum Tumnoi,≤100
2086963124904186,พรรคก้าวไกล แม่ฮ่องสอน,พรรคก้าวไกล แม่ฮ่องสอน,≤100
159570997481890,พลตำรวจเอกเสรีพิศุทธ์ เตมียเวส,พลตำรวจเอกเสรีพิศุทธ์ เตมียเวส,≤100
110398018491526,สุทิน นพขำ พรรคเพื่อไทย จังหวัดปทุมธานี,สุทิน นพขำ พรรคเพื่อไทย จังหวัดปทุมธานี,≤100
113023081702937,ธีระ สลักเพชร,ธีระ สลักเพชร,≤100
109404485235732,ศิริวัฒน์ ขจรประศาสน์-ยอด,Supharat Sirisawat,≤100
107612328588715,The Voters,สันติสุข กาญจนประกร,≤100
115922723434700,ครูเจพีสรุปย่อ for Teacher,ครูเจพีสรุปย่อ for Teacher,≤100
113001706909463,สส.เป้ นภาพร เพ็ชร์จินดา Dr.Napaporn Petchinda,สส.เป้ นภาพร เพ็ชร์จินดา Dr.Napaporn Petchinda,≤100
110925395241605,พรรครักษ์ผืนป่าประเทศไทย,These ads ran without a disclaimer,≤100
107945618934003,ธนูชยานันท์ ปั้นบริสุทธิ์,ธนูชยานันท์ ปั้นบริสุทธิ์,≤100
100915662043252,Denis Ads.,บริษัท เดนิส แอดส์ จำกัด,≤100
607667879247292,คิง GT7 MOTOR,These ads ran without a disclaimer,≤100
317911298372936,อรอนงค์  กาญจนชูศักดิ์,อรอนงค์  กาญจนชูศักดิ์,≤100
110962080309820,HONS Bathroom,These ads ran without a disclaimer,≤100
100985972856061,ธนพจน์ ทรัพย์ยอดแก้ว - Thanapoj Subyodkaew,Thanapoj Subyodkaew,≤100
113705587638009,น้องหมอขอตอบ,Phunna Songprasert,≤100
111331191880453,วินัย วิจิตรโสภณ - Winai Wijitsophon,วินัย วิจิตรโสภณ - Winai Wijitsophon,≤100
2151302718520482,ธิดารัตน์ ยิ่งเจริญ Tidarat Yingcharoen,ธิดารัตน์ ยิ่งเจริญ Tidarat Yingcharoen,≤100
112661633844172,คลังประมูล/รับออเดอร์คัดงาน/ปลีก/ส่ง/ยกกระสอบ,These ads ran without a disclaimer,≤100
100893829013139,ภูริวรรธก์ ใจสำราญ - Puriwat Chaisamran,Puriwat Chaisamran,≤100
102544175903371,เบ๊นซ์ นิธิพล  เพื่อคนสมุทรปราการ,เบ๊นซ์ นิธิพล  เพื่อคนสมุทรปราการ,≤100
454523585079183,ภาดาท์ วรกานนท์ Pada Vorakanon,ภาดาท์ วรกานนท์ Pada Vorakanon,≤100
106018291054558,พลังประชารัฐ ภูเก็ต สุทา ประทีป ณ ถลาง,พลังประชารัฐ ภูเก็ต สุทา ประทีป ณ ถลาง,≤100
109263155401195,นายกประเทศ บุญยงค์,นายกประเทศ บุญยงค์,≤100
105275398809695,อารยะ โรจนวณิชชากร ปชป.ชลบุรี,These ads ran without a disclaimer,≤100
101755712680612,รัก ณิชาภา โกวิทานนท์ ผู้สมัคร ส.ส.สมุทรสงคราม พรรคเพื่อไทย,รัก ณิชาภา โกวิทานนท์ ผู้สมัคร ส.ส.สมุทรสงคราม พรรคเพื่อไทย,≤100
108515294626891,สอบข้าราชการท้องถิ่น By Thurakan,Chiraphorn Thuree,≤100
105125715202609,ส.ส.ไผ่ ลิกค์,ส.ส.ไผ่ ลิกค์,≤100
100761582502948,จารุพล เรืองสุวรรณ - อาจารย์จา,Charupol Ruangsuwan,≤100
108535378427614,นาย สุรชัย แดงละอุ่น - นายกโท้ง,นาย สุรชัย แดงละอุ่น - นายกโท้ง,≤100
106561034744198,ลอรี่ - พงศ์พล ยอดเมืองเจริญ,ลอรี่ - พงศ์พล ยอดเมืองเจริญ,≤100
112073738279329,สิงโต - ศักดิ์สิทธิ์ ขาวทอง,สิงโต - ศักดิ์สิทธิ์ ขาวทอง,≤100
101911785474583,ร้านการ์ดแต่งงาน ของชำร่วยงานแต่ง Kingcraft Studio,These ads ran without a disclaimer,≤100
101573459356406,ภัทรพงศ์ ภัทรประสิทธิ์ - Phattrapong Phattraprasit,Suparerk Poopipatpinyo,≤100
111852360177624,วิวัฒน์ จินดาพล สจ.ต้อม,วิวัฒน์ จินดาพล สจ.ต้อม,≤100
113019528379127,"กมลสันติ กลั่นบุศย์ ""ผู้การจี""",Chalit Tuntithanakul,≤100
111482201923087,นคร มาฉิม,Kristapun Aphichatchayanon,≤100
120584364308926,Fcรองแก๊ป-ศักดา สมบูรณ์ลักขณา,Apichit Intachan,≤100
105308564750704,ณัฏฐ์ มงคลนาวิน,ณัฏฐ์ มงคลนาวิน,≤100
152665702176493,Ringsideการเมือง,Ringsideการเมือง,≤100
100707529597990,พรรคเพื่อไทย จังหวัดตราด,พรรคเพื่อไทย จังหวัดตราด,≤100
119014337828730,รักเบอร์4 ศุภชัย  เครือจันทร์,These ads ran without a disclaimer,≤100
100298682713615,เสื้อวินเทจ ลายมัน ผ้าดำ,เสื้อวินเทจ ลายมัน ผ้าดำ,≤100
114574341574903,อิทธิเดช สุพงษ์ - Itthidej Suphong,Tanapat Srisontiyakun,≤100
168439769888716,HONiC,These ads ran without a disclaimer,≤100
112706641077875,สจ.ดนุภัทร์ เชียงชุม,These ads ran without a disclaimer,≤100
112720555129852,งานวิชาการ,These ads ran without a disclaimer,≤100
120584364308926,Fcรองแก๊ป-ศักดา สมบูรณ์ลักขณา,Thanarat Tubtieamsuk,≤100
108615578531493,สุกรี มะเต๊ะ นราธิวาส - เขต5,These ads ran without a disclaimer,≤100
1008069346052207,วีระ รูปคม-weera roopkom,วีระ รูปคม-weera roopkom,≤100
105269258108591,EGCO Group,These ads ran without a disclaimer,≤100
106876765669721,เอกภพ สายไหม,เอกภพ สายไหม,≤100
142756472518931,สุภาภรณ์ คงวุฒิปัญญา,สุภาภรณ์ คงวุฒิปัญญา,≤100
106114681299032,ชูเกียรติ จีนาภักดิ์,ชูเกียรติ จีนาภักดิ์,≤100
111102121566092,พลช กฤษณะราช,พลช กฤษณะราช,≤100
104964595422801,ยุทธ สุระศักดิ์ รุประมาณ,These ads ran without a disclaimer,≤100
108091688886508,Smart Cybersecurity Summit - Thailand,These ads ran without a disclaimer,≤100
174738095989909,Pichai Naripthaphan,These ads ran without a disclaimer,≤100
778389422245239,BenarNews Thailand,These ads ran without a disclaimer,≤100