Page ID,Page name,Disclaimer,Amount spent (USD)
124252504303223,UNICEF (FR),UNICEF avec des crédits publicitaires Facebook,≤100
68793499001,UNICEF,UNICEF with Facebook Ad Credits,≤100
166178460072395,اليونيسف بالعربية - UNICEF in Arabic,اليونيسف باستخدام اعتمادات الإعلان على الفيسبوك,≤100
101493902773017,SPIC-Turkey,These ads ran without a disclaimer,≤100
167878593236712,UNICEF en español,UNICEF con créditos publicitarios de Facebook,≤100
106012187777392,Madagasikara an'i Kristy,Tahina Fanomezantsoa Ramakavelo,≤100