Page ID,Page name,Disclaimer,Amount spent (VND)
105845511087981,TRUYỀN HÌNH AN VIÊN,TRUYỀN HÌNH AN VIÊN,9318
105062615490802,Thượng Tọa Thích Đức Thiện,Thượng Tọa Thích Đức Thiện,6429
199803143390683,Oxfam in Vietnam,Oxfam in Vietnam,3580
106823432074875,An Viên Sự Kiện,An Viên Sự Kiện,2960
919479674872321,Báo Nghệ An,Báo Nghệ An,484
633246560165629,Fujifilm Global,These ads ran without a disclaimer,359
131169181232,VOGUE JAPAN,These ads ran without a disclaimer,179
136428433091172,Tv5monde Asie Pacifique,These ads ran without a disclaimer,≤100