Page ID,Page name,Disclaimer,Amount spent (USD)
108657847619569,Goberna Ecuador,Goberna Ecuador,≤100
486957511486639,Liderazgo Capacitación Ecuador,These ads ran without a disclaimer,≤100
195488207272178,Ciudadanía y Desarrollo,Ciudadanía y Desarrollo,≤100
715978025241450,Marciana Valdivieso de Poveda,Marciana Auxiliadora Valdivieso Zamora,≤100
148963240630570,Tomas Zevallos,Tomás Tupacyupanqui Zevallos Vera,≤100
105539772365757,Mentordemy,Mentordemy,≤100
102823644882450,Pedro Pablo Moran 2023,Pedro Pablo Moran Marchan,≤100
495225060514172,Degso,Gabriela Veronica Chango Hermoza,≤100
606448792700458,Instituto de Formación en Gastronomía Turismo Hoteleria GTH,Hugo Benalcázar,≤100
171870950030850,Teodoro Gallegos Salem,Benigno Teodoro Gallegos Salem,≤100
616008265157883,JORGE PINTO D,Jorge Washington Pinto Davila,≤100
2221570604786246,Primicias,Primicias,≤100
185930698690529,Observatorio de Gasto Público,Ciudadanía y Desarrollo,≤100
105468602466759,Mundo Verde y Natural,These ads ran without a disclaimer,≤100
101056676141616,Asesoría Política - Goberna Ecuador,Goberna Ecuador S.A.S,≤100
237469833662018,Observatorio Judicial Ecuador,Ciudadanía y Desarrollo,≤100
115012276965624,Daniel Noboa  Azin,Daniel Noboa Azin,≤100
165042833621264,Schneider Electric,These ads ran without a disclaimer,≤100
112352340222699,Emprendedores de éxito,These ads ran without a disclaimer,≤100