Page ID,Page name,Disclaimer,Amount spent (USD)
298861020736,فرانس 24 / FRANCE 24 Arabic,These ads ran without a disclaimer,≤100
296173694467158,Bâti-Est Expo /salon du bâtiment,These ads ran without a disclaimer,≤100
102573822746926,Dzair shopping,These ads ran without a disclaimer,≤100
106004665806662,إجتياز النهائي لذوي الخبرة,These ads ran without a disclaimer,≤100
107944608042253,الصفحة الرسمية للنائب الدكتور بوجلطية ناصر,الصفحة الرسمية للنائب الدكتور بوجلطية ناصر,≤100
274017972795375,Algerie 24,aljazair24,≤100