Page ID,Page name,Disclaimer,Amount spent (USD)
162379173778716,Alcaldía de San Salvador,Alcaldía de San Salvador,≤100
100541468870287,Alcaldía Municipal de Mejicanos,Alcaldía Municipal de Mejicanos,≤100
643513979193133,Justicia para Beatriz,Neuma,≤100
108213030904997,Ricardo Rivas,Ricardo Rivas,≤100
152914224736727,Banco Mundial,These ads ran without a disclaimer,≤100
890916994384759,Rafael Arévalo,Rafael Edgardo Arévalo González,≤100
131602424169035,Oxfam en Español,These ads ran without a disclaimer,≤100
109753348739502,Ocho pe eme,These ads ran without a disclaimer,≤100