Page ID,Page name,Disclaimer,Amount spent (PEN)
101665683225827,José Luna Gálvez - Pepe Luna,Laidy Diana Peceros Espinoza,888
201324190574817,Alex Rodriguez Alvarado,Jesús Jhonatan Santisteban Riojas,382
107277410983740,Polanski Carmona Cruz,Polanski Carmona Cruz,≤100
204040603454657,Dr. Jorge Pérez,Maria Del Carmen Collantes Alvarez,≤100
119723768043679,Grupo Verona,Giovanni Domenico Verona Baluarte,≤100
101555396562359,Voto Informado,Voto Informado,≤100
103805062448191,Yomi Orosco Nunton,Victor Yomi Orosco Nunton,≤100
101218724615115,SOMOS PERÚ Lambayeque,SOMOS PERÚ,≤100
100626162835885,Lambayeque Despierta,LAMBAYEQUE DESPIERTA,≤100
100249176247091,Juan Carrasco Millones Oficial,LAMBAYEQUE REGIÓN,≤100
111450058300845,Alex y los Jóvenes,Waldir Robert Castillo Ortiz,≤100
111470355596678,ONPE Oficina Nacional de Procesos Electorales - Perú,Oficina Nacional de Procesos Electorales,≤100
109186465355018,Las Lilas - Perú,Las Lilas,≤100
109019574560600,Aula Gaceta,Joel V. Supo Baldo,≤100
264223880347121,Lampadia Oficial,LAMPADIA,≤100
112763377864484,Gold Medical Centro Médico - Odontológico,LAMBAYEQUE REGIÓN,≤100
108612759471258,Colegio de Ingenieros del Peru CD Lambayeque,CIP CD LAMBAYEQUE,≤100
142062936237878,Goberna,Goberna,≤100
287389705061665,Nut. Roy Miranda,Oscar Roy Miranda,≤100
687691121319854,Ernesto Álvarez Miranda,Ernesto Julio Alvarez Miranda,≤100
1805183599788143,Silvia Monteza,Héctor Melgar Sandoval,≤100
104381882429050,Cumbre de Gobernadores e Intendentes de Latinoamérica,Shocking Wave Productions,≤100
729149373915986,Rextie,Rextie,≤100
1897126257190528,Instituto Latinoamericano de Capacitaciones Jurídicas-ILCJ,ILCJ,≤100
105566838477273,Leonor Carolina Romero - Abogada,Julio César Silva Meneses,≤100
534284396949027,Ilich López,Renzo Jireh Casas Torres,≤100
455802295156178,Nuestramerica TV,Crhistian Jorge Peralta Ramírez,≤100
113162141028968,Integridad,Integridad por el Peru,≤100
161024241267665,Julio César Silva Meneses - Abogado,Julio César Silva Meneses,≤100
699489483476556,Darwin Espinoza Vargas,Jhaec Darwin Espinoza Vargas,≤100
100514466193488,Eduardo Salhuana,Jamill Marzuka Cortez,≤100
102098544497318,Alfredo Perez,Alfredo Perez,≤100
106395164602216,Juan Burgos,Luis Alberto Chavarry Gutierrez,≤100
1275465342519887,Servicios Educativos El Agustino,SERVICIOS EDUCATIVOS EL AGUSTINO,≤100
100283442359203,Fernando Arce Alvarado - Parlamentario Andino,Gustavo Gongora Rodriguez,≤100
235391323233632,PNUD Perú,Megumi Nagayoshi Sakuda,≤100
501011359923743,IDL-Instituto de Defensa Legal,Jose Del Carmen Rojas Chuya,≤100
316564475960113,Estudio Jurídico Tarazona & Asociados,Diego Alberto Isla Yengle,≤100
112894738199084,Comisión de Transportes y Comunicaciones / Período 2022-2023,Luis Alberto Bravo Orosco,≤100
370900893358837,Luis Landauro,Luis Alberto Nicolas Landauro Ramirez,≤100
102700072470995,Sinapzis,Sinapzis,≤100
1435752576703876,Súmate a Fernando Zumarán,Carlos E Quepuy Quispe,≤100
184737444996542,Virú S.A.,These ads ran without a disclaimer,≤100
196140697656186,Len Corell,Ricardo Felix Coral,≤100
1133038383505312,Roger a la región,Marco Enyelver Asencio Camizán,≤100
107886892080038,Los jóvenes con Roger Guevara,Enzo Waldir Llanos Palacios,≤100
104982448888713,Ing. Angler Pazo Jacinto - Consejero Regional/Sechura,Angler Pazo Jacinto,≤100
115806960260634,Juan Carlos Mori,Franco Javier Rios Flores,≤100
111656531549095,Gilia Gutiérrez Ayala,Alan Phaolo Loayza Calderón,≤100
751269661657206,Bayer Crop Science México,These ads ran without a disclaimer,≤100
1234116153313066,Quiero Mi Piura Segura,Hi Politic,≤100
106746035551083,Yoni Mamani,Yoni Mamani Quispe,≤100
1490783727827308,Informa Ayacucho,These ads ran without a disclaimer,≤100
103571168624124,evasybrujaspodcast,These ads ran without a disclaimer,≤100
314343331981142,Mundo Sano,These ads ran without a disclaimer,≤100
1650216218535063,Oceana Perú,Oceana Perú,≤100
100613652687537,Peruanos de Centro,Chani Mejia,≤100