Page ID,Page name,Disclaimer,Amount spent (USD)
100524251686344,Gustavo Acevedo,Gustavo Jose Acevedo Berganza,120
162379173778716,Alcaldía de San Salvador,Alcaldía de San Salvador,≤100
102681318100638,Juan Carlos Zepeda Marroquín,Juan Carlos Zepeda Marroquin,≤100
643513979193133,Unidos por Beatriz,Neuma,≤100
102401164853252,Cecilia Rivera,Cecilia Rivera,≤100
1935947973198237,Alcaldía El Paraíso Chalatenango,Alexi Antonio Escalante Galdamez,≤100
147858435252169,Embajada de los Estados Unidos en El Salvador,Embajada de Estados Unidos en El Salvador,≤100
224011722197507,Doctor Luis Armando Figueroa,Doctor Luis Armando Figueroa,≤100
106211080792837,Marvin Sánchez,These ads ran without a disclaimer,≤100
112309875494277,Cámara de Comercio e Industria de El Salvador,These ads ran without a disclaimer,≤100
269601400112823,Raúl Chamagua,Jose Raúl Chamagua Noyola,≤100
386252852217600,Género y Metodologías,These ads ran without a disclaimer,≤100
102488864666696,Lorena Fuentes,These ads ran without a disclaimer,≤100
131857626888341,Aceprensa,These ads ran without a disclaimer,≤100
104703872565471,Zoila Feminista,These ads ran without a disclaimer,≤100
125335024157691,Promine,These ads ran without a disclaimer,≤100