Page ID,Page name,Disclaimer,Amount spent (USD)
484994444995990,Duwun,an advertiser in Myanmar,≤100
2074476209434546,Happy Healthy Myanmar  ပျော်ရွှင်ကျန်းမာ တို့မြန်မာ,an advertiser in Myanmar,≤100
110456411440371,Doh Hlay,an advertiser in Myanmar,≤100
1584183878552505,Institute for Strategy and Policy- Myanmar,an advertiser in Myanmar,≤100
395933837270620,Tet Luu Kyaw - တက်လူကျော် စာပေ,an advertiser in Myanmar,≤100
112079715304478,Wai Min Oo,These ads ran without a disclaimer,≤100
1845804832341723,Green Online Shop,These ads ran without a disclaimer,≤100
100923182293408,"Youth Corner Lashio Shan State """,These ads ran without a disclaimer,≤100