Page ID,Page name,Disclaimer,Amount spent (BSD)
1025152104235573,Team Cooper - Chester Cooper,Team Cooper - Chester Cooper,≤100
146824719213191,"Clay Sweeting MP, Central & South Eleuthera","Clay Sweeting MP, Central & South Eleuthera",≤100
111346800527564,ArawakX,These ads ran without a disclaimer,≤100
664019147362563,St.Po Family Co.,These ads ran without a disclaimer,≤100
110510071864172,"Deputy Prime Minister of The Bahamas, Chester Cooper","Deputy Prime Minister of The Bahamas, Chester Cooper",≤100