Page ID,Page name,Disclaimer,Amount spent (USD)
102041322886335,مولاي أشرف حمود الشيخ Moulaye Achraf Hamoud Cheikh,Bah Abdellahi,≤100
106758591720574,النائب سيد محمد ولد السيدي,اطول عمر المصطف,≤100
113988695291857,وكالة الأخبار المستقلة,أحمدو محمد المصطفى,≤100
110631788681313,تواصل/ الحملة الإنتخابية 2023 - معا نصنع التغيير,Abdallahi Saleck Mohamed Alem,≤100
111785821882316,أمل نواكشوط Espoir Nouakchott,اطول عمر المصطف,≤100
330841846933183,حزب التجمع الوطني للإصلاح والتنمية - تواصل,Mohamed Soueidi,≤100
100456972130365,Mauri-design,Mauri-design,≤100
158183830897328,Bellewarmedia - بلوار ميديا,Bellewarmedia - بلوار ميديا,≤100
100289891936192,محمد حم فزاز,محمد حم فزاز,≤100
110597938686582,النائب أحمدو بمب ولد أحمد المختار,محمد الأمين محمد,≤100
116420348100139,السعد ولد أفلواط,NEJAHPROJECT,≤100
112996045035943,حملة مرشح الشباب: محمد ولد يحيى,اطول عمر المصطف,≤100
101523669605768,Sid’Ahmed Bolle Cheibany - سيد أحمد بلّه الشيباني,Abdellahi Ahmed El Mostapha,≤100
108292708888062,محمد غالي ولد اشريف أحمد,Ahmed Med Cheikh,≤100
120031604401797,حملة مرشح حزب الإصلاح لنيابيات أوجفت لبروفسور اعل ولد بتار,Ely Sidi Ahmed,≤100
114012888341133,"حملة اللائحة الوطنية المختلطة ل""تواصل""",Abdallahi Saleck Mohamed Alem,≤100