Page ID,Page name,Disclaimer,Amount spent (PYG)
242259253120490,Igualdad de Genero SÍ,Igualdad de Genero SÍ,55976
140457539356382,Gabinete Social Presidencia de la República del Paraguay,Gabinete Social Presidencia de la República del Paraguay,28965
1510805942583059,Norma Zarate de Monges,Norma Zarate,8364
272098156231873,Diario HOY Paraguay,Diario HOY Paraguay,7241
278226125974096,El Paraguayo Independiente,Paraguayo Independiente,4223
184860595385745,Ing. Roberto Jiménez - Concejal,Roberto Fernando Jimenez Ayala,1200
123892278310235,Eduardo Valiente,Eduardo Valiente,1159
359307964420456,Terere Cómplice,Centro Interdisciplinario de Investigación Social,698
101986861866371,Tía Ida - Diputada 2023,Jazmin Thamara Elizabeth Ortiz De Bonzi,453
118397948223791,Oscar Tuma,Óscar Luis Tuma Bogado,422
599371683431175,Cooperativa Cumbre de la Cordillera,Cooperativa Cumbre de la Cordillera,120
363306313879750,Marle Chispita Orue,Marlene Tatiana Orue Leon,≤100
717442448287834,Portal Canindeyu,Portal Canindeyu,≤100
116747321316881,Javier Ferreira,Javier Ferreira,≤100
94199711897,Hábitat para la Humanidad,These ads ran without a disclaimer,≤100
137071910500968,Alvaro Grau,Oscar David Baez Alvarenga,≤100