Page ID,Page name,Disclaimer,Amount spent (VND)
103462819259532,Xuất Khẩu Lao Động Nước Ngoài Phí Rẻ,These ads ran without a disclaimer,4501
105062615490802,Thượng Tọa Thích Đức Thiện,Thượng Tọa Thích Đức Thiện,3724
105845511087981,TRUYỀN HÌNH AN VIÊN,TRUYỀN HÌNH AN VIÊN,3372
105845511087981,TRUYỀN HÌNH AN VIÊN,These ads ran without a disclaimer,448
919479674872321,Báo Nghệ An,Báo Nghệ An,366
101957285428877,Thức Tỉnh,These ads ran without a disclaimer,357
101865258169428,ĐEN Secondhand,ĐEN Secondhand,296
109511221989097,Ánh Sáng Bookstore,These ads ran without a disclaimer,107