Page ID,Page name,Disclaimer,Amount spent (USD)
100996575982707,Samajik Feed,Internet Market Today Pvt. Ltd.,≤100
1414802032117321,South Asian Regional Trade Union Council,South Asian Regional Trade Union Council,≤100
116853221297981,Youth-Led Action Against AIDS,we For Change,≤100
13341879933,Organic Consumers Association,These ads ran without a disclaimer,≤100
107735975410627,सनातन संस्कृति संरक्षण अभियान,Pradeep Khanal,≤100
103486405407498,Visit Danzhou,These ads ran without a disclaimer,≤100
118421671143192,Nirem Travels & Tours Pvt. Ltd.,These ads ran without a disclaimer,≤100