Page ID,Page name,Disclaimer,Amount spent (USD)
238019255471,PNM - The People's National Movement,PNM - The People's National Movement,≤100
13204463437,"UNHCR, the UN Refugee Agency",These ads ran without a disclaimer,≤100
276410485748244,Wired868,Wired868,≤100
137550252978378,Cipriani College of Labour and Co-operative Studies,These ads ran without a disclaimer,≤100
108061471650955,SoluTec,These ads ran without a disclaimer,≤100
146822255731958,Fast Travel Games,These ads ran without a disclaimer,≤100