Page ID,Page name,Disclaimer,Amount spent (CRC)
117702158266385,Antonio Álvarez Desanti,Antonio Alvarez Desanti,611
1540070352761579,Leslye Bojorges,Leslye Ruben Bojorges Leon,554
399929296730642,Consejo Nacional de Cooperativas,Jonathan Ureña Vargas,316
265843867173714,La Revista,La Revista,≤100
285530825204,Klitschko,These ads ran without a disclaimer,≤100
502665456448329,Federico Barolin,These ads ran without a disclaimer,≤100
102851155670931,mUEve,mUEve,≤100
10423517786,Harvard Business Review,These ads ran without a disclaimer,≤100