Page ID,Page name,Disclaimer,Amount spent (VND)
111649914996393,Viên đại tràng Nhất Nhất,These ads ran without a disclaimer,1264
106128284947266,Lương Y Phạm Văn Thanh Xương Khớp - Việc Tử Tế VTV1,These ads ran without a disclaimer,708
105845511087981,TRUYỀN HÌNH AN VIÊN,TRUYỀN HÌNH AN VIÊN,181
919479674872321,Báo Nghệ An,Báo Nghệ An,≤100
101865258169428,ĐEN Secondhand,ĐEN Secondhand,≤100
114075063569561,Lương Y Phạm Văn Thanh - Việc Tử Tế VTV1,These ads ran without a disclaimer,≤100
155460521146066,RFI Tiếng Việt,These ads ran without a disclaimer,≤100