Page ID,Page name,Disclaimer,Amount spent (THB)
195119697286323,พุทธิพงษ์  ปุณณกันต์,พุทธิพงษ์  ปุณณกันต์,≤100
157659344260788,จุรินทร์ ลักษณวิศิษฏ์ Aoodda,Jurin Laksanawisit,≤100
149079361791677,พรรคเพื่อไทย,พรรคเพื่อไทย,≤100
241115389300595,คุณหญิงสุดารัตน์ เกยุราพันธุ์ Sudarat Keyuraphan,คุณหญิงสุดารัตน์ เกยุราพันธุ์ Sudarat Keyuraphan,≤100
622674297897819,Screenshirt2020,Screenshirt2020,≤100
104427797605274,พี่ต่อ ดร.เฉลิมชัย ศรีอ่อน “คำไหน-คำนั้น”,พี่ต่อ ดร.เฉลิมชัย ศรีอ่อน “คำไหน-คำนั้น”,≤100
116668478038395,โด่ง ชัชวาล พรอมรธรรม เพื่อไทย ขอนแก่น เขต 1,โด่ง ชัชวาล พรอมรธรรม,≤100
100932118600686,"เรารักลุงป้อม ""We love Lung Pom""",These ads ran without a disclaimer,≤100