Page ID,Page name,Disclaimer,Amount spent (VND)
101657654885243,Nhà đất giá rẻ nha trang,These ads ran without a disclaimer,16405
107876140675732,Bằng cấp Chứng Chỉ Toàn Quốc - Hải Anh,These ads ran without a disclaimer,10550
103749562500024,Kiên Trần - Chuyên Bằng Cấp Chứng Chỉ,These ads ran without a disclaimer,4070
280124715749325,Sự Thật Về Pháp Luân Công,Sự Thật Về Pháp Luân Công,2233
1507429892822619,BOM Money,BOM Money,929
919479674872321,Báo Nghệ An,These ads ran without a disclaimer,195