Page ID,Page name,Disclaimer,Amount spent (VND)
101914358044085,Tài Liệu Ôn Thi Viên Chức Giáo Dục,Tài Liệu Ôn Thi Viên Chức Giáo Dục,23567
105062615490802,Thượng Tọa Thích Đức Thiện,Thượng Tọa Thích Đức Thiện,12928
113614244649513,Quà Tặng Doanh Nghiệp - Khắc Tên Theo Yêu Cầu - Cơ sở 10,These ads ran without a disclaimer,3892
1403725043191074,Cổng Thông Tin Tuyển Sinh Melbourne Polytechnic Việt Nam,These ads ran without a disclaimer,3409
378454888947214,Roxtec Group,These ads ran without a disclaimer,≤100