Page ID,Page name,Disclaimer,Amount spent (THB)
101673076131930,พรรคเปลี่ยน,พรรคเปลี่ยน,1083
100477645667021,อัฟฟาน หะยียูโซะ,These ads ran without a disclaimer,782
109239188766815,ดร. วิทยา อินาลา พรรคไทยพร้อม,Klod Sawadputsra,≤100
182657125936067,พรรคภูมิใจไทย,พรรคภูมิใจไทย,≤100
161651553861945,Amnesty International Thailand,Amnesty International Thailand,≤100
157659344260788,จุรินทร์ ลักษณวิศิษฏ์ Aoodda,Jurin Laksanawisit,≤100
102807719039442,พรรครวมไทยสร้างชาติ United Thai Nation Party,พรรครวมไทยสร้างชาติ United Thai Nation Party,≤100
104963151112166,การเมือง kanmuang.com,การเมือง kanmuang.com,≤100
107263299311646,Zom Marie,"Tellscore Co., Ltd.",≤100
137188693021815,สืบจากข่าว,สืบจากข่าว,≤100
2230596726985945,ฮาย ปวิศรัฐฐ์ ติยะไพรัช,บริษัท เวิร์ค 360 จำกัด,≤100
183238185051108,อรรถวิชช์ สุวรรณภักดี,อรรถวิชช์ สุวรรณภักดี,≤100
100454798870209,พรรคเส้นด้าย - Zendai Party,พรรคเส้นด้าย - Zendai Party,≤100
296508406790,"Democrat Party, Thailand พรรคประชาธิปัตย์","Democrat Party, Thailand พรรคประชาธิปัตย์",≤100
103983981304937,พรรคเสมอภาค-Equality Party,Nalinphas Ongkunaruk,≤100
104879999243950,พลชัย พิพิธวรกุล เบอร์ 2 เขต 4 ขอนแก่น พรรคประชาธิปัตย์,Ponchai Pipitvorakul,≤100
283908908680102,พรรคพลังธรรมใหม่,พรรคพลังธรรมใหม่,≤100
101535845426970,พรรคไทยสร้างไทย,พรรคไทยสร้างไทย,≤100
149079361791677,พรรคเพื่อไทย,พรรคเพื่อไทย,≤100
407194015987067,Ch7HD News,Ch7HD News,≤100
115922723434700,ครูเจพีสรุปย่อ for Teacher,ครูเจพีสรุปย่อ for Teacher,≤100
108261230583781,เอิร์ธ พงศกร ขวัญเมือง - Earth Pongsakorn Kwanmuang,เอิร์ธ พงศกร ขวัญเมือง - Earth Pongsakorn Kwanmuang,≤100
115653434840464,พรรคประชาธิปัตย์ นาย ไพบูลย์ ศิริมา เบอร์ 7 จ.สุรินทร์ เขต 8,Pooky Kham-Oun,≤100
1633051440333187,FTE หลักสูตรเพื่อพัฒนาเจ้าของธุรกิจรุ่นใหม่ ครบเครื่อง ทันใจ แบบเร่งรัด,"VP group infinity Co.,Ltd.",≤100
110925395241605,พรรครักษ์ผืนป่าประเทศไทย,พรรครักษ์ผืนป่าประเทศไทย,≤100
451864701523507,Infographic Thailand,Infographic Thailand,≤100
241115389300595,คุณหญิงสุดารัตน์ เกยุราพันธุ์ Sudarat Keyuraphan,คุณหญิงสุดารัตน์ เกยุราพันธุ์ Sudarat Keyuraphan,≤100
109404485235732,ศิริวัฒน์ ขจรประศาสน์-ยอด,Supharat Sirisawat,≤100
546416699215073,ห้องสื่อครูคอม,Krisada Khamma,≤100
118757751143686,อิทธิพล ชลธราศิริ - Itthiphon Chontharasiri - แบงค์ชัย,Itthiphon Chontharasiri,≤100
108515294626891,สอบข้าราชการท้องถิ่น By Thurakan,Chiraphorn Thuree,≤100
101673076131930,พรรคเปลี่ยน,นอท พันธ์ธวัช นาควิสุทธิ์,≤100
204016840519336,ศ.ดร.นฤมล ภิญโญสินวัฒน์,ศ.ดร.นฤมล ภิญโญสินวัฒน์,≤100
2086963124904186,พรรคก้าวไกล แม่ฮ่องสอน,พรรคก้าวไกล แม่ฮ่องสอน,≤100
275507006405211,Padipat Suntiphada - ปดิพัทธ์ สันติภาดา,Padipat Suntiphada - ปดิพัทธ์ สันติภาดา,≤100
117849264601668,วิษณุ กรองกันภัย พรรคไทยพร้อม เบอร์ 28,ลลดา อมาตยกุล,≤100
513741371997112,Amarin TV,อมรินทร์ เทเลวิชั่น,≤100
105955949137073,ติดตามกระแสคนดัง,Narat Thanyaratmetee,≤100
159570997481890,พลตำรวจเอกเสรีพิศุทธ์ เตมียเวส,พลตำรวจเอกเสรีพิศุทธ์ เตมียเวส,≤100
104554835726206,พรรคท้องที่ไทย,Tanongsak Sirirat,≤100
107945618934003,ธนูชยานันท์ ปั้นบริสุทธิ์,ธนูชยานันท์ ปั้นบริสุทธิ์,≤100
112073738279329,สิงโต - ศักดิ์สิทธิ์ ขาวทอง,สิงโต - ศักดิ์สิทธิ์ ขาวทอง,≤100
112343717773740,Betapetonline,ชัชญา พานิช,≤100
104393812499502,ชีทสรุปกฎหมาย สำหรับสอบราชการ พนักงานราชการ by.kantap,ชีทสรุปกฎหมาย สำหรับสอบราชการ พนักงานราชการ by.kantap,≤100
2232486313631668,อนุรักษ์ จุรีมาศ,ธวัชชานลล์ ทำขุรู,≤100
116668478038395,โด่ง ชัชวาล พรอมรธรรม เพื่อไทย ขอนแก่น เขต 1,โด่ง ชัชวาล พรอมรธรรม,≤100
111341764925564,สำนักสนับสนุนการพัฒนาระบบสุขภาพ - สำนัก 7 สสส.,สำนักสนับสนุนการพัฒนาระบบสุขภาพ - สำนัก 7 สสส.,≤100
1105604039583762,Line One สว.นท. ขอเชิญส่งประวัติ ส่วนตัว องค์กร เพื่อเข้ารับรางวัลประจำปี,Suksan Booran,≤100
115613383629627,ลุงตู่ วิ่ง สู้ ฟัด,These ads ran without a disclaimer,≤100
103003377726705,เสื้อผ้าแฟชั่นNaPa,Threeramate Artkongharn,≤100
216524221773305,Big C,These ads ran without a disclaimer,≤100
161052211196800,พรรคเสรีรวมไทย,พรรคเสรีรวมไทย,≤100
111331191880453,วินัย วิจิตรโสภณ - Winai Wijitsophon,วินัย วิจิตรโสภณ - Winai Wijitsophon,≤100
107668691460508,ดรุณี พูนประสิทธิ์ อดีต สจ.สระแก้ว,Narong Thongphantha,≤100
102108535240880,สมบัติ ยะสินธุ์,สมบัติ ยะสินธุ์,≤100
190851094962157,เป่ายิ้งฉุบ รับผลิตเสื้อเพื่อคุณ,These ads ran without a disclaimer,≤100
106114681299032,ชูเกียรติ จีนาภักดิ์,ชูเกียรติ จีนาภักดิ์,≤100
100761582502948,จารุพล เรืองสุวรรณ - อาจารย์จา,Charupol Ruangsuwan,≤100
102949686071401,ทศพล แก้วทิมา ราชบุรีต้องดีกว่าเดิม,ทศพล แก้วทิมา ราชบุรีต้องดีกว่าเดิม,≤100
113023081702937,ธีระ สลักเพชร,ธีระ สลักเพชร,≤100
345127652279503,มูลนิธิสากลเพื่อคนพิการ,มูลนิธิสากลเพื่อคนพิการ,≤100
106561034744198,ลอรี่ - พงศ์พล ยอดเมืองเจริญ,ลอรี่ - พงศ์พล ยอดเมืองเจริญ,≤100
113067400607487,กันตพงศ์ ดีชัยยะ - แมพ,กันตพงศ์ ดีชัยยะ - แมพ,≤100
108201828409912,ณัฐวัฒน์ พอใช้ได้,Atirit Dechasiniwat,≤100
111485468432921,พรรคเปลี่ยนอนาคต Changefuture party,พรรคเปลี่ยนอนาคต Changefuture party,≤100
112667281187463,ถิรเดช ตั้งมั่นก่อกิจ สจ.ม้อ,ถิรเดช ตั้งมั่นก่อกิจ สจ.ม้อ,≤100
194806671454828,นายศาสตรา ศรีปาน - Sarttra Sripan,นายศาสตรา ศรีปาน - Sarttra Sripan,≤100
504514060047514,สุณัฐชา โล่สถาพรพิพิธ - ตรัง,สุณัฐชา โล่สถาพรพิพิธ,≤100
101289896276961,ทีมปากนครพัฒนา,These ads ran without a disclaimer,≤100
107569661842229,หน่อย-ศุภนาถลดา รัตนาธนัชภัค,หน่อย-ศุภนาถลดา รัตนาธนัชภัค,≤100
104908418629549,EnableSurvey,"Excellent Digital Development Co.,Ltd.",≤100
1635406246730420,วรงค์ เดชกิจวิกรม - Warong Dechgitvigrom,วรงค์ เดชกิจวิกรม - Warong Dechgitvigrom,≤100
2151302718520482,ธิดารัตน์ ยิ่งเจริญ Tidarat Yingcharoen,ธิดารัตน์ ยิ่งเจริญ Tidarat Yingcharoen,≤100
109132222106497,เอฟ ชนัตถ์ นันทปัญญา,Katakorn Phukhaow,≤100
110672681521491,พรรคชาติรุ่งเรือง - Chat Rung Rueang Party,พรรคชาติรุ่งเรือง - Chat Rung Rueang Party,≤100
110688558670229,,These ads ran without a disclaimer,≤100
100915662043252,Denis Ads.,บริษัท เดนิส แอดส์ จำกัด,≤100
107612328588715,The Voters,สันติสุข กาญจนประกร,≤100
109263155401195,นายกประเทศ บุญยงค์,นายกประเทศ บุญยงค์,≤100
111755668564628,อลงกรณ์ พลบุตร เบอร์ 7,These ads ran without a disclaimer,≤100
622674297897819,Screenshirt2020,Screenshirt2020,≤100
789991318125212,พงศกร รัตนเรืองวัฒนา,พงศกร รัตนเรืองวัฒนา,≤100
707294083039692,เบียร์ พนธกร,เบียร์ พนธกร,≤100
111852360177624,วิวัฒน์ จินดาพล สจ.ต้อม,วิวัฒน์ จินดาพล สจ.ต้อม,≤100
107448364979874,ศิริพงศ์ นานคงแนบ - Siripong Nankongnab,Siripong Nankongnab,≤100
135827909783631,beartai แบไต๋,SHOW NO LIMIT COMPANY LIMITED,≤100
106872458897954,ระพีพัฒน์ สุเมธโชติเมธา,ระพีพัฒน์ สุเมธโชติเมธา,≤100
972019486321939,บู้ จเด็ศ จันทรา,จเด็ด จันทรา,≤100
103742482695590,เจมส์ สรรเพ็ชญ ศรีสวัสดิ์ - James Sanphet Srisawat,เกริกกฤษดา ทองแก้วสวัสดิ์,≤100
107016601863148,ยุทธศักดิ์ ชูประเสริฐ - จ่ายุทธ,ยุทธศักดิ์ ชูประเสริฐ - จ่ายุทธ,≤100
2147269921986413,ธนัญญา พันธุ์การรุ่ง พรรคเพื่อไทย นครปฐม,Pang Thanakulchotikan,≤100
122798967391008,อนุวัตร สัมพันธ์ทรัพย์,These ads ran without a disclaimer,≤100
102544175903371,เบ๊นซ์ นิธิพล  เพื่อคนสมุทรปราการ,เบ๊นซ์ นิธิพล  เพื่อคนสมุทรปราการ,≤100
101755712680612,รัก ณิชาภา โกวิทานนท์ ผู้สมัคร ส.ส.สมุทรสงคราม พรรคเพื่อไทย,รัก ณิชาภา โกวิทานนท์ ผู้สมัคร ส.ส.สมุทรสงคราม พรรคเพื่อไทย,≤100
104342402244178,อารุม ตุ้มน้อย - Arum Tumnoi,อารุม ตุ้มน้อย - Arum Tumnoi,≤100
601953326929372,ธัญวัจน์ กมลวงศ์วัฒน์ - Tunyawaj Kamolwongwat,Tunyawaj Kamolwongwat,≤100
100351181333699,ล็อตเตอรี่พารวย,These ads ran without a disclaimer,≤100
101274425792459,กิตติพงศ์ รวยฟูพันธ์ - ส.ก.ไอซ์ เขตทุ่งครุ,กิตติพงศ์ รวยฟูพันธ์ - ส.ก.ไอซ์ เขตทุ่งครุ,≤100
101831726085555,พรรครวมแผ่นดิน,พรรครวมแผ่นดิน,≤100
103863149219273,นิธิกร วุฒินันชัย เอก พรรคเพื่อไทย,เอก นิธิกร วุฒินันชัย,≤100
110945151879204,SMILE LUNLA,These ads ran without a disclaimer,≤100
110398018491526,สุทิน นพขำ พรรคเพื่อไทย จังหวัดปทุมธานี,สุทิน นพขำ พรรคเพื่อไทย จังหวัดปทุมธานี,≤100