Page ID,Page name,Disclaimer,Amount spent (USD)
105508802350299,Pradeep Gyawali,Raju Gautam,≤100
2246168735670776,MeroAdda मेरोअड्डा,MeroAdda मेरोअड्डा,≤100
293830514453910,Biraj Bhakta Shrestha बिराज भक्त श्रेष्ठ,Biraj Bhakta Shrestha बिराज भक्त श्रेष्ठ,≤100
115615364743419,MP Murtikar,These ads ran without a disclaimer,≤100
100996575982707,Samajik Feed,Internet Market Today Pvt. Ltd.,≤100
115301803573781,The World Fact,These ads ran without a disclaimer,≤100
101569176040527,The News Room,These ads ran without a disclaimer,≤100
101305111453944,Arthasanjal,Sunil Maharjan,≤100