Page ID,Page name,Disclaimer,Amount spent (VND)
192195994956428,Tài Liệu Thi Viên Chức Giáo Viên,Tài Liệu Thi Viên Chức Giáo Viên,50316
114658477052849,Lương Y Việc Tử Tế VTV 1 - Phạm Văn Thanh,These ads ran without a disclaimer,44569
902785046529464,Tài liệu Thi Viên Chức Giáo Dục Quảng Ngãi,Tài liệu Thi Viên Chức Giáo Dục Quảng Ngãi,41081
110734615258316,Trung Tâm Điều Trị U - Triệt Tiêu Các Tế Bào Ung Thư Số 2,These ads ran without a disclaimer,8002
108390095364515,Phạm Văn Thanh- Đặc Trị Xương Khớp,These ads ran without a disclaimer,6408
106475068390652,Thầy Phạm Văn Thanh - Hiệu Thuốc Hoàng Liên Sơn,These ads ran without a disclaimer,5245
953482191475322,Cảnh Báo Chứng Khoán 68 - CK68,These ads ran without a disclaimer,468