Page ID,Page name,Disclaimer,Amount spent (GTQ)
167924689961661,Unidad Nacional de la Esperanza,Unidad Nacional de la Esperanza,197
187073013532,Partido VIVA,Partido Político Visión con Valores,≤100
1630952833827354,Armando Castillo,Armando  Damian Castillo Alvarado,≤100
106908785419555,Goberna Guatemala,Goberna,≤100
196258110831945,Partido Valor,Partido Valor,≤100
101405406148203,Valor Suchitepequez,Byron Estuardo Villatorio Liu,≤100
187461997935711,Unilever Careers,These ads ran without a disclaimer,≤100
454868334556847,Huawei Latinoamérica,These ads ran without a disclaimer,≤100