Page ID,Page name,Disclaimer,Amount spent (USD)
1439827996248795,Belize City Council,Belize City Council,≤100
162840403741833,Courts Belize,These ads ran without a disclaimer,≤100
68793499001,UNICEF,UNICEF with Facebook Ad Credits,≤100
150561598426238,San Pedro Town Council,San Pedro Town Council,≤100
167878593236712,UNICEF en español,UNICEF con créditos publicitarios de Facebook,≤100
124252504303223,UNICEF (FR),UNICEF avec des crédits publicitaires Facebook,≤100
200345460422728,Johnny Abraham : Conquista TU mundo,These ads ran without a disclaimer,≤100
166178460072395,اليونيسف بالعربية - UNICEF in Arabic,اليونيسف باستخدام اعتمادات الإعلان على الفيسبوك,≤100