Page ID,Page name,Disclaimer,Amount spent (USD)
147858435252169,Embajada de los Estados Unidos en El Salvador,Embajada de Estados Unidos en El Salvador,≤100
100541468870287,Alcaldía Municipal de Mejicanos,Alcaldía Municipal de Mejicanos,≤100
1935947973198237,Alcaldía El Paraíso Chalatenango,Alexi Antonio Escalante Galdamez,≤100
108213030904997,Ricardo Rivas,Ricardo Rivas,≤100
2393165234062729,Dennis Salinas,Dennis Salinas,≤100
890916994384759,Rafael Arévalo,Rafael Edgardo Arévalo González,≤100
100568368335023,Fatima Esmeralda Ascencio,Esmeralda Asencio,≤100
101090099546806,greenlybachue,These ads ran without a disclaimer,≤100
285530825204,Klitschko,These ads ran without a disclaimer,≤100