Page ID,Page name,Disclaimer,Amount spent (USD)
343780273395073,"Hon. George Mireku Duker - MP, Tarkwa-Nsuaem.","Gomashie, Wisdom",≤100
102618778592624,Come Unto Christ In West Accra,Come Unto Christ In West Accra,≤100
106709907567630,Emmanuel Armah-Kofi Buah,Emmanuel Buah,≤100
565225540184937,CGTN,These ads ran without a disclaimer,≤100
133945616646913,RioOnWatch.org,These ads ran without a disclaimer,≤100
112220134851421,Under the Sisterhood,These ads ran without a disclaimer,≤100
100311291847776,Gender-Based Violence Area of Responsibility,These ads ran without a disclaimer,≤100