Page ID,Page name,Disclaimer,Amount spent (UYU)
100492222711808,Somos Todos Uruguayos,Somos Todos Uruguayos,≤100
103988995047541,Diputada Nancy Nuñez Soler,Nancy Estela del Pilar Nuñez Soler,≤100
104722751816273,Diplomatura en Bioarquitectura,These ads ran without a disclaimer,≤100
896046427178402,O'Farrell S.R.L,These ads ran without a disclaimer,≤100
225968600759645,Andrés Lima,Ernesto Dario Castro Rodriguez,≤100
1392286137657957,Jorge Rios Designer,These ads ran without a disclaimer,≤100
1424003061235730,Asociación Autismo en Uruguay,Arlene Raquel Navarro Aguiar,≤100