Page ID,Page name,Disclaimer,Amount spent (JPY)
102468941548369,宮城県民共済,宮城県民共済,6892
1904070096535109,スマート選挙,株式会社センキョ,1132
208661552479830,日本財団,Shigeru Fujita,627
664345490331547,ビジネス＋it（Business+it）,ビジネス＋it（Business+it）,575
766675180118176,最新ビジネスイベントを配信中『ビズスタ』,ビズスタ,326
475681929154100,国連UNHCR協会,国連UNHCR協会,268
239558679475625,株式会社トマス技術研究所,Kenji Fukutomi,256
426981831471929,仙台市議会議員　田村勝,田村勝,154
136636846682019,ふるさと名品オブ・ザ・イヤー,ふるさと名品オブ・ザ・イヤー,149
579187028792625,社長と会社の手元現金を増やす仕組みづくりの専門家,社長と会社の手元現金を増やす仕組みづくりの専門家,123
492073607520322,認定特定非営利活動法人 ふくしま30年プロジェクト,NPO法人ふくしま30年プロジェクト,≤100
544702409046206,手相の見方大事典テソペディア,株式会社Qu Creation,≤100
881025135256351,Japan In-depth,Japan In-depth,≤100
676655469036670,松下政経塾,松下政経塾,≤100
100301468490510,フルーツギフト専門店「蝶結び」,These ads ran without a disclaimer,≤100
1958836327690816,明治安田生命（広告配信用）,These ads ran without a disclaimer,≤100
151214938794853,ミエセン,ジャッグジャパン株式会社,≤100
603731356470113,関西学院大学　診療所を中核とした地域医療経営人材育成プログラム,関西学院大学専門職大学院　経営戦略研究科,≤100
115247946520017,電波オークションを実現する会,Mitsumasa Kato,≤100
104533215755145,ZOE_Japan,ZOE Japan,≤100
1672330153015605,透明アクリル業者票,アドアチーブ株式会社,≤100
113422658309473,魔石騎士団 - Puzzle War,These ads ran without a disclaimer,≤100