Page ID,Page name,Disclaimer,Amount spent (USD)
944644078980153,"Securities and Exchange Commission, Ghana","Securities and Exchange Commission, Ghana",≤100
259498284391389,Sidii Abubakar Musah,Sidii Abubakar Musah,≤100
191347710997880,New Patriotic Party (NPP: Development in Freedom),New Patriotic Party (NPP: Development in Freedom),≤100
343780273395073,"Hon. George Mireku Duker - MP, Tarkwa-Nsuaem.","Gomashie, Wisdom",≤100
102179325363565,Samuel A. Jinapor,Samuel Abdulai Jinapor,≤100
132387390209896,HFM,These ads ran without a disclaimer,≤100