Page ID,Page name,Disclaimer,Amount spent (JPY)
1904070096535109,スマート選挙,株式会社センキョ,1348
208661552479830,日本財団,Shigeru Fujita,1147
112523977041775,参政党,参政党,864
124946600918797,NTTドコモ（NTT DOCOMO）,These ads ran without a disclaimer,405
475681929154100,国連UNHCR協会,国連UNHCR協会,394
543662599325014,地方移住・関係人口創出のプラットフォーム【ネイティブ. メディア】,ネイティブ株式会社,159
981456705576473,Datadog Japan,These ads ran without a disclaimer,136
239558679475625,株式会社トマス技術研究所,Kenji Fukutomi,123
103914976352692,選挙ドットコム,イチニ株式会社,105
100251962938282,スピリチュアル心理,These ads ran without a disclaimer,≤100
1397074863864450,Fair Finance Guide Japan,Fair Finance Guide Japan,≤100
151214938794853,ミエセン,ジャッグジャパン株式会社,≤100
123217824515511,牛見 航  /  山口県防府市議会議員,Wataru Ushimi,≤100
288385447888433,公益財団法人モラロジー道徳教育財団,公益財団法人モラロジー道徳教育財団,≤100
579187028792625,社長と会社の手元現金を増やす仕組みづくりの専門家,社長と会社の手元現金を増やす仕組みづくりの専門家,≤100
110011487544246,大和民族大學校,These ads ran without a disclaimer,≤100
107367904080878,VIVA-たいけん美じゅつ場-,NPO法人取手アートプロジェクトオフィス,≤100
243143172757375,情報ドットコム（K.Oshima）,大島 和彦,≤100
105190364351696,Abuild 就活,These ads ran without a disclaimer,≤100
881025135256351,Japan In-depth,Japan In-depth,≤100
259163764160829,FoE Japan,FoE Japan,≤100
115053374813920,BizFul/ビズフル - ビジネスに役立つ資料が見つかる,株式会社ビズフル,≤100
104533215755145,ZOE_Japan,ZOE Japan,≤100
1672330153015605,透明アクリル業者票,アドアチーブ株式会社,≤100
270368192998908,世田谷区議会議員  あべ力也,阿部 力也,≤100
290548741647607,Belmaias,These ads ran without a disclaimer,≤100