Page ID,Page name,Disclaimer,Amount spent (UYU)
339506493370193,Richard Sander,Richard Saul Sander Darín,488
225968600759645,Andrés Lima,Ernesto Dario Castro Rodriguez,≤100
102337244995366,Prudencia Uruguay,Santiago Raffo Arias,≤100
103988995047541,Diputada Nancy Nuñez Soler,Nancy Estela del Pilar Nuñez Soler,≤100
152914224736727,Banco Mundial,These ads ran without a disclaimer,≤100
167878593236712,UNICEF en español,These ads ran without a disclaimer,≤100
144545426101959,SantanderX,These ads ran without a disclaimer,≤100