Page ID,Page name,Disclaimer,Amount spent (USD)
401965126494988,UCLA Alan D. Leve Center for Jewish Studies,These ads ran without a disclaimer,≤100
1175630379148974,China Xinhua Sci-Tech,These ads ran without a disclaimer,≤100
324648538032886,Dzair Tube tv دزاير توب,Dzair Tube tv دزاير توب,≤100
643647332320553,Orient - أورينت,These ads ran without a disclaimer,≤100
1881504255432596,Hav Media,These ads ran without a disclaimer,≤100
104140320927199,قناة النصر TV,قناة النصر TV,≤100
108967318055585,العمالي بهجة - Lammali Behdja,العمالي بهجة - Lammali Behdja,≤100