Page ID,Page name,Disclaimer,Amount spent (NZD)
117997265415910,James McDowall MP,the Parliamentary Service on behalf of ACT New Zealand,≤100
11870725774,Greenpeace Aotearoa,Greenpeace NZ,≤100
92043134118,ACT,the Parliamentary Service on behalf of ACT New Zealand,≤100
103294052679561,Kiwis Backing Farmers,Beef + Lamb NZ,≤100
101127282332652,Mindthegap.nz,Mindthegap.nz,≤100
183355881680015,New Zealand National Party,New Zealand National Party,≤100
173912362663564,Electoral Commission NZ,Electoral Commission NZ,≤100
37547788323,UNICEF Aotearoa,UNICEF Aotearoa,≤100
165702023478421,Family First New Zealand,Family First New Zealand,≤100
106194579030381,Doctors Without Borders / Médecins Sans Frontières NZ,Doctors Without Borders / Médecins Sans Frontières NZ,≤100
1846207688941551,Ministry for the Environment,Ministry for the Environment,≤100
110909661534199,The Common Room NZ,The Common Room NZ,≤100
376006035816016,Storyworth,These ads ran without a disclaimer,≤100
175954932952,WWF New Zealand,WWF New Zealand,≤100
19648092895,Tearfund New Zealand,Tearfund New Zealand,≤100
114569918196150,Barbie's Bill,Pead,≤100
101828332517373,National Zakat Foundation New Zealand,National Zakat Foundation New Zealand,≤100
92043134118,ACT,ACT,≤100
110910531830985,David MacLeod for New Plymouth,"David MacLeod, National Party Candidate for the New Plymouth Electorate",≤100
39020697087,Auckland Property Investors' Association,These ads ran without a disclaimer,≤100
105534772373969,NZ News Essentials,NZ News Essentials,≤100
196967540964595,Mindful Money,Mindful Money,≤100
185590638873,NZHL Home Loans / Insurance,NZHL Home Loans / Insurance,≤100
213708008642996,Pink Shirt Day Aotearoa,Mental Health Foundation of New Zealand,≤100
74410368422,Mental Health Foundation of New Zealand,Mental Health Foundation,≤100
134871109877812,Save the Children New Zealand,Save the Children New Zealand,≤100
111699101849124,Ōu Huatau Hauora | Your Views On Health,Ministry of Health,≤100
305655596286980,Paul Goldsmith,NZ Parliamentary Service on behalf of Paul Goldsmith MP,≤100
10779081371,Green Party of Aotearoa New Zealand,The NZ Parliamentary Service on behalf of the Green Party,≤100
104174354363267,Christopher Luxon,New Zealand National Party,≤100
109439615316279,Just Say No,Just Say No,≤100
112793716847509,Environmental Law Initiative,Environmental Law Initiative,≤100
1281262645251755,Hobson's Pledge,Hobson's Pledge,≤100
206932501046,Habitat for Humanity New Zealand,Habitat for Humanity New Zealand,≤100
105681068874945,Ag Matters,New Zealand Agricultural Greenhouse Gas Research Centre,≤100
1609645495950424,James Shaw,The NZ Parliamentary Service on behalf of the Green Party,≤100
2664407520240811,VUW International Socialists,ISO Te Whanganui-a-Tara branch,≤100
623609397660759,Ngatoki O Ngapuhi,These ads ran without a disclaimer,≤100
1820592608152727,Tim van de Molen MP,Parliamentary Service on behalf of Tim van de Molen - MP for Waikato,≤100
105962449139113,ChatBox,These ads ran without a disclaimer,≤100
100352389404011,The Godly Marriage,These ads ran without a disclaimer,≤100
102251318064432,Organon,These ads ran without a disclaimer,≤100