Page ID,Page name,Disclaimer,Amount spent (USD)
129803967052432,Consejo Nacional Electoral del Ecuador,Consejo Nacional Electoral del Ecuador,539
100848672800182,Consulta Ciudadana Ec,Consulta Ciudadana Ec,≤100
2099717270260794,Jorge Montero R,Jorge Montero R,≤100
101953791456280,Mario Mancino,Mario Mancino,≤100
714555068883909,Edwin Patricio Lima Celi,Katia Beatriz Lima Paladines,≤100
550365461794655,Juan Carlos Torres,Juan Carlos Torres Diaz,≤100
117606353405265,Jorge Reyes J.,Ramón Ricardo Reyes Cordova,≤100
363247223714714,Ministerio Inclusión Económica Social Ecuador,MINISTERIO DE INCLUSION ECONOMICA Y SOCIAL,≤100
410911402402157,Movimiento APLA,Esteban Jose Vivar Espinosa,≤100
107617145409118,Pablo Quiñonez Riofrío,Pablo Anibal  Quiñonez Riofrio,≤100
103103905525783,Paul Ortega,Paul Ortega,≤100
114164328214990,Carlos Aguilar,Carlos Alberto Aguilar Peñaloza,≤100
108657847619569,Goberna Ecuador,Goberna Ecuador,≤100
140019043330175,Oscar Ayerve,Oscar Rene Ayerve Rosas,≤100
714677181953662,Cristian Zamora - Concejal de Cuenca,Cristian Zamora,≤100
105575258210401,Nicole Bonifaz Candidata al CPCCS 2023,Nicole Bonifaz,≤100
1574664112833285,Correístas,Ecuador Informado,≤100
103449972417961,Yeleny Coello Orozco,Yeleny Coello,≤100
2221570604786246,Primicias,Primicias,≤100
105539772365757,Mentordemy,Mentordemy,≤100
107415572111243,Nixon Granda,These ads ran without a disclaimer,≤100
101056676141616,Asesoría Política - Goberna Ecuador,Goberna Ecuador S.A.S,≤100
323061501783622,Concejala Analía Ledesma García,Analía Ledesma García,≤100
189474325001666,Estefany Chica,Estefany Chica,≤100
104983249076001,Elmer Gallardo,Elmer Ubaldo Gallardo Asanza,≤100
195488207272178,Ciudadanía y Desarrollo,Ciudadanía y Desarrollo,≤100
101844371776009,Voto Informado Ecuador,Ciudadanía y Desarrollo,≤100
102868228794800,Melina Villacrés,Melina Villacres,≤100
2174951136066727,Amigos De John Vinueza,John Henry Vinueza Salinas,≤100
108814468659804,Kurt Serrano,Kurt Serrano,≤100
215067441969546,La Ultima Noticia de Naranjito,LA ULTIMA NOTICIA,≤100
2000274223590054,Galo Zambrano Alcalde,Galo Silvano Zambrano Acosta,≤100
788384531282129,Rossana Cevallos,Jessica Veronica Bravo Bravo,≤100
102823644882450,Pedro Pablo Moran 2023,Pedro Pablo Moran Marchan,≤100
491483914537134,Guillermo Serrano,Christhiam Joe Ontaneda Rios,≤100
495225060514172,Degso,Gabriela Veronica Chango Hermoza,≤100
965218816913719,Producciones Román,Manuel Alejandro Roman Loor,≤100
171870950030850,Teodoro Gallegos Salem,Benigno Teodoro Gallegos Salem,≤100
105575258210401,Nicole Bonifaz Candidata al CPCCS 2023,These ads ran without a disclaimer,≤100
205802423292412,Manuel Caizabanda Jerez,Manuel Caizabanda Jerez,≤100
579966648781917,María José Carrión,Maria Jose Carrion Cevallos,≤100
104163552345011,Rocío Ávila Cox,Francisco Lecaro Robles,≤100
106293975463462,Mayra Alava,Lourdes Alava,≤100
779788855474670,Ambato Noticias,AMBATO LIBERTAD,≤100
132586338976088,Betty Jerez,grupotecnovatel,≤100
106524642069871,Jaime Juela,Guayas Avanza,≤100
111839081501660,Peter Ortega,Peter Ortega,≤100
1122125837943832,Lenin Aguilar,Lenin Fabian Aguilar Aguirre,≤100
576293326050856,Daniel Villavicencio - Concejal de Paute,Carlos Daniel Villavicencio Pesantez,≤100
107285866588682,Roberta Zambrano Ortíz,Roberta Zambrano Ortíz,≤100
103312708542356,Bella Fiallos- Bienes raíces  Asesoría,Bella America Fiallos Castillo,≤100
223539761524901,Cesar Troya Mayorga,Cesar Troya Mayorga,≤100
237501700522397,Daniela Asan Torres,Andrea Cevallos,≤100
100773761298526,Dra. Johanna Espinoza A.,These ads ran without a disclaimer,≤100
105219802326054,Marcela Paredes,Marcela Paredes,≤100
111903834869341,Sandra Moreno,Pedro Moreno Castro,≤100
129933377054758,Achpe - Asociación Nacional de Clínicas y Hospitales Privados del Ecuador,"Asociación Nacional de Clínicas y Hospitales Privados del Ecuador, ACHPE",≤100
616405925438411,GAD Municipal de El Empalme,Javier Guato Macias,≤100
430342697166077,Abraham Freire Paz,Yerimar Moya Tenelema,≤100
1049889138552094,Ing. Sandra Nogales Véliz,Sandra Nogales Véliz,≤100
103981152451101,Shirley Ceballos,Shirley Ceballos,≤100
102544102568829,Antonio Zavala,Alejandro  Antonio Zavala Murillo,≤100
106360285419022,Jimmy Valverde Peláez,Jimmy Cristhian Valverde Peláez,≤100
104051801973062,Mateo Flores,Mateo Sebastian Flores Calderon,≤100
107662830709681,Santiago Campoverde,Herman Santiago Campoverde Laiza,≤100
107851317679437,Panas de Marcelo Suárez y Gustavo Baroja,Elisa Marlene Guallasamin Niarata,≤100
111943841337327,"Antonio ""Toño"" Jara",Marco Antonio Jara Bad,≤100
589408861751444,UNEP International Environmental Technology Centre,These ads ran without a disclaimer,≤100
253259028164598,Magali Quezada,César Augusto Peralta Zhucozhañay,≤100
711425465620039,Antonio Espinoza Infante,These ads ran without a disclaimer,≤100
631308090300301,Observatorio Legislativo Ecuador,Ciudadanía y Desarrollo,≤100
103248702631987,Eduardito EC,These ads ran without a disclaimer,≤100
576881912409334,Marco Troya - Oficial,Marco Troya,≤100
102471594933086,"Edgar Quezada ""El Asambleista Del Pueblo""",Edgar Patricio Quezada Patiño,≤100
103226722624173,Marco Cabrera Ochoa Alcalde  NABON,Marco Cabrera,≤100
108538841996792,Félix Javier Manjarrés,Félix Javier Manjarrés Arias,≤100
1428310440732616,Sebastián Cevallos,Rodrigo Sebastian Cevallos Vivar,≤100
106386888743470,Ordinarilyla.com,These ads ran without a disclaimer,≤100
332450723475325,Banco Internacional Ecuador,These ads ran without a disclaimer,≤100
483449898450575,Alfonso Montalvan Cerezo Oficial,Oscar Stalin Briones Mora,≤100
336960923666379,Alcaldía De Milagro,Joss Melissa Vera Miranda,≤100
1595856434078075,Pamela Aguirre,Pame Aguirre,≤100
311351563056444,CÂSCARA,These ads ran without a disclaimer,≤100
1323888624375344,Cecilia Román,Cecilia Román,≤100
106351384513465,Luis Morales Solís,These ads ran without a disclaimer,≤100
113203854909890,Fuerza Mejiense Alóag,Fuerza Mejiense Alóag,≤100
363247223714714,Ministerio Inclusión Económica Social Ecuador,These ads ran without a disclaimer,≤100
2300113683603018,Omar Alvarez,Jessica Yadira Guiracocha Heredia,≤100
110548067875740,José Sánchez,José Sánchez Reyes,≤100
1863718303895756,Study First Group,These ads ran without a disclaimer,≤100
999188666785524,阿里巴巴集團,These ads ran without a disclaimer,≤100