Page ID,Page name,Disclaimer,Amount spent (CRC)
117702158266385,Antonio Álvarez Desanti,Antonio Alvarez Desanti,1184
643513979193133,Unidos por Beatriz,Neuma,782
1540070352761579,Leslye Bojorges,Leslye Ruben Bojorges Leon,592
116150003163125,Fundación Pollitos de Hierro - Ayuda a niños con cáncer - Costa Rica,Fundación Pollitos de Hierro,495
102084562479533,Digital506,Digital506,160
106468811119965,Republicans Abroad Costa Rica,David Ortiz,≤100
265843867173714,La Revista,La Revista,≤100
105223385595171,Alice Gomes,These ads ran without a disclaimer,≤100
103332995742824,Familia MÁS digital,These ads ran without a disclaimer,≤100
202225953152762,Yomeanimo,These ads ran without a disclaimer,≤100