Page ID,Page name,Disclaimer,Amount spent (PEN)
108914741596097,Reynaldo Hilbck SI Cumple,Reynaldo Hilbck,5857
1689717484436468,Canal Piura,Piura Informado,5044
756922834393995,Reynaldo Hilbck - Unidad Regional,Reynaldo Hilbck,3521
101665683225827,José Luna Gálvez - Pepe Luna,Laidy Diana Peceros Espinoza,884
100535786188317,Piura lo dejo a tu criterio,Lucho Neyra del Reloj,881
776498802704340,Piura Denuncia,Piura Informado,876
475157512880993,Lucho Neyra León - Gobernador Regional,Jose Miguel Lopez Leon,231
475157512880993,Lucho Neyra León - Gobernador Regional,Lucy Cristina Riojas Rivera,198
102009868271044,Noticias Piura,Jackson Zegarra,162
348918008452785,Piura Data - Estudios de mercado,Maria Fernanda Checa Seminario,≤100
119723768043679,Grupo Verona,Giovanni Domenico Verona Baluarte,≤100
101555396562359,Voto Informado,Voto Informado,≤100
495706950531442,Pepe Feria,Maria Marleny Elias Amaya,≤100
111470355596678,ONPE Oficina Nacional de Procesos Electorales - Perú,Oficina Nacional de Procesos Electorales,≤100
1234116153313066,Quiero Mi Piura Segura,Hi Politic,≤100
109186465355018,Las Lilas - Perú,Las Lilas,≤100
264223880347121,Lampadia Oficial,LAMPADIA,≤100
109019574560600,Aula Gaceta,Joel V. Supo Baldo,≤100
1489389251302922,Percy Fiestas Aquino,Becquer Martin Jara Cordova,≤100
282902148539107,Roberth Sánchez Córdova,Anita Olenka Sanchez Chuquihuanga,≤100
406770429830140,Anibal Zapata,Jose Anibal Zapata Pacherre,≤100
100283442359203,Fernando Arce Alvarado - Parlamentario Andino,Gustavo Gongora Rodriguez,≤100
142062936237878,Goberna,Goberna,≤100
104982448888713,Ing. Angler Pazo Jacinto - Consejero Regional/Sechura,Angler Pazo Jacinto,≤100
161024241267665,Julio César Silva Meneses - Abogado,Julio César Silva Meneses,≤100
729149373915986,Rextie,Rextie,≤100
105566838477273,Leonor Carolina Romero - Abogada,Julio César Silva Meneses,≤100
287389705061665,Nut. Roy Miranda,Oscar Roy Miranda,≤100
687691121319854,Ernesto Álvarez Miranda,Ernesto Julio Alvarez Miranda,≤100
100514466193488,Eduardo Salhuana,Jamill Marzuka Cortez,≤100
104381882429050,Cumbre de Gobernadores e Intendentes de Latinoamérica,Shocking Wave Productions,≤100
1805183599788143,Silvia Monteza,Héctor Melgar Sandoval,≤100
455802295156178,Nuestramerica TV,Crhistian Jorge Peralta Ramírez,≤100
534284396949027,Ilich López,Renzo Jireh Casas Torres,≤100
1897126257190528,Instituto Latinoamericano de Capacitaciones Jurídicas-ILCJ,ILCJ,≤100
113162141028968,Integridad,Integridad por el Peru,≤100
102098544497318,Alfredo Perez,Alfredo Perez,≤100
699489483476556,Darwin Espinoza Vargas,Jhaec Darwin Espinoza Vargas,≤100
106395164602216,Juan Burgos,Luis Alberto Chavarry Gutierrez,≤100
1275465342519887,Servicios Educativos El Agustino,SERVICIOS EDUCATIVOS EL AGUSTINO,≤100
235391323233632,PNUD Perú,Megumi Nagayoshi Sakuda,≤100
370900893358837,Luis Landauro,Luis Alberto Nicolas Landauro Ramirez,≤100
107886892080038,Los jóvenes con Roger Guevara,Enzo Waldir Llanos Palacios,≤100
112894738199084,Comisión de Transportes y Comunicaciones / Período 2022-2023,Luis Alberto Bravo Orosco,≤100
102700072470995,Sinapzis,Sinapzis,≤100
106746035551083,Yoni Mamani,Yoni Mamani Quispe,≤100
501011359923743,IDL-Instituto de Defensa Legal,Jose Del Carmen Rojas Chuya,≤100
184737444996542,Virú S.A.,These ads ran without a disclaimer,≤100
316564475960113,Estudio Jurídico Tarazona & Asociados,Diego Alberto Isla Yengle,≤100
1435752576703876,Súmate a Fernando Zumarán,Carlos E Quepuy Quispe,≤100
1133038383505312,Roger a la región,Marco Enyelver Asencio Camizán,≤100
196140697656186,Len Corell,Ricardo Felix Coral,≤100
115806960260634,Juan Carlos Mori,Franco Javier Rios Flores,≤100
751269661657206,Bayer Crop Science México,These ads ran without a disclaimer,≤100
111656531549095,Gilia Gutiérrez Ayala,Alan Phaolo Loayza Calderón,≤100
314343331981142,Mundo Sano,These ads ran without a disclaimer,≤100
414139832118173,Ciro Castillo - Callao,Yo apoyo a MAS CALLAO,≤100
1650216218535063,Oceana Perú,Oceana Perú,≤100
103571168624124,evasybrujaspodcast,These ads ran without a disclaimer,≤100
100613652687537,Peruanos de Centro,Chani Mejia,≤100