Page ID,Page name,Disclaimer,Amount spent (PYG)
242259253120490,Igualdad de Genero SÍ,Igualdad de Genero SÍ,17438
140457539356382,Gabinete Social Presidencia de la República del Paraguay,Gabinete Social Presidencia de la República del Paraguay,8746
278226125974096,El Paraguayo Independiente,Paraguayo Independiente,1119
101209788723937,Dr. Omar Gonzalez,Dr. Omar Gonzalez,998
1733149113467717,Basic In,These ads ran without a disclaimer,276
111914656998808,Dr. Dionisio Ortega,Dr. Dionisio Ortega,≤100
100570355996366,raquelcalue,These ads ran without a disclaimer,≤100
100157179072061,Financiera ueno SAECA,These ads ran without a disclaimer,≤100