Page ID,Page name,Disclaimer,Amount spent (VND)
111649914996393,Viên đại tràng Nhất Nhất,These ads ran without a disclaimer,5014
106128284947266,Lương Y Phạm Văn Thanh Xương Khớp - Việc Tử Tế VTV1,These ads ran without a disclaimer,3434
114075063569561,Lương Y Phạm Văn Thanh - Việc Tử Tế VTV1,These ads ran without a disclaimer,1639
105845511087981,TRUYỀN HÌNH AN VIÊN,TRUYỀN HÌNH AN VIÊN,638
919479674872321,Báo Nghệ An,Báo Nghệ An,159
155460521146066,RFI Tiếng Việt,These ads ran without a disclaimer,≤100