Page ID,Page name,Disclaimer,Amount spent (USD)
179167545479394,Салідарнасць,Онлайн-медиа «Салiдарнасць»,≤100
105497721784216,Филин. Оперативная аналитика и публицистика,Филин. Оперативная аналитика и публицистика,≤100
144776752025,Голос Америки,These ads ran without a disclaimer,≤100
136772206333551,Amnesty International Eastern Europe & Central Asia,These ads ran without a disclaimer,≤100
267353906619818,Mr. Gugu & Miss Go,These ads ran without a disclaimer,≤100
102340108960419,Heat Transfers Company,These ads ran without a disclaimer,≤100