Page ID,Page name,Disclaimer,Amount spent (COP)
191210184867688,Julián Serna Concejal,Julian Andres Serna Ruíz,22872
787232315012598,Cristian Barragán Correcha - Tol,Cristhian Andres Barragán Correcha,14195
101071764864119,Dulce Veneno,Dulce Veneno,7057
130834367164,Red PaPaz,Red PaPaz,4325
108158921672438,Llener Borja,Alvaro Jose Gomez Ramirez,3454
969143216462972,Felipe Cañizalez,Andreina Quintero Correa,2055
108946084100541,Alcaldía Cartagena Del Chairá,Tuto Gonzalez,1567
101769386141297,Congreso Nacional de Actualización Tributaria y Laboral,Julian Chuchoque,1480
1823807254333065,Soy Más País,Soy Mas Pais,831
108875804858437,Antimilitantes,Antimilitantes,619
131161704260384,Carlos Ardila,Hugo Andrés Galindo Palacio,550
103833791361048,El Legado de Álvaro Uribe Vélez,Centro Democrático - Comunidad Oficial,526
267198759973201,Bairon Enrique Muñoz Lizarazo,Bairon Enrique Muñoz Lizarazo,446
104670935764697,Jaime Alarcon Muriel,These ads ran without a disclaimer,444
765302097170348,Línea Cero,Linea Cero,406
1519006894853848,El Quindiano,EL QUINDIANO SAS,397
311351563056444,CÂSCARA,These ads ran without a disclaimer,324
140451182823675,Edwin Palma Egea,Edwin Palma Egea,317
53177129367,Dilian Francisca Toro Torres,Dilian Francisca Toro,286
1622001728047397,Harman Alcalde,Harman Alcalde,283
1242864402475742,BC Noticias,Oscar Javiar Bayona Villada,267
350160788433059,Proclama Cauca y Valle,Proclama Cauca y Valle,266
237316706446146,Alianza Francesa de Pereira,Alianza Francesa de Pereira,264
381464961911270,Cruz Roja Antioquia,Cruz Roja Colombiana Seccional Antioquia,159
109810958651903,Daniel Duarte Pabón candidato a Representante de los Egresados UIS 2023,Daniel F Duarte Pabón,152
179003239458192,Jorge Humberto Rangel,Jorge Rangel,138
1529335724037224,Aeropuerto del Café,INTUAL,137
108459260282,Universidad La Gran Colombia,Universidad La Gran Colombia,130
103517519256177,Joe Plata,These ads ran without a disclaimer,122
588841011459819,Abg. César Rodríguez,Cesar Hernando  Rodriguez Ramos,≤100
835710939898329,Paulina Aguinaga,Paulina Aguinaga,≤100
122989028111811,Alexander Ruiz,Edgar Alexander Ruiz Garcia,≤100
204435366254477,IETA - Instituto de Estudios Técnicos Aeronáuticos,William Guillermo Delgado Lopez,≤100
100304338642614,Toro Digital 1972,Joseph Ferney Galvis Gonzalez,≤100
999188666785524,阿里巴巴集團,These ads ran without a disclaimer,≤100
1666714230240447,Por el Derecho a Morir con Dignidad A.C.,These ads ran without a disclaimer,≤100
118606061493541,World Innovation Summit for Education - WISE,These ads ran without a disclaimer,≤100
1863718303895756,Study First Group,These ads ran without a disclaimer,≤100
178194518893277,اقرأ لي,These ads ran without a disclaimer,≤100
85147586731,Julio César Triana,Julio César Triana,≤100
102943332181244,InmigrarBien,These ads ran without a disclaimer,≤100
1407316266166963,Jetcraft,These ads ran without a disclaimer,≤100