Page ID,Page name,Disclaimer,Amount spent (USD)
109854728594212,برنامج تحديث القطاع العام,برنامج تحديث القطاع العام,≤100
103323581486845,النائب سليمان موسى ابو يحيى,Sleman Abuyahia,≤100
664477853670759,المكتب الاعلامي للنائب معتز ابورمان,Moutaz Abu Rumman,≤100
102931605845722,تيار وطني يهدف لتأسيس حزب باسم العمل,حزب العمل,≤100
111934298458280,مجموعة القبة الإعلامية,مجموعة القبة الإعلامية,≤100
107141858896307,Rewell Society,Rewell Society,≤100
112416568138364,Al Mashhad المشهد,These ads ran without a disclaimer,≤100
108271242164727,مجلة المجتمع,These ads ran without a disclaimer,≤100