Page ID,Page name,Disclaimer,Amount spent (THB)
177948972256358,เอกนัฏ พร้อมพันธุ์ (ขิง),เอกนัฏ พร้อมพันธุ์ (ขิง),104
157659344260788,จุรินทร์ ลักษณวิศิษฏ์ Aoodda,Ruthaikan Tanomkerd,≤100
102807719039442,พรรครวมไทยสร้างชาติ United Thai Nation Party,พรรครวมไทยสร้างชาติ United Thai Nation Party,≤100
257083724467673,ยุทธพล  อังกินันทน์,ยุทธพล อังกินันทน์,≤100
345127652279503,มูลนิธิสากลเพื่อคนพิการ,มูลนิธิสากลเพื่อคนพิการ,≤100
104427797605274,ดร.เฉลิมชัย ศรีอ่อน รัฐมนตรีว่าการกระทรวงเกษตรและสหกรณ์,ดร.เฉลิมชัย ศรีอ่อน รัฐมนตรีว่าการกระทรวงเกษตรและสหกรณ์,≤100
296508406790,"Democrat Party, Thailand พรรคประชาธิปัตย์","Democrat Party, Thailand พรรคประชาธิปัตย์",≤100
103986582301984,เนื้อ นา บุญ,Phrathanakrit Upachai,≤100
101274425792459,กิตติพงศ์ รวยฟูพันธ์ - ส.ก.ไอซ์ เขตทุ่งครุ,These ads ran without a disclaimer,≤100
111341764925564,สำนักสนับสนุนการพัฒนาระบบสุขภาพ - สำนัก 7 สสส.,สำนักสนับสนุนการพัฒนาระบบสุขภาพ - สำนัก 7 สสส.,≤100
622674297897819,Screenshirt2020,Screenshirt2020,≤100
115922723434700,ครูเจพีสรุปย่อ for Teacher,ครูเจพีสรุปย่อ for Teacher,≤100
161651553861945,Amnesty International Thailand,Amnesty International Thailand,≤100
107612328588715,The Voters,สันติสุข กาญจนประกร,≤100
567743816917663,The Article,The Article,≤100
1105604039583762,Line One สว.นท. ขอเชิญส่งประวัติ ส่วนตัว องค์กร เพื่อเข้ารับรางวัลประจำปี,Suksan Booran,≤100
100240152175449,ป้าโส FC by Tacina,Dunyawat  Bamrungchan,≤100
103668907891539,การเมือง Kanmuang,การเมือง Kanmuang,≤100
100624122148338,โรงพยาบาลรวมใจรักษ์ สุขุมวิท 62 Ruamjairak Hospital Sukhumvit 62,โรงพยาบาลรวมใจรักษ์ สุขุมวิท 62 Ruamjairak Hospital Sukhumvit 62,≤100
177948972256358,เอกนัฏ พร้อมพันธุ์ (ขิง),Chonticha Mahachai,≤100
985820164804495,ธนาคารพัฒนาวิสาหกิจขนาดกลางและขนาดย่อมแห่งประเทศไทย,ธนาคารพัฒนาวิสาหกิจขนาดกลางและขนาดย่อมแห่งประเทศไทย,≤100
190923294988741,สอบครูผู้ช่วยนะ,สอบครูผู้ช่วยนะ,≤100
108508377637861,มุ้งจีบพระราม2 โรงงานผลิตมุ้งจีบ มุ้งลวด เหล็ดดัดทุกชนิด,กุหลาบ บัวสด,≤100
112394371483043,เครื่องมือไฟฟ้า และเครื่องมือช่าง ราคาถูก by HomeLink V.1,Surin Phothiphoksampan,≤100
959106827437030,TAT Review Magazine,These ads ran without a disclaimer,≤100
2091153520919518,อนุทิน ชาญวีรกูล,อนุทิน ชาญวีรกูล,≤100
601953326929372,ธัญวัจน์ กมลวงศ์วัฒน์ - Tunyawaj Kamolwongwat,Tunyawaj Kamolwongwat,≤100
872702859784466,KoThar Gyi Helping Hand General Services,These ads ran without a disclaimer,≤100
105289357813967,ปุณณ์สิริ บุณยเกียรติ - บีท - Punsiri Boonyakiat,ปุณณ์สิริ บุณยเกียรติ - บีท - Punsiri Boonyakiat,≤100
277320192288594,โอม จิรชาติ,โอม จิรชาติ,≤100
112969264517494,เพ็ญพิสุทธิ์ จินตโสภณ - Penpisut Jintasophon,Vatcharapong Wongkom,≤100
102402517857423,Lady2_Shop,These ads ran without a disclaimer,≤100
103465462538992,ภูมิใจไทย ภูเก็ต,These ads ran without a disclaimer,≤100
207416296817756,พรรคก้าวไกลราชบุรี - Move Forward Party,Unnop Sricharoenchai,≤100
110144991464196,กรอบลอยไวนิล แคนวาส บอร์ดไดคัท 99 บาท มีเก็บปลายทาง,Sakawtip Utha,≤100
113780154676973,เครื่องมือช่างไฟฟ้า เครื่องมือช่างไม้ เครื่องมือช่างยนต์ by Pro tool,Surin Phothiphoksampan,≤100
613689015307999,ส.ส.แมน ฉัตรพันธ์ เดชกิจสุนทร,ส.ส.แมน ฉัตรพันธ์ เดชกิจสุนทร,≤100
106561034744198,ลอรี่ - พงศ์พล ยอดเมืองเจริญ,ลอรี่ - พงศ์พล ยอดเมืองเจริญ,≤100
102300185055217,ภควัทคีตา-Bhagavad Gita,These ads ran without a disclaimer,≤100
102422172552813,မဲ့ဆောက်လင်း VCD -အေးချမ်းမြတ်ဘုန်း စာပေ,These ads ran without a disclaimer,≤100