Page ID,Page name,Disclaimer,Amount spent (USD)
362475287903040,Սերժ Սարգսյանի աջակիցներ / Serzh Sargsyan's supporters,Միքայել Գրիգորյան,≤100
117883984992205,ՀՀ արդարադատության նախարարություն/Ministry of Justice of Armenia,ՀՀ արդարադատության նախարարություն/Ministry of Justice of Armenia,≤100
386469311494240,Իրազեկ քաղաքացիների միավորում - Union of Informed Citizens,Union of Informed Citizens NGO,≤100
179916515749362,FIP - Փաստերի ստուգման հարթակ,Union of Informed Citizens NGO,≤100
108837171601077,Վալոդյա Գրիգորյան/Valodya Grigoryan,Country to live party,≤100
195018463901371,CivilNet,CivilNet,≤100
330537565808,Tert.am,Tert.am LLC,≤100
112757083778788,"Economic Daily, China",These ads ran without a disclaimer,≤100