Page ID,Page name,Disclaimer,Amount spent (USD)
130555146995650,الخليل النحوي,الخليل النحوي,≤100
108292708888062,محمد غالي ولد اشريف أحمد,Ahmed Med Cheikh,≤100
110469572033318,نائب الجماهير محمد الكبير ولد السيد,سيدي محمد مختار,≤100
106758591720574,النائب سيد محمد ولد السيدي,اطول عمر المصطف,≤100
113988695291857,وكالة الأخبار المستقلة,أحمدو محمد المصطفى,≤100
158183830897328,Bellewarmedia - بلوار ميديا,Bellewarmedia - بلوار ميديا,≤100
330841846933183,حزب التجمع الوطني للإصلاح والتنمية - تواصل,Mohamed Soueidi,≤100
110631788681313,تواصل/ الحملة الإنتخابية 2023 - معا نصنع التغيير,Abdallahi Saleck Mohamed Alem,≤100
271202350087390,النائب البرلماني : محمد بوي ولد الشيخ محمد فاضل - خيار الحق,النائب البرلماني : محمد بوي ولد الشيخ محمد فاضل - خيار الحق,≤100
116420348100139,السعد ولد أفلواط,NEJAHPROJECT,≤100
114012888341133,"حملة اللائحة الوطنية المختلطة ل""تواصل""",Abdallahi Saleck Mohamed Alem,≤100
117197243016905,منصة الحوض الشرقي,Ribat,≤100
110597938686582,النائب أحمدو بمب ولد أحمد المختار,محمد الأمين محمد,≤100
220889658511608,FRUD,FRUD,≤100
104963455926864,حملة النائب منى منت الدي-اللائحة الوطنية للنساء,Abdallahi Saleck Mohamed Alem,≤100
104201725324650,أنصار معالي الوزير الداه ولد سيد أعمر طالب,أنصار معالي الوزير الداه ولد سيد أعمر طالب,≤100
100293659725893,مرشح الشباب د. محمد عبد الجليل الشيخ القاضي,Mohamed Ouwah Edje,≤100
110936568656840,صفحة المرشح للنيابيات عن مقاطعة كيفه محمد محمود الغوث,أحمد موسى,≤100
106800479077565,تيار مرابطون,Cheikh Ahmed Elemine,≤100
535476523324373,منصة أغشوركيت الإخبارية,Ribat,≤100
102041322886335,مولاي أشرف حمود الشيخ Moulaye Achraf Hamoud Cheikh,Bah Abdellahi,≤100
101523669605768,Sid’Ahmed Bolle Cheibany - سيد أحمد بلّه الشيباني,Abdellahi Ahmed El Mostapha,≤100
104549069276016,الشـعب - El Chaab,محمد المرتضى,≤100
105866755831930,محمد أحمدو سالم,These ads ran without a disclaimer,≤100
110016112069980,حملة النائب إسلكو ولد ابهاه,Isselkou,≤100
1675355429443379,أنصار اعل الشيخ ولد الحضرامي ولد أمم,محمد الأمين محمد,≤100
112996045035943,حملة مرشح الشباب: محمد ولد يحيى,اطول عمر المصطف,≤100