Page ID,Page name,Disclaimer,Amount spent (EUR)
1407065656179729,Minister Dangui Oduber,DanguiOduber.com,≤100
349384125155892,MEP,Movimiento Electoral di Pueblo,≤100
103220632108447,Minister Geoffrey Wever,Geoffrey Wever,≤100
1630892023894778,FCVR Fundacion Contra Violencia Relacional,Fundacion Contra Violencia Relacional,≤100
108625789179165,Soi Dog Foundation,These ads ran without a disclaimer,≤100
101082842736363,The world of reader,These ads ran without a disclaimer,≤100
104843862135388,Kef Reading,These ads ran without a disclaimer,≤100