Page ID,Page name,Disclaimer,Amount spent (VND)
108390095364515,Phạm Văn Thanh- Đặc Trị Xương Khớp,These ads ran without a disclaimer,1114
100354958698407,Vui App - Chi lương Linh hoạt,These ads ran without a disclaimer,952
109079315342282,Phong Thủy Thiên Phúc,These ads ran without a disclaimer,709
919479674872321,Báo Nghệ An,Báo Nghệ An,431
103825932381345,Tự xét nghiệm HIV tại nhà - Trung tâm Kiểm soát bệnh tật tỉnh An Giang,Tự xét nghiệm HIV tại nhà - Trung tâm Kiểm soát bệnh tật tỉnh An Giang,104
105355282148912,Phạm Văn Thanh - Lương Y Vùng Cao,These ads ran without a disclaimer,≤100
102833359215349,Chủ.Tịch Vũ Nga,These ads ran without a disclaimer,≤100