Page ID,Page name,Disclaimer,Amount spent (UYU)
225968600759645,Andrés Lima,Ernesto Dario Castro Rodriguez,≤100
339506493370193,Richard Sander,Richard Saul Sander Darín,≤100
103988995047541,Diputada Nancy Nuñez Soler,Nancy Estela del Pilar Nuñez Soler,≤100
1424003061235730,Asociación Autismo en Uruguay,Arlene Raquel Navarro Aguiar,≤100
316246769083069,Corruptos Radio,Juan Andrés Gómez Robaina,≤100
299227550122220,Radio Cina Internazionale,These ads ran without a disclaimer,≤100
101958599473285,Or HaOlam - אור העולם - Luz del Mundo,These ads ran without a disclaimer,≤100