Page ID,Page name,Disclaimer,Amount spent (CRC)
102084562479533,Digital506,Digital506,894
399929296730642,Consejo Nacional de Cooperativas,Jonathan Ureña Vargas,542
116522821359620,Turismo por Costa Rica,Turismo Por Costa Rica,411
1540070352761579,Leslye Bojorges,Leslye Ruben Bojorges Leon,368
265843867173714,La Revista,La Revista,216
494354027360929,Dirección de Educación Continua Pontificia Universidad Javeriana Bogotá,These ads ran without a disclaimer,≤100
117531371235659,Inspirinia Ok,These ads ran without a disclaimer,≤100
82928774489,Panda Security,These ads ran without a disclaimer,≤100