Page ID,Page name,Disclaimer,Amount spent (USD)
1584183878552505,Institute for Strategy and Policy- Myanmar,an advertiser in Myanmar,≤100
102979191111423,Toe Toe Phaw,an advertiser in Myanmar,≤100
111789443531410,Wai Yan Aung,These ads ran without a disclaimer,≤100
2074476209434546,Happy Healthy Myanmar  ပျော်ရွှင်ကျန်းမာ တို့မြန်မာ,an advertiser in Myanmar,≤100
395933837270620,Tet Luu Kyaw - တက်လူကျော် စာပေ,an advertiser in Myanmar,≤100
457986557673503,Heaven Melody - Art & Music,These ads ran without a disclaimer,≤100