Page ID,Page name,Disclaimer,Amount spent (USD)
1557231747832291,afikra,These ads ran without a disclaimer,≤100
578201022242371,MJCC وزارة الشباب والثقافة والتواصل,"Ministère de la Jeunesse, de la Culture et de la Communication",≤100
147084112022235,La Nouvelle Tribune,La Nouvelle Tribune,≤100
272535046654,HESPRESS,HESPRESS,≤100
328835903834763,اشرف مسياح Achraf Msiah,Achraf Mohamed Msiah,≤100
127757937250301,German Information Centre Arab World - المركز الألماني للإعلام,These ads ran without a disclaimer,≤100