Page ID,Page name,Disclaimer,Amount spent (USD)
110631788681313,تواصل/ الحملة الإنتخابية 2023 - معا نصنع التغيير,Abdallahi Saleck Mohamed Alem,≤100
100293659725893,مرشح الشباب د. محمد عبد الجليل الشيخ القاضي,Mohamed Ouwah Edje,≤100
102041322886335,مولاي أشرف حمود الشيخ Moulaye Achraf Hamoud Cheikh,Bah Abdellahi,≤100
117197243016905,منصة الحوض الشرقي,Ribat,≤100
112113145095343,حملة مرشح الوفاء النائب يعقوب ولد البنية,أحمد موسى,≤100
271202350087390,النائب البرلماني : محمد بوي ولد الشيخ محمد فاضل - خيار الحق,النائب البرلماني : محمد بوي ولد الشيخ محمد فاضل - خيار الحق,≤100
112996045035943,حملة مرشح الشباب: محمد ولد يحيى,اطول عمر المصطف,≤100