Page ID,Page name,Disclaimer,Amount spent (THB)
101673076131930,พรรคเปลี่ยน,นอท พันธ์ธวัช นาควิสุทธิ์,1859
1686179558087025,ไพลิน เทียนสุวรรณ,ไพลิน เทียนสุวรรณ,1361
318392915554883,ภิญโญ กิจเลิศไพโรจน์ - Pinyo Kitlertphairoj,ภิญโญ กิจเลิศไพโรจน์ - Pinyo Kitlertphairoj,852
127610057890,KBank Live,KBank Live,689
106592249064812,เธียรสิน จิตพงค์ศรี,Naruecha Saedan,457
102360756116291,แพรวพรรณ พุกพิบูลย์,Praewphan Pukpiboon,298
108235995177438,ตรีสิทธิ์ ศิริวรรณ - Treesith Siriwan,ตรีสิทธิ์ ศิริวรรณ - Treesith Siriwan,269
137188693021815,สืบจากข่าว,สืบจากข่าว,168
626952517700280,ลิ้ม ศรัณยสัณฑ์ วีรกุลสุนทร ว่าที่ผู้สมัคร ส.ส. เขตจอมทอง พรรคเพื่อไทย,ลิ้ม ศรัณยสัณฑ์ วีรกุลสุนทร ว่าที่ผู้สมัคร ส.ส. เขตจอมทอง พรรคเพื่อไทย,≤100
221139347953872,อภิมุข ฉันทวานิช - Apimuk Xanthavanij,อภิมุข ฉันทวานิช - Apimuk Xanthavanij,≤100
106875995299953,ธวัชชัย ทรงพัฒนาศิลป์,ธวัชชัย ทรงพัฒนาศิลป์,≤100
102807719039442,พรรครวมไทยสร้างชาติ United Thai Nation Party,พรรครวมไทยสร้างชาติ United Thai Nation Party,≤100
651699931624315,Techsauce,Techsauce,≤100
112969264517494,เพ็ญพิสุทธิ์ จินตโสภณ - Penpisut Jintasophon,Vatcharapong Wongkom,≤100
149079361791677,พรรคเพื่อไทย,พรรคเพื่อไทย,≤100
352318098651383,โตโต้ ปิยรัฐ - Piyarat Chongthep,โตโต้ ปิยรัฐ - Piyarat Chongthep,≤100
2131398436998925,ชนินทร์ รุ่งแสง ปชป.,ชนินทร์ รุ่งแสง ปชป.,≤100
183238185051108,อรรถวิชช์ สุวรรณภักดี,อรรถวิชช์ สุวรรณภักดี,≤100
538633149666112,กวีวงศ์ อยู่วิจิตร-ผู้สมัคร ส.ส. เขตบางนา พระโขนง พรรคเพื่อไทย เบอร์ 3,กวีวงศ์ เบิด อยู่วิจิตร,≤100
102544175903371,เบ๊นซ์ นิธิพล  เพื่อคนสมุทรปราการ,นิธิพล บุญเพ็ชร,≤100
2230596726985945,ฮาย ปวิศรัฐฐ์ ติยะไพรัช,บริษัท เวิร์ค 360 จำกัด,≤100
241115389300595,คุณหญิงสุดารัตน์ เกยุราพันธุ์ Sudarat Keyuraphan,คุณหญิงสุดารัตน์ เกยุราพันธุ์ Sudarat Keyuraphan,≤100
157659344260788,จุรินทร์ ลักษณวิศิษฏ์ Aoodda,Jurin Laksanawisit,≤100
296508406790,"Democrat Party, Thailand พรรคประชาธิปัตย์","Democrat Party, Thailand พรรคประชาธิปัตย์",≤100
103493019318704,เพิ่มพงศ์ วงศ์ทรายทอง - เบลล์,เพิ่มพงศ์ วงศ์ทรายทอง,≤100
108201828409912,ณัฐวัฒน์ พอใช้ได้,Atirit Dechasiniwat,≤100
177948972256358,เอกนัฏ พร้อมพันธุ์ (ขิง),Chonticha Mahachai,≤100
100624122148338,โรงพยาบาลรวมใจรักษ์ สุขุมวิท 62 Ruamjairak Hospital Sukhumvit 62,โรงพยาบาลรวมใจรักษ์ สุขุมวิท 62 Ruamjairak Hospital Sukhumvit 62,≤100
106872458897954,ระพีพัฒน์ สุเมธโชติเมธา,ระพีพัฒน์ สุเมธโชติเมธา,≤100
101535845426970,พรรคไทยสร้างไทย,พรรคไทยสร้างไทย,≤100
243465416352138,พรรคเพื่อชาติ,บริษัท เวิร์ค 360 จำกัด,≤100
115905241390909,เนเน่ รัดเกล้า สุวรรณคีรี,Rudklao Intawong Suwankiri,≤100
1635406246730420,วรงค์ เดชกิจวิกรม - Warong Dechgitvigrom,วรงค์ เดชกิจวิกรม - Warong Dechgitvigrom,≤100
108683518829164,ดร.ดุสิต  พันธุ์เสือ  พรรคประชาธิปัตย์จ. สมุทรปราการ เขต 2,Nuwat Chalerm-adirek,≤100
258984171484737,นนท์ นนทิวรรธน์,วรรณชัย เรือนแก้ว,≤100
112332525119611,เอกภาพ หงสกุล ผู้สมัคร ส.ส.พรรคเพื่อไทย เขตสายไหม,เอกภาพ หงสกุล ผู้สมัคร ส.ส.พรรคเพื่อไทย เขตสายไหม,≤100
104427797605274,พี่ต่อ ดร.เฉลิมชัย ศรีอ่อน “คำไหน-คำนั้น”,พี่ต่อ ดร.เฉลิมชัย ศรีอ่อน “คำไหน-คำนั้น”,≤100
2046265545683549,เชียร์ลุง,เชียร์ลุง,≤100
382558248956531,กมลพัฒน์  ปุงบางกะดี่  เขตบางขุนเทียน,กมลพัฒน์  ปุงบางกะดี่  เขตบางขุนเทียน,≤100
109263155401195,นายกประเทศ บุญยงค์,นายกประเทศ บุญยงค์,≤100
120566510971339,พรรคเพื่อไทยจังหวัดชลบุรี,These ads ran without a disclaimer,≤100
118757751143686,อิทธิพล ชลธราศิริ - Itthiphon Chontharasiri - แบงค์ชัย,Itthiphon Chontharasiri,≤100
101755712680612,รัก ณิชาภา โกวิทานนท์ ผู้สมัคร ส.ส.สมุทรสงคราม พรรคเพื่อไทย,รัก ณิชาภา โกวิทานนท์ ผู้สมัคร ส.ส.สมุทรสงคราม พรรคเพื่อไทย,≤100
109253101480638,วรท ศิริรักษ์ - Warot Sirirak,วรท ศิริรักษ์ - Warot Sirirak,≤100
109316932096944,ดร.พร้อมพงศ์ นพฤทธิ์ - Dr.Prompong Nopparit,Prompong Nopparit,≤100
101504656149099,Peace Sasipatra  - พีซ ศศิร์ภัทรา,Peace Sasipatra  - พีซ ศศิร์ภัทรา,≤100
112343717773740,Betapetonline,ชัชญา พานิช,≤100
175034722553191,ดร.ลีลาวดี วัชโรบล,ลีลาวดี วัชโรบล,≤100
118563167838903,พรรคถิ่นกาขาวชาววิไล l Thinkakaochaovilai Party,These ads ran without a disclaimer,≤100
122759277786688,Siam Inter Comics,These ads ran without a disclaimer,≤100
530945957405983,Nitipon Piwmow - นิติพล ผิวเหมาะ,Nitipon Piwmow,≤100
1469000100090040,สมาคมวางแผนครอบครัวแห่งประเทศไทยฯ,These ads ran without a disclaimer,≤100
106561034744198,ลอรี่ - พงศ์พล ยอดเมืองเจริญ,ลอรี่ - พงศ์พล ยอดเมืองเจริญ,≤100
877369462441031,ปูอัด ไชยามพวาน ว่าที่ผู้สมัคร ส.ส. เขตจอมทอง พรรคก้าวไกล,Chaiyamparwaan Manpianjit,≤100
100985972856061,ธนพจน์ ทรัพย์ยอดแก้ว - Thanapoj Subyodkaew,Thanapoj Subyodkaew,≤100
100761582502948,จารุพล เรืองสุวรรณ - อาจารย์จา,Charupol Ruangsuwan,≤100
112073738279329,สิงโต - ศักดิ์สิทธิ์ ขาวทอง,สิงโต - ศักดิ์สิทธิ์ ขาวทอง,≤100
622674297897819,Screenshirt2020,Screenshirt2020,≤100
111531108139387,สุวัฒน์ ม่วงศิริ,These ads ran without a disclaimer,≤100
103082582573797,Hoodieshop1999s,These ads ran without a disclaimer,≤100
108508377637861,มุ้งจีบพระราม2 โรงงานผลิตมุ้งจีบ มุ้งลวด เหล็ดดัดทุกชนิด,กุหลาบ บัวสด,≤100
116015268059097,กรวัฒน์ หันประดิษฐ์-JoeBangpee,These ads ran without a disclaimer,≤100
102661302788490,กานต์ กฤตินี รุณแสง,วรรณชัย เรือนแก้ว,≤100
224633698033299,The Better news,The Better news,≤100
601953326929372,ธัญวัจน์ กมลวงศ์วัฒน์ - Tunyawaj Kamolwongwat,Tunyawaj Kamolwongwat,≤100
115922723434700,ครูเจพีสรุปย่อ for Teacher,ครูเจพีสรุปย่อ for Teacher,≤100
107612328588715,The Voters,สันติสุข กาญจนประกร,≤100
101861489530398,มณีรัตน์ ลิมป์รัตนกาญจน์,Sitthikorn Toomsanthia,≤100
101372342567471,ต้นกล้า จรยุทธ จตุรพรประสิทธิ์ - TonKla Chorayuth Chaturapornprasit,Chorayuth Chaturapornprasit,≤100
365923533756876,Kleens อกไก่ปั่น,สันตยุต ทองวิลาศ,≤100
103863149219273,นิธิกร วุฒินันชัย เอก พรรคเพื่อไทย,เอก นิธิกร วุฒินันชัย,≤100
1105604039583762,Line One สว.นท. ขอเชิญส่งประวัติ ส่วนตัว องค์กร เพื่อเข้ารับรางวัลประจำปี,Suksan Booran,≤100
101794231527425,สุภกร ตันติไพบูลย์ธนะ - Supakon Tangtiphaiboontana,สุภกร ตันติไพบูลย์ธนะ,≤100
2151302718520482,ธิดารัตน์ ยิ่งเจริญ Tidarat Yingcharoen,ธิดารัตน์ ยิ่งเจริญ Tidarat Yingcharoen,≤100
110119528503129,สจ.วิชัย รวมไทยสร้างชาติ,These ads ran without a disclaimer,≤100
107448364979874,ศิริพงศ์ นานคงแนบ - Siripong Nankongnab,Siripong Nankongnab,≤100
100545119426784,พีระพันธุ์ FC,Bunsong Rodyo,≤100
103374929058783,flukkies,These ads ran without a disclaimer,≤100
111341764925564,สำนักสนับสนุนการพัฒนาระบบสุขภาพ - สำนัก 7 สสส.,สำนักสนับสนุนการพัฒนาระบบสุขภาพ - สำนัก 7 สสส.,≤100
418729291509368,สถาบันปรีดี พนมยงค์ Pridi Banomyong Institute,สถาบันปรีดี พนมยงค์ Pridi Banomyong Institute,≤100
100893829013139,ภูริวรรธก์ ใจสำราญ - Puriwat Chaisamran,Puriwat Chaisamran,≤100
102485609473639,เรขา ปรีชาวัย-คงแก้ว,วรรณชัย เรือนแก้ว,≤100
204016840519336,ศ.ดร.นฤมล ภิญโญสินวัฒน์,ศ.ดร.นฤมล ภิญโญสินวัฒน์,≤100
100298682713615,เสื้อวินเทจ ลายมัน ผ้าดำ,เสื้อวินเทจ ลายมัน ผ้าดำ,≤100
103983981304937,พรรคเสมอภาค-Equality Party,Nalinphas Ongkunaruk,≤100
111981083759952,พรรคก้าวไกล ตราด,Pannasate Numnoo,≤100
115195181447846,อ้อ ศิรินันท์ ศิริพานิช,อ้อ ศิรินันท์ ศิริพานิช,≤100
204016840519336,ศ.ดร.นฤมล ภิญโญสินวัฒน์,These ads ran without a disclaimer,≤100
100915662043252,Denis Ads.,บริษัท เดนิส แอดส์ จำกัด,≤100
2261328364142621,ดร.อ้น อมรศักดิ์ สินเหลือ,These ads ran without a disclaimer,≤100
539119526485380,ทนายใหญ่ ธิมาชัย,ใหญ่ ธิมาชัย,≤100
102556966043387,ประชาธิปัตย์ ศรีราชา,These ads ran without a disclaimer,≤100
108515294626891,สอบข้าราชการท้องถิ่น By Thurakan,Chiraphorn Thuree,≤100
746897038728067,นพ.บัญญัติ เจตนจันทร์,นพ.บัญญัติ เจตนจันทร์,≤100
108640528477500,เชฟบุญธรรม ภาคโพธิ์,These ads ran without a disclaimer,≤100
106804542303183,สำนักงานกฎหมายทนายใหญ่,สำนักงานกฎหมายทนายใหญ่,≤100
197506433714730,Our History: เรื่อง เล่า เรา โลก,These ads ran without a disclaimer,≤100
101903785231136,นายกไก่กังวาล ศักดิ์ชัย พิศาลผล,Thanachit Phraemuang,≤100
101015808041186,ป้ายชื่อตั้งโต๊ะทำงาน เสริมบารมี ราคาถูก,These ads ran without a disclaimer,≤100
190923294988741,สอบครูผู้ช่วยนะ,สอบครูผู้ช่วยนะ,≤100
104321752173970,สมเกียรติ ขุนบุญจันทร์,สมเกียรติ ขุนบุญจันทร์,≤100
103270756062594,ทนายกาย ธนินท์ธร ภูมราช เบอร์ 2 เขต 2 นนทบุรี,These ads ran without a disclaimer,≤100
111852360177624,วิวัฒน์ จินดาพล สจ.ต้อม,วิวัฒน์ จินดาพล สจ.ต้อม,≤100
116668478038395,โด่ง ชัชวาล พรอมรธรรม เพื่อไทย ขอนแก่น เขต 1,โด่ง ชัชวาล พรอมรธรรม,≤100
494189467277672,Agenda,Agenda,≤100
105125715202609,ส.ส.ไผ่ ลิกค์,ส.ส.ไผ่ ลิกค์,≤100
2117655671832030,ธวัชชัย ทองสิมา พรรคไทยสร้างไทย เขตจอมทอง,These ads ran without a disclaimer,≤100
100563224683217,Amarat Chokepamitkul อมรัตน์ โชคปมิตต์กุล,These ads ran without a disclaimer,≤100
113001706909463,สส.เป้ นภาพร เพ็ชร์จินดา Dr.Napaporn Petchinda,สส.เป้ นภาพร เพ็ชร์จินดา Dr.Napaporn Petchinda,≤100
103519619366975,รวมไทยสร้างชาติ ชลบุรี,พลสิทธิ์ พงศ์พัฒนะกิจ,≤100
117958994526730,สจ.ยงยศ มัธยัสสิน,สจ.ยงยศ มัธยัสสิน,≤100
113023081702937,ธีระ สลักเพชร,ธีระ สลักเพชร,≤100
107403235309297,วันเพ็ญ ปัญญาทิพย์,These ads ran without a disclaimer,≤100
264065496937763,My Chavapol (ชวพล วัฒนพรมงคล),My Chavapol (ชวพล วัฒนพรมงคล),≤100
106120645745753,ดร.ภญ.สุชาดา เบล เวสารัชตระกูล,These ads ran without a disclaimer,≤100
111102121566092,พลช กฤษณะราช,พลช กฤษณะราช,≤100