Page ID,Page name,Disclaimer,Amount spent (USD)
102992285280678,الصفحة الرسمية للسيد النائب نوري سفيان,الصفحة الرسمية للسيد النائب نوري سفيان,≤100
293384094915450,جريدة الحراك الإخباري,جريدة الحراك الإخباري,≤100
985246578276059,هشام صفر Hichem Sifer,هشام صفر Hichem Sifer,≤100
118523236205486,سامر خير - كاتب,These ads ran without a disclaimer,≤100
995765983772115,Dzair Tube,Dzair Tube,≤100
104140320927199,قناة الإنتصار TV,قناة الإنتصار TV,≤100
107703155980813,EarlyRise,These ads ran without a disclaimer,≤100
131189377574,MDPI,These ads ran without a disclaimer,≤100