Page ID,Page name,Disclaimer,Amount spent (USD)
115610190354167,Maguette Sène Officiel,Maguette Sène Officiel,≤100
190126634445277,Africa Defense Forum ADF Magazine,These ads ran without a disclaimer,≤100
1495287077369181,"Killé Sakho, Maire de Diawara","Killé Sakho, Maire de Diawara",≤100
1495287077369181,"Killé Sakho, Maire de Diawara",Sakho Killé,≤100
641572929530326,Actu221.net,Mamadou Moustapha Ndiongue,≤100
111679394767549,المشروع القومي لمشتقات البلازما,These ads ran without a disclaimer,≤100