Page ID,Page name,Disclaimer,Amount spent (USD)
109854728594212,برنامج تحديث القطاع العام,برنامج تحديث القطاع العام,≤100
103323581486845,النائب سليمان موسى ابو يحيى,Sleman Abuyahia,≤100
103736596415097,صندوق الملك عبدالله الثاني للتنمية (KAFD),These ads ran without a disclaimer,≤100
664477853670759,المكتب الاعلامي للنائب معتز ابورمان,Moutaz Abu Rumman,≤100
107141858896307,Rewell Society,Rewell Society,≤100
111934298458280,مجموعة القبة الإعلامية,مجموعة القبة الإعلامية,≤100
117712314600132,مشروع الزمالة البرلمانية,King Abdullah II Fund for Development,≤100
521303771314889,وزارة الصناعة و التجارة و التموين الاردنية Mit.gov.jo,Muhanad Alomyan,≤100
102931605845722,تيار وطني يهدف لتأسيس حزب باسم العمل,حزب العمل,≤100
115184984772348,ابراهيم الاسعد الداود,These ads ran without a disclaimer,≤100
106333873031741,الدكتور معاوية العليوي,These ads ran without a disclaimer,≤100
100205160065392,Samar Al.Shamsi,These ads ran without a disclaimer,≤100
131189377574,MDPI,These ads ran without a disclaimer,≤100