Page ID,Page name,Disclaimer,Amount spent (THB)
107392695633799,สรวีย์ เขต1ปทุมธานี พรรคก้าวไกล,Suppalerk Suppapantita,692
105826292451688,พลตำรวจตรี วัฒนา วงศ์จันทร์,Jirapiwat Wongchun,183
277320192288594,โอม จิรชาติ,โอม จิรชาติ,105
229178137856991,ประเสริฐศรี ฮ้อแสงชัย ปทุมธานี,ประเสริฐศรี ฮ้อแสงชัย ปทุมธานี,≤100
2131398436998925,ชนินทร์ รุ่งแสง ปชป.,ชนินทร์ รุ่งแสง ปชป.,≤100
112332525119611,,เอกภาพ หงสกุล ว่าที่ผู้สมัคร ส.ส.พรรคเพื่อไทย เขตสายไหม,≤100
110863091226908,เสวก ประเสริฐสุข,เสวก ประเสริฐสุข,≤100
241115389300595,คุณหญิงสุดารัตน์ เกยุราพันธุ์ Sudarat Keyuraphan,คุณหญิงสุดารัตน์ เกยุราพันธุ์ Sudarat Keyuraphan,≤100
102807719039442,พรรครวมไทยสร้างชาติ United Thai Nation Party,พรรครวมไทยสร้างชาติ United Thai Nation Party,≤100
100454798870209,พรรคเส้นด้าย - Zendai Party,พรรคเส้นด้าย - Zendai Party,≤100
111341764925564,สำนักสนับสนุนการพัฒนาระบบสุขภาพ - สำนัก 7 สสส.,สำนักสนับสนุนการพัฒนาระบบสุขภาพ - สำนัก 7 สสส.,≤100
101535845426970,พรรคไทยสร้างไทย,พรรคไทยสร้างไทย,≤100
177948972256358,เอกนัฏ พร้อมพันธุ์ (ขิง),Chonticha Mahachai,≤100
106804542303183,สำนักงานกฎหมายทนายใหญ่,Luksamee Saetiaw,≤100
104427797605274,ดร.เฉลิมชัย ศรีอ่อน รัฐมนตรีว่าการกระทรวงเกษตรและสหกรณ์,ดร.เฉลิมชัย ศรีอ่อน รัฐมนตรีว่าการกระทรวงเกษตรและสหกรณ์,≤100
345127652279503,มูลนิธิสากลเพื่อคนพิการ,มูลนิธิสากลเพื่อคนพิการ,≤100
296508406790,"Democrat Party, Thailand พรรคประชาธิปัตย์","Democrat Party, Thailand พรรคประชาธิปัตย์",≤100
102530815945359,องอาจ วชิรพงศ์,Areeya Namdokmai,≤100
157659344260788,จุรินทร์ ลักษณวิศิษฏ์ Aoodda,Jurin Laksanawisit,≤100
100624122148338,โรงพยาบาลรวมใจรักษ์ สุขุมวิท 62 Ruamjairak Hospital Sukhumvit 62,โรงพยาบาลรวมใจรักษ์ สุขุมวิท 62 Ruamjairak Hospital Sukhumvit 62,≤100
204016840519336,ศ.ดร.นฤมล ภิญโญสินวัฒน์,ศ.ดร.นฤมล ภิญโญสินวัฒน์,≤100
118757751143686,อิทธิพล ชลธราศิริ - Itthiphon Chontharasiri - แบงค์ชัย,Itthiphon Chontharasiri,≤100
109316932096944,ดร.พร้อมพงศ์ นพฤทธิ์ - Dr.Prompong Nopparit,Prompong Nopparit,≤100
622674297897819,Screenshirt2020,Screenshirt2020,≤100
106184152433924,,These ads ran without a disclaimer,≤100
2046265545683549,เชียร์ลุง,เชียร์ลุง,≤100
100893829013139,ภูริวรรธก์ ใจสำราญ - Puriwat Chaisamran,Puriwat Chaisamran,≤100
107569661842229,หน่อย-ศุภนาถลดา รัตนาธนัชภัค,หน่อย-ศุภนาถลดา รัตนาธนัชภัค,≤100
1635406246730420,วรงค์ เดชกิจวิกรม - Warong Dechgitvigrom,Supaporn Sakuljuy,≤100
110175441444627,เชตวัน เตือประโคน - Chetawan Thuaprakhon,เชตวัน เตือประโคน - Chetawan Thuaprakhon,≤100
108508377637861,มุ้งจีบพระราม2 โรงงานผลิตมุ้งจีบ มุ้งลวด เหล็ดดัดทุกชนิด,กุหลาบ บัวสด,≤100
224633698033299,The Better news,The Better news,≤100
101636186123234,ไชยพล เดชตระกูล,ไชยพล เดชตระกูล,≤100
101118132838797,หมอวรงค์ต้องได้เป็นนายก,หมอวรงค์ต้องได้เป็นนายก,≤100
530945957405983,Nitipon Piwmow - นิติพล ผิวเหมาะ,Nitipon Piwmow,≤100
101585715993371,2p_vintage_store,These ads ran without a disclaimer,≤100
382558248956531,กมลพัฒน์  ปุงบางกะดี่  เขตบางขุนเทียน,กมลพัฒน์  ปุงบางกะดี่  เขตบางขุนเทียน,≤100
115922723434700,ครูเจพีสรุปย่อ for Teacher,ครูเจพีสรุปย่อ for Teacher,≤100
1105604039583762,Line One สว.นท. ขอเชิญส่งประวัติ ส่วนตัว องค์กร เพื่อเข้ารับรางวัลประจำปี,Suksan Booran,≤100
108832691827531,งาดำงานวิจัยเชียงใหม่ T 080 769 5092,These ads ran without a disclaimer,≤100
2151302718520482,ธิดารัตน์ ยิ่งเจริญ Tidarat Yingcharoen,ธิดารัตน์ ยิ่งเจริญ Tidarat Yingcharoen,≤100
190923294988741,สอบครูผู้ช่วยนะ,สอบครูผู้ช่วยนะ,≤100
107612328588715,The Voters,สันติสุข กาญจนประกร,≤100
340110720173014,SaveThaiCuts,SaveThaiCuts,≤100
1686179558087025,ไพลิน เทียนสุวรรณ,ไพลิน เทียนสุวรรณ,≤100
103836382326915,เซซามินงานวิจัยศูนย์เชียงใหม่ T 080 769 5092,These ads ran without a disclaimer,≤100
114396410315247,ร้านสยามกีฬา-จำหน่ายชุดกีฬา/ปลีก-ส่ง,These ads ran without a disclaimer,≤100
100545119426784,พีระพันธุ์ FC,Bunsong Rodyo,≤100
100915662043252,Denis Ads.,บริษัท เดนิส แอดส์ จำกัด,≤100
105308564750704,Natt Mongkolnavin,ณัฏฐ์ มงคลนาวิน,≤100
877369462441031,ปูอัด ไชยามพวาน ว่าที่ผู้สมัคร ส.ส. เขตจอมทอง พรรคก้าวไกล,Chaiyamparwaan Manpianjit,≤100
108515294626891,สอบข้าราชการท้องถิ่น By Thurakan,Chiraphorn Thuree,≤100
365923533756876,Kleens อกไก่ปั่น,สันตยุต ทองวิลาศ,≤100
514800142336756,ดร. นิพนธ์ แจ่มจำรัส ชลบุรี เขต 7,Kevin Maltig,≤100
109794888685584,สมเจตน์ เกตุวัตถา,สมเจตน์ เกตุวัตถา,≤100
109228884002006,ทนายมนตรีกับเสมียนอินดี้,These ads ran without a disclaimer,≤100
109720095237186,กษิรัช สุวรรณเพ็ญ - ประชาธิปัตย์ ตาก,Kasirat Suwanpen,≤100
715838732136310,ธนเดช เพ็งสุข - Tanadej Pengsuk,Tanadej Pengsuk,≤100
146007617136671,พลสิทธิ์ พงศ์พัฒนะกิจ -Ponlasit Pongpattanakit,พลสิทธิ์ พงศ์พัฒนะกิจ -Ponlasit Pongpattanakit,≤100
109629844791957,ห้องเรียนวิชาการ,These ads ran without a disclaimer,≤100
152665702176493,Ringsideการเมือง,Ringsideการเมือง,≤100
1519393701421180,ผมเกิดมาเป็นติ่ง,These ads ran without a disclaimer,≤100
106561034744198,ลอรี่ - พงศ์พล ยอดเมืองเจริญ,ลอรี่ - พงศ์พล ยอดเมืองเจริญ,≤100
428009970864153,อ้วนรังสิต พระเครื่อง,These ads ran without a disclaimer,≤100
114914794432449,กฎหมายใช้สอบราชการ by Æ+,กฎหมายใช้สอบราชการ by Æ+,≤100
985820164804495,ธนาคารพัฒนาวิสาหกิจขนาดกลางและขนาดย่อมแห่งประเทศไทย,ธนาคารพัฒนาวิสาหกิจขนาดกลางและขนาดย่อมแห่งประเทศไทย,≤100
105826292451688,พลตำรวจตรี วัฒนา วงศ์จันทร์,These ads ran without a disclaimer,≤100
100761582502948,จารุพล เรืองสุวรรณ - อาจารย์จา,These ads ran without a disclaimer,≤100
111494824691027,มงคล เหลี่ยมวัฒนกุล - Mongkol Liamwattanakul,มงคล เหลี่ยมวัฒนกุล - Mongkol Liamwattanakul,≤100
106337912336664,ปั้น ณัทกร แก้วพิจิตร,ปั้น ณัทกร แก้วพิจิตร,≤100
317911298372936,อรอนงค์  กาญจนชูศักดิ์,อรอนงค์  กาญจนชูศักดิ์,≤100
108683518829164,ดร.ดุสิต  พันธุ์เสือ  พรรคประชาธิปัตย์จ. สมุทรปราการ เขต 2,Nuwat Chalerm-adirek,≤100
108947135246342,รัฐพงศ์ ระหงษ์,These ads ran without a disclaimer,≤100
101164632678987,อุดม กันม่วง - กำนันเผ่น,These ads ran without a disclaimer,≤100
182927663813,Prachachat - ประชาชาติ,These ads ran without a disclaimer,≤100
101755712680612,รัก ณิชาภา โกวิทานนท์ ว่าที่ผู้สมัคร สส. เพื่อไทย สมุทรสงคราม,รัก ณิชาภา โกวิทานนท์ ว่าที่ผู้สมัคร สส. เพื่อไทย สมุทรสงคราม,≤100
101903785231136,นายกไก่กังวาล ศักดิ์ชัย พิศาลผล,Thanachit Phraemuang,≤100
172057439546202,พันโท สินธพ แก้วพิจิตร (เสธ.แก้ว),พันโท สินธพ แก้วพิจิตร (เสธ.แก้ว),≤100
100298682713615,เสื้อวินเทจ ลายมัน ผ้าดำ,เสื้อวินเทจ ลายมัน ผ้าดำ,≤100
188872144758,CCTV,These ads ran without a disclaimer,≤100