Page ID,Page name,Disclaimer,Amount spent (USD)
106101625266252,Fatim-Zahra Ammor - فاطمة الزهراء عمور,Fatim-Zahra Ammor - فاطمة الزهراء عمور,≤100
147084112022235,La Nouvelle Tribune,La Nouvelle Tribune,≤100
103180295526797,Ministère de l’Equipement et de l’Eau - وزارة التجهيز والماء,Ministère de l’Equipement et de l’Eau - وزارة التجهيز والماء,≤100
578201022242371,MJCC وزارة الشباب والثقافة والتواصل,"Ministère de la Jeunesse, de la Culture et de la Communication",≤100
1081434028658964,وزارة الانتقال الطاقي والتنمية المستدامة,وزارة الانتقال الطاقي والتنمية المستدامة,≤100
113414308041611,Great Arab Minds,These ads ran without a disclaimer,≤100
106875275519862,Morocco AM 2023,These ads ran without a disclaimer,≤100