Page ID,Page name,Disclaimer,Amount spent (VEF)
645406838886541,Freddy Superlano,an advertiser in Venezuela,500000
435259723296695,Política Internacional - Otra Mirada,These ads ran without a disclaimer,2100
342543309244937,People in Need América Latina,These ads ran without a disclaimer,≤100
564188034075673,Roberto Enriquez,an advertiser in Venezuela,≤100
37896015468,"Embajada de los EE.UU., Venezuela",an advertiser in Venezuela,≤100
106297255064534,Julio Fuenmayor,an advertiser in Venezuela,≤100