Page ID,Page name,Disclaimer,Amount spent (THB)
100158499547196,พระบ้าน ล้านพุทธคุณ,These ads ran without a disclaimer,1433
345127652279503,มูลนิธิสากลเพื่อคนพิการ,มูลนิธิสากลเพื่อคนพิการ,742
282963318728517,Abbott Nutrition Care,These ads ran without a disclaimer,360
177948972256358,เอกนัฏ พร้อมพันธุ์ (ขิง),เอกนัฏ พร้อมพันธุ์ (ขิง),274
102837065348999,DiGi-CUBE,These ads ran without a disclaimer,263
104769961794110,อินทรัตน์ ยอดบางเตย,อินทรัตน์ ยอดบางเตย,239
100624122148338,โรงพยาบาลรวมใจรักษ์ สุขุมวิท 62 Ruamjairak Hospital Sukhumvit 62,โรงพยาบาลรวมใจรักษ์ สุขุมวิท 62 Ruamjairak Hospital Sukhumvit 62,228
418729291509368,สถาบันปรีดี พนมยงค์ Pridi Banomyong Institute,สถาบันปรีดี พนมยงค์ Pridi Banomyong Institute,191
1105604039583762,Line One สว.นท. ขอเชิญส่งประวัติ ส่วนตัว องค์กร เพื่อเข้ารับรางวัลประจำปี,Line One สว.นท. ขอเชิญส่งประวัติ ส่วนตัว องค์กร เพื่อเข้ารับรางวัลประจำปี,189
111341764925564,สำนักสนับสนุนการพัฒนาระบบสุขภาพ - สำนัก 7 สสส.,สำนักสนับสนุนการพัฒนาระบบสุขภาพ - สำนัก 7 สสส.,183
601953326929372,ธัญวัจน์ กมลวงศ์วัฒน์ - Tunyawaj Kamolwongwat,ธัญวัจน์ กมลวงศ์วัฒน์ - Tunyawaj Kamolwongwat,113
352318098651383,โตโต้ ปิยรัฐ - Piyarat Chongthep,โตโต้ ปิยรัฐ - Piyarat Chongthep,109
110325275488,efinanceThai,efinanceThai,≤100
1026888470835739,Prejapan88 ขนส่งสินค้าจากญี่ปุ่นมาไทย รับประมูล สั่งซื้อสินค้าญี่ปุ่นทุกเวป,These ads ran without a disclaimer,≤100
1551751431783222,The Momentum,The Momentum,≤100
107612328588715,The Voters,The Voters,≤100
546416699215073,ห้องสื่อครูคอม,ห้องสื่อครูคอม,≤100
365425170785654,AKKEE Thai Delicacies & Tasting Counter,These ads ran without a disclaimer,≤100
106804542303183,สำนักงานกฎหมายทนายใหญ่,สำนักงานกฎหมายทนายใหญ่,≤100
102523331737588,ตัวแทนประกันชีวิต/ประกันมรดก/ประกันสุขภาพ/เงินออม/ลดหย่อนภาษี by สิริรัตน์,These ads ran without a disclaimer,≤100
108625789179165,Soi Dog Foundation,These ads ran without a disclaimer,≤100
104414891596686,Studio Photo Story,These ads ran without a disclaimer,≤100
100188792560525,เฟอร์นิเจอร์ตกแต่งบ้านราคาถูก,These ads ran without a disclaimer,≤100
115922723434700,ครูเจพีสรุปย่อ for Teacher,ครูเจพีสรุปย่อ for Teacher,≤100
109552337467130,THE STANDARD WEALTH,"THE STANDARD CO., LTD",≤100
104393812499502,ชีทสรุปกฎหมาย สำหรับสอบราชการ พนักงานราชการ by.kantap,ชีทสรุปกฎหมาย สำหรับสอบราชการ พนักงานราชการ by.kantap,≤100
104239001956170,ข่าวสาร สาระดีๆ,These ads ran without a disclaimer,≤100
608650595820049,The Conqueror Challenges,These ads ran without a disclaimer,≤100
105992549162758,ข่าวชีวิตติดกระแส,บริษัท เดนิส แอดส์ จำกัด,≤100
104427797605274,พี่ต่อ ดร.เฉลิมชัย ศรีอ่อน “คำไหน-คำนั้น”,พี่ต่อ ดร.เฉลิมชัย ศรีอ่อน “คำไหน-คำนั้น”,≤100
333794970138725,Gen.Bunchon - บัญชร ชวาลศิลป์,Gen.Bunchon - บัญชร ชวาลศิลป์,≤100
462909117451519,หนังสือดีบอกต่อ & TONI Bookstore,These ads ran without a disclaimer,≤100
117202611369933,ป้ายชื่อเครื่องแบบด่วน,These ads ran without a disclaimer,≤100
2294120500839581,รับซื้อธนบัตรโบราณ  เหรียญ โบราณ,These ads ran without a disclaimer,≤100
162047453807939,Dr.Kriengsak Chareonwongsak เกรียงศักดิ์ เจริญวงศ์ศักดิ์,These ads ran without a disclaimer,≤100
154469462034471,Thai GL Company,These ads ran without a disclaimer,≤100
105546651850693,วีรนันท์ ฮวดศรี-Weeranan Huadsri-ทนายป๊อก,วีรนันท์ ฮวดศรี-Weeranan Huadsri-ทนายป๊อก,≤100
106028831878217,JW Clinic คลินิคผิวหนัง ความงาม,These ads ran without a disclaimer,≤100
101903785231136,นายกไก่กังวาล ศักดิ์ชัย พิศาลผล,นายกไก่กังวาล ศักดิ์ชัย พิศาลผล,≤100
572592940087101,คณพลคนกันเอง,คณพลคนกันเอง,≤100
106326640734371,เสื้อกั๊กกรมการปกครองหรือกระทรวงต่างๆ มีบริการเก็บเงินปลายทาง,These ads ran without a disclaimer,≤100
165652116849204,Urban Futures & Policy,These ads ran without a disclaimer,≤100
105478148774022,VR Clinic ศูนย์ศัลยกรรมด้านความงาม,These ads ran without a disclaimer,≤100
101074962611236,ห้องสื่อวิชาการ ครูตัวกลม,These ads ran without a disclaimer,≤100
112823263575800,CCCL Film Festival,These ads ran without a disclaimer,≤100
112214671700161,Arun Pandey,These ads ran without a disclaimer,≤100
100130132039878,greenlynatalia,These ads ran without a disclaimer,≤100
107431635701822,Huang Hsi,These ads ran without a disclaimer,≤100
201592649916262,RFI ខេមរភាសា / RFI Khmer,These ads ran without a disclaimer,≤100
101082842736363,The world of reader,These ads ran without a disclaimer,≤100
789394817776187,This is Hunan,These ads ran without a disclaimer,≤100
420107494865559,CARE's The ethical Chef Days,These ads ran without a disclaimer,≤100
110215891477092,Entertainment Dude,These ads ran without a disclaimer,≤100