Page ID,Page name,Disclaimer,Amount spent (GTQ)
167924689961661,Unidad Nacional de la Esperanza,Unidad Nacional de la Esperanza,103
167924689961661,Unidad Nacional de la Esperanza,Leonel Aníbal Quiñónez Aguilar,≤100
1911003529195315,Roberto Arzú,Roberto Arzú García-Granados,≤100
106908785419555,Goberna Guatemala,Goberna,≤100
643513979193133,Unidos por Beatriz,Neuma,≤100
210684176077839,Centinelas por la Dignificación del Estado,Centinelas por la Dignificación del Estado,≤100
1630952833827354,Armando Castillo,Armando  Damian Castillo Alvarado,≤100
292129440851133,CropLife Latin America,These ads ran without a disclaimer,≤100