Page ID,Page name,Disclaimer,Amount spent (USD)
147084112022235,La Nouvelle Tribune,La Nouvelle Tribune,≤100
107627395144123,الحكومة المغربية,الحكومة المغربية,≤100
103180295526797,Ministère de l’Equipement et de l’Eau - وزارة التجهيز والماء,M Equipement Maroc,≤100
578201022242371,MJCC وزارة الشباب والثقافة والتواصل,"Ministère de la Jeunesse, de la Culture et de la Communication",≤100
123393171111656,Mehdi Bensaid   المهدي بنسعيد,Mohammed Mehdi Bensaid,≤100
105528868929344,Mohamed El Hamouti • محمد الحموتي,Mohamed El Hamouti,≤100
167254950013774,Rue20.Com,Ayoub Elkouari,≤100
161637767281862,LE MATIN.ma,Groupe Le Matin,≤100
1117512094962616,Ministère de l’Industrie et du Commerce,MCINET,≤100
106989164933586,Arrondissement ben M'sick - مقاطعة بن امسيك,Arrondissement ben Msick,≤100
194824897244836,Zayed Sustainability Prize,These ads ran without a disclaimer,≤100
606018839433507,Future for Advanced Research & Studies - FARAS,These ads ran without a disclaimer,≤100
229475587079008,kifache,Mehdi Farhi,≤100
334353136587648,L'Observateur du Maroc et d'Afrique,Mehdi Farhi,≤100
100712042862552,Lahcen Anir,These ads ran without a disclaimer,≤100
427648547297783,Hasan Ismaik - حسن إسميك,These ads ran without a disclaimer,≤100
105483765311416,Arrondissement Communal de Sidi Belyout - مقاطعة سيدي بليوط,Arrondissement communal sidi belyout,≤100
1107005629310630,American English for Educators,These ads ran without a disclaimer,≤100
310943025606302,World Cancer Day,These ads ran without a disclaimer,≤100
224597158386607,Rosa Luxemburg Foundation,These ads ran without a disclaimer,≤100
211454462257570,International Hockey Federation (FIH),These ads ran without a disclaimer,≤100