Page ID,Page name,Disclaimer,Amount spent (USD)
107591924752701,Xafiiska Horumarinta Magaalooyinka iyo Dhismaha DDS,an advertiser in Ethiopia,≤100
103780749105731,Dire Dawa Adminstration Transport And Logistics,an advertiser in Ethiopia,≤100
104876078661597,Chaltu Sani - ጫልቱ ሳኒ Minister,an advertiser in Ethiopia,≤100
116679401363112,Kelce Jam,These ads ran without a disclaimer,≤100
107410862226340,Make Africa Great Again,These ads ran without a disclaimer,≤100
668701066598159,مجلس حكماء المسلمين,These ads ran without a disclaimer,≤100