Page ID,Page name,Disclaimer,Amount spent (THB)
622674297897819,Screenshirt2020,Screenshirt2020,≤100
109239188766815,ดร. วิทยา อินาลา พรรคไทยพร้อม,Klod Sawadputsra,≤100
108261230583781,เอิร์ธ พงศกร ขวัญเมือง - Earth Pongsakorn Kwanmuang,เอิร์ธ พงศกร ขวัญเมือง - Earth Pongsakorn Kwanmuang,≤100
113023081702937,ธีระ สลักเพชร,ธีระ สลักเพชร,≤100
101673076131930,พรรคเปลี่ยน,พรรคเปลี่ยน,≤100
182657125936067,พรรคภูมิใจไทย,พรรคภูมิใจไทย,≤100
159570997481890,พลตำรวจเอกเสรีพิศุทธ์ เตมียเวส,พลตำรวจเอกเสรีพิศุทธ์ เตมียเวส,≤100
157659344260788,จุรินทร์ ลักษณวิศิษฏ์ Aoodda,Jurin Laksanawisit,≤100
681918321922813,ดร.ตั้น กฤชนนท์ อัยยปัญญา,ดร.ตั้น กฤชนนท์ อัยยปัญญา,≤100
183238185051108,อรรถวิชช์ สุวรรณภักดี,อรรถวิชช์ สุวรรณภักดี,≤100
407194015987067,Ch7HD News,Ch7HD News,≤100
1633051440333187,FTE หลักสูตรเพื่อพัฒนาเจ้าของธุรกิจรุ่นใหม่ ครบเครื่อง ทันใจ แบบเร่งรัด,"VP group infinity Co.,Ltd.",≤100
161651553861945,Amnesty International Thailand,Amnesty International Thailand,≤100
135827909783631,beartai แบไต๋,SHOW NO LIMIT COMPANY LIMITED,≤100
111341764925564,สำนักสนับสนุนการพัฒนาระบบสุขภาพ - สำนัก 7 สสส.,สำนักสนับสนุนการพัฒนาระบบสุขภาพ - สำนัก 7 สสส.,≤100
131777330175392,MGR Online Politics,MGR Online Politics,≤100
107648367788852,วงศกร ชนะกิจ,วงศกร ชนะกิจ,≤100
103983981304937,พรรคเสมอภาค-Equality Party,Nalinphas Ongkunaruk,≤100
113067400607487,กันตพงศ์ ดีชัยยะ - แมพ,กันตพงศ์ ดีชัยยะ - แมพ,≤100
149079361791677,พรรคเพื่อไทย,พรรคเพื่อไทย,≤100
2252271524986341,คิดไม่ออกบอกกวินนาถ - กวินนาถ ตาคีย์,กวินนาถ ตาคีย์,≤100
116668478038395,โด่ง ชัชวาล พรอมรธรรม เพื่อไทย ขอนแก่น เขต 1,โด่ง ชัชวาล พรอมรธรรม,≤100
118563167838903,พรรคถิ่นกาขาวชาววิไล l Thinkakaochaovilai Party,Prawta Khongto,≤100
257083724467673,ยุทธพล  อังกินันทน์,ยุทธพล อังกินันทน์,≤100
513741371997112,Amarin TV,อมรินทร์ เทเลวิชั่น,≤100
118757751143686,อิทธิพล ชลธราศิริ - Itthiphon Chontharasiri - แบงค์ชัย,Itthiphon Chontharasiri,≤100
102108535240880,สมบัติ ยะสินธุ์,สมบัติ ยะสินธุ์,≤100
102807719039442,พรรครวมไทยสร้างชาติ United Thai Nation Party,พรรครวมไทยสร้างชาติ United Thai Nation Party,≤100