Page ID,Page name,Disclaimer,Amount spent (VND)
106649512163916,"Trung Tâm  Điều trị U Xơ, U Nang, U Tuyến Giáp-0923.697.484",These ads ran without a disclaimer,10711
113283690847449,Thương Hiệu Quốc Gia Online,These ads ran without a disclaimer,973
919479674872321,Báo Nghệ An,Báo Nghệ An,897
111831663772285,BOMvn,BOMvn,437
101865258169428,ĐEN Secondhand,ĐEN Secondhand,105
105845511087981,TRUYỀN HÌNH AN VIÊN,TRUYỀN HÌNH AN VIÊN,≤100
1625350890913575,Viettel Solutions,These ads ran without a disclaimer,≤100
106994278911120,JP&US Chuyên Hàng Chính Hãng,These ads ran without a disclaimer,≤100