Page ID,Page name,Disclaimer,Amount spent (VND)
105845511087981,TRUYỀN HÌNH AN VIÊN,Truyền hình Bchannel - BTV9 An Viên,20869
105062615490802,Thượng Tọa Thích Đức Thiện,Thượng Tọa Thích Đức Thiện,7362
103696505642477,Chùa Quán Sứ,Chùa Quán Sứ,7332
108390095364515,Phạm Văn Thanh- Đặc Trị Xương Khớp,These ads ran without a disclaimer,3147
156776368385414,Nhan Sắc Mới Khởi Đầu Mới,Nhan Sắc Mới Khởi Đầu Mới,2579
103997715661536,Thầy Phạm Văn Thanh - Chữa Dứt Điểm  Bệnh Dạ Dày Đại Tràng,These ads ran without a disclaimer,2509
111267731617802,Lương Y Phạm Văn Thanh - Người Thầy Y Đức,These ads ran without a disclaimer,2490
104262935867100,Chương trình Đào tạo Trực tuyến khu vực phía Nam-ĐH MỞ HÀ NỘI,These ads ran without a disclaimer,1044
104111485877130,Thùy Lan HONDA OTO Saigon - 0983.910.924,These ads ran without a disclaimer,907
101825789362820,Trung Tâm Điều Trị U - Triệt Tiêu Các Tế Bào Ung Thư 3,These ads ran without a disclaimer,777
101238282600816,Phụ tùng ô tô Auto,These ads ran without a disclaimer,551
103728275673138,Lương Y Vùng Cao - Phạm Văn Thanh,These ads ran without a disclaimer,512
101771959074940,"Kẹo Lạc Hồng - Đặc Sản Tiên Yên, Quảng Ninh",These ads ran without a disclaimer,277
243929942407499,CLB Doanh Nhân Sài Gòn,These ads ran without a disclaimer,247
111657357765777,Chúng tớ là Cộng Sản,These ads ran without a disclaimer,245
108685817326606,Truther Piece Official,These ads ran without a disclaimer,≤100
302192956888291,EU Immi - Định Cư Toàn Cầu,These ads ran without a disclaimer,≤100
103497027790225,Fonos,These ads ran without a disclaimer,≤100
102798135637475,XKLĐ Nhật Bản Nợ Phí,These ads ran without a disclaimer,≤100
103084755330516,YuGi Kiều Oanh,These ads ran without a disclaimer,≤100