Page ID,Page name,Disclaimer,Amount spent (THB)
137188693021815,สืบจากข่าว,สืบจากข่าว,≤100
241115389300595,คุณหญิงสุดารัตน์ เกยุราพันธุ์ Sudarat Keyuraphan,คุณหญิงสุดารัตน์ เกยุราพันธุ์ Sudarat Keyuraphan,≤100
149079361791677,พรรคเพื่อไทย,พรรคเพื่อไทย,≤100
451864701523507,Infographic Thailand,Infographic Thailand,≤100
102807719039442,พรรครวมไทยสร้างชาติ United Thai Nation Party,พรรครวมไทยสร้างชาติ United Thai Nation Party,≤100
101504656149099,Peace Sasipatra  - พีซ ศศิร์ภัทรา,Peace Sasipatra  - พีซ ศศิร์ภัทรา,≤100
104427797605274,ดร.เฉลิมชัย ศรีอ่อน รัฐมนตรีว่าการกระทรวงเกษตรและสหกรณ์,ดร.เฉลิมชัย ศรีอ่อน รัฐมนตรีว่าการกระทรวงเกษตรและสหกรณ์,≤100
101098248640061,กางเกงยีนส์ขาสั้นชาย Ikp short Jeans,มานิตย์ พลายชุม,≤100
296508406790,"Democrat Party, Thailand พรรคประชาธิปัตย์","Democrat Party, Thailand พรรคประชาธิปัตย์",≤100
100114485437460,"S.K.shops 2Hand""",These ads ran without a disclaimer,≤100
157659344260788,จุรินทร์ ลักษณวิศิษฏ์ Aoodda,Jurin Laksanawisit,≤100
115922723434700,ครูเจพีสรุปย่อ for Teacher,ครูเจพีสรุปย่อ for Teacher,≤100
113023081702937,ธีระ สลักเพชร,ธีระ สลักเพชร,≤100
317911298372936,อรอนงค์  กาญจนชูศักดิ์,อรอนงค์  กาญจนชูศักดิ์,≤100
102530815945359,องอาจ วชิรพงศ์,Areeya Namdokmai,≤100
116679231319335,ตุ๊ก - กานสินี,Dunyawat  Bamrungchan,≤100
101535845426970,พรรคไทยสร้างไทย,พรรคไทยสร้างไทย,≤100
104393812499502,ชีทสรุปกฎหมาย สำหรับสอบราชการ พนักงานราชการ by.kantap,ชีทสรุปกฎหมาย สำหรับสอบราชการ พนักงานราชการ by.kantap,≤100
109316932096944,ดร.พร้อมพงศ์ นพฤทธิ์ - Dr.Prompong Nopparit,Prompong Nopparit,≤100
2151302718520482,ธิดารัตน์ ยิ่งเจริญ Tidarat Yingcharoen,ธิดารัตน์ ยิ่งเจริญ Tidarat Yingcharoen,≤100
2046265545683549,เชียร์ลุง,เชียร์ลุง,≤100
539119526485380,ทนายใหญ่ ธิมาชัย,ใหญ่ ธิมาชัย,≤100
651699931624315,Techsauce,Techsauce,≤100
2263098807292933,ทนายศฤงคาร  ข่ายสุวรรณ์,Saringkan Khaisuwon,≤100
108515294626891,สอบข้าราชการท้องถิ่น By Thurakan,Chiraphorn Thuree,≤100
105125715202609,ส.ส.ไผ่ ลิกค์,ส.ส.ไผ่ ลิกค์,≤100
118757751143686,อิทธิพล ชลธราศิริ - Itthiphon Chontharasiri - แบงค์ชัย,Itthiphon Chontharasiri,≤100
108723940847688,คนสร้างไม้,These ads ran without a disclaimer,≤100
601953326929372,ธัญวัจน์ กมลวงศ์วัฒน์ - Tunyawaj Kamolwongwat,Tunyawaj Kamolwongwat,≤100
111341764925564,สำนักสนับสนุนการพัฒนาระบบสุขภาพ - สำนัก 7 สสส.,สำนักสนับสนุนการพัฒนาระบบสุขภาพ - สำนัก 7 สสส.,≤100
108306718545116,SCT CHAN Marathon,These ads ran without a disclaimer,≤100
100893829013139,ภูริวรรธก์ ใจสำราญ - Puriwat Chaisamran,Puriwat Chaisamran,≤100
365923533756876,Kleens อกไก่ปั่น,สันตยุต ทองวิลาศ,≤100
107612328588715,The Voters,สันติสุข กาญจนประกร,≤100
111494824691027,มงคล เหลี่ยมวัฒนกุล - Mongkol Liamwattanakul,มงคล เหลี่ยมวัฒนกุล - Mongkol Liamwattanakul,≤100
100761582502948,จารุพล เรืองสุวรรณ - อาจารย์จา,Charupol Ruangsuwan,≤100
106561034744198,ลอรี่ - พงศ์พล ยอดเมืองเจริญ,ลอรี่ - พงศ์พล ยอดเมืองเจริญ,≤100
110954691955005,ณภัสนันท์ อรินทคุณวงษ์ - Napassanan Arintakunawong,These ads ran without a disclaimer,≤100
622674297897819,Screenshirt2020,Screenshirt2020,≤100
101059939187444,Grand Kaze Yakiniku Chiangmai,These ads ran without a disclaimer,≤100
1635406246730420,วรงค์ เดชกิจวิกรม - Warong Dechgitvigrom,Supaporn Sakuljuy,≤100
2147269921986413,ธนัญญา พันธุ์การรุ่ง พรรคเพื่อไทย นครปฐม,These ads ran without a disclaimer,≤100
102108535240880,สมบัติ ยะสินธุ์,สมบัติ ยะสินธุ์,≤100
100298682713615,เสื้อวินเทจ ลายมัน ผ้าดำ,เสื้อวินเทจ ลายมัน ผ้าดำ,≤100
114914794432449,กฎหมายใช้สอบราชการ by Æ+,กฎหมายใช้สอบราชการ by Æ+,≤100
106256777922958,SEA Today News,These ads ran without a disclaimer,≤100
112073738279329,สิงโต - ศักดิ์สิทธิ์ ขาวทอง,สิงโต - ศักดิ์สิทธิ์ ขาวทอง,≤100
746897038728067,นพ.บัญญัติ เจตนจันทร์,นพ.บัญญัติ เจตนจันทร์,≤100
104180171920520,ราชการไทย,These ads ran without a disclaimer,≤100
111031708411837,Dreame 98xb-1,These ads ran without a disclaimer,≤100
821430017924241,Sungrow,These ads ran without a disclaimer,≤100