Page ID,Page name,Disclaimer,Amount spent (THB)
103967489136860,Online Trading,These ads ran without a disclaimer,≤100
266172157730,คนค้นฅน,คนค้นฅน,≤100
155367977855088,กองทุนพัฒนาไฟฟ้า สำนักงาน กกพ.,These ads ran without a disclaimer,≤100
104427797605274,พี่ต่อ ดร.เฉลิมชัย ศรีอ่อน “คำไหน-คำนั้น”,พี่ต่อ ดร.เฉลิมชัย ศรีอ่อน “คำไหน-คำนั้น”,≤100
494189467277672,Agenda,บริษัท ดิ อาเจนด้า จำกัด,≤100
105053578044333,Green Hearts Phuket,These ads ran without a disclaimer,≤100
108515294626891,สอบข้าราชการท้องถิ่น By Thurakan,Chiraphorn Thuree,≤100