Page ID,Page name,Disclaimer,Amount spent (HNL)
483441215141189,ASJ Honduras,Asociación para una Sociedad más Justa,≤100
153003381515332,Cespad - Centro de Estudio para la Democracia,Centro de Estudio para la Democracia (Cespad),≤100
113933318391304,Centro Religioso Amores Eternos,These ads ran without a disclaimer,≤100
486382251906084,Honduras El País,Diario El  Pais.hn,≤100
459107311130639,Dr. Luther Harry,Dr. Luther Harry,≤100
496839213786593,"Secretaría Nacional de Ciencia, Tecnología e Innovación","Secretaría Nacional de Ciencia, Tecnología e Innovación",≤100
43880852708,Amnistía Internacional Américas,These ads ran without a disclaimer,≤100