Page ID,Page name,Disclaimer,Amount spent (USD)
100187268355709,KYSFM-English,Rashida Fatawu,≤100
191347710997880,New Patriotic Party (NPP: Development in Freedom),New Patriotic Party (NPP: Development in Freedom),≤100
944644078980153,"Securities and Exchange Commission, Ghana","Securities and Exchange Commission, Ghana",≤100
1885114401706195,Dr. Matthew Opoku Prempeh,Dr. Matthew Opoku Prempeh,≤100
105713881570703,Ernest Kobeah,Ernest Kobeah,≤100
102179325363565,Samuel A. Jinapor,Samuel Abdulai Jinapor,≤100
102618778592624,Come Unto Christ In West Accra,Come Unto Christ In West Accra,≤100
427739974242140,Dr. Owusu Afriyie Akoto,Kingdom Concepts Consults,≤100
111829092211956,CNBC Africa,These ads ran without a disclaimer,≤100
105675589097240,Clean Earth Solar,These ads ran without a disclaimer,≤100