Page ID,Page name,Disclaimer,Amount spent (PEN)
812555298878305,Linder Del Aguila,These ads ran without a disclaimer,≤100
109019574560600,Aula Gaceta,Joel V. Supo Baldo,≤100
264223880347121,Lampadia Oficial,LAMPADIA,≤100
462790453744032,Sutep,Sindicato Unitario de Trabajadores en la Educación del Perú - SUTEP,≤100
112755042067857,Instituto Peruano de Economía - IPE,Instituto Peruano de Economía - IPE,≤100
115806960260634,Juan Carlos Mori,Franco Javier Rios Flores,≤100
474392346103738,RCR Red de Comunicación Regional,Red de Comunicación Regional,≤100
116301553829102,Cedren,Cedren,≤100
316564475960113,Estudio Jurídico Tarazona & Asociados,Diego Alberto Isla Yengle,≤100
103192204884175,Américo Gonza - Congresista de la República,Martha Gonza Castillo,≤100
534284396949027,Ilich López,Renzo Jireh Casas Torres,≤100
1805183599788143,Silvia Monteza,Héctor Melgar Sandoval,≤100
106395164602216,Juan Burgos,Luis Alberto Chavarry Gutierrez,≤100
1217651728387538,Diálogo Popular - Chincha,Jesus Alzamora Bendrell,≤100
101053675911037,Fabri & Asociados Consultoría Política y de Mercadeo,Whilber Eugenio Huallanca Conde,≤100
609829643005541,Cuencas Sagradas,Iniciativa Cuencas Sagradas,≤100
1897126257190528,Instituto Latinoamericano de Capacitaciones Jurídicas-ILCJ,ILCJ,≤100
200857600643943,Intercambio,Compañía de Jesús Provincia Del Perú,≤100
107787894456602,Melissa Huayhua Almonacid,Melissa Huayhua Almonacid,≤100
455802295156178,Nuestramerica TV,Crhistian Jorge Peralta Ramírez,≤100
107290784647450,HB Abogados,Julio Alberto Huerta Barrera,≤100
100901972889080,Noticias Al Día Perú,These ads ran without a disclaimer,≤100
101115909470323,Congresista Paul Silvio Gutiérrez Ticona,William Tapia,≤100
196140697656186,Len Corell,Ricardo Felix Coral,≤100
104580825801183,,These ads ran without a disclaimer,≤100
178333576154352,Aprodeh Apurimac,These ads ran without a disclaimer,≤100
115480308098213,andresmoraleshiguita,These ads ran without a disclaimer,≤100
382882368520781,People Performance International,These ads ran without a disclaimer,≤100
446695028860294,NotiCentro - Perú,Graciela Monica Yzarra Diaz,≤100
142062936237878,Goberna,Goberna,≤100
495706950531442,Pepe Feria,Pepe Feria,≤100