Page ID,Page name,Disclaimer,Amount spent (USD)
157354480893,Municipio Autónomo de Caguas,Municipio Autónomo de Caguas,≤100
921043291407287,Junta de Planificación,Junta de Planificación de Puerto Rico,≤100
164049599660,Catholic Relief Services en español,CATHOLIC RELIEF SERVICES,≤100
1616977468583066,Ada Alvarez Conde,Ada Mercedes Alvarez Conde,≤100
189445177858595,Metropistas,Metropistas,≤100
292680997602545,Manuel Calderón Cerame,Comité Manuel Calderón Cerame,≤100
1593945460882954,Seguro Social Orientadores,Seguro Social Orientadores,≤100
546066468753446,Black Health Matters,BLACK HEALTH MATTERS FOUNDATION INC,≤100
324828494307293,Jorge J. González 2024,Jorge J. González,≤100
100519772749954,Obamacare-Pride,Norwegian Financial LLC,≤100
502665456448329,Federico Barolin,These ads ran without a disclaimer,≤100
1729731747257645,Lcda. Ivonne Lozada,Ivonne Lozada Rosas,≤100
103597027708447,SuperPlanet Games,These ads ran without a disclaimer,≤100