Page ID,Page name,Disclaimer,Amount spent (EUR)
660181434095864,Visų reikalas,Lygių galimybių kontrolieriaus tarnyba,≤100
178362315106,European Parliament,European Parliament,≤100
76783564232,Europos Komisijos atstovybė Lietuvoje,Europos Komisijos atstovybė Lietuvoje,≤100
1119271974749710,Grąžinti verta,These ads ran without a disclaimer,≤100
147547541961576,Council of the European Union,Council of the European Union,≤100
202360056491831,Lietuvos socialdemokratų partija - LSDP,Lietuvos socialdemokratų partija - LSDP,≤100
125379923659,Valdovų Rūmai,Palace of the Grand Dukes of Lithuania (Nacionalinis muziejus Lietuvos Didžiosios Kunigaikštystės valdovų rūmai),≤100