Page ID,Page name,Disclaimer,Amount spent (VEF)
105327402529317,Adelitas Del Estado De Chihuahua,These ads ran without a disclaimer,13889
100520825048827,Movant Connection,These ads ran without a disclaimer,7875
11449543593,Carlos Ocariz,an advertiser in Venezuela,≤100
106297255064534,Julio Fuenmayor,an advertiser in Venezuela,≤100
37896015468,"Embajada de los EE.UU., Venezuela",an advertiser in Venezuela,≤100
378036902617379,ATFX,These ads ran without a disclaimer,≤100
288558181158008,"Rigzone.com is The Leader in Oil & Gas Jobs, News, Oil Prices, and Events.",These ads ran without a disclaimer,≤100