Page ID,Page name,Disclaimer,Amount spent (USD)
179916515749362,FIP - Փաստերի ստուգման հարթակ,Union of Informed Citizens NGO,≤100
330537565808,Tert.am,Tert.am LLC,≤100
117883984992205,ՀՀ արդարադատության նախարարություն/Ministry of Justice of Armenia,ՀՀ արդարադատության նախարարություն/Ministry of Justice of Armenia,≤100
195018463901371,CivilNet,CivilNet,≤100
108837171601077,Վալոդյա Գրիգորյան/Valodya Grigoryan,Country to live party,≤100
101335822727152,ԵՄ-Հայաստան քաղհասարակության պլատֆորմ/EU-Armenia Civil Society Platform,These ads ran without a disclaimer,≤100
101286118673417,sherenemelania,These ads ran without a disclaimer,≤100
103966819118750,evn_pocket_gardens,These ads ran without a disclaimer,≤100