Page ID,Page name,Disclaimer,Amount spent (USD)
124751345729116,Presidencia de la República Dominicana,Presidencia de la República Dominicana,≤100
100441899588408,Partido Renovador Reformista PRR,Paritdo Renovador Reformista,≤100
167878593236712,UNICEF en español,UNICEF con créditos publicitarios de Facebook,≤100
109833958271703,Bancada de Centro,Bancada de Centro,≤100
100151225919146,Homero Figueroa G,Le Black Room,≤100
123397997671209,Listín Diario,Alejandro Jose Madera Rodriguez,≤100
68793499001,UNICEF,UNICEF with Facebook Ad Credits,≤100
102739112342896,masluis2024,Junior Bernavel Poche Mariñez,≤100
103478302551600,Jesús Vargas Regidor,Jesus Vargas,≤100