Page ID,Page name,Disclaimer,Amount spent (VND)
101071576108959,An Viên Hà Nội - Chuyên Khoa Suy Giãn Tĩnh Mạch Hàng Đầu Việt Nam,These ads ran without a disclaimer,16168
111831663772285,BOMvn,BOMvn,3308
105845511087981,TRUYỀN HÌNH AN VIÊN,TRUYỀN HÌNH AN VIÊN,1742
105062615490802,Thượng Tọa Thích Đức Thiện,Thượng Tọa Thích Đức Thiện,919
104640271243082,Bách Hóa Ăn Dặm,Bách Hóa Ăn Dặm,806
919479674872321,Báo Nghệ An,Báo Nghệ An,749
1813090249021573,Nguyễn Trọng Quỳnh,These ads ran without a disclaimer,706
101865258169428,ĐEN Secondhand,ĐEN Secondhand,≤100