Page ID,Page name,Disclaimer,Amount spent (JPY)
1904070096535109,スマート選挙,株式会社センキョ,906
104639837578646,THE OWNER,These ads ran without a disclaimer,571
475681929154100,国連UNHCR協会,国連UNHCR協会,216
1899665293632534,チームラボ採用 / teamLab Recruit,These ads ran without a disclaimer,121
208661552479830,日本財団,Shigeru Fujita,≤100
239558679475625,株式会社トマス技術研究所,Kenji Fukutomi,≤100
382249355166494,講談社BOOK倶楽部,株式会社講談社,≤100
1615481598672156,Blueair Japan Official,These ads ran without a disclaimer,≤100
1615731718654167,Marubeni Corporation／丸紅株式会社,These ads ran without a disclaimer,≤100
236792844915124,Symview-シムビュー,These ads ran without a disclaimer,≤100
104533215755145,ZOE_Japan,ZOE Japan,≤100
111759777259677,ローカル・マニフェスト推進連盟,健輔 山内,≤100
544991069308243,日本投資機構株式会社,These ads ran without a disclaimer,≤100
380393902016138,日の出屋製菓,These ads ran without a disclaimer,≤100
1672330153015605,透明アクリル業者票,アドアチーブ株式会社,≤100
676655469036670,松下政経塾,松下政経塾,≤100
1607696895913679,日経プラス９サタデー　ニュースの疑問,Takamasa Kikawa,≤100
115368986979547,共感がお金に変わる魔法の授業,These ads ran without a disclaimer,≤100