Page ID,Page name,Disclaimer,Amount spent (JPY)
311759352350356,立憲民主党鳥取県第2区総支部,Shunji Yuhara,2605
1904070096535109,スマート選挙,株式会社センキョ,491
475681929154100,国連UNHCR協会,国連UNHCR協会,316
208661552479830,日本財団,Shigeru Fujita,270
239558679475625,株式会社トマス技術研究所,Kenji Fukutomi,≤100
543662599325014,地方移住・関係人口創出のプラットフォーム【ネイティブ. メディア】,ネイティブ株式会社,≤100
579187028792625,社長と会社の手元現金を増やす仕組みづくりの専門家,社長と会社の手元現金を増やす仕組みづくりの専門家,≤100
115053374813920,BizFul/ビズフル - ビジネスに役立つ資料が見つかる,株式会社ビズフル,≤100
1607696895913679,日経プラス９サタデー　ニュースの疑問,Takamasa Kikawa,≤100
464822496891330,いい投票／e投票,株式会社グラント,≤100
104533215755145,ZOE_Japan,ZOE Japan,≤100
676655469036670,松下政経塾,松下政経塾,≤100
288385447888433,公益財団法人モラロジー道徳教育財団,公益財団法人モラロジー道徳教育財団,≤100
881025135256351,Japan In-depth,Japan In-depth,≤100
1652747391657865,山浦英太（横浜市会議員　戸塚区）,Yamaura  Eita,≤100
100251962938282,スピリチュアル心理,These ads ran without a disclaimer,≤100
151214938794853,ミエセン,ジャッグジャパン株式会社,≤100