Page ID,Page name,Disclaimer,Amount spent (PYG)
102266292553995,Sucia Política,Diego Ricardo Ramírez,2859
325540631525675,En La Tecla,En la Tecla,1810
106721948731693,Prof. Aldo Centurión López,Prof. Aldo Centurión López,791
1151984808290856,Hugo Portillo,Hugo Portillo,709
104456201144006,Alba Oviedo,Alba Nieve Oviedo De Torres,370
105545157610039,Euclides Acevedo,Euclides Roberto Acevedo Candia,298
517426394969535,Ricardo Canese,Ricardo Canese,286
103040788902949,Concertación Nacional 2023,Rocio Magali Moreno Vera,195
363306313879750,Marle Chispita Orue,Marlene Tatiana Orue Leon,109
235526436573168,Ing. Eche Tu Diputado,Adalberto Pastor Echeverría Villasboa,≤100
278226125974096,El Paraguayo Independiente,Paraguayo Independiente,≤100
359307964420456,Terere Cómplice,Meli Olavarrieta,≤100
107706177740738,Periodismo 29,Periodismo 29,≤100
150741961754512,Mercedes Canese Antúnez,Mercedes Canese,≤100
101840779897426,Cristian Cardozo,Cristian Antonio Cardozo Villalba,≤100
107892591960886,Lorena Barrios Concejal Departamental,Lorena Barrios,≤100
724051717643013,Miguel Prieto,Celso Kevin Ramon Sánchez Florentin,≤100
109400298573862,Dr. Víctor Ocampos Gobernador Paraguarí,Victor Luis Ocampos Gómez,≤100
1615736141794497,Luis Portillo,These ads ran without a disclaimer,≤100
107472138771407,Roque Avalos Concejal,Roque Jacinto Avalos Rojas,≤100
101359268928132,Dr Juan Benitez,Juan Ramon Benitez Rios,≤100
105872245439208,Pelusa Senadora,Maria Yolanda Del Rosario Moreno de Ruíz,≤100
1753251591598763,Dani Mujica,Celso Kevin Ramon Sánchez Florentin,≤100
1468570519872644,Santiago Peña,PRANA SA,≤100
1441704549436832,Regina Rios,Regina Rios Irala,≤100
338961084535,WWF Paraguay,WWF Paraguay,≤100
430961180344844,EVER VILLALBA,Ever Federico Villalba Martinez,≤100
101434362823135,rolandoprusak,These ads ran without a disclaimer,≤100
227622537655549,CGTN en Español,These ads ran without a disclaimer,≤100
106236005306369,bolzancibersecurityacademy,These ads ran without a disclaimer,≤100
108982768685910,Cynthia Rios Candidata,Wilson Armoa,≤100