Page ID,Page name,Disclaimer,Amount spent (USD)
519608978084713,Ghana Education Trust Fund,Ghana Education Trust Fund (GETFund),≤100
1885114401706195,Dr. Matthew Opoku Prempeh,Dr. Matthew Opoku Prempeh,≤100
68793499001,UNICEF,These ads ran without a disclaimer,≤100
102618778592624,Come Unto Christ In West Accra,Come Unto Christ In West Accra,≤100
105713881570703,Ernest Kobeah,Ernest Kobeah,≤100
101024679602487,TK Dzimega,These ads ran without a disclaimer,≤100
102179325363565,Samuel A. Jinapor,Samuel Abdulai Jinapor,≤100