Page ID,Page name,Disclaimer,Amount spent (USD)
110921815217530,Óscar Domínguez,Ministerio de Agricultura y Ganadería,≤100
890916994384759,Rafael Arévalo,Rafael Edgardo Arévalo González,≤100
348470785241655,Ministerio de Agricultura y Ganadería de El Salvador,Ministerio de Agricultura y Ganadería de El Salvador,≤100
100524251686344,Gustavo Acevedo,Gustavo Jose Acevedo Berganza,≤100
162379173778716,Alcaldía de San Salvador,Alcaldía de San Salvador,≤100
643513979193133,Unidos por Beatriz,Neuma,≤100
269601400112823,Raúl Chamagua,Jose Raúl Chamagua Noyola,≤100
102681318100638,Juan Carlos Zepeda Marroquín,Juan Carlos Zepeda Marroquin,≤100
107341240841296,Efraín Guatemala,Rikrdo Lopez,≤100
285530825204,Klitschko,These ads ran without a disclaimer,≤100
747420075340256,El Agricultor Primero,These ads ran without a disclaimer,≤100