Page ID,Page name,Disclaimer,Amount spent (VEF)
37896015468,"Embajada de los EE.UU., Venezuela",an advertiser in Venezuela,1444999
341721517096411,Radio Asamblea Nacional,an advertiser in Venezuela,750000
148231808588187,Gatorade Venezuela,an advertiser in Venezuela,500000
102901055579612,Alcaldia Alberto Adriani,an advertiser in Venezuela,250000
137784086302022,El Venezolano de Panamá,These ads ran without a disclaimer,≤100
100426612940178,Concejo Municipal de San Diego,an advertiser in Venezuela,≤100
270082823183144,Canton Fair,These ads ran without a disclaimer,≤100
249715249055539,Leonardo Trechi,These ads ran without a disclaimer,≤100