Page ID,Page name,Disclaimer,Amount spent (HNL)
107658657801543,Ariel Montoya,Oscar Ariel Montoya Rodezno,≤100
349524351841734,Cárlenton Dávila,Jose Carlenton Davila Mondragon,≤100
138641796219203,Aves Honduras - ASHO,Aves Honduras - ASHO,≤100
109580408013707,Francisco Flores,Francisco Miguel Flores Guifarro,≤100
153003381515332,Cespad - Centro de Estudio para la Democracia,Centro de Estudio para la Democracia (Cespad),≤100
100699988762231,ramonfcarranzad,These ads ran without a disclaimer,≤100
109459948457740,Gustavo Caceres Diputado,Gustavo Alberto Caceres Banegas,≤100
1392592317738074,Jorge Cálix,Jorge Cálix,≤100