Page ID,Page name,Disclaimer,Amount spent (THB)
296508406790,"Democrat Party, Thailand พรรคประชาธิปัตย์","Democrat Party, Thailand พรรคประชาธิปัตย์",≤100
104427797605274,ดร.เฉลิมชัย ศรีอ่อน รัฐมนตรีว่าการกระทรวงเกษตรและสหกรณ์,ดร.เฉลิมชัย ศรีอ่อน รัฐมนตรีว่าการกระทรวงเกษตรและสหกรณ์,≤100
622674297897819,Screenshirt2020,Screenshirt2020,≤100
1105604039583762,Line One สว.นท. ขอเชิญส่งประวัติ ส่วนตัว องค์กร เพื่อเข้ารับรางวัลประจำปี,Suksan Booran,≤100
102807719039442,พรรครวมไทยสร้างชาติ United Thai Nation Party,พรรครวมไทยสร้างชาติ United Thai Nation Party,≤100
157659344260788,จุรินทร์ ลักษณวิศิษฏ์ Aoodda,Ruthaikan Tanomkerd,≤100
257083724467673,ยุทธพล  อังกินันทน์,ยุทธพล อังกินันทน์,≤100
542226425847003,DGA Thailand,These ads ran without a disclaimer,≤100
161651553861945,Amnesty International Thailand,Amnesty International Thailand,≤100
111341764925564,สำนักสนับสนุนการพัฒนาระบบสุขภาพ - สำนัก 7 สสส.,สำนักสนับสนุนการพัฒนาระบบสุขภาพ - สำนัก 7 สสส.,≤100
107612328588715,The Voters,สันติสุข กาญจนประกร,≤100
103986582301984,เนื้อ นา บุญ,Phrathanakrit Upachai,≤100
100786134895717,เสื้อแตงโม By Khamma บูติค,พรทิพย์ กันทะปัน,≤100
241115389300595,คุณหญิงสุดารัตน์ เกยุราพันธุ์ Sudarat Keyuraphan,คุณหญิงสุดารัตน์ เกยุราพันธุ์ Sudarat Keyuraphan,≤100
112969264517494,เพ็ญพิสุทธิ์ จินตโสภณ - Penpisut Jintasophon,Vatcharapong Wongkom,≤100
345127652279503,มูลนิธิสากลเพื่อคนพิการ,มูลนิธิสากลเพื่อคนพิการ,≤100
101535845426970,พรรคไทยสร้างไทย,พรรคไทยสร้างไทย,≤100
493026767870664,พรรคพลังประชารัฐ,พรรคพลังประชารัฐ,≤100
100298682713615,เสื้อวินเทจ ลายมัน ผ้าดำ,เสื้อวินเทจ ลายมัน ผ้าดำ,≤100
108553605171587,อ้อ อรทัย เกิดทรัพย์ - ภูเก็ต,อ้อ อรทัย เกิดทรัพย์ - ภูเก็ต,≤100
107287682234545,เพื่อนตำรวจ,These ads ran without a disclaimer,≤100
152665702176493,Ringsideการเมือง,Ringsideการเมือง,≤100
1635406246730420,วรงค์ เดชกิจวิกรม - Warong Dechgitvigrom,วรงค์ เดชกิจวิกรม - Warong Dechgitvigrom,≤100
601953326929372,ธัญวัจน์ กมลวงศ์วัฒน์ - Tunyawaj Kamolwongwat,Tunyawaj Kamolwongwat,≤100
103668907891539,การเมือง Kanmuang,การเมือง Kanmuang,≤100
190923294988741,สอบครูผู้ช่วยนะ,สอบครูผู้ช่วยนะ,≤100
567743816917663,The Article,The Article,≤100
616175001768977,aomMONEY,These ads ran without a disclaimer,≤100
108508377637861,มุ้งจีบพระราม2 โรงงานผลิตมุ้งจีบ มุ้งลวด เหล็ดดัดทุกชนิด,กุหลาบ บัวสด,≤100
102200742249872,อาจารย์ป๊อป สอนออนไลน์s.4.1/4,ไพทวน ยาวาปี,≤100
106561034744198,ลอรี่ - พงศ์พล ยอดเมืองเจริญ,ลอรี่ - พงศ์พล ยอดเมืองเจริญ,≤100
232025966942314,ดร.สามารถ ราชพลสิทธิ์ - Dr.Samart Ratchapolsitte,These ads ran without a disclaimer,≤100