Page ID,Page name,Disclaimer,Amount spent (USD)
103544829416602,"San Pedro Women, Youths & Children Affairs","San Pedro Women, Youths & Children Affairs",≤100
1439827996248795,Belize City Council,Belize City Council,≤100
111113447867154,The Daily Dose,These ads ran without a disclaimer,≤100
110677194902720,Ok Reading,These ads ran without a disclaimer,≤100
103440071784916,The Dancing Cucumber Center,These ads ran without a disclaimer,≤100
1027626217435226,Richouses,These ads ran without a disclaimer,≤100