Page ID,Page name,Disclaimer,Amount spent (USD)
100228192530865,حزب الوحدة الشعبية الديمقراطي الأردني,حزب الوحدة الشعبية الديمقراطي الأردني,≤100
107141858896307,Rewell Society,Rewell Society,≤100
218834391531386,Ihqaq -  إحقاق,Islam Abdul-karim,≤100
521303771314889,وزارة الصناعة و التجارة و التموين الاردنية Mit.gov.jo,Muhanad Alomyan,≤100
789830274365101,Dr. Yacoub Nasereddin,These ads ran without a disclaimer,≤100
101134569517831,fatima.al.mktom,These ads ran without a disclaimer,≤100
109727775093270,Cralm namre fror nreck,These ads ran without a disclaimer,≤100
108574915370949,Overhear kiddingly,These ads ran without a disclaimer,≤100