Page ID,Page name,Disclaimer,Amount spent (USD)
1584183878552505,Institute for Strategy and Policy- Myanmar,an advertiser in Myanmar,≤100
111789443531410,Wai Yan Aung,These ads ran without a disclaimer,≤100
102979191111423,Toe Toe Phaw,an advertiser in Myanmar,≤100
110456411440371,Doh Hlay,an advertiser in Myanmar,≤100
395933837270620,Tet Luu Kyaw - တက်လူကျော် စာပေ,an advertiser in Myanmar,≤100
102964401580933,Rehmonnya Institute for Civic Engagement - RICE,These ads ran without a disclaimer,≤100