Page ID,Page name,Disclaimer,Amount spent (USD)
109854728594212,برنامج تحديث القطاع العام,برنامج تحديث القطاع العام,≤100
102931605845722,تيار وطني يهدف لتأسيس حزب باسم العمل,حزب العمل,≤100
103323581486845,النائب سليمان موسى ابو يحيى,Sleman Abuyahia,≤100
104343205670775,حزب إرادة - تحت التأسيس,حزب إرادة - تحت التأسيس,≤100
664477853670759,المكتب الاعلامي للنائب معتز ابورمان,Moutaz Abu Rumman,≤100
905208189574429,We Rise Center for Sustainable development- مركز نحن ننهض للتنمية المستدامة,We Rise Center for Sustainable development- مركز نحن ننهض للتنمية المستدامة,≤100
107141858896307,Rewell Society,Rewell Society,≤100
114234114894674,Minassat - منصات,minassat digital media,≤100
1088726734495568,جريدة الاهالي,These ads ran without a disclaimer,≤100