Page ID,Page name,Disclaimer,Amount spent (HNL)
2180582345316242,Secretaría de Desarrollo Social,Secretaria de Estado en el Despacho de Desarrollo Social,≤100
349524351841734,Cárlenton Dávila,Jose Carlenton Davila Mondragon,≤100
919092984894463,Partido Salvador de Honduras,Cordelia Ordoñez,≤100
1392592317738074,Jorge Cálix,Jorge Cálix,≤100
486382251906084,Honduras El Pais,Diario El  Pais.hn,≤100
1803279899993382,"Ni Una Palmadita, Fernanda Restrepo",These ads ran without a disclaimer,≤100
333541433377510,Plastico.com,These ads ran without a disclaimer,≤100
104599735671754,Goberna Honduras,Goberna Honduras,≤100
100520825048827,Movant Connection,These ads ran without a disclaimer,≤100