Page ID,Page name,Disclaimer,Amount spent (EUR)
122344957784863,Amnistia Internacional Portugal,Amnistia Internacional Portugal,≤100
197936253581591,Fundação Francisco Manuel dos Santos,Fundação Francisco Manuel dos Santos,≤100
107898832590939,European Commission,European Commission,≤100
347829038571812,Aldeias de Crianças SOS Portugal,Aldeias de Crianças SOS Portugal,≤100
127925800618165,Socialists and Democrats Group in the European Parliament,Socialists and Democrats Group in the European Parliament,≤100
170400489279,Representação da Comissão Europeia em Portugal,Representação da Comissão Europeia em Portugal,≤100
54779960819,United Nations,United Nations with Facebook Ad Credits,≤100