Page ID,Page name,Disclaimer,Amount spent (VND)
108390095364515,Phạm Văn Thanh- Đặc Trị Xương Khớp,These ads ran without a disclaimer,20815
654396084640049,IMM GROUP,IMM Group,15505
1127821033978868,Xóm Hóng,These ads ran without a disclaimer,13542
425181617530046,Lớp Toeic Thầy Long,These ads ran without a disclaimer,≤100
106864984981716,Tài liệu ôn thi viên chức giáo viên TP. HCM,Tài liệu ôn thi viên chức giáo viên TP. HCM,≤100
105310469026814,Nhật Bản Chờ Tôi Nhé,These ads ran without a disclaimer,≤100