Page ID,Page name,Disclaimer,Amount spent (VND)
114658477052849,Lương Y Việc Tử Tế VTV 1 - Phạm Văn Thanh,These ads ran without a disclaimer,70023
110734615258316,Trung Tâm Điều Trị U - Triệt Tiêu Các Tế Bào Ung Thư Số 2,These ads ran without a disclaimer,31433
106475068390652,Thầy Phạm Văn Thanh - Hiệu Thuốc Hoàng Liên Sơn,These ads ran without a disclaimer,30412
108390095364515,Phạm Văn Thanh- Đặc Trị Xương Khớp,These ads ran without a disclaimer,7276
1831330046916094,Tuyển Dụng Giáo Viên Hà Nội,Tuyển Dụng Giáo Viên Hà Nội,3131
953482191475322,Cảnh Báo Chứng Khoán 68 - CK68,These ads ran without a disclaimer,724