Page ID,Page name,Disclaimer,Amount spent (USD)
114166553658738,Olmedo E Guillén,Olmedo Enrique Guillen Anguizola,≤100
327804570952589,Partido Alianza,Partido Alianza,≤100
106775568769729,Goberna Panamá,Goberna Panamá,≤100
1998079943602873,Espacio Cívico,Maria Gabriela Fong Ali,≤100
105740931681717,Centro de Excelencia Educativa de Panamá,Natalia Endara,≤100
68793499001,UNICEF,These ads ran without a disclaimer,≤100
627254007695823,HUB News,These ads ran without a disclaimer,≤100
106300075678269,Nación Pensante,These ads ran without a disclaimer,≤100