Page ID,Page name,Disclaimer,Amount spent (VND)
105845511087981,TRUYỀN HÌNH AN VIÊN,TRUYỀN HÌNH AN VIÊN,9687
106476091689860,Bartra Wealth Advisors,Bartra Wealth Advisors,8094
1647630882127400,Nhân đạo VTV1,These ads ran without a disclaimer,314
101865258169428,ĐEN Secondhand,ĐEN Secondhand,299
106596131892463,Trầm Hương Thiên Mộc Hương - Hà Nội,These ads ran without a disclaimer,290
100190251454228,Bình Bán Book,These ads ran without a disclaimer,≤100
974896235961055,UPL-Ltd,These ads ran without a disclaimer,≤100