Page ID,Page name,Disclaimer,Amount spent (VND)
102726939281075,Đồ bộ đẹp trung niên 2,These ads ran without a disclaimer,55309
105456375620326,Phòng Tuyển Sinh - Vilaco,These ads ran without a disclaimer,4696
105845511087981,TRUYỀN HÌNH AN VIÊN,TRUYỀN HÌNH AN VIÊN,4443
106476091689860,Bartra Wealth Advisors,Bartra Wealth Advisors,627
105062615490802,Thượng Tọa Thích Đức Thiện,Thượng Tọa Thích Đức Thiện,509
101865258169428,ĐEN Secondhand,ĐEN Secondhand,251
919479674872321,Báo Nghệ An,Báo Nghệ An,140
19740928752,World Animal Protection,These ads ran without a disclaimer,≤100