Page ID,Page name,Disclaimer,Amount spent (VND)
104640271243082,Bách Hóa Ăn Dặm,Bách Hóa Ăn Dặm,1085
105062615490802,Thượng Tọa Thích Đức Thiện,Thượng Tọa Thích Đức Thiện,747
280124715749325,Sự Thật Về Pháp Luân Công,These ads ran without a disclaimer,452
919479674872321,Báo Nghệ An,Báo Nghệ An,209
109311801378953,1000 Bài Học Danh Nhân - Những Bài Học Vĩ Đại Từ Những Người Vĩ Đại,These ads ran without a disclaimer,≤100
101865258169428,ĐEN Secondhand,ĐEN Secondhand,≤100
109432751532773,Lương Y Phạm Văn Thanh 166 Hàm Nghi Lào Cai,These ads ran without a disclaimer,≤100
378454888947214,Roxtec Group,These ads ran without a disclaimer,≤100