Page ID,Page name,Disclaimer,Amount spent (KES)
600979883334883,Hon. Zaheer Jhanda Mp Nyaribari Chache,Hon. Zaheer Jhanda Mp Nyaribari Chache,≤100
100885769269937,Hon. Brenda Kraido Majune,Hon. Brenda Kraido Majune,≤100
105833652399018,Maina Karobia,Mwangi Godfrey Maina,≤100
1506723769658512,Susan Kihika,Susan Kihika,≤100
100951662795304,"Learn, Grow, and Business",These ads ran without a disclaimer,≤100
28312410177,World Food Programme,These ads ran without a disclaimer,≤100
180530218760,masifunde learner development,These ads ran without a disclaimer,≤100