Page ID,Page name,Disclaimer,Amount spent (USD)
417555479037006,PPSG TECH Pvt. Ltd.,PPSG TECH Pvt. Ltd.,≤100
350672214987048,PI Academy for Engineering and CSIT Entrance,PI Academy for Engineering and CSIT Entrance,≤100
106683901323122,Janaki Television HD,Rahmat Rain,≤100
105766678937447,Ruling News of Ghorahi,Abhishek Bista,≤100
333426070147135,Benny Kuriakose Associates,These ads ran without a disclaimer,≤100
462848513792011,国家大剧院National Centre for the Performing Arts,These ads ran without a disclaimer,≤100