Page ID,Page name,Disclaimer,Amount spent (USD)
109604544889317,गुरुमन्त्र एकेडेमी Gurumantra Academy,गुरुमन्त्र एकेडेमी Gurumantra Academy,≤100
417555479037006,PPSG TECH Pvt. Ltd.,PPSG TECH Pvt. Ltd.,≤100
1414802032117321,South Asian Regional Trade Union Council,South Asian Regional Trade Union Council,≤100
149255008546296,Govinda Giri,Govinda Giri,≤100
130136833750497,IELTS Official,These ads ran without a disclaimer,≤100
348826502286119,Nepal Samaya,Jiwan Timsina,≤100
8669021235,"Keane Southard, Composer",These ads ran without a disclaimer,≤100
430258463820053,International School of Ministry with Pastor Chris,These ads ran without a disclaimer,≤100