Page ID,Page name,Disclaimer,Amount spent (TND)
141662475911566,Instance Supérieure Indépendante pour les Élections - ISIE,Instance Supérieure Indépendante pour les Élections - ISIE,≤100
109648084665010,انور الطعلوش الصفحة الرسمية,Kiwi Softwares,≤100
124252504303223,UNICEF (FR),UNICEF avec des crédits publicitaires Facebook,≤100
166178460072395,اليونيسف بالعربية - UNICEF in Arabic,اليونيسف باستخدام اعتمادات الإعلان على الفيسبوك,≤100
68793499001,UNICEF,UNICEF with Facebook Ad Credits,≤100
472130523587683,Dhafer Sghiri - ظافر الصغيري,Dhafer Sghiri - ظافر الصغيري,≤100
565225540184937,CGTN,These ads ran without a disclaimer,≤100