Page ID,Page name,Disclaimer,Amount spent (THB)
157659344260788,จุรินทร์ ลักษณวิศิษฏ์ Aoodda,Jurin Laksanawisit,≤100
2105350112863264,ร้อยเอก ดร.จองชัย วงศ์ทรายทอง - ผู้กองเบิร์ด,ร้อยเอก ดร.จองชัย วงศ์ทรายทอง - ผู้กองเบิร์ด,≤100
101535845426970,พรรคไทยสร้างไทย,พรรคไทยสร้างไทย,≤100
102807719039442,พรรครวมไทยสร้างชาติ United Thai Nation Party,พรรครวมไทยสร้างชาติ United Thai Nation Party,≤100
204016840519336,ศ.ดร.นฤมล ภิญโญสินวัฒน์,ศ.ดร.นฤมล ภิญโญสินวัฒน์,≤100
296508406790,"Democrat Party, Thailand พรรคประชาธิปัตย์","Democrat Party, Thailand พรรคประชาธิปัตย์",≤100
116679231319335,ตุ๊ก - กานสินี,Dunyawat  Bamrungchan,≤100
104908418629549,EnableSurvey,"Excellent Digital Development Co.,Ltd.",≤100
115922723434700,ครูเจพีสรุปย่อ for Teacher,ครูเจพีสรุปย่อ for Teacher,≤100
216147078543372,สำนักงานคณะกรรมการการเลือกตั้ง,สำนักงานคณะกรรมการการเลือกตั้ง,≤100
241115389300595,คุณหญิงสุดารัตน์ เกยุราพันธุ์ Sudarat Keyuraphan,คุณหญิงสุดารัตน์ เกยุราพันธุ์ Sudarat Keyuraphan,≤100
100530401779420,พรรคไทยภักดี,พรรคไทยภักดี,≤100
102530815945359,องอาจ วชิรพงศ์,Areeya Namdokmai,≤100
108553605171587,อ้อ อรทัย เกิดทรัพย์ - ภูเก็ต,อ้อ อรทัย เกิดทรัพย์ - ภูเก็ต,≤100
846980862056290,Tami,These ads ran without a disclaimer,≤100
112073738279329,สิงโต - ศักดิ์สิทธิ์ ขาวทอง,สิงโต - ศักดิ์สิทธิ์ ขาวทอง,≤100
622674297897819,Screenshirt2020,Screenshirt2020,≤100
107612328588715,The Voters,สันติสุข กาญจนประกร,≤100
101178062238439,ณณัฏฐ์ หงษ์ชูเวช กิ๊ก,ณณัฏฐ์ หงษ์ชูเวช กิ๊ก,≤100
876168575848382,U-Report Thailand,UNICEF Thailand,≤100
496992307468643,ฐิติกันต์ ฐิติพฤฒิกุล - Thitikan Thitipruethikul,ฐิติกันต์ ฐิติพฤฒิกุล - Thitikan Thitipruethikul,≤100
365923533756876,Kleens อกไก่ปั่น,สันตยุต ทองวิลาศ,≤100
108515294626891,สอบข้าราชการท้องถิ่น By Thurakan,Chiraphorn Thuree,≤100
109070798785512,วัดหนองระแหงเหนือ อุทัยธานี,These ads ran without a disclaimer,≤100
111270371545562,Songkran เสื้อยืดมือสอง USA ปลีก-ส่ง V.2,These ads ran without a disclaimer,≤100
190923294988741,สอบครูผู้ช่วยนะ,สอบครูผู้ช่วยนะ,≤100
100460666140804,ห้องเรียนครูกาย,Krunontipat Katpradit,≤100
3080161418691131,Thailand FACT Today,Thailand FACT Today,≤100
111341764925564,สำนักสนับสนุนการพัฒนาระบบสุขภาพ - สำนัก 7 สสส.,สำนักสนับสนุนการพัฒนาระบบสุขภาพ - สำนัก 7 สสส.,≤100
1105604039583762,Line One สว.นท. ขอเชิญส่งประวัติ ส่วนตัว องค์กร เพื่อเข้ารับรางวัลประจำปี,Suksan Booran,≤100
105125715202609,ส.ส.ไผ่ ลิกค์,ส.ส.ไผ่ ลิกค์,≤100
1635406246730420,วรงค์ เดชกิจวิกรม - Warong Dechgitvigrom,วรงค์ เดชกิจวิกรม - Warong Dechgitvigrom,≤100
601953326929372,ธัญวัจน์ กมลวงศ์วัฒน์ - Tunyawaj Kamolwongwat,Tunyawaj Kamolwongwat,≤100
106561034744198,ลอรี่ - พงศ์พล ยอดเมืองเจริญ,ลอรี่ - พงศ์พล ยอดเมืองเจริญ,≤100
142150192622068,Elite+ Magazine,These ads ran without a disclaimer,≤100
104224665030349,สุราษฎร์ต้องไปต่อ Go To The Future,ศิวัตม์ ใจเอื้อ,≤100
2263098807292933,ทนายศฤงคาร  ข่ายสุวรรณ์,Saringkan Khaisuwon,≤100
109720095237186,กษิรัช สุวรรณเพ็ญ - ประชาธิปัตย์ ตาก,Kasirat Suwanpen,≤100
114914794432449,กฎหมายใช้สอบราชการ by Æ+,กฎหมายใช้สอบราชการ by Æ+,≤100
279417352523067,กฤษณ สุนทรกิจพาณิชย์,Narong Thongphantha,≤100
110144991464196,กรอบลอยไวนิล แคนวาส บอร์ดไดคัท 99 บาท มีเก็บปลายทาง,Sakawtip Utha,≤100
101490328087087,Majesty,These ads ran without a disclaimer,≤100
102342747923923,Researchpod,These ads ran without a disclaimer,≤100