Page ID,Page name,Disclaimer,Amount spent (BSD)
137651823623470,Office of the Prime Minister - The Bahamas,The Office of The Prime Minister Bahamas,223
114606549484,Philip Brave Davis,The Office of The Prime Minister Bahamas,206
1025152104235573,Team Cooper - Chester Cooper,Isaac Chester Cooper,≤100
126205140373896,Valentine Dei,These ads ran without a disclaimer,≤100
116355337718182,Moli lulu,These ads ran without a disclaimer,≤100
100172476278127,Easy Study,These ads ran without a disclaimer,≤100