Page ID,Page name,Disclaimer,Amount spent (VND)
110773195056180,Quang Vinh,These ads ran without a disclaimer,7294
103462819259532,Xuất Khẩu Lao Động Nước Ngoài Phí Rẻ,These ads ran without a disclaimer,2498
105062615490802,Thượng Tọa Thích Đức Thiện,Thượng Tọa Thích Đức Thiện,1496
101865258169428,ĐEN Secondhand,ĐEN Secondhand,660
105845511087981,TRUYỀN HÌNH AN VIÊN,TRUYỀN HÌNH AN VIÊN,333
101957285428877,Thức Tỉnh,These ads ran without a disclaimer,255
105845511087981,TRUYỀN HÌNH AN VIÊN,These ads ran without a disclaimer,230
919479674872321,Báo Nghệ An,Báo Nghệ An,≤100