Page ID,Page name,Disclaimer,Amount spent (USD)
112477522422248,David Collado,David Collado,≤100
100441899588408,Partido Renovador Reformista PRR,Paritdo Renovador Reformista,≤100
100151225919146,Homero Figueroa G,Le Black Room,≤100
167878593236712,UNICEF en español,UNICEF con créditos publicitarios de Facebook,≤100
123397997671209,Listín Diario,Alejandro Jose Madera Rodriguez,≤100
109833958271703,Bancada de Centro,Bancada de Centro,≤100
106687624223989,Rescate Democratico,Rescate Democratico,≤100
68793499001,UNICEF,UNICEF with Facebook Ad Credits,≤100
532600796858736,Jean Luis Rodriguez,Jean Luis Rodriguez Jimenez,≤100
492966110748093,Su Mundo TV,Penelope Canario Herrera,≤100
101581852174318,Fuerza Digital,Fuerza del Pueblo,≤100
124252504303223,UNICEF (FR),UNICEF avec des crédits publicitaires Facebook,≤100
106050769450765,UNICEF República Dominicana,UNICEF República Dominicana,≤100
465691517186469,Noticias Nacionales RD,Angel Miguel Rivera Rijo,≤100
401144539898661,Fondo Marena,Nicolás Enrique Grullón Ubinas,≤100
108625789179165,Soi Dog Foundation,These ads ran without a disclaimer,≤100
103327914698887,Jeffrey Infante,Jeffrey Infante,≤100
103119027899256,Caribbean Climate-Smart Accelerator,These ads ran without a disclaimer,≤100
109177411981988,Influencias.do,These ads ran without a disclaimer,≤100
104376759188069,Agsky-scrape,These ads ran without a disclaimer,≤100
102527089089994,Reporte Médico,Gerardo Rafael Rodriguez Barreto,≤100
102739112342896,masluis2024,Junior Bernavel Poche Mariñez,≤100
280728805363715,Tesorería Nacional Dominicana,These ads ran without a disclaimer,≤100
364302183618093,Periódico Hoy,These ads ran without a disclaimer,≤100
166178460072395,اليونيسف بالعربية - UNICEF in Arabic,اليونيسف باستخدام اعتمادات الإعلان على الفيسبوك,≤100
101924172720353,La publicación de Investing,These ads ran without a disclaimer,≤100