Page ID,Page name,Disclaimer,Amount spent (BOB)
109201057318552,JCSV,Fernando Omar Rosales Perez,105
1967100150206417,Instituto de Formación Femenina Integral - IFFI,Maya Fatima Garcia Rodriguez,≤100
964080723662055,Carlos Subirana Responde,Editorial CSS,≤100
106403237850347,Goberna Bolivia,Goberna,≤100
269633369881331,Senador Rodrigo Paz,Gabriela Pacello Guillen,≤100
128794501288356,Estudia en Posgrado UPEA,These ads ran without a disclaimer,≤100
2328823850688165,José M. Ormachea,José M. Ormachea,≤100
101824857848955,Enrique Urquidi - Diputado,Enrique Fernando Urquidi Daza,≤100
105941541719195,Concejo Municipal de El Alto,Ronald Wilson Morales Llerena,≤100
517750071766113,SEDES - BENI,Cedecap Bolivia,≤100
370615526396567,Pablo Arízaga Ruiz,Walter Pablo Arizaga Ruiz,≤100
108683083934527,Emmanuel - Chatbot Profesional,These ads ran without a disclaimer,≤100
17043549797,MIT Technology Review,These ads ran without a disclaimer,≤100
127871740620547,Agustín Zambrana en El Bunker,Walter Agustin Zambrana Arze,≤100
103410222658639,adhoc_immigration,These ads ran without a disclaimer,≤100
183391831715311,Utel Universidad,These ads ran without a disclaimer,≤100
270082823183144,Canton Fair,These ads ran without a disclaimer,≤100
130336323685885,Gobernación de Santa Cruz,Gobernación de Santa Cruz,≤100