Page ID,Page name,Disclaimer,Amount spent (EUR)
122037308191612,Make.org,Make.org,≤100
105670034379791,Agence Régionale de Santé La Réunion,Agence Régionale de Santé La Réunion,≤100
1643015115962903,AB CONSULTANTS,AB CONSULTANTS,≤100
101807738445049,"Saint-André, Centre-ville d’Avenir","Saint-André, Centre-ville d’Avenir",≤100
102127572746339,Petronas Réunion,These ads ran without a disclaimer,≤100
763722197034246,En Développement,These ads ran without a disclaimer,≤100
1917715138510680,Follow Your Legend,These ads ran without a disclaimer,≤100
106684228815847,Africa's Green Economy Summit,These ads ran without a disclaimer,≤100