Page ID,Page name,Disclaimer,Amount spent (USD)
1885114401706195,Dr. Matthew Opoku Prempeh,Dr. Matthew Opoku Prempeh,≤100
519608978084713,Ghana Education Trust Fund,Ghana Education Trust Fund (GETFund),≤100
110674420604041,Dr. Kwabena Duffuor,Kwabena Duffuor,≤100
102618778592624,Come Unto Christ In West Accra,Come Unto Christ In West Accra,≤100
102179325363565,Samuel A. Jinapor,Samuel Abdulai Jinapor,≤100
427739974242140,Dr. Owusu Afriyie Akoto,Dr. Owusu Afriyie Akoto,≤100
2092924957605425,Solis,These ads ran without a disclaimer,≤100
301960393281716,Study International,These ads ran without a disclaimer,≤100