Page ID,Page name,Disclaimer,Amount spent (VND)
192195994956428,Tài Liệu Thi Viên Chức Giáo Viên,Tài Liệu Thi Viên Chức Giáo Viên,56396
101914358044085,Tài Liệu Ôn Thi Viên Chức Giáo Dục,Tài Liệu Ôn Thi Viên Chức Giáo Dục,26258
105845511087981,TRUYỀN HÌNH AN VIÊN,TRUYỀN HÌNH AN VIÊN,3904
105456375620326,Phòng Tuyển Sinh - Vilaco,These ads ran without a disclaimer,2113
919479674872321,Báo Nghệ An,Báo Nghệ An,1079
105062615490802,Thượng Tọa Thích Đức Thiện,Thượng Tọa Thích Đức Thiện,669
19740928752,World Animal Protection,These ads ran without a disclaimer,≤100