Page ID,Page name,Disclaimer,Amount spent (USD)
109854728594212,برنامج تحديث القطاع العام,برنامج تحديث القطاع العام,≤100
103323581486845,النائب سليمان موسى ابو يحيى,Sleman Abuyahia,≤100
1929306147386446,الحزب الديمقراطي الأجتماعي الأردني,الحزب الديمقراطي الأجتماعي الأردني,≤100
107564608061606,مبادرة رؤية ملك,These ads ran without a disclaimer,≤100
521303771314889,وزارة الصناعة و التجارة و التموين الاردنية Mit.gov.jo,Muhanad Alomyan,≤100
107141858896307,Rewell Society,Rewell Society,≤100
100997395395778,CoinsPaid Media,These ads ran without a disclaimer,≤100
56632622313,U.S. Mission Vienna,These ads ran without a disclaimer,≤100