Page ID,Page name,Disclaimer,Amount spent (THB)
414100949350619,ณัฐนันท์ กัลยาศิริ - ทนายบอน,ณัฐนันท์ กัลยาศิริ,1315
101274425792459,กิตติพงศ์ รวยฟูพันธ์ - ส.ก.ไอซ์ เขตทุ่งครุ,กิตติพงศ์ รวยฟูพันธ์ - ส.ก.ไอซ์ เขตทุ่งครุ,1243
102807719039442,พรรครวมไทยสร้างชาติ United Thai Nation Party,พรรครวมไทยสร้างชาติ United Thai Nation Party,1044
104427797605274,ดร.เฉลิมชัย ศรีอ่อน รัฐมนตรีว่าการกระทรวงเกษตรและสหกรณ์,ดร.เฉลิมชัย ศรีอ่อน รัฐมนตรีว่าการกระทรวงเกษตรและสหกรณ์,814
101178062238439,ณณัฏฐ์ หงษ์ชูเวช กิ๊ก,ณณัฏฐ์ หงษ์ชูเวช กิ๊ก,585
622674297897819,Screenshirt2020,Screenshirt2020,431
106872458897954,ระพีพัฒน์ สุเมธโชติเมธา,ระพีพัฒน์ สุเมธโชติเมธา,418
626952517700280,ลิ้ม ศรัณยสัณฑ์ วีรกุลสุนทร ว่าที่ผู้สมัคร ส.ส. เขตจอมทอง พรรคเพื่อไทย,ลิ้ม ศรัณยสัณฑ์ วีรกุลสุนทร ว่าที่ผู้สมัคร ส.ส. เขตจอมทอง พรรคเพื่อไทย,418
107449532000210,ธิติวัฐ อดิศรพันธ์กุล - Thitiwat Adisornphankul,ธิติวัฐ อดิศรพันธ์กุล - Thitiwat Adisornphankul,402
352318098651383,โตโต้ ปิยรัฐ - Piyarat Chongthep,These ads ran without a disclaimer,365
104014285798198,กานต์ กิตติอำพน,กานต์ กิตติอำพน,333
296508406790,"Democrat Party, Thailand พรรคประชาธิปัตย์","Democrat Party, Thailand พรรคประชาธิปัตย์",300
100624122148338,โรงพยาบาลรวมใจรักษ์ สุขุมวิท 62 Ruamjairak Hospital Sukhumvit 62,โรงพยาบาลรวมใจรักษ์ สุขุมวิท 62 Ruamjairak Hospital Sukhumvit 62,265
1635406246730420,วรงค์ เดชกิจวิกรม - Warong Dechgitvigrom,วรงค์ เดชกิจวิกรม - Warong Dechgitvigrom,261
115905241390909,เนเน่ รัดเกล้า สุวรรณคีรี,Rudklao Intawong Suwankiri,235
715838732136310,ธนเดช เพ็งสุข - Tanadej Pengsuk,Tanadej Pengsuk,235
183238185051108,อรรถวิชช์ สุวรรณภักดี,อรรถวิชช์ สุวรรณภักดี,194
113516956981172,ขจรศักดิ์ ประดิษฐาน,ขจรศักดิ์ ประดิษฐาน,145
106337912336664,ปั้น ณัทกร แก้วพิจิตร,ปั้น ณัทกร แก้วพิจิตร,140
102530815945359,ชูชีพ ตรีโภคา,Areeya Namdokmai,139
216147078543372,สำนักงานคณะกรรมการการเลือกตั้ง,สำนักงานคณะกรรมการการเลือกตั้ง,131
1105604039583762,Line One สว.นท. ขอเชิญส่งประวัติ ส่วนตัว องค์กร เพื่อเข้ารับรางวัลประจำปี,Suksan Booran,116
345127652279503,มูลนิธิสากลเพื่อคนพิการ,มูลนิธิสากลเพื่อคนพิการ,108
112969264517494,เพ็ญพิสุทธิ์ จินตโสภณ - Penpisut Jintasophon,Vatcharapong Wongkom,≤100
104134765098843,ทศพล โชติคุตร์ - ผกก.หนุ่ย,ทศพล โชติคุตร์ - ผกก.หนุ่ย,≤100
106561034744198,ลอรี่ - พงศ์พล ยอดเมืองเจริญ,ลอรี่ - พงศ์พล ยอดเมืองเจริญ,≤100
107612328588715,The Voters,สันติสุข กาญจนประกร,≤100
111109130324753,อโณทัยลูกทะเลปลาหมึกแห้ง1,These ads ran without a disclaimer,≤100
108354147624545,natfarouz,These ads ran without a disclaimer,≤100
129602281218084,Pongwat T. - ผู้สมัคร สส กทม เขต 6 พรรคเสรีรวมไทย,Pongwat Tunnukul,≤100
111341764925564,สำนักสนับสนุนการพัฒนาระบบสุขภาพ - สำนัก 7 สสส.,สำนักสนับสนุนการพัฒนาระบบสุขภาพ - สำนัก 7 สสส.,≤100
102477654678259,Givegoody,Pitiphat Sangngam,≤100
264065496937763,My Chavapol (ชวพล วัฒนพรมงคล),My Chavapol (ชวพล วัฒนพรมงคล),≤100
204016840519336,ศ.ดร.นฤมล ภิญโญสินวัฒน์,ศ.ดร.นฤมล ภิญโญสินวัฒน์,≤100
115922723434700,ครูเจพีสรุปย่อ for Teacher,ครูเจพีสรุปย่อ for Teacher,≤100
104909135396165,Phuthita Chaianun - พุธิตา ชัยอนันต์,Chavalit Laohaudomphan,≤100
877369462441031,ปูอัด ไชยามพวาน ว่าที่ผู้สมัคร ส.ส. เขตจอมทอง พรรคก้าวไกล,Chaiyamparwaan Manpianjit,≤100
2263098807292933,ทนายศฤงคาร  ข่ายสุวรรณ์,Saringkan Khaisuwon,≤100
108515294626891,สอบข้าราชการท้องถิ่น By Thurakan,Chiraphorn Thuree,≤100
172057439546202,พันโท สินธพ แก้วพิจิตร (เสธ.แก้ว),พันโท สินธพ แก้วพิจิตร (เสธ.แก้ว),≤100
108508377637861,มุ้งจีบพระราม2 โรงงานผลิตมุ้งจีบ มุ้งลวด เหล็ดดัดทุกชนิด,กุหลาบ บัวสด,≤100
109293730978064,พรรคก้าวไกล เชียงใหม่ - Move Forward Party Chiangmai,Visarut Sankham,≤100
229178137856991,ประเสริฐศรี ฮ้อแสงชัย ปทุมธานี,ประเสริฐศรี ฮ้อแสงชัย ปทุมธานี,≤100
157659344260788,จุรินทร์ ลักษณวิศิษฏ์ Aoodda,Jurin Laksanawisit,≤100
103493019318704,เพิ่มพงศ์ วงศ์ทรายทอง - เบลล์,เพิ่มพงศ์ วงศ์ทรายทอง,≤100
601953326929372,ธัญวัจน์ กมลวงศ์วัฒน์ - Tunyawaj Kamolwongwat,Tunyawaj Kamolwongwat,≤100
100545119426784,พีระพันธุ์ FC,Bunsong Rodyo,≤100
100298682713615,เสื้อวินเทจ ลายมัน ผ้าดำ,เสื้อวินเทจ ลายมัน ผ้าดำ,≤100
100240152175449,ป้าโส FC by Tacina,Dunyawat  Bamrungchan,≤100
114914794432449,กฎหมายใช้สอบราชการ by Æ+,กฎหมายใช้สอบราชการ by Æ+,≤100
105668122332322,บ้านสวน ควายไทย หนองบัวลำภู ในเครือ หจก เกษทองมา กรุ๊ป,These ads ran without a disclaimer,≤100
190923294988741,สอบครูผู้ช่วยนะ,สอบครูผู้ช่วยนะ,≤100
105888772350427,เครื่องชาร์จแบตเตอรี่รถยนต์ ใช้ได้ทั้งแบตเตอรี่ มอเตอร์ไซค์ และรถยนต์,Surin Phothiphoksampan,≤100
110144991464196,กรอบลอยไวนิล แคนวาส บอร์ดไดคัท 99 บาท มีเก็บปลายทาง,Sakawtip Utha,≤100
102628598609804,Jamiyyah Ulama Songkla Darussalam สภาอูลามาอฺสงขลาดารุสสลาม,These ads ran without a disclaimer,≤100
101814199471980,Danuch Tanterdtid,These ads ran without a disclaimer,≤100
111508197374332,ADB Southeast Asia Development Solutions - SEADS,These ads ran without a disclaimer,≤100
338109312883186,China Xinhua News,These ads ran without a disclaimer,≤100