Page ID,Page name,Disclaimer,Amount spent (VND)
109874745174543,Vàng Bạc Kim Ngọc Anh,These ads ran without a disclaimer,9672
101825789362820,Trung Tâm Điều Trị U - Triệt Tiêu Các Tế Bào Ung Thư 3,These ads ran without a disclaimer,1446
111267731617802,Lương Y Phạm Văn Thanh - Người Thầy Y Đức,These ads ran without a disclaimer,1107
105062615490802,Thượng Tọa Thích Đức Thiện,Thượng Tọa Thích Đức Thiện,906
101291915685026,Thầy Thuốc Nhân Dân Phạm Văn Thanh,These ads ran without a disclaimer,769
408751076538567,Thầy thuốc Phạm Văn Thanh - Sức Khỏe Cho Người Tiểu Đường,These ads ran without a disclaimer,426
105845511087981,TRUYỀN HÌNH AN VIÊN,Truyền hình Bchannel - BTV9 An Viên,352
111505864946076,"CH Football - Chuyên quần áo bóng đá, phụ kiện, dịch vụ in ấn, thêu logo",These ads ran without a disclaimer,132
107817672184695,Trần Bảo Khương,These ads ran without a disclaimer,112
479359388848657,KetnoiSingapore,These ads ran without a disclaimer,≤100
105454012331966,Chủ Tịch Vân Anh,These ads ran without a disclaimer,≤100
108685817326606,Truther Piece Official,These ads ran without a disclaimer,≤100
102834919202706,CAPRIHome - Furniture & Decor,These ads ran without a disclaimer,≤100