Page ID,Page name,Disclaimer,Amount spent (USD)
386469311494240,Իրազեկ քաղաքացիների միավորում - Union of Informed Citizens,Union of Informed Citizens NGO,≤100
336154206570851,Arsen Torosyan,Arsen Torosyan,≤100
330537565808,Tert.am,Tert.am LLC,≤100
115345034857569,Artur Simonyan / Արթուր Սիմոնյան,These ads ran without a disclaimer,≤100
195018463901371,CivilNet,CivilNet,≤100
127593214106236,HAYASTAN.news,These ads ran without a disclaimer,≤100
1675360659149686,University of Aberdeen School of Geosciences,These ads ran without a disclaimer,≤100
111679394767549,المشروع القومي لمشتقات البلازما,These ads ran without a disclaimer,≤100