Page ID,Page name,Disclaimer,Amount spent (USD)
149421481734737,"ACNUR, la Agencia de la ONU para los Refugiados",These ads ran without a disclaimer,110
616008265157883,JORGE PINTO D,Jorge Washington Pinto Davila,≤100
108657847619569,Goberna Ecuador,Goberna Ecuador,≤100
105539772365757,Mentordemy,Mentordemy,≤100
486957511486639,Liderazgo Capacitación Ecuador,These ads ran without a disclaimer,≤100
103612631457479,PUNTO SANO,Fabian Patricio Salazar Rios,≤100
148892085279230,David Sabando Elizalde,David Israel Sabando Elizalde,≤100
115012276965624,Daniel Noboa  Azin,Daniel Noboa Azin,≤100
101246514831028,Ojo al Concejo - Quito,Fundación Ciudadanía y Desarrollo,≤100
587012644654073,Alcaldía de Ibarra,Jacinto Roberto Salazar Valenzuela,≤100
195488207272178,Ciudadanía y Desarrollo,Ciudadanía y Desarrollo,≤100
111310177841570,Dr. Marcos Molina,Marcos Molina Jurado,≤100
120596301323465,Radio Sucre 700 AM,Radio Sucre 700 AM,≤100
81089852182,U.S. Embassy Ecuador,Embassies: U.S. Embassy Ecuador,≤100
171870950030850,Teodoro Gallegos Salem,Benigno Teodoro Gallegos Salem,≤100
1655058734779946,Consorcio de Municipios Amazónicos y Galápagos,Guillermo Geovanny Granda Tovar,≤100
101056676141616,Asesoría Política - Goberna Ecuador,Goberna Ecuador S.A.S,≤100
606448792700458,Instituto de Formación en Gastronomía Turismo Hoteleria GTH,Hugo Benalcázar,≤100
412892222115125,La Prensa Riobamba,These ads ran without a disclaimer,≤100
148963240630570,Tomas Zevallos,Tomás Tupacyupanqui Zevallos Vera,≤100
237469833662018,Observatorio Judicial Ecuador,Ciudadanía y Desarrollo,≤100
495225060514172,Degso,Gabriela Veronica Chango Hermoza,≤100
2221570604786246,Primicias,Primicias,≤100
102823644882450,Pedro Pablo Moran 2023,Pedro Pablo Moran Marchan,≤100
165042833621264,Schneider Electric,These ads ran without a disclaimer,≤100
101141362593364,CAM en Español,These ads ran without a disclaimer,≤100
185930698690529,Observatorio de Gasto Público,Ciudadanía y Desarrollo,≤100
616405925438411,GAD Municipal de El Empalme,Javier Guato Macias,≤100
206871509410716,Clacso - Consejo Latinoamericano de Ciencias Sociales,These ads ran without a disclaimer,≤100
105717484907163,she.bleeds.words,These ads ran without a disclaimer,≤100
534076950410152,Rosa Belén Mayorga,Jorge Campozano,≤100
2497449046945249,El Purgatorio,Denisse Murillo Alvarado,≤100
101765851519633,Martha Escobar Carbonelly,Martha Escobar Carbonelly,≤100
1917715138510680,Follow Your Legend,These ads ran without a disclaimer,≤100
747420075340256,El Agricultor Primero,These ads ran without a disclaimer,≤100
131189377574,MDPI,These ads ran without a disclaimer,≤100
311431722397745,Unión Integral y Democrática de todos los pueblos-MID,These ads ran without a disclaimer,≤100