Page ID,Page name,Disclaimer,Amount spent (CRC)
265843867173714,La Revista,La Revista,1379
643513979193133,Unidos por Beatriz,Neuma,598
116150003163125,Fundación Pollitos de Hierro - Ayuda a niños con cáncer - Costa Rica,Fundación Pollitos de Hierro,524
101128242614247,Dr. Rodolfo Brenes Vargas,Rodolfo Brenes Vargas,≤100
101736596126028,kateryna_palanska,These ads ran without a disclaimer,≤100
1540070352761579,Leslye Bojorges,Leslye Ruben Bojorges Leon,≤100
108388131575777,Fresia Agudelo,These ads ran without a disclaimer,≤100