Page ID,Page name,Disclaimer,Amount spent (VND)
103956025652503,Thế Giới Tài Chính 6.0,These ads ran without a disclaimer,23471
105510788949153,Đầu Tư Tài Chính Mới 5.0,These ads ran without a disclaimer,15726
280124715749325,Sự Thật Về Pháp Luân Công,Sự Thật Về Pháp Luân Công,11034
103517282662604,Edu VCCI esp,These ads ran without a disclaimer,836
1507429892822619,BOM Money,BOM Money,336
103403077832667,Hóng Express,Hóng Express,156
104241329078503,Đầu Tư Phát Triển Kinh Tế 6.0,These ads ran without a disclaimer,≤100