Page ID,Page name,Disclaimer,Amount spent (USD)
1935947973198237,Alcaldía El Paraíso Chalatenango,Alexi Antonio Escalante Galdamez,≤100
107990917616047,Saúl Mancía,Saúl Mancía,≤100
106733882018219,Consorcio Académico,These ads ran without a disclaimer,≤100
111826817167364,Nuevas Ideas Municipal Ciudad Delgado,Ernesto Antonio Ortiz,≤100
108213030904997,Ricardo Rivas,Ricardo Rivas,≤100
243382712951990,Andy Failer,These ads ran without a disclaimer,≤100
104458994617452,Claypots we are,These ads ran without a disclaimer,≤100