Page ID,Page name,Disclaimer,Amount spent (KES)
600979883334883,Hon. Zaheer Jhanda Mp Nyaribari Chache,Hon. Zaheer Jhanda Mp Nyaribari Chache,481
643875235632378,Boniface Mwangi,These ads ran without a disclaimer,127
123182861072147,Hon Musalia W Mudavadi,Michael Lulu Mudavadi,101
749501791796416,Hon. Wakili Njeri Maina,Jane Njeri Maina,≤100
105282877901533,Hon Vincent Machoka,Hon Vincent Machoka,≤100
105833652399018,Maina Karobia,Mwangi Godfrey Maina,≤100
116310878056949,Mandy Wong Chatgpt,These ads ran without a disclaimer,≤100