Page ID,Page name,Disclaimer,Amount spent (USD)
110456411440371,Doh Hlay,an advertiser in Myanmar,≤100
2074476209434546,Happy Healthy Myanmar  ပျော်ရွှင်ကျန်းမာ တို့မြန်မာ,an advertiser in Myanmar,≤100
1584183878552505,Institute for Strategy and Policy- Myanmar,an advertiser in Myanmar,≤100
912571352135610,UN-Habitat Myanmar,an advertiser in Myanmar,≤100
107515125279771,January12 Project,These ads ran without a disclaimer,≤100
112757083778788,"Economic Daily, China",These ads ran without a disclaimer,≤100