Page ID,Page name,Disclaimer,Amount spent (VND)
192195994956428,Tài Liệu Thi Viên Chức Giáo Viên,Tài Liệu Thi Viên Chức Giáo Viên,46725
101914358044085,Tài Liệu Ôn Thi Viên Chức Giáo Dục,Tài Liệu Ôn Thi Viên Chức Giáo Dục,27017
111831663772285,BOMvn,BOMvn,9608
105062615490802,Thượng Tọa Thích Đức Thiện,Thượng Tọa Thích Đức Thiện,5328
100190251454228,Bình Bán Book,These ads ran without a disclaimer,342
548398018590693,UNDP in Việt Nam,These ads ran without a disclaimer,≤100
101576356154191,Rain On The Red Flag,These ads ran without a disclaimer,≤100