Page ID,Page name,Disclaimer,Amount spent (PYG)
102266292553995,Sucia Política,Diego Ricardo Ramírez,6708
325540631525675,En La Tecla,En la Tecla,4270
1151984808290856,Hugo Portillo,Hugo Portillo,1875
517426394969535,Ricardo Canese,Ricardo Canese,1248
106721948731693,Prof. Aldo Centurión López,Prof. Aldo Centurión López,1168
105545157610039,Euclides Acevedo,Euclides Roberto Acevedo Candia,1013
103040788902949,Concertación Nacional 2023,Rocio Magali Moreno Vera,975
359307964420456,Terere Cómplice,Meli Olavarrieta,508
1753251591598763,Dani Mujica,Celso Kevin Ramon Sánchez Florentin,405
105872245439208,Pelusa Senadora,Maria Yolanda Del Rosario Moreno de Ruíz,347
278226125974096,El Paraguayo Independiente,Paraguayo Independiente,334
104456201144006,Alba Oviedo,Alba Nieve Oviedo De Torres,330
108246601026063,Derlis Rodríguez Diputado 2023,Derlis Manuel Rodríguez Baez,321
235526436573168,Ing. Eche Tu Diputado,Adalberto Pastor Echeverría Villasboa,296
107892591960886,Lorena Barrios Concejal Departamental,Lorena Barrios,294
101840779897426,Cristian Cardozo,Cristian Antonio Cardozo Villalba,290
724051717643013,Miguel Prieto,Celso Kevin Ramon Sánchez Florentin,288
150741961754512,Mercedes Canese Antúnez,Mercedes Canese,228
107706177740738,Periodismo 29,Periodismo 29,120
363306313879750,Marle Chispita Orue,Marlene Tatiana Orue Leon,111
109400298573862,Dr. Víctor Ocampos Gobernador Paraguarí,Victor Luis Ocampos Gómez,106
107472138771407,Roque Avalos Concejal,Roque Jacinto Avalos Rojas,≤100
1615736141794497,Luis Portillo,These ads ran without a disclaimer,≤100
101359268928132,Dr Juan Benitez,Juan Ramon Benitez Rios,≤100
1468570519872644,Santiago Peña,PRANA SA,≤100
108982768685910,Cynthia Rios Candidata,Wilson Armoa,≤100
430961180344844,EVER VILLALBA,Ever Federico Villalba Martinez,≤100
795079500550035,Diário do Povo Online,These ads ran without a disclaimer,≤100
1441704549436832,Regina Rios,Regina Rios Irala,≤100
131347596900240,Servindi,These ads ran without a disclaimer,≤100