Page ID,Page name,Disclaimer,Amount spent (THB)
161651553861945,Amnesty International Thailand,Amnesty International Thailand,≤100
157659344260788,จุรินทร์ ลักษณวิศิษฏ์ Aoodda,Jurin Laksanawisit,≤100
110362667973472,สรวิศ เดชเสน - Sorawit Dessen,สรวิศ เดชเสน - Sorawit Dessen,≤100
343641631483,ร้านนายอินทร์,These ads ran without a disclaimer,≤100
102807719039442,พรรครวมไทยสร้างชาติ United Thai Nation Party,พรรครวมไทยสร้างชาติ United Thai Nation Party,≤100
105711950893323,The Modernist,บริษัท โอพีเนียน มีเดีย จำกัด,≤100
268359690956,Danai Chanchaochai,These ads ran without a disclaimer,≤100
296508406790,"Democrat Party, Thailand พรรคประชาธิปัตย์","Democrat Party, Thailand พรรคประชาธิปัตย์",≤100
102530815945359,องอาจ วชิรพงศ์,Areeya Namdokmai,≤100
216147078543372,สำนักงานคณะกรรมการการเลือกตั้ง,สำนักงานคณะกรรมการการเลือกตั้ง,≤100
204016840519336,ศ.ดร.นฤมล ภิญโญสินวัฒน์,ศ.ดร.นฤมล ภิญโญสินวัฒน์,≤100
104427797605274,ดร.เฉลิมชัย ศรีอ่อน รัฐมนตรีว่าการกระทรวงเกษตรและสหกรณ์,ดร.เฉลิมชัย ศรีอ่อน รัฐมนตรีว่าการกระทรวงเกษตรและสหกรณ์,≤100
2263098807292933,ทนายศฤงคาร  ข่ายสุวรรณ์,Saringkan Khaisuwon,≤100
115922723434700,ครูเจพีสรุปย่อ for Teacher,ครูเจพีสรุปย่อ for Teacher,≤100
108515294626891,สอบข้าราชการท้องถิ่น By Thurakan,Chiraphorn Thuree,≤100
101178062238439,ณณัฏฐ์ หงษ์ชูเวช กิ๊ก,ณณัฏฐ์ หงษ์ชูเวช กิ๊ก,≤100
107612328588715,The Voters,สันติสุข กาญจนประกร,≤100
112706641077875,สจ.ดนุภัทร์ เชียงชุม,สจ.ดนุภัทร์ เชียงชุม,≤100
190923294988741,สอบครูผู้ช่วยนะ,สอบครูผู้ช่วยนะ,≤100
1635406246730420,วรงค์ เดชกิจวิกรม - Warong Dechgitvigrom,วรงค์ เดชกิจวิกรม - Warong Dechgitvigrom,≤100
103093255305223,Be Worth Shop,Sureerat Mankannan,≤100
345127652279503,มูลนิธิสากลเพื่อคนพิการ,มูลนิธิสากลเพื่อคนพิการ,≤100
334466657363647,ร้านพระเครื่องByขงเบ้ง รับเช่าพระเครื่อง พระบูชา ใหม่ เก่า ในราคาที่คุณพอใจ,These ads ran without a disclaimer,≤100
985820164804495,ธนาคารพัฒนาวิสาหกิจขนาดกลางและขนาดย่อมแห่งประเทศไทย,ธนาคารพัฒนาวิสาหกิจขนาดกลางและขนาดย่อมแห่งประเทศไทย,≤100
101391206118142,อุ๋งอิ๋ง - ปานรดา ปัณณธรวรเมธ - Panrada pannathonworameth,Panrada Pannathornworameth,≤100
103668907891539,การเมือง Kanmuang,การเมือง Kanmuang,≤100
114914794432449,กฎหมายใช้สอบราชการ by Æ+,กฎหมายใช้สอบราชการ by Æ+,≤100
601953326929372,ธัญวัจน์ กมลวงศ์วัฒน์ - Tunyawaj Kamolwongwat,Tunyawaj Kamolwongwat,≤100
111341764925564,สำนักสนับสนุนการพัฒนาระบบสุขภาพ - สำนัก 7 สสส.,สำนักสนับสนุนการพัฒนาระบบสุขภาพ - สำนัก 7 สสส.,≤100
622674297897819,Screenshirt2020,Screenshirt2020,≤100
2091153520919518,อนุทิน ชาญวีรกูล,อนุทิน ชาญวีรกูล,≤100
104362182571499,ภาษาไทยเพื่อครูไทย by ครูตัวกลม,Wanida Wanpakdee,≤100
152665702176493,Ringsideการเมือง,Ringsideการเมือง,≤100
106561034744198,ลอรี่ - พงศ์พล ยอดเมืองเจริญ,ลอรี่ - พงศ์พล ยอดเมืองเจริญ,≤100
418729291509368,สถาบันปรีดี พนมยงค์ Pridi Banomyong Institute,สถาบันปรีดี พนมยงค์ Pridi Banomyong Institute,≤100