Page ID,Page name,Disclaimer,Amount spent (JPY)
475681929154100,国連UNHCR協会,国連UNHCR協会,11898
1677419399148240,たはら亮 後援会（朝霞市）,Ryo  Tahara,3097
101997779146691,正しいお金の借り方,These ads ran without a disclaimer,2215
1904070096535109,スマート選挙,株式会社センキョ,1812
208661552479830,日本財団,Shigeru Fujita,948
100768172344790,ビューティートピック,These ads ran without a disclaimer,723
486394434773945,春日部市議会議員　栄ひろみ　サポーターズクラブ,栄ひろみサポーターズクラブ,651
239558679475625,株式会社トマス技術研究所,Kenji Fukutomi,541
296703483713248,【久喜市議会議員】新井けん応援ページ,Ken Arai,327
579187028792625,社長と会社の手元現金を増やす仕組みづくりの専門家,社長と会社の手元現金を増やす仕組みづくりの専門家,309
459101354119592,石巻金華鯖ずし”華ずし”,Tsubasa Itabashi,174
136636846682019,ふるさと名品オブ・ザ・イヤー,ふるさと名品オブ・ザ・イヤー,121
603731356470113,関西学院大学　診療所を中核とした地域医療経営人材育成プログラム,関西学院大学専門職大学院　経営戦略研究科,≤100
881025135256351,Japan In-depth,Japan In-depth,≤100
151214938794853,ミエセン,ジャッグジャパン株式会社,≤100
551303845317383,高橋元気（中央区議会議員）,Genki Takahashi,≤100
1454796194806512,文京区議会議員 海津 敦子 かいづあつこ,海津敦子,≤100
676655469036670,松下政経塾,松下政経塾,≤100
659484080845648,小島まさやす　熊谷No1プロジェクト,These ads ran without a disclaimer,≤100
111452121171849,選挙しか勝たん！しんどい地獄の政治活動は業者に頼む！「どぶ板選挙ドットウィン！」緊急相談窓口「03-6915-2310」,成田幹男,≤100
123217824515511,牛見 航  /  山口県防府市議会議員,Wataru Ushimi,≤100
102345105947737,選挙しか勝たん！どぶ板を業者に任せる楽ちん候補予定者のための「ポスターPR党」by 選挙ドットウィン「03-6915-2310」,僕俺株式会社,≤100
1410243545774903,一般社団法人日本wpa,Ogawa Yuzo,≤100
1672330153015605,透明アクリル業者票,アドアチーブ株式会社,≤100
105371502336242,乌克兰.ua,These ads ran without a disclaimer,≤100
492984144218541,Morning Worship Moment,These ads ran without a disclaimer,≤100