Page ID,Page name,Disclaimer,Amount spent (NZD),Number of ads in Library
337477311451,New Zealand Labour Party,NZ Parliamentary Service on behalf of New Zealand Labour Party,3601,69
111699101849124,Ōu Huatau Hauora | Your Views On Health,Ministry of Health,2112,154
92043134118,ACT,the Parliamentary Service on behalf of ACT New Zealand,1387,14
106194579030381,Doctors Without Borders / Médecins Sans Frontières NZ,Doctors Without Borders / Médecins Sans Frontières NZ,1163,14
183355881680015,New Zealand National Party,New Zealand National Party,1129,172
116362033529,Amnesty International Aotearoa New Zealand,Amnesty International Aotearoa New Zealand,1020,24
11870725774,Greenpeace Aotearoa,Greenpeace NZ,943,9
173912362663564,Electoral Commission NZ,Electoral Commission NZ,816,9
37547788323,UNICEF Aotearoa,UNICEF Aotearoa,582,37
92043134118,ACT,ACT,399,5
1671535913101759,Entrust,Entrust New Zealand,346,12
103294052679561,Kiwis Backing Farmers,Beef + Lamb NZ,330,54
376006035816016,Storyworth,These ads ran without a disclaimer,211,2
175954932952,WWF New Zealand,WWF New Zealand,198,3
19648092895,Tearfund New Zealand,Tearfund New Zealand,157,19
200480966638039,Supremacy 1914,These ads ran without a disclaimer,152,2
117930708298273,Hamilton City Council,Hamilton City Council,149,5
147902845293390,New Zealander of the Year Awards,New Zealander of the Year Awards,135,28
110909661534199,The Common Room NZ,The Common Room NZ,133,2
363940644005754,Shanan Halbert- MP for Northcote,NZ Parliamentary Service on behalf of Shanan Halbert MP,117,1
154331724631584,David Seymour,the Parliamentary Service on behalf of ACT New Zealand,≤100,2
100272638114473,Tim Costley,Ōtaki National Party,≤100,2
109145321007464,Groundswell NZ,Groundswell NZ,≤100,16
175465665824008,Queenstown NZ,Queenstown NZ,≤100,6
121956660842544,Grant McCallum for Northland,New Zealand National Party (Northland Electorate),≤100,7
196967540964595,Mindful Money,Mindful Money,≤100,4
1382593808665877,Manawatū District Council,Manawatū District Council,≤100,2
213708008642996,Pink Shirt Day Aotearoa,Mental Health Foundation of New Zealand,≤100,18
279272708771892,Schneider Electric,Schneider Electric,≤100,2
371913763842,Te Kāhui Tika Tangata Human Rights Commission,Te Kāhui Tika Tangata Human Rights Commission,≤100,1
117997265415910,James McDowall MP,the Parliamentary Service on behalf of ACT New Zealand,≤100,1
667708756580711,Matt Doocey MP,Parliamentary Service,≤100,1
110186134060806,Fairness in Focus,Medicines New Zealand,≤100,20
417859725433,SAFE,Save Animals From Exploitation Incorperated,≤100,1
100432998389927,Karen Chhour MP,ACT,≤100,5
185590638873,NZHL Home Loans / Insurance,NZHL Home Loans / Insurance,≤100,13
110910531830985,David MacLeod for New Plymouth,"David MacLeod, National Party Candidate for the New Plymouth Electorate",≤100,2
105534772373969,NZ News Essentials,NZ News Essentials,≤100,1
182047568518433,Phil Twyford,NZ Parliamentary Service on behalf of Phil Twyford MP,≤100,1
451936698281378,Cancer Society of Otago & Southland,Cancer Society Otago & Southland Division,≤100,3
282174425155343,Rotorua Lakes Council,Rotorua Lakes Council,≤100,6
23625700722,Oxfam,Oxfam Aotearoa,≤100,1
305655596286980,Paul Goldsmith,NZ Parliamentary Service on behalf of Paul Goldsmith MP,≤100,6
110974094005509,Nicole McKee MP,the Parliamentary Service on behalf of ACT New Zealand,≤100,2
111518076963780,Nicola Grigg MP,Parliamentary Services NZ on behalf of Nicola Grigg MP,≤100,1
105681068874945,Ag Matters,New Zealand Agricultural Greenhouse Gas Research Centre,≤100,1
133758444883,Palmerston North City Council,Palmerston North City Council,≤100,3
454557294670525,BayBuzz,BayBuzz,≤100,2
100432998389927,Karen Chhour MP,the Parliamentary Service on behalf of ACT New Zealand,≤100,1
203953359629611,Voice For Life,Voice for Life,≤100,1
128872083791896,Greater Wellington,Greater Wellington,≤100,4
148662045166231,Bay of Plenty Regional Council,Bay of Plenty Regional Council,≤100,1
112431991697294,Animal Justice Party Aotearoa NZ,Animal Justice Party Aotearoa NZ,≤100,1
203463489667720,Western Bay of Plenty District Council,Western Bay of Plenty District Council,≤100,2
109190088664909,Hamish Campbell for Ilam,Hamish Campbell for Ilam,≤100,1
149519831907669,Raf Manji,The Opportunities Party,≤100,1
134871109877812,Save the Children New Zealand,Save the Children New Zealand,≤100,1
111961788300105,Melissa White Candidate Arrowtown-Kawarau Ward QLDC By-Election 2023,Melissa White,≤100,1
110077017479600,One Sun in the Sky,Ewen Frank Mcqueen,≤100,2
1609645495950424,James Shaw,The NZ Parliamentary Service on behalf of the Green Party,≤100,1
104501819255827,Vanessa Weenink for Banks Peninsula,Vanessa Weenink for Banks Peninsula,≤100,2
520830134704591,National Centre for Research on Europe,Cashias Gumbo,≤100,1
104174354363267,Christopher Luxon,New Zealand National Party,≤100,1
564453323744421,TOP - The Opportunities Party,TOP - The Opportunities Party,≤100,1
1281262645251755,Hobson's Pledge,Hobson's Pledge,≤100,1
623394081159965,Te Pou Theatre,Te Pou Theatre,≤100,1
224272831430679,Voice for Life Dunedin,Voice for Life Dunedin,≤100,1
113739291232474,Heart Mind Institute,These ads ran without a disclaimer,≤100,3
100618666013922,CATA Child and Adolescent Therapists Association,CATA.org.nz,≤100,1
101431535833189,Paul McMahon: Linwood Community Board Member,Paul George Mcmahon,≤100,1
309846686264586,Scott Watson Fact,Thomas John Watson,≤100,1
151942197817,New Zealand Wine,These ads ran without a disclaimer,≤100,2
128872083791896,Greater Wellington,These ads ran without a disclaimer,≤100,3
103403094634162,Ethan Reille for Waitaki,Ethan Mark Reille,≤100,1
156709261092239,Simon O'Connor,NZ Parliamentary Service on behalf of Simon O’Connor MP,≤100,1
83022598290,Trade Aid New Zealand,Trade Aid New Zealand,≤100,1
454204961447807,Student Christian Movement Aotearoa,Student Christian Movement Aotearoa,≤100,1
2664407520240811,VUW International Socialists,ISO Te Whanganui-a-Tara branch,≤100,1
109882599038063,Queenstown Lakes District Council,Queenstown Lakes District Council,≤100,1
104137689061268,Point of Order,These ads ran without a disclaimer,≤100,1
103059578091271,Cook Islands Seabed Minerals Authority,Ngametua Denisio Mingi,≤100,1
110463704610731,Cute Kiwi,These ads ran without a disclaimer,≤100,1
100192402741987,Daily News,These ads ran without a disclaimer,≤100,1
298489910165453,Raffles Hotel Singapore,These ads ran without a disclaimer,≤100,1
100374392742057,Weregreenly- Magazine,These ads ran without a disclaimer,≤100,1
643057169228509,FT Channels,These ads ran without a disclaimer,≤100,1
156279764411149,Times Higher Education,These ads ran without a disclaimer,≤100,2
102415047928145,Shanghai Electric,These ads ran without a disclaimer,≤100,1
104055108950069,thereal_jusg,These ads ran without a disclaimer,≤100,1
287842647957979,EU International Partnerships,These ads ran without a disclaimer,≤100,2
127031794038958,Blue Marine Foundation,These ads ran without a disclaimer,≤100,10
105962808801596,IZZY - Stream Israel,These ads ran without a disclaimer,≤100,1
102121579296432,Allcsta time,These ads ran without a disclaimer,≤100,3
286094071469577,VINCI Energies,These ads ran without a disclaimer,≤100,1