Page ID,Page name,Disclaimer,Amount spent (USD),Number of ads in Library
274141766381712,Conseil National de la Transition GN,Conseil National de la Transition GN,≤100,8
103989135541669,Hadja Maïmouna Yombouno,Bangoura Maïmouna Yombouno,≤100,2
103770381469097,Hôpital de l’Amitié Sino Guinéenne,These ads ran without a disclaimer,≤100,1
176104589110851,IEEE,These ads ran without a disclaimer,≤100,1
102407559822494,Training Centre in Communication (TCC Africa),These ads ran without a disclaimer,≤100,1
450326391674911,Allianz,These ads ran without a disclaimer,≤100,1