Page ID,Page name,Disclaimer,Amount spent (USD),Number of ads in Library
193773314132490,Ballinu Montana,an advertiser in Mali,172,31
110569738072660,Seydou Mamadou Coulibaly,an advertiser in Mali,≤100,1
176104589110851,IEEE,These ads ran without a disclaimer,≤100,1
102407559822494,Training Centre in Communication (TCC Africa),These ads ran without a disclaimer,≤100,1
450326391674911,Allianz,These ads ran without a disclaimer,≤100,1
218019218362291,Association des Blogueurs du Mali,These ads ran without a disclaimer,≤100,1