Page ID,Page name,Disclaimer,Amount spent (THB),Number of ads in Library
100240152175449,ป้าโส FC by Tacina,Dunyawat  Bamrungchan,6564,88
1639146799524292,Omi,These ads ran without a disclaimer,4091,1
241115389300595,คุณหญิงสุดารัตน์ เกยุราพันธุ์ Sudarat Keyuraphan,คุณหญิงสุดารัตน์ เกยุราพันธุ์ Sudarat Keyuraphan,3106,5
296508406790,"Democrat Party, Thailand พรรคประชาธิปัตย์","Democrat Party, Thailand พรรคประชาธิปัตย์",2923,31
104427797605274,ดร.เฉลิมชัย ศรีอ่อน รัฐมนตรีว่าการกระทรวงเกษตรและสหกรณ์,ดร.เฉลิมชัย ศรีอ่อน รัฐมนตรีว่าการกระทรวงเกษตรและสหกรณ์,2841,14
102807719039442,พรรครวมไทยสร้างชาติ United Thai Nation Party,พรรครวมไทยสร้างชาติ United Thai Nation Party,1961,6
105347558390671,นริสสร แสงแก้ว,Attaporn Pohkaew,1849,12
101274425792459,กิตติพงศ์ รวยฟูพันธ์ - ส.ก.ไอซ์ เขตทุ่งครุ,กิตติพงศ์ รวยฟูพันธ์ - ส.ก.ไอซ์ เขตทุ่งครุ,1653,4
972019486321939,บู้ จเด็ศ จันทรา,จเด็ด จันทรา,1157,3
100530401779420,พรรคไทยภักดี,พรรคไทยภักดี,922,7
111341764925564,สำนักสนับสนุนการพัฒนาระบบสุขภาพ - สำนัก 7 สสส.,สำนักสนับสนุนการพัฒนาระบบสุขภาพ - สำนัก 7 สสส.,899,14
622674297897819,Screenshirt2020,Screenshirt2020,806,2
149878535813571,สำนักงาน คปภ.ภาค 1 (เชียงใหม่),ศุภกานต์ สุขสวัสดิ์,710,1
108635927540997,เทมส์ ไกรทัศน์ - ภูเก็ต,เทมส์ ไกรทัศน์ - ภูเก็ต,681,1
107449532000210,ธิติวัฐ อดิศรพันธ์กุล - Thitiwat Adisornphankul,ธิติวัฐ อดิศรพันธ์กุล - Thitiwat Adisornphankul,621,2
103943018154038,บุญสืบ จันทร์แจ่มศรี ปุ๊,บุญสืบ จันทร์แจ่มศรี,610,4
1105604039583762,Line One สว.นท. ขอเชิญส่งประวัติ ส่วนตัว องค์กร เพื่อเข้ารับรางวัลประจำปี,Suksan Booran,604,1
103986582301984,เนื้อ นา บุญ,Phrathanakrit Upachai,596,4
105421542338383,ไทม์ ดุลยวัฒน์ - หัวใจสีฟ้า,Dunyawat  Bamrungchan,572,10
101535845426970,พรรคไทยสร้างไทย,พรรคไทยสร้างไทย,541,2
157659344260788,จุรินทร์ ลักษณวิศิษฏ์ Aoodda,Jurin Laksanawisit,537,1
108508377637861,มุ้งจีบพระราม2 โรงงานผลิตมุ้งจีบ มุ้งลวด เหล็ดดัดทุกชนิด,กุหลาบ บัวสด,530,1
1635406246730420,วรงค์ เดชกิจวิกรม - Warong Dechgitvigrom,วรงค์ เดชกิจวิกรม - Warong Dechgitvigrom,465,5
161651553861945,Amnesty International Thailand,Amnesty International Thailand,442,1
493026767870664,พรรคพลังประชารัฐ,พรรคพลังประชารัฐ,368,3
109420251938390,"ชณทัต ปัทะมะภูวดล ""แม็ค""","ชณทัต ปัทะมะภูวดล ""แม็ค""",343,5
567743816917663,The Article,The Article,340,6
276537859877842,FC ผู้ใหญ่ตาน คนบ้านเรา,ปฐมพร จันทร์ผ่อง,334,4
345127652279503,มูลนิธิสากลเพื่อคนพิการ,มูลนิธิสากลเพื่อคนพิการ,298,1
414100949350619,ณัฐนันท์ กัลยาศิริ - ทนายบอน,ณัฐนันท์ กัลยาศิริ,270,1
111203087295386,ดร.ทวนชัย นิยมชาติ,Thuanchai Niyomchart,250,1
601953326929372,ธัญวัจน์ กมลวงศ์วัฒน์ - Tunyawaj Kamolwongwat,Tunyawaj Kamolwongwat,213,4
105771508183333,Vintage NineTeen,These ads ran without a disclaimer,209,1
183238185051108,อรรถวิชช์ สุวรรณภักดี,อรรถวิชช์ สุวรรณภักดี,194,1
107612328588715,The Voters,สันติสุข กาญจนประกร,191,16
105710145448698,Dr.Kultida  Maopech,กุลธิดา เหมาเพชร,182,2
103668907891539,การเมือง Kanmuang,การเมือง Kanmuang,170,1
100761582502948,จารุพล เรืองสุวรรณ - อาจารย์จา,Charupol Ruangsuwan,141,1
106561034744198,ลอรี่ - พงศ์พล ยอดเมืองเจริญ,ลอรี่ - พงศ์พล ยอดเมืองเจริญ,124,3
105711950893323,The Modernist,บริษัท โอพีเนียน มีเดีย จำกัด,106,1
108080841125724,ก้าวไกลขอนแก่น,Wasittee Khoyun,≤100,1
494189467277672,Agenda,บริษัท ดิ อาเจนด้า จำกัด,≤100,1
104134765098843,ทศพล โชติคุตร์ - ผกก.หนุ่ย,ทศพล โชติคุตร์ - ผกก.หนุ่ย,≤100,1
174674890018644,นายเดชอิศม์ ขาวทอง นายกชาย,Phetai Sretrairat,≤100,3
613689015307999,ส.ส.แมน ฉัตรพันธ์ เดชกิจสุนทร,ส.ส.แมน ฉัตรพันธ์ เดชกิจสุนทร,≤100,1
112969264517494,เพ็ญพิสุทธิ์ จินตโสภณ - Penpisut Jintasophon,Vatcharapong Wongkom,≤100,1
277320192288594,โอม จิรชาติ,โอม จิรชาติ,≤100,2
418729291509368,สถาบันปรีดี พนมยงค์ Pridi Banomyong Institute,สถาบันปรีดี พนมยงค์ Pridi Banomyong Institute,≤100,3
102760714981774,สุภาพร กำเนิดผล,สุภาพร กำเนิดผล,≤100,1
2091153520919518,อนุทิน ชาญวีรกูล,อนุทิน ชาญวีรกูล,≤100,3
190923294988741,สอบครูผู้ช่วยนะ,สอบครูผู้ช่วยนะ,≤100,1
207416296817756,พรรคก้าวไกลราชบุรี - Move Forward Party,Unnop Sricharoenchai,≤100,1
110144991464196,กรอบลอยไวนิล แคนวาส บอร์ดไดคัท 99 บาท มีเก็บปลายทาง,Sakawtip Utha,≤100,1
100378068249359,กฤตภพ สติดีนิติวงศ์ -Krittaphop Satideenitiwong,Krittaphop Stideenitiwong,≤100,1
100298682713615,เสื้อวินเทจ ลายมัน ผ้าดำ,เสื้อวินเทจ ลายมัน ผ้าดำ,≤100,1
204862942932993,Nikkei Asia,These ads ran without a disclaimer,≤100,3
985820164804495,ธนาคารพัฒนาวิสาหกิจขนาดกลางและขนาดย่อมแห่งประเทศไทย,ธนาคารพัฒนาวิสาหกิจขนาดกลางและขนาดย่อมแห่งประเทศไทย,≤100,2
119405895873,Huawei,These ads ran without a disclaimer,≤100,1
1527441590671253,ข้าวปุ่น. เปิดประมูล พระบ้าน วัดตาวัดใจ,These ads ran without a disclaimer,≤100,1
2263098807292933,ทนายศฤงคาร  ข่ายสุวรรณ์,These ads ran without a disclaimer,≤100,2
270082823183144,Canton Fair,These ads ran without a disclaimer,≤100,1
293389669120488,Blushing Brides,These ads ran without a disclaimer,≤100,1
1556481434584901,Paul Xavier,These ads ran without a disclaimer,≤100,1
31292782350,Deutschland.de,These ads ran without a disclaimer,≤100,1
112794927146269,Anern Solar Street Light & Solar Power System,These ads ran without a disclaimer,≤100,1
101715608808670,Judgment Day: Angel of God,These ads ran without a disclaimer,≤100,2