Page ID,Page name,Disclaimer,Amount spent (USD),Number of ads in Library
122560994513217,The Progressives,The Progressives,≤100,1
425571700848977,Wayne Panton MP for Newlands,Kelly Holding,≤100,2
365800603503752,Rotary Central Cayman Islands,These ads ran without a disclaimer,≤100,1
104853645903563,Excellent Book,These ads ran without a disclaimer,≤100,1
102023009327901,Global Compassion Coalition,These ads ran without a disclaimer,≤100,1
100912541413695,Más Impulso,These ads ran without a disclaimer,≤100,1