Page ID,Page name,Disclaimer,Amount spent (THB),Number of ads in Library
546416699215073,ห้องสื่อครูคอม,ห้องสื่อครูคอม,2937,2
177948972256358,เอกนัฏ พร้อมพันธุ์ (ขิง),เอกนัฏ พร้อมพันธุ์ (ขิง),1904,2
105992549162758,ข่าวชีวิตติดกระแส,บริษัท เดนิส แอดส์ จำกัด,1406,3
115496146572483,เขารูปช้างพลังใหม่,เขารูปช้างพลังใหม่,994,1
108515294626891,สอบข้าราชการท้องถิ่น By Thurakan,สอบข้าราชการท้องถิ่น By Thurakan,981,1
972019486321939,บู้ จเด็ศ จันทรา,บู้ จเด็ศ จันทรา,775,6
105125715202609,ส.ส.ไผ่ ลิกค์,ส.ส.ไผ่ ลิกค์,683,3
1105604039583762,Line One สว.นท. ขอเชิญส่งประวัติ ส่วนตัว องค์กร เพื่อเข้ารับรางวัลประจำปี,Line One สว.นท. ขอเชิญส่งประวัติ ส่วนตัว องค์กร เพื่อเข้ารับรางวัลประจำปี,590,1
107261268818419,PM Lotto V.3 สลากกินแบ่งฯ สนามบินน้ำ,These ads ran without a disclaimer,529,1
111341764925564,สำนักสนับสนุนการพัฒนาระบบสุขภาพ - สำนัก 7 สสส.,สำนักสนับสนุนการพัฒนาระบบสุขภาพ - สำนัก 7 สสส.,509,8
622674297897819,Screenshirt2020,Screenshirt2020,482,1
101306972998400,รักษ์เขารูปช้าง,รักษ์เขารูปช้าง,467,12
110325275488,efinanceThai,efinanceThai,409,1
161651553861945,Amnesty International Thailand,Amnesty International Thailand,384,5
104769961794110,อินทรัตน์ ยอดบางเตย,อินทรัตน์ ยอดบางเตย,360,12
108669011358316,PINGX,PINGX,295,1
100624122148338,โรงพยาบาลรวมใจรักษ์ สุขุมวิท 62 Ruamjairak Hospital Sukhumvit 62,โรงพยาบาลรวมใจรักษ์ สุขุมวิท 62 Ruamjairak Hospital Sukhumvit 62,281,31
106636525625332,พลตำรวจเอกสมศักดิ์ จันทะพิงค์ นายก อบจ นครสวรรค์,พลตำรวจเอกสมศักดิ์ จันทะพิงค์ นายก อบจ นครสวรรค์,236,2
108625789179165,Soi Dog Foundation,These ads ran without a disclaimer,203,1
104080691680083,ทีมพัฒนาเมืองลำสามแก้ว,These ads ran without a disclaimer,196,1
104393812499502,ชีทสรุปกฎหมาย สำหรับสอบราชการ พนักงานราชการ by.kantap,ชีทสรุปกฎหมาย สำหรับสอบราชการ พนักงานราชการ by.kantap,190,1
115922723434700,ครูเจพีสรุปย่อ for Teacher,ครูเจพีสรุปย่อ for Teacher,184,2
174738095989909,Pichai Naripthaphan,These ads ran without a disclaimer,181,1
105077975990502,pardgroupth,These ads ran without a disclaimer,181,1
3080161418691131,Thailand FACT Today,Thailand FACT Today,179,1
1905453556145520,Maehongson Creative,These ads ran without a disclaimer,177,3
715838732136310,ธนเดช เพ็งสุข - Tanadej Pengsuk,ธนเดช เพ็งสุข - Tanadej Pengsuk,139,1
104475082514245,น้องชายขายรองเท้า,These ads ran without a disclaimer,136,1
108078728711599,Dr.Fon clinic -หาดใหญ่,Dr.Fon clinic -หาดใหญ่,135,2
107612328588715,The Voters,The Voters,133,5
101752965608250,โยธิน พงษ์อ้อ Yothin Pong-or,These ads ran without a disclaimer,131,2
110766468644579,อนันต์ ปรีดาสุทธิจิตต์,อนันต์ ปรีดาสุทธิจิตต์,116,1
102000355765413,ธันย์ชนน ศรีอัษฎาวุธกุล - Thanchanon Sriusadawutkul,ธันย์ชนน ศรีอัษฎาวุธกุล - Thanchanon Sriusadawutkul,114,1
444815236101667,สอบติดราชการ ครูผู้ช่วย สพฐ/กทม/ ท้องถิ่น/นักวิชาการศึกษา,These ads ran without a disclaimer,113,1
190923294988741,สอบครูผู้ช่วยนะ,สอบครูผู้ช่วยนะ,108,1
101903785231136,นายกไก่กังวาล ศักดิ์ชัย พิศาลผล,นายกไก่กังวาล ศักดิ์ชัย พิศาลผล,≤100,2
12105421715,Blognone,These ads ran without a disclaimer,≤100,1
106151945819870,Dr.Fon clinic หาดใหญ่,Dr.Fon clinic หาดใหญ่,≤100,2
572592940087101,คณพลคนกันเอง,คณพลคนกันเอง,≤100,2
106934809126394,My-Book Bookstore with stories,These ads ran without a disclaimer,≤100,2
494189467277672,Agenda,บริษัท ดิ อาเจนด้า จำกัด,≤100,1
102376312258745,ริชแมน เกษตรบ้านนาโปรดักท์ ปุ๋ย ยา ฮอร์โมนพืช,These ads ran without a disclaimer,≤100,1
108992755009125,Social Diver,Social Diver,≤100,1
100399988164632,ร่มธรรม ขำนุรักษ์ -หวาย,ร่มธรรม ขำนุรักษ์ -หวาย,≤100,1
767719373245534,ศูนย์ต้านนิรโทษกรรม,These ads ran without a disclaimer,≤100,1
114588881674632,ของใช้ในบ้าน,These ads ran without a disclaimer,≤100,1
106028831878217,JW Clinic คลินิคผิวหนัง ความงาม,These ads ran without a disclaimer,≤100,1
102895935319115,วิพุธ ศรีวะอุไร - Viput Srivaurai,วิพุธ ศรีวะอุไร - Viput Srivaurai,≤100,1
788176884663635,Banpu NEXT,These ads ran without a disclaimer,≤100,1
105583991831514,Social Study Story,These ads ran without a disclaimer,≤100,1
104240334953784,ชีทสรุป สอบราชการ x งานกฎหมาย,These ads ran without a disclaimer,≤100,1
333794970138725,Gen.Bunchon - บัญชร ชวาลศิลป์,Gen.Bunchon - บัญชร ชวาลศิลป์,≤100,1
104050648204135,รถเช่ากระบี่ ถูกสุด By Design Krabi Car rent,These ads ran without a disclaimer,≤100,2
112115945016340,เบส ณัฐศักดิ์ หงษ์ทอง - Nattasak hongtong,เบส ณัฐศักดิ์ หงษ์ทอง - Nattasak hongtong,≤100,1
108264268182006,Huawei Digital Power APAC,These ads ran without a disclaimer,≤100,1
115268018195438,จดเครื่องหมายการค้า DEP,These ads ran without a disclaimer,≤100,1
101789669033812,วันชัย สุทธิอารีกุล,วันชัย สุทธิอารีกุล,≤100,1
110263445313857,สภาทนายความจังหวัดระยอง และชมรมทนายความจังหวัดระยอง,These ads ran without a disclaimer,≤100,1
150271398942624,อัศจรรย์เมืองพุทธ,These ads ran without a disclaimer,≤100,1
615040838898606,Angry Birds Dream Blast,These ads ran without a disclaimer,≤100,1
107542781608241,Thai Today Report - ไทยทูเดย์รีพอร์ต,These ads ran without a disclaimer,≤100,1
235082503219128,ศูนย์ที่ปรึกษาการใช้แรงงานต่างด้าว เอสเอ็มเอส สุราษฎร์ธานี,These ads ran without a disclaimer,≤100,1
112248763465922,The Youngster,The Youngster,≤100,1
1748200825467366,Bureau Veritas Thailand and Greater Mekong Sub-Region,These ads ran without a disclaimer,≤100,2
774163095969168,ชุมพร ฟ้าใหม่,These ads ran without a disclaimer,≤100,1
105650394954220,ตรีนุช เทียนทอง Treenuch Thienthong,ตรีนุช เทียนทอง Treenuch Thienthong,≤100,3
791943710959735,EPOP,These ads ran without a disclaimer,≤100,1
185130644919625,Meta for Business,These ads ran without a disclaimer,≤100,1
100816385656328,ParentzTalk - Travel,These ads ran without a disclaimer,≤100,1
104738335990390,Fnuhj-1234,These ads ran without a disclaimer,≤100,2
107828158232221,CCCC First Highway Engineering Group,These ads ran without a disclaimer,≤100,1
100305849167750,Born To Know,These ads ran without a disclaimer,≤100,2
702279983471744,Olympic Council of Asia,These ads ran without a disclaimer,≤100,1
171195311682401,ParentzTalk - Activities,These ads ran without a disclaimer,≤100,1
102795885694138,milokibullz,These ads ran without a disclaimer,≤100,1
1306086469482572,Ricardo Miranda,These ads ran without a disclaimer,≤100,1
105433098937696,Fun Magazine Club,These ads ran without a disclaimer,≤100,1
103392028956943,Driving Todays - Stories,These ads ran without a disclaimer,≤100,2