Page ID,Page name,Disclaimer,Amount spent (BSD),Number of ads in Library
137651823623470,Office of the Prime Minister - The Bahamas,The Office of The Prime Minister Bahamas,587,8
114606549484,Philip Brave Davis,The Office of The Prime Minister Bahamas,231,4
110510071864172,"Deputy Prime Minister of The Bahamas, Chester Cooper","Deputy Prime Minister of The Bahamas, Chester Cooper",≤100,1
1025152104235573,Team Cooper - Chester Cooper,Isaac Chester Cooper,≤100,1
94005676787,Hitachi Vantara,These ads ran without a disclaimer,≤100,1
107706102295108,Wire Tool,These ads ran without a disclaimer,≤100,1