Page ID,Page name,Disclaimer,Amount spent (USD),Number of ads in Library
1399417653716342,Maundy A. L. Lewis,Maundy Lewis,≤100,1
1629123210711989,Office of the Prime Minister of Saint Lucia,Office of the Prime Minister,≤100,1
1409638192624686,Allen Chastanet,Allen Chastanet,≤100,1
725505594135727,Adventure Escape,These ads ran without a disclaimer,≤100,1
101715608808670,Judgment Day: Angel of God,These ads ran without a disclaimer,≤100,1
200480966638039,Supremacy 1914,These ads ran without a disclaimer,≤100,1
101453801610760,Share-On Project,These ads ran without a disclaimer,≤100,1