Page ID,Page name,Disclaimer,Amount spent (THB),Number of ads in Library
177948972256358,เอกนัฏ พร้อมพันธุ์ (ขิง),เอกนัฏ พร้อมพันธุ์ (ขิง),9237,5
157659344260788,จุรินทร์ ลักษณวิศิษฏ์ Aoodda,Ruthaikan Tanomkerd,6044,13
100240152175449,ป้าโส FC by Tacina,Dunyawat  Bamrungchan,5239,103
1639146799524292,Omi,These ads ran without a disclaimer,4126,1
102807719039442,พรรครวมไทยสร้างชาติ United Thai Nation Party,พรรครวมไทยสร้างชาติ United Thai Nation Party,3647,7
972019486321939,บู้ จเด็ศ จันทรา,จเด็ด จันทรา,3297,5
296508406790,"Democrat Party, Thailand พรรคประชาธิปัตย์","Democrat Party, Thailand พรรคประชาธิปัตย์",2434,20
345127652279503,มูลนิธิสากลเพื่อคนพิการ,มูลนิธิสากลเพื่อคนพิการ,2331,1
100624122148338,โรงพยาบาลรวมใจรักษ์ สุขุมวิท 62 Ruamjairak Hospital Sukhumvit 62,โรงพยาบาลรวมใจรักษ์ สุขุมวิท 62 Ruamjairak Hospital Sukhumvit 62,2142,141
104427797605274,ดร.เฉลิมชัย ศรีอ่อน รัฐมนตรีว่าการกระทรวงเกษตรและสหกรณ์,ดร.เฉลิมชัย ศรีอ่อน รัฐมนตรีว่าการกระทรวงเกษตรและสหกรณ์,1742,7
101274425792459,กิตติพงศ์ รวยฟูพันธ์ - ส.ก.ไอซ์ เขตทุ่งครุ,These ads ran without a disclaimer,1730,5
101274425792459,กิตติพงศ์ รวยฟูพันธ์ - ส.ก.ไอซ์ เขตทุ่งครุ,กิตติพงศ์ รวยฟูพันธ์ - ส.ก.ไอซ์ เขตทุ่งครุ,1707,4
111341764925564,สำนักสนับสนุนการพัฒนาระบบสุขภาพ - สำนัก 7 สสส.,สำนักสนับสนุนการพัฒนาระบบสุขภาพ - สำนัก 7 สสส.,1043,18
103986582301984,เนื้อ นา บุญ,Phrathanakrit Upachai,888,6
109552337467130,THE STANDARD WEALTH,"THE STANDARD CO., LTD",755,2
115922723434700,ครูเจพีสรุปย่อ for Teacher,ครูเจพีสรุปย่อ for Teacher,724,6
241115389300595,คุณหญิงสุดารัตน์ เกยุราพันธุ์ Sudarat Keyuraphan,คุณหญิงสุดารัตน์ เกยุราพันธุ์ Sudarat Keyuraphan,705,1
112969264517494,เพ็ญพิสุทธิ์ จินตโสภณ - Penpisut Jintasophon,Vatcharapong Wongkom,660,7
1811022602310855,พรรคก้าวไกล สุรินทร์,พรรคก้าวไกล,659,1
622674297897819,Screenshirt2020,Screenshirt2020,628,1
103943018154038,บุญสืบ จันทร์แจ่มศรี ปุ๊,บุญสืบ จันทร์แจ่มศรี,569,5
108508377637861,มุ้งจีบพระราม2 โรงงานผลิตมุ้งจีบ มุ้งลวด เหล็ดดัดทุกชนิด,กุหลาบ บัวสด,525,1
257083724467673,ยุทธพล  อังกินันทน์,ยุทธพล อังกินันทน์,521,2
1105604039583762,Line One สว.นท. ขอเชิญส่งประวัติ ส่วนตัว องค์กร เพื่อเข้ารับรางวัลประจำปี,Suksan Booran,511,1
161651553861945,Amnesty International Thailand,Amnesty International Thailand,442,1
107449532000210,ธิติวัฐ อดิศรพันธ์กุล - Thitiwat Adisornphankul,ธิติวัฐ อดิศรพันธ์กุล - Thitiwat Adisornphankul,428,1
105421542338383,ไทม์ ดุลยวัฒน์ - หัวใจสีฟ้า,Dunyawat  Bamrungchan,385,10
103815855888467,โกหม่อง เพื่อไทย ภูเก็ต,โกหม่อง เพื่อไทย ภูเก็ต,381,3
414100949350619,ณัฐนันท์ กัลยาศิริ - ทนายบอน,ณัฐนันท์ กัลยาศิริ,341,3
177438153830567,พลอยทะเล ลักษมีแสงจันทร์,พลอยทะเล ลักษมีแสงจันทร์,339,2
109420251938390,"ชณทัต ปัทะมะภูวดล ""แม็ค""","ชณทัต ปัทะมะภูวดล ""แม็ค""",313,3
567743816917663,The Article,The Article,312,6
368356080442700,กำนันพงษ์ศักดิ์ จ่าแก้ว - คนรักสุราษฎร์,Chadapon Maksuwan,302,3
107612328588715,The Voters,สันติสุข กาญจนประกร,300,12
174674890018644,นายเดชอิศม์ ขาวทอง นายกชาย,Phetai Sretrairat,262,4
105313238236774,ตวงทอง ประดิษฐพร - สจ.ตวง,ตวงทอง ประดิษฐพร - สจ.ตวง,237,2
105289357813967,ปุณณ์สิริ บุณยเกียรติ - บีท - Punsiri Boonyakiat,ปุณณ์สิริ บุณยเกียรติ - บีท - Punsiri Boonyakiat,236,3
110425134486071,แสนยากรณ์ สิงห์วีรธรรม : ชาติพัฒนากล้า บางซื่อ,แสนยากรณ์ สิงห์วีรธรรม : ชาติพัฒนากล้า บางซื่อ,217,1
101903329383104,ผู้การติ๊ก : จรัญ ขุนอินทร์,ผู้การติ๊ก : จรัญ ขุนอินทร์,206,1
107535498701936,ธาม สมุทรานนท์ - Tharm Smuthranond,Yonlapat Wangsarn,204,1
626952517700280,ลิ้ม ศรัณยสัณฑ์ วีรกุลสุนทร ว่าที่ผู้สมัคร ส.ส. เขตจอมทอง พรรคเพื่อไทย,ลิ้ม ศรัณยสัณฑ์ วีรกุลสุนทร ว่าที่ผู้สมัคร ส.ส. เขตจอมทอง พรรคเพื่อไทย,188,1
103668907891539,การเมือง Kanmuang,การเมือง Kanmuang,184,1
102422172552813,မဲ့ဆောက်လင်း VCD -အေးချမ်းမြတ်ဘုန်း စာပေ,These ads ran without a disclaimer,176,1
101690386041480,မဲ့ဆောက်လင်း  VCD အေးချမ်းမြတ်ဘုန်းစာပေ,These ads ran without a disclaimer,176,1
177948972256358,เอกนัฏ พร้อมพันธุ์ (ขิง),Chonticha Mahachai,163,2
985820164804495,ธนาคารพัฒนาวิสาหกิจขนาดกลางและขนาดย่อมแห่งประเทศไทย,ธนาคารพัฒนาวิสาหกิจขนาดกลางและขนาดย่อมแห่งประเทศไทย,154,3
190923294988741,สอบครูผู้ช่วยนะ,สอบครูผู้ช่วยนะ,143,2
715838732136310,ธนเดช เพ็งสุข - Tanadej Pengsuk,Tanadej Pengsuk,128,1
106561034744198,ลอรี่ - พงศ์พล ยอดเมืองเจริญ,ลอรี่ - พงศ์พล ยอดเมืองเจริญ,123,2
872702859784466,KoThar Gyi Helping Hand General Services,These ads ran without a disclaimer,108,1
104220275003310,ชนินทร์ รุ่งธนเกียรติ - หนุ่ม,ชนินทร์ รุ่งธนเกียรติ - หนุ่ม,106,1
108839095327193,โก้จ๋าย เอกวานิช,โก้จ๋าย เอกวานิช,105,3
111325021787418,โจ้ ณัฐวุฒิ ตรีเพ็ชร์,These ads ran without a disclaimer,104,1
110362667973472,สรวิศ เดชเสน - Sorawit Dessen,สรวิศ เดชเสน - Sorawit Dessen,103,1
601953326929372,ธัญวัจน์ กมลวงศ์วัฒน์ - Tunyawaj Kamolwongwat,Tunyawaj Kamolwongwat,102,4
2091153520919518,อนุทิน ชาญวีรกูล,อนุทิน ชาญวีรกูล,≤100,2
105710145448698,Dr.Kultida  Maopech,กุลธิดา เหมาเพชร,≤100,1
959106827437030,TAT Review Magazine,These ads ran without a disclaimer,≤100,1
109253101480638,วรท ศิริรักษ์ - Warot Sirirak,วรท ศิริรักษ์ - Warot Sirirak,≤100,1
102402517857423,Lady2_Shop,These ads ran without a disclaimer,≤100,2
111020164096996,ธัญธร ธนินวัฒนาธร - Thanyathorn Dhaninwattanathorn,ธัญธร ธนินวัฒนาธร - Thanyathorn Dhaninwattanathorn,≤100,1
379725072797606,พลังประชารัฐภูเก็ต ส.ส.นัทธี ถิ่นสาคู,พลังประชารัฐภูเก็ต ส.ส.นัทธี ถิ่นสาคู,≤100,1
103465462538992,ภูมิใจไทย ภูเก็ต,These ads ran without a disclaimer,≤100,1
277320192288594,โอม จิรชาติ,โอม จิรชาติ,≤100,1
113780154676973,เครื่องมือช่างไฟฟ้า เครื่องมือช่างไม้ เครื่องมือช่างยนต์ by Pro tool,Surin Phothiphoksampan,≤100,3
112394371483043,เครื่องมือไฟฟ้า และเครื่องมือช่าง ราคาถูก by HomeLink V.1,Surin Phothiphoksampan,≤100,6
613689015307999,ส.ส.แมน ฉัตรพันธ์ เดชกิจสุนทร,ส.ส.แมน ฉัตรพันธ์ เดชกิจสุนทร,≤100,1
110144991464196,กรอบลอยไวนิล แคนวาส บอร์ดไดคัท 99 บาท มีเก็บปลายทาง,Sakawtip Utha,≤100,1
276537859877842,FC ผู้ใหญ่ตาน คนบ้านเรา,ปฐมพร จันทร์ผ่อง,≤100,1
207416296817756,พรรคก้าวไกลราชบุรี - Move Forward Party,Unnop Sricharoenchai,≤100,1
2009054229181721,Nattacha Boonchaiinsawat - ณัฐชา บุญไชยอินสวัสดิ์,Lidear Nunarnan,≤100,1
102300185055217,ภควัทคีตา-Bhagavad Gita,These ads ran without a disclaimer,≤100,1
1039675682714205,스브스뉴스,These ads ran without a disclaimer,≤100,1
285530825204,Klitschko,These ads ran without a disclaimer,≤100,1
107441672063262,MRS Universe Asia USA 2022,These ads ran without a disclaimer,≤100,1
274394006605216,History A2Z Magazine,These ads ran without a disclaimer,≤100,1
130369030334301,KidsRights,These ads ran without a disclaimer,≤100,1
101715608808670,Judgment Day: Angel of God,These ads ran without a disclaimer,≤100,2