Page ID,Page name,Disclaimer,Amount spent (USD),Number of ads in Library
675823195926658,Get Rid Ah Dem,Get Rid Ah Dem,≤100,2
335129206031,New Democratic Party,New Democratic Party,≤100,2
168781357007535,Kay R.A Bacchus Baptiste For WSG,Kamal Bacchus-Browne,≤100,3
131189377574,MDPI,These ads ran without a disclaimer,≤100,1
101715608808670,Judgment Day: Angel of God,These ads ran without a disclaimer,≤100,1
100374392742057,Weregreenly- Magazine,These ads ran without a disclaimer,≤100,2
167810553565549,Conor O'Neill - The Everyday Athlete Program,These ads ran without a disclaimer,≤100,2