Page ID,Page name,Disclaimer,Amount spent (THB),Number of ads in Library
327274740648929,แคน อติรุจ,These ads ran without a disclaimer,10400,1
161651553861945,Amnesty International Thailand,Amnesty International Thailand,8985,19
475355145913095,ข่าวหุ้นธุรกิจ - Kaohoon,These ads ran without a disclaimer,2464,1
108515294626891,สอบข้าราชการท้องถิ่น By Thurakan,สอบข้าราชการท้องถิ่น By Thurakan,1628,2
345127652279503,มูลนิธิสากลเพื่อคนพิการ,มูลนิธิสากลเพื่อคนพิการ,1375,4
111341764925564,สำนักสนับสนุนการพัฒนาระบบสุขภาพ - สำนัก 7 สสส.,สำนักสนับสนุนการพัฒนาระบบสุขภาพ - สำนัก 7 สสส.,1204,10
2147352858864607,เตรียมสอบบรรจุ ข้าราชการท้องถิ่นและครูผู้ช่วย อปท.,These ads ran without a disclaimer,1172,1
1105604039583762,Line One สว.นท. ขอเชิญส่งประวัติ ส่วนตัว องค์กร เพื่อเข้ารับรางวัลประจำปี,Line One สว.นท. ขอเชิญส่งประวัติ ส่วนตัว องค์กร เพื่อเข้ารับรางวัลประจำปี,929,1
480222865705980,สรรเพชญ บุญญามณี,สรรเพชญ บุญญามณี,774,1
109552337467130,THE STANDARD WEALTH,"THE STANDARD CO., LTD",693,1
104571979194914,ปานทิพย์  พิมพ์พิชชา  ชัยศุภกิจเจริญ,ปานทิพย์  พิมพ์พิชชา  ชัยศุภกิจเจริญ,691,4
622674297897819,Screenshirt2020,Screenshirt2020,638,1
177948972256358,เอกนัฏ พร้อมพันธุ์ (ขิง),เอกนัฏ พร้อมพันธุ์ (ขิง),609,2
1647814138801784,Physiogel Thailand,These ads ran without a disclaimer,588,3
651699931624315,Techsauce,Techsauce,566,2
105125715202609,ส.ส.ไผ่ ลิกค์,ส.ส.ไผ่ ลิกค์,561,6
972019486321939,บู้ จเด็ศ จันทรา,บู้ จเด็ศ จันทรา,558,4
178577273067499,Coke Promotion by Thainamthip,These ads ran without a disclaimer,543,3
190744968374504,British Council Thailand English,These ads ran without a disclaimer,502,2
295129834227671,Unicharm Pet,These ads ran without a disclaimer,470,3
104769961794110,อินทรัตน์ ยอดบางเตย,อินทรัตน์ ยอดบางเตย,458,10
104393812499502,ชีทสรุปกฎหมาย สำหรับสอบราชการ พนักงานราชการ by.kantap,ชีทสรุปกฎหมาย สำหรับสอบราชการ พนักงานราชการ by.kantap,414,2
104553005992573,Short Note & Sheet สรุปสอบข้าราชการ และใบงาน,Short Note & Sheet สรุปสอบข้าราชการ และใบงาน,413,2
106500602280120,เตรียมสอบข้อราชการท้องถิ่น อปท. กพ.,เตรียมสอบข้อราชการท้องถิ่น อปท. กพ.,387,1
106151945819870,Dr.Fon clinic หาดใหญ่,Dr.Fon clinic หาดใหญ่,312,4
111914873805471,AIS Shop Central Eastville,These ads ran without a disclaimer,299,1
105838817755256,วงศ์อะเคื้อ บุญศล - กิ่งแก้ว,วงศ์อะเคื้อ บุญศล - กิ่งแก้ว,284,1
101903785231136,นายกไก่กังวาล ศักดิ์ชัย พิศาลผล,นายกไก่กังวาล ศักดิ์ชัย พิศาลผล,264,7
107406281857759,Graph Dental คลินิกทันตกรรมกราฟ สุขาภิบาล5-สายไหม,These ads ran without a disclaimer,255,6
100624122148338,โรงพยาบาลรวมใจรักษ์ สุขุมวิท 62 Ruamjairak Hospital Sukhumvit 62,โรงพยาบาลรวมใจรักษ์ สุขุมวิท 62 Ruamjairak Hospital Sukhumvit 62,255,25
102895935319115,วิพุธ ศรีวะอุไร - Viput Srivaurai,วิพุธ ศรีวะอุไร - Viput Srivaurai,229,2
108876478142078,Maxtive Banana,These ads ran without a disclaimer,203,2
110931780694333,LAGOM,These ads ran without a disclaimer,195,1
231701717614410,ชายโช วินเทจ,These ads ran without a disclaimer,188,1
1683658098593742,THE STANDARD,"THE STANDARD CO., LTD",180,1
539119526485380,ทนายใหญ่ ธิมาชัย,ทนายใหญ่ ธิมาชัย,173,1
174738095989909,Pichai Naripthaphan,These ads ran without a disclaimer,170,1
234345809961492,ส.ส.จ๋า - วชิราภรณ์ กาญจนะ,ส.ส.จ๋า - วชิราภรณ์ กาญจนะ,162,1
107612328588715,The Voters,The Voters,136,7
1707343086190560,Modish Food Design,These ads ran without a disclaimer,135,2
108078728711599,Dr.Fon clinic -หาดใหญ่,Dr.Fon clinic -หาดใหญ่,132,2
100222561935335,สจ.เอกชัย สืบสารคาม,สจ.เอกชัย สืบสารคาม,120,1
101876555117469,OT Design รับออกแบบและผลิตเสื้อพิมพ์ลาย เสื้อบริษัท เสื้อกีฬา ราคาโรงงาน,These ads ran without a disclaimer,104,1
140106746161119,นิวมิตซูหาดใหญ่ - ผู้จำหน่ายรถมิตซูบิชิ หาดใหญ่ สงขลา,นิวมิตซูหาดใหญ่ - ผู้จำหน่ายรถมิตซูบิชิ หาดใหญ่ สงขลา,103,1
110766468644579,อนันต์ ปรีดาสุทธิจิตต์,อนันต์ ปรีดาสุทธิจิตต์,102,1
183824431635928,Ensure,Ensure,101,1
418729291509368,สถาบันปรีดี พนมยงค์ Pridi Banomyong Institute,สถาบันปรีดี พนมยงค์ Pridi Banomyong Institute,≤100,1
106804542303183,สำนักงานกฎหมายทนายใหญ่,สำนักงานกฎหมายทนายใหญ่,≤100,2
856383837771145,รับสมัครนักศึกษา มหาวิทยาลัยกรุงเทพธนบุรี by ดร.หวาน,These ads ran without a disclaimer,≤100,1
190923294988741,สอบครูผู้ช่วยนะ,สอบครูผู้ช่วยนะ,≤100,1
108992755009125,Social Diver,Social Diver,≤100,1
112084256875807,ศรัณย์วุฒิ ศรัณย์เกตุ,ศรัณย์วุฒิ ศรัณย์เกตุ,≤100,1
572592940087101,คณพลคนกันเอง,คณพลคนกันเอง,≤100,1
101596418909602,Nuuw นัว ผงนมซินไบโอติก ที่ไม่ได้มาจากสัตว์ หอม มัน อร่อย ไฟเบอร์เน้นๆ,These ads ran without a disclaimer,≤100,1
104632334568638,พรรคก้าวไกล สงขลา,พรรคก้าวไกล สงขลา,≤100,1
109968945220121,เก่งได้ อะคาเดมี่,These ads ran without a disclaimer,≤100,2
340110720173014,SaveThaiCuts,SaveThaiCuts,≤100,1
114914794432449,กฎหมายใช้สอบราชการ by Æ+,กฎหมายใช้สอบราชการ by Æ+,≤100,1
108873595424804,กลุ่มพลังหนุ่ม,กลุ่มพลังหนุ่ม,≤100,1
1438893919482996,MB Copy ถ่ายเอกสาร เข้าเล่มวิทยานิพนธ์ ราคาถูก พระราม7,These ads ran without a disclaimer,≤100,1
2363127037346553,TT Insurance Broker,These ads ran without a disclaimer,≤100,1
2263098807292933,ทนายศฤงคาร  ข่ายสุวรรณ์,These ads ran without a disclaimer,≤100,1
107501497800874,Shi-Tori Thailand,These ads ran without a disclaimer,≤100,1
109111191988463,Seishin Izakaya - ร้านอาหารญี่ปุ่น เซชิน อิซากายะ ราชเทวี,These ads ran without a disclaimer,≤100,1
112115945016340,เบส ณัฐศักดิ์ หงษ์ทอง - Nattasak hongtong,เบส ณัฐศักดิ์ หงษ์ทอง - Nattasak hongtong,≤100,1
194806671454828,นายศาสตรา ศรีปาน - Sarttra Sripan,นายศาสตรา ศรีปาน - Sarttra Sripan,≤100,1
1798166090408487,ผลิตและจำหน่ายน้ำดื่ม และรับสร้างแบรนด์น้ำดื่มเชียงราย-พะเยา,These ads ran without a disclaimer,≤100,1
333794970138725,Gen.Bunchon - บัญชร ชวาลศิลป์,Gen.Bunchon - บัญชร ชวาลศิลป์,≤100,2
106114488852497,บรามือโอบของแท้ งานนำเข้า.v2,These ads ran without a disclaimer,≤100,1
106664485191987,EDGE Invest,EDGE Invest,≤100,1
105069437905215,เสื้อผ้า style ploy,These ads ran without a disclaimer,≤100,1
1466273283637782,XChange English ติว TOEIC TOEFL,These ads ran without a disclaimer,≤100,1
159926697949888,ทันข่าว Today,These ads ran without a disclaimer,≤100,2
382058822189907,Phufa Resthome,These ads ran without a disclaimer,≤100,4
305834849464113,เทใจ - TaejaiDotcom,These ads ran without a disclaimer,≤100,1
30911162508,Forbes,These ads ran without a disclaimer,≤100,1
100044162063101,Alex Salmond,These ads ran without a disclaimer,≤100,1
106403067788374,Buzz World,These ads ran without a disclaimer,≤100,1
137412866820,RSL Awards,These ads ran without a disclaimer,≤100,1
405199520209766,The Belt and Road News Network,These ads ran without a disclaimer,≤100,1
104762075732099,Fany Pineda,These ads ran without a disclaimer,≤100,1