Page ID,Page name,Disclaimer,Amount spent (NZD),Number of ads in Library
337477311451,New Zealand Labour Party,NZ Parliamentary Service on behalf of New Zealand Labour Party,7490,17
173912362663564,Electoral Commission NZ,Electoral Commission NZ,1939,14
183355881680015,New Zealand National Party,New Zealand National Party,1689,172
104174354363267,Christopher Luxon,New Zealand National Party,1044,10
11870725774,Greenpeace Aotearoa,Greenpeace NZ,1025,4
705422666171288,Chris Bishop,Chris Bishop,882,5
116362033529,Amnesty International Aotearoa New Zealand,Amnesty International Aotearoa New Zealand,764,6
1966234280281774,Brooke van Velden MP,ACT,563,9
371913763842,Te Kāhui Tika Tangata Human Rights Commission,Te Kāhui Tika Tangata Human Rights Commission,495,6
106952008971755,Catherine Wedd for Tukituki,Catherine Wedd for Tukituki,417,6
120703687692577,Mining Means Progress,Straterra Limited,378,18
103881760966661,Gen Less,Energy Efficiency & Conservation Authority,376,1
105370978007709,Katie Nimon for Napier,Katie Nimon for Napier,370,3
110613705109260,Independent Electoral Review - He Arotake Pōtitanga Motuhake,Independent Electoral Review,331,2
100278988277160,Simon Watts MP for North Shore,North Shore National Party,313,2
209221986221719,Nicola Willis MP,Nicola Willis MP,287,6
165702023478421,Family First New Zealand,Family First New Zealand,275,1
106157572429609,Cameron Brewer for Upper Harbour,Cameron Brewer for Upper Harbour,256,12
106159648977980,Suze Redmayne for Rangitīkei,Suze Redmayne for Rangitikei,229,2
120853907618462,Mahesh Muralidhar for Auckland Central,Mahesh Muralidhar for Auckland Central,222,51
92043134118,ACT,ACT,221,17
37547788323,UNICEF Aotearoa,UNICEF Aotearoa,220,2
107777965524870,Frances Hughes for Mana,New Zealand National Party (Mana Electorate),193,8
100272638114473,Tim Costley for Ōtaki,Ōtaki National Party,181,6
102887312771425,Greg Fleming,Greg Fleming for Maungakiekie,176,36
114961458268104,The Integrity Institute,The Integrity Institute,156,5
116450041373720,Siva Kilari for Manurewa,Manurewa National Party,151,3
104319172596371,Blair Cameron for Nelson,Blair Cameron,145,8
113846130364869,Rima Nakhle for Takanini,Rima Nakhle for Takanini,134,21
74410368422,Mental Health Foundation of New Zealand,Mental Health Foundation,129,6
111518076963780,Nicola Grigg MP,Parliamentary Services NZ on behalf of Nicola Grigg MP,125,3
175954932952,WWF New Zealand,WWF New Zealand,106,1
1281262645251755,Hobson's Pledge,Hobson's Pledge,≤100,8
105534772373969,NZ News Essentials,NZ News Essentials,≤100,3
111518076963780,Nicola Grigg MP,New Zealand National Party,≤100,2
112286851853300,Scott Sheeran for Wellington Central,"S Sheeran, 41 Pipitea Street, Wellington",≤100,2
121956660842544,Grant McCallum,New Zealand National Party (Northland Electorate),≤100,10
123375421154267,Duncan Webb Labour MP for Christchurch Central,NZ Parliamentary Service on behalf of Duncan Webb MP,≤100,1
23625700722,Oxfam,Oxfam Aotearoa,≤100,4
110909661534199,The Common Room NZ,The Common Room NZ,≤100,2
109325357303193,Sarah Pallett - MP for Ilam,NZ Parliamentary Service on behalf of Sarah Pallett MP,≤100,1
451907931984042,Speak Up For Women NZ,Speak Up For Women NZ,≤100,1
179342172711193,Dan Bidois,Dan Bidois for Northcote,≤100,1
189782211062735,Environment Canterbury,Environment Canterbury,≤100,3
100113565101028,Vanushi Walters MP,NZ Parliamentary Service on behalf of Vanushi Walters MP,≤100,4
564453323744421,TOP - The Opportunities Party,TOP - The Opportunities Party,≤100,2
1294334830681468,Forest & Bird Youth,Forest & Bird,≤100,1
346186225761296,Erica Stanford MP,Erica Stanford MP,≤100,2
104523225895525,Huihui Mai Greater Christchurch,Greater Christchurch Partnership,≤100,4
424806334290059,New Zealand Taxpayers' Union,New Zealand Taxpayers' Union,≤100,2
403868133556427,Palestine Solidarity Network Aotearoa - PSNA,Palestine Solidarity Network Aotearoa,≤100,3
160855903938854,Megan Woods - MP for Wigram,NZ Parliamentary Service on behalf of Megan Woods MP,≤100,3
196967540964595,Mindful Money,Mindful Money,≤100,1
100696438234003,Dale Stephens for Christchurch Central,Dale Stephens for Christchurch Central,≤100,1
103021582757731,Ankit Bansal for Palmerston North,Ankit Bansal for Palmerston North,≤100,1
340956962955027,Steph Lewis MP for Whanganui,"NZ Labour Party, Auth by R Salmond, 160 Willis St WLG",≤100,1
19648092895,Tearfund New Zealand,Tearfund New Zealand,≤100,7
149519831907669,Raf Manji,The Opportunities Party,≤100,2
102857559488426,Andrew Hoggard for ACT,ACT,≤100,4
393662284000045,New Zealand Listener,These ads ran without a disclaimer,≤100,1
117930708298273,Hamilton City Council,Hamilton City Council,≤100,3
106636689109962,Tom Rutherford for Bay of Plenty,Tom Rutherford for Bay of Plenty,≤100,1
282174425155343,Rotorua Lakes Council,Rotorua Lakes Council,≤100,1
105523081921584,JC Caridad,These ads ran without a disclaimer,≤100,1
1846207688941551,Ministry for the Environment,Ministry for the Environment,≤100,5
110974094005509,Nicole McKee MP,ACT,≤100,4
201340000036663,Ashburton District Council,Ashburton District Council,≤100,2
171901233444420,Mel Courtney - Nelson City Councillor,Mel Courtney,≤100,1
305655596286980,Paul Goldsmith,NZ Parliamentary Service on behalf of Paul Goldsmith MP,≤100,1
1591672150854791,The Doctors NZ,Green Cross Health,≤100,2
134871109877812,Save the Children New Zealand,Save the Children New Zealand,≤100,1
185590638873,NZHL Home Loans / Insurance,NZHL Home Loans / Insurance,≤100,14
104411054853609,Mark Cameron - ACT List MP,ACT,≤100,4
10779081371,Green Party of Aotearoa New Zealand,The NZ Parliamentary Service on behalf of the Green Party,≤100,1
114731636915763,Simon Court MP,the Parliamentary Service on behalf of ACT New Zealand,≤100,1
100836489646592,Rosemary Bourke for Māngere,Rosemary Bourke for Māngere,≤100,2
107937407609923,Arena Williams MP,Arena Williams MP,≤100,1
109145321007464,Groundswell NZ,Groundswell NZ,≤100,1
100372253091292,David Meades for ICC,David Meades for ICC,≤100,2
162019810410,Focus on the Family New Zealand,Focus on the Family New Zealand,≤100,1
110077017479600,One Sun in the Sky,One Sun in the Sky,≤100,1
291373147558098,LIC,LIC,≤100,1
119798114390625,Tracy Summerfield for Wigram,Tracy Summerfield for Wigram,≤100,1
103549809343092,Miles Anderson for Waitaki,Miles Anderson for Waitaki,≤100,1
108056570909783,Electra Business Breakfast,Electra Business Breakfast,≤100,1
73970658023,International Rescue Committee,These ads ran without a disclaimer,≤100,7
108234101885618,Naashon,These ads ran without a disclaimer,≤100,1
105681068874945,Ag Matters,New Zealand Agricultural Greenhouse Gas Research Centre,≤100,1
2664407520240811,VUW International Socialists,ISO Te Whanganui-a-Tara branch,≤100,2
671210776237827,Wellington Property Investors Association,Wellington Property Investors Association,≤100,1
107937407609923,Arena Williams MP,NZ Parliamentary Service on behalf of Arena Williams MP,≤100,1
159565807556574,Aroha Cruise In,These ads ran without a disclaimer,≤100,1
179853765497519,ADLS,ADLS,≤100,1
108625789179165,Soi Dog Foundation,These ads ran without a disclaimer,≤100,1
238970829620740,Culturesafe,These ads ran without a disclaimer,≤100,1
451936698281378,Cancer Society of Otago & Southland,Cancer Society Otago & Southland Division,≤100,1
203953359629611,Voice For Life,Voice for Life,≤100,1
285779926080,VUWSA - Victoria University of Wellington Students' Association,VUWSA - Victoria University of Wellington Students' Association,≤100,1
157136240296,Marie Claire UK,These ads ran without a disclaimer,≤100,1
101834344920077,It's in the Ballot,"Sam Somers, Producer of It's in the Ballot",≤100,1
109736720527010,Glen Bennett for New Plymouth,NZ Parliamentary Service on behalf of Glen Bennett MP,≤100,1
195454263800226,Julie Anne Genter MP,Julie Anne Genter MP,≤100,1
666096106755488,Banks Peninsula Greens,Aoraki Greens,≤100,1
110207703668553,Sean Rush a little less conversation a little more ACTion,These ads ran without a disclaimer,≤100,1
105101119113430,meghakayakfest,These ads ran without a disclaimer,≤100,1
104876578168457,Doc Journals - Magazine,These ads ran without a disclaimer,≤100,1
127916484044784,Scentroid,These ads ran without a disclaimer,≤100,1
205332123261241,Знакомства RusDate,These ads ran without a disclaimer,≤100,1
1220981994590364,FT Partner Content,These ads ran without a disclaimer,≤100,1
103016680138,SA Tourism Update Online,These ads ran without a disclaimer,≤100,1
100451933698060,AdVenture Communist,These ads ran without a disclaimer,≤100,1
216311481960,Bill Gates,These ads ran without a disclaimer,≤100,1
1439364926329185,Animal Matters,These ads ran without a disclaimer,≤100,1
104738335990390,Fnuhj-1234,These ads ran without a disclaimer,≤100,1
539616893109857,The Sentiment,These ads ran without a disclaimer,≤100,1
113058865019747,Cocobowls,These ads ran without a disclaimer,≤100,1