Page ID,Page name,Disclaimer,Amount spent (BSD),Number of ads in Library
114606549484,Philip Brave Davis,The Office of The Prime Minister Bahamas,463,3
1025152104235573,Team Cooper - Chester Cooper,Isaac Chester Cooper,≤100,1
108770575358900,Like that 20,These ads ran without a disclaimer,≤100,1
101715608808670,Judgment Day: Angel of God,These ads ran without a disclaimer,≤100,2
118981582262,Sid Roth's It's Supernatural,These ads ran without a disclaimer,≤100,1
338109312883186,China Xinhua News,These ads ran without a disclaimer,≤100,1