Page ID,Page name,Disclaimer,Amount spent (NZD),Number of ads in Library
337477311451,New Zealand Labour Party,NZ Parliamentary Service on behalf of New Zealand Labour Party,4909,44
116362033529,Amnesty International Aotearoa New Zealand,Amnesty International Aotearoa New Zealand,1916,28
213708008642996,Pink Shirt Day Aotearoa,Mental Health Foundation of New Zealand,1188,6
103881760966661,Gen Less,Energy Efficiency & Conservation Authority,1148,11
37547788323,UNICEF Aotearoa,UNICEF Aotearoa,1131,56
183355881680015,New Zealand National Party,New Zealand National Party,1036,154
106194579030381,Doctors Without Borders / Médecins Sans Frontières NZ,Doctors Without Borders / Médecins Sans Frontières NZ,961,15
1671535913101759,Entrust,Entrust New Zealand,864,19
173912362663564,Electoral Commission NZ,Electoral Commission NZ,818,9
11870725774,Greenpeace Aotearoa,Greenpeace NZ,782,3
341865911020,ASB Bank,ASB Bank Ltd,743,3
424806334290059,New Zealand Taxpayers' Union,New Zealand Taxpayers' Union,384,11
92043134118,ACT,ACT,310,5
92043134118,ACT,the Parliamentary Service on behalf of ACT New Zealand,257,3
19648092895,Tearfund New Zealand,Tearfund New Zealand,232,24
175954932952,WWF New Zealand,WWF New Zealand,213,1
110910531830985,David MacLeod for New Plymouth,"David MacLeod, National Party Candidate for the New Plymouth Electorate",173,2
689146908145006,Free Speech Union,Free Speech Union,159,6
1281262645251755,Hobson's Pledge,Hobson's Pledge,155,4
376006035816016,Storyworth,These ads ran without a disclaimer,118,10
123093944890778,Re: News,Re:,113,1
700679639984258,Kāpiti Coast District Council,Kāpiti Coast District Council,≤100,8
363940644005754,Shanan Halbert- MP for Northcote,NZ Parliamentary Service on behalf of Shanan Halbert MP,≤100,1
121956660842544,Grant McCallum,New Zealand National Party (Northland Electorate),≤100,8
107372172303903,,Aotearoa Covid Action,≤100,6
103294052679561,Kiwis Backing Farmers,Kiwis Backing Farmers,≤100,5
110909661534199,The Common Room NZ,The Common Room NZ,≤100,1
103503756036187,Housing Survey: Residential Choices and Constraints,The University of Waikato,≤100,7
117930708298273,Hamilton City Council,Hamilton City Council,≤100,6
175465665824008,Queenstown NZ,Queenstown NZ,≤100,6
600749256636478,Tauranga City Council,Tauranga City Council,≤100,4
110186134060806,Fairness in Focus,Medicines New Zealand,≤100,16
346186225761296,Erica Stanford MP,Erica Stanford MP,≤100,4
154331724631584,David Seymour,the Parliamentary Service on behalf of ACT New Zealand,≤100,3
185590638873,NZHL Home Loans / Insurance,NZHL Home Loans / Insurance,≤100,3
134871109877812,Save the Children New Zealand,Save the Children New Zealand,≤100,4
252001784959757,Te Whatu Ora ‐Taranaki,These ads ran without a disclaimer,≤100,1
196967540964595,Mindful Money,Mindful Money,≤100,2
106952008971755,Catherine Wedd for Tukituki,Catherine Wedd for Tukituki,≤100,1
123674487757196,New Zealand Nurses Organisation - NZNO,New Zealand Nurses Organisation - NZNO,≤100,2
100696438234003,Dale Stephens for Christchurch Central,Dale Aotea Stephens,≤100,1
704246323260758,New Zealand Certified Builders Association,New Zealand Certified Builders Association,≤100,2
102887312771425,Greg Fleming,Greg Fleming for Maungakiekie,≤100,9
197006887611387,Citizens Advice Bureau NZ,CABNZ,≤100,2
100432998389927,Karen Chhour MP,ACT,≤100,6
128872083791896,Greater Wellington,Greater Wellington,≤100,1
112431991697294,Animal Justice Party Aotearoa NZ,Animal Justice Party Aotearoa NZ,≤100,1
102354862041584,"It's time, Canterbury",Environment Canterbury,≤100,1
133758444883,Palmerston North City Council,Palmerston North City Council,≤100,1
101680052558214,Pendulum Life NZ,These ads ran without a disclaimer,≤100,1
417859725433,SAFE,Save Animals From Exploitation Incorperated,≤100,2
1591672150854791,The Doctors NZ,Green Cross Health,≤100,2
269047933236930,Horowhenua District Council,Horowhenua District Council,≤100,1
23625700722,Oxfam,Oxfam Aotearoa,≤100,2
1219528811471643,Ricardo Menéndez March MP,The NZ Parliamentary Service on behalf of Ricardo Menendez March MP,≤100,1
454557294670525,BayBuzz,BayBuzz,≤100,2
115195056703042,Rawiri Waititi MP,Parliamentary Service on Behalf of Rawiri Waititi MP,≤100,1
119344539932039,OptaPower,These ads ran without a disclaimer,≤100,9
109325357303193,Sarah Pallett - MP for Ilam,NZ Parliamentary Service on behalf of Sarah Pallett MP,≤100,1
182564675177680,Wellington City Council,Wellington City Council,≤100,1
203953359629611,Voice For Life,Voice for Life,≤100,2
105681068874945,Ag Matters,New Zealand Agricultural Greenhouse Gas Research Centre,≤100,1
201340000036663,Ashburton District Council,Ashburton District Council,≤100,3
10779081371,Green Party of Aotearoa New Zealand,The NZ Parliamentary Service on behalf of the Green Party,≤100,1
101181700276551,Salvation Army Women's Ministries,The Salvation Army Women's Ministries NZFTS,≤100,1
1820592608152727,Tim van de Molen MP,Parliamentary Service on behalf of Tim van de Molen - MP for Waikato,≤100,4
203463489667720,Western Bay of Plenty District Council,Western Bay of Plenty District Council,≤100,1
109882599038063,Queenstown Lakes District Council,Queenstown Lakes District Council,≤100,1
206932501046,Habitat for Humanity New Zealand,Habitat for Humanity New Zealand,≤100,1
640804959876113,Joseph Mooney MP for Southland,New Zealand Parliamentary Service on behalf of Joseph Mooney MP,≤100,2
108217938914452,Bill Dyet - Democracy NZ Candidate for Whangaparaoa,Democracy New Zealand,≤100,2
1772213219772184,Harete Hipango MP,"Parliamentary Service on behalf of Harete Hipango, Parliament Buildings, Wellington",≤100,2
100469685056180,Angela Roberts MP,NZ Parliamentary Service on behalf of Angela Roberts MP,≤100,2
205982996196509,St. Peter's on Willis (Wellington),St Peter's on Willis,≤100,1
122859715050319,Fleur Fitzsimons for Rongotai,Fleur Fitzsimons for Rongotai,≤100,1
309846686264586,Scott Watson Fact,Thomas John Watson,≤100,1
108625789179165,Soi Dog Foundation,These ads ran without a disclaimer,≤100,1
103045794397820,Selfawear,These ads ran without a disclaimer,≤100,1
384422538296426,United Palestinian Appeal - UPA,These ads ran without a disclaimer,≤100,2
110600578614349,Stephanie Rodgers for Ōhāriu,Stephanie Rodgers for Ōhāriu,≤100,1
106743391918909,Charlie van gorkumm,These ads ran without a disclaimer,≤100,1
150830641743673,Tomplay,These ads ran without a disclaimer,≤100,1
1589154051350606,FOZ - Friends of Zion Museum,These ads ran without a disclaimer,≤100,1
117039841320523,Big Pink Youth Dialogue,These ads ran without a disclaimer,≤100,1
1183996195056831,Sentient,These ads ran without a disclaimer,≤100,1
109095960492507,Wanderers Compass Travel Blog,These ads ran without a disclaimer,≤100,1
109023478608136,Ihabitantne,These ads ran without a disclaimer,≤100,1
106563664700230,Vertical Galilee House Of Prayer,These ads ran without a disclaimer,≤100,1
113864178277471,Eco Mindset,These ads ran without a disclaimer,≤100,6
100451933698060,AdVenture Communist,These ads ran without a disclaimer,≤100,2
100374392742057,Weregreenly- Magazine,These ads ran without a disclaimer,≤100,2
130136833750497,IELTS Official,These ads ran without a disclaimer,≤100,1
1883003128429295,Queer Majority,These ads ran without a disclaimer,≤100,2
109036555449915,Slenergy,These ads ran without a disclaimer,≤100,1