Page ID,Page name,Disclaimer,Amount spent (USD),Number of ads in Library
233603476696460,United Workers Party (Saint Lucia),United Workers Party,≤100,4
1409638192624686,Allen Chastanet,Allen Chastanet,≤100,1
108625789179165,Soi Dog Foundation,These ads ran without a disclaimer,≤100,1
130369030334301,KidsRights,These ads ran without a disclaimer,≤100,1
101082842736363,The world of reader,These ads ran without a disclaimer,≤100,1
103269898428170,Cooking 4 All Mode,These ads ran without a disclaimer,≤100,1