Page ID,Page name,Disclaimer,Amount spent (USD),Number of ads in Library
101379696174165,"صحيفة الجماهير ""اسبوعية-سياسية عامة""",an advertiser in Yemen,≤100,1
377711155937443,بن داراني باوزير للتجارة,an advertiser in Yemen,≤100,3
442306293169627,دائرة الشباب والرياضة في المجلس الانتقالي الجنوبي,an advertiser in Yemen,≤100,1
1283584115100446,Arab Youth Sustainable Development Network,These ads ran without a disclaimer,≤100,1
1883003128429295,Queer Majority,These ads ran without a disclaimer,≤100,1
299227550122220,Radio Cina Internazionale,These ads ran without a disclaimer,≤100,2
100205232489461,Luis,These ads ran without a disclaimer,≤100,1