Page ID,Page name,Disclaimer,Amount spent (GBP),Number of ads in Library
68793499001,UNICEF,UNICEF with Facebook Ad Credits,≤100,11
167878593236712,UNICEF en español,UNICEF con créditos publicitarios de Facebook,≤100,4
124252504303223,UNICEF (FR),UNICEF avec des crédits publicitaires Facebook,≤100,2
565225540184937,CGTN,These ads ran without a disclaimer,≤100,1
166178460072395,اليونيسف بالعربية - UNICEF in Arabic,اليونيسف باستخدام اعتمادات الإعلان على الفيسبوك,≤100,4
60516116431,Člověk v tísni,These ads ran without a disclaimer,≤100,1
101715608808670,Judgment Day: Angel of God,These ads ran without a disclaimer,≤100,1
31292782350,Deutschland.de,These ads ran without a disclaimer,≤100,1