Page ID,Page name,Disclaimer,Amount spent (USD),Number of ads in Library
108447974942666,Instituto de Bienestar Animal - El Salvador,Instituto de Bienestar Animal,≤100,3
100524251686344,Gustavo Acevedo,Gustavo Jose Acevedo Berganza,≤100,1
643513979193133,Unidos por Beatriz,Neuma,≤100,2
147858435252169,Embajada de los Estados Unidos en El Salvador,Embajada de Estados Unidos en El Salvador,≤100,5
321298057947622,Alcaldía Municipal de Ilopango,Edwin Mardoqueo Rivera Corvera,≤100,2
421104621589691,Cristian Flores,Presidencia de la República de El Salvador,≤100,4
1935947973198237,Alcaldía El Paraíso Chalatenango,Alexi Antonio Escalante Galdamez,≤100,1
104975560887876,Ministerio de Hacienda,These ads ran without a disclaimer,≤100,1
100541468870287,Alcaldía Municipal de Mejicanos,Alcaldía Municipal de Mejicanos,≤100,1
110383207395861,Alcaldía Municipal de Tecoluca,Arnulfo Isaias Montano Franco,≤100,1
92681788070,Caja de Crédito de Sonsonate,CAJA DE CREDITO DE SONSONATE,≤100,1
218914836773539,Amalia de Salinas,Amalia Leiva De Salinas,≤100,2
124389362289333,Sinai Hernandez,Sinai Hernandez,≤100,1
1825302654442616,Alcaldía Municipal de Ciudad Delgado,Karla Nohemy Chul Herrera,≤100,1
100478844819736,Alexander Guardado,Jonatan Fuentes,≤100,1
111684638235538,Soyapango UNIDO,Jacob Josafat Benitez Carrillo,≤100,1
100456328373090,Samuel Martínez,Erick Erazo,≤100,1
101710084928516,Dr. Bryan Orellana,Dr. Bryan Orellana,≤100,1
107756041807121,oxfam_es,These ads ran without a disclaimer,≤100,1
101878039328451,Lic Guzmán,Moises Guzman Duran,≤100,1
100568368335023,Fatima Esmeralda Ascencio,Esmeralda Asencio,≤100,2
217552831709715,Ministerio de Trabajo El Salvador,These ads ran without a disclaimer,≤100,1
101090099546806,greenlybachue,These ads ran without a disclaimer,≤100,1
102036678865142,zabalaaldia,These ads ran without a disclaimer,≤100,1
103597027708447,SuperPlanet Games,These ads ran without a disclaimer,≤100,1
1691657301053819,No Todos Los Veranos Tienen Que Ser Azules,These ads ran without a disclaimer,≤100,1
177854402389449,Imdosoc,These ads ran without a disclaimer,≤100,1
8002590959,Rainforest Action Network - RAN,These ads ran without a disclaimer,≤100,2
285530825204,Klitschko,These ads ran without a disclaimer,≤100,2
1759469477617716,Programa VIVE,These ads ran without a disclaimer,≤100,1
243385523091421,Competent Boards,These ads ran without a disclaimer,≤100,1