Page ID,Page name,Disclaimer,Amount spent (THB),Number of ads in Library
157659344260788,จุรินทร์ ลักษณวิศิษฏ์ Aoodda,Ruthaikan Tanomkerd,6375,12
100240152175449,ป้าโส FC by Tacina,Dunyawat  Bamrungchan,5069,94
102807719039442,พรรครวมไทยสร้างชาติ United Thai Nation Party,พรรครวมไทยสร้างชาติ United Thai Nation Party,3131,6
972019486321939,บู้ จเด็ศ จันทรา,จเด็ด จันทรา,2891,4
1639146799524292,Omi,These ads ran without a disclaimer,2786,1
345127652279503,มูลนิธิสากลเพื่อคนพิการ,มูลนิธิสากลเพื่อคนพิการ,2334,1
101274425792459,กิตติพงศ์ รวยฟูพันธ์ - ส.ก.ไอซ์ เขตทุ่งครุ,กิตติพงศ์ รวยฟูพันธ์ - ส.ก.ไอซ์ เขตทุ่งครุ,1891,5
105347558390671,นริสสร แสงแก้ว,These ads ran without a disclaimer,1763,1
257083724467673,ยุทธพล  อังกินันทน์,ยุทธพล อังกินันทน์,1755,5
296508406790,"Democrat Party, Thailand พรรคประชาธิปัตย์","Democrat Party, Thailand พรรคประชาธิปัตย์",1636,23
100624122148338,โรงพยาบาลรวมใจรักษ์ สุขุมวิท 62 Ruamjairak Hospital Sukhumvit 62,โรงพยาบาลรวมใจรักษ์ สุขุมวิท 62 Ruamjairak Hospital Sukhumvit 62,1584,154
112073738279329,สิงโต - ศักดิ์สิทธิ์ ขาวทอง,สิงโต - ศักดิ์สิทธิ์ ขาวทอง,1528,52
102721728305247,ทีมภูเก็ตหยัดได้,ทีมภูเก็ตหยัดได้,1402,4
111341764925564,สำนักสนับสนุนการพัฒนาระบบสุขภาพ - สำนัก 7 สสส.,สำนักสนับสนุนการพัฒนาระบบสุขภาพ - สำนัก 7 สสส.,1009,20
101535845426970,พรรคไทยสร้างไทย,พรรคไทยสร้างไทย,1000,1
1545656555649588,ดร.ยุ้ย เกษรา ธัญลักษณ์ภาคย์,These ads ran without a disclaimer,961,1
109552337467130,THE STANDARD WEALTH,"THE STANDARD CO., LTD",942,2
115922723434700,ครูเจพีสรุปย่อ for Teacher,ครูเจพีสรุปย่อ for Teacher,816,7
622674297897819,Screenshirt2020,Screenshirt2020,694,1
103986582301984,เนื้อ นา บุญ,Phrathanakrit Upachai,584,4
1811022602310855,พรรคก้าวไกล สุรินทร์,พรรคก้าวไกล,577,1
339810463063059,Conflict Of Nations : World War 3,These ads ran without a disclaimer,546,1
104427797605274,ดร.เฉลิมชัย ศรีอ่อน รัฐมนตรีว่าการกระทรวงเกษตรและสหกรณ์,ดร.เฉลิมชัย ศรีอ่อน รัฐมนตรีว่าการกระทรวงเกษตรและสหกรณ์,533,5
108508377637861,มุ้งจีบพระราม2 โรงงานผลิตมุ้งจีบ มุ้งลวด เหล็ดดัดทุกชนิด,กุหลาบ บัวสด,481,1
177948972256358,เอกนัฏ พร้อมพันธุ์ (ขิง),เอกนัฏ พร้อมพันธุ์ (ขิง),430,1
161651553861945,Amnesty International Thailand,Amnesty International Thailand,422,1
105421542338383,ไทม์ ดุลยวัฒน์ - หัวใจสีฟ้า,Dunyawat  Bamrungchan,412,10
2009054229181721,Nattacha Boonchaiinsawat - ณัฐชา บุญไชยอินสวัสดิ์,Lidear Nunarnan,404,2
414100949350619,ณัฐนันท์ กัลยาศิริ - ทนายบอน,ณัฐนันท์ กัลยาศิริ,402,4
103943018154038,บุญสืบ จันทร์แจ่มศรี ปุ๊,บุญสืบ จันทร์แจ่มศรี,390,3
112969264517494,เพ็ญพิสุทธิ์ จินตโสภณ - Penpisut Jintasophon,Vatcharapong Wongkom,389,6
103815855888467,โกหม่อง เพื่อไทย ภูเก็ต,โกหม่อง เพื่อไทย ภูเก็ต,382,3
567743816917663,The Article,The Article,364,9
241115389300595,คุณหญิงสุดารัตน์ เกยุราพันธุ์ Sudarat Keyuraphan,คุณหญิงสุดารัตน์ เกยุราพันธุ์ Sudarat Keyuraphan,362,2
109420251938390,"ชณทัต ปัทะมะภูวดล ""แม็ค""","ชณทัต ปัทะมะภูวดล ""แม็ค""",297,3
107612328588715,The Voters,สันติสุข กาญจนประกร,293,14
174674890018644,นายเดชอิศม์ ขาวทอง นายกชาย,Phetai Sretrairat,246,2
105313238236774,ตวงทอง ประดิษฐพร - สจ.ตวง,ตวงทอง ประดิษฐพร - สจ.ตวง,241,2
100255282807859,ก่อง อัณณพ อารีย์วงศ์สกุล,These ads ran without a disclaimer,234,1
626952517700280,ลิ้ม ศรัณยสัณฑ์ วีรกุลสุนทร ว่าที่ผู้สมัคร ส.ส. เขตจอมทอง พรรคเพื่อไทย,ลิ้ม ศรัณยสัณฑ์ วีรกุลสุนทร ว่าที่ผู้สมัคร ส.ส. เขตจอมทอง พรรคเพื่อไทย,228,1
190923294988741,สอบครูผู้ช่วยนะ,สอบครูผู้ช่วยนะ,221,3
601953326929372,ธัญวัจน์ กมลวงศ์วัฒน์ - Tunyawaj Kamolwongwat,Tunyawaj Kamolwongwat,198,4
101903329383104,ผู้การติ๊ก : จรัญ ขุนอินทร์,ผู้การติ๊ก : จรัญ ขุนอินทร์,197,1
102094145839391,Youth Fine Arts Company,These ads ran without a disclaimer,196,1
107535498701936,ธาม สมุทรานนท์ - Tharm Smuthranond,Yonlapat Wangsarn,195,1
715838732136310,ธนเดช เพ็งสุข - Tanadej Pengsuk,Tanadej Pengsuk,157,1
1105604039583762,Line One สว.นท. ขอเชิญส่งประวัติ ส่วนตัว องค์กร เพื่อเข้ารับรางวัลประจำปี,Suksan Booran,151,1
2091153520919518,อนุทิน ชาญวีรกูล,อนุทิน ชาญวีรกูล,147,5
105710145448698,Dr.Kultida  Maopech,กุลธิดา เหมาเพชร,136,1
379725072797606,พลังประชารัฐภูเก็ต ส.ส.นัทธี ถิ่นสาคู,พลังประชารัฐภูเก็ต ส.ส.นัทธี ถิ่นสาคู,131,1
106561034744198,ลอรี่ - พงศ์พล ยอดเมืองเจริญ,ลอรี่ - พงศ์พล ยอดเมืองเจริญ,122,2
613689015307999,ส.ส.แมน ฉัตรพันธ์ เดชกิจสุนทร,ส.ส.แมน ฉัตรพันธ์ เดชกิจสุนทร,109,1
105054525073867,เอ็ม ปิยะพงษ์ ปัญญาดา Piyapong Panyada,Piyapong Panyada,106,1
493026767870664,พรรคพลังประชารัฐ,พรรคพลังประชารัฐ,103,1
108839095327193,โก้จ๋าย เอกวานิช,โก้จ๋าย เอกวานิช,≤100,3
985820164804495,ธนาคารพัฒนาวิสาหกิจขนาดกลางและขนาดย่อมแห่งประเทศไทย,ธนาคารพัฒนาวิสาหกิจขนาดกลางและขนาดย่อมแห่งประเทศไทย,≤100,2
107828304882414,MUSEF Conference,These ads ran without a disclaimer,≤100,1
418729291509368,สถาบันปรีดี พนมยงค์ Pridi Banomyong Institute,สถาบันปรีดี พนมยงค์ Pridi Banomyong Institute,≤100,1
2263098807292933,ทนายศฤงคาร  ข่ายสุวรรณ์,Saringkan Khaisuwon,≤100,2
105289357813967,ปุณณ์สิริ บุณยเกียรติ - บีท - Punsiri Boonyakiat,ปุณณ์สิริ บุณยเกียรติ - บีท - Punsiri Boonyakiat,≤100,1
177948972256358,เอกนัฏ พร้อมพันธุ์ (ขิง),These ads ran without a disclaimer,≤100,2
110425134486071,แสนยากรณ์ สิงห์วีรธรรม : ชาติพัฒนากล้า บางซื่อ,แสนยากรณ์ สิงห์วีรธรรม : ชาติพัฒนากล้า บางซื่อ,≤100,1
116999510209463,Monkey Junior,These ads ran without a disclaimer,≤100,4
106013405453487,"""นายกโต้ง"" นายนพพร อุสิทธิ์ นายก อบจ.ชุมพร","""นายกโต้ง"" นายนพพร อุสิทธิ์ นายก อบจ.ชุมพร",≤100,2
102264295456894,Sirin Sanguansin - สิริน สงวนสิน,Lidear Nunarnan,≤100,2
107368818238731,Phattarapong Leelaphat - ภัทรพงษ์ ลีลาภัทร์,Phattarapong Leelaphat,≤100,1
106499716052338,BMW Millennium Auto,These ads ran without a disclaimer,≤100,6
277320192288594,โอม จิรชาติ,โอม จิรชาติ,≤100,1
107449532000210,ธิติวัฐ อดิศรพันธ์กุล - Thitiwat Adisornphankul,ธิติวัฐ อดิศรพันธ์กุล - Thitiwat Adisornphankul,≤100,1
112394371483043,เครื่องมือไฟฟ้า และเครื่องมือช่าง ราคาถูก by HomeLink V.1,Surin Phothiphoksampan,≤100,6
207416296817756,พรรคก้าวไกลราชบุรี - Move Forward Party,Unnop Sricharoenchai,≤100,1
467424870040934,ปกรณ์ อารีกุล,ปกรณ์ อารีกุล,≤100,1
526327500799853,China.org.cn,These ads ran without a disclaimer,≤100,1
101372342567471,ต้นกล้า จรยุทธ จตุรพรประสิทธิ์ - TonKla Chorayuth Chaturapornprasit,Chorayuth Chaturapornprasit,≤100,1
104763178714577,Gels MDPI,These ads ran without a disclaimer,≤100,1
103452138035457,蘇家欣 Brianna So,These ads ran without a disclaimer,≤100,1
104101828742637,SPACEBAR,These ads ran without a disclaimer,≤100,1
106996578831116,voiceofvoyce,These ads ran without a disclaimer,≤100,1
327115907736300,Asia Global Institute,These ads ran without a disclaimer,≤100,1
110919974897108,SH,These ads ran without a disclaimer,≤100,1
1452232881531908,UNICEF East Asia & Pacific,These ads ran without a disclaimer,≤100,2
173254003362613,WE ARE CHINA,These ads ran without a disclaimer,≤100,1
143661702404558,Хочу учиться в США,These ads ran without a disclaimer,≤100,1
112757083778788,"Economic Daily, China",These ads ran without a disclaimer,≤100,1
136176823413276,Eco-Business,These ads ran without a disclaimer,≤100,1
101715608808670,Judgment Day: Angel of God,These ads ran without a disclaimer,≤100,1
216311481960,Bill Gates,These ads ran without a disclaimer,≤100,2
189232005248268,CTG,These ads ran without a disclaimer,≤100,1