Page ID,Page name,Disclaimer,Amount spent (USD),Number of ads in Library
378004832575264,PEP Progressive Empowerment Party,Progressively Empowering People,≤100,1
592390457533601,Heliconia Foundation,Osei Jameel A Roach-Benn,≤100,1
105326350138425,Michelle Benjamin - MP for Moruga / Tableland,Michelle Benjamin,≤100,1
239503953056785,RAMPS Logistics,RAMPS Logistics,≤100,1
479285342097950,AeroTime,These ads ran without a disclaimer,≤100,1
105241441562595,Bob's Hideout - Stories,These ads ran without a disclaimer,≤100,2
643647332320553,Orient - أورينت,These ads ran without a disclaimer,≤100,1