Page ID,Page name,Disclaimer,Amount spent (USD),Number of ads in Library
100684072907553,𝙵𝚄𝚃𝚄𝚁 𝙿𝚁𝙴𝚂𝙸𝙳𝙴𝙽𝚃 _𝚉𝙰𝙺𝙰𝚁𝙸𝙰 𝙰𝙳𝙸𝚁𝙴 𝚃𝙸𝙴𝙽𝙳𝚁𝙴𝙱𝙴𝙾𝙶𝙾.,𝙵𝚄𝚃𝚄𝚁 𝙿𝚁𝙴𝚂𝙸𝙳𝙴𝙽𝚃 _𝚉𝙰𝙺𝙰𝚁𝙸𝙰 𝙰𝙳𝙸𝚁𝙴 𝚃𝙸𝙴𝙽𝙳𝚁𝙴𝙱𝙴𝙾𝙶𝙾.,≤100,2
1534293386675084,Ministère de la Justice et des Droits Humains,Ministère de la Justice et des Droits Humains,≤100,1
17043549797,MIT Technology Review,These ads ran without a disclaimer,≤100,2
529713137232746,RaGe,These ads ran without a disclaimer,≤100,1
475778355919914,BB - Best Bios,These ads ran without a disclaimer,≤100,1
2079497235397580,עופר גולדשטיין רואי חשבון - מיסוי בינלאומי,These ads ran without a disclaimer,≤100,1