Page ID,Page name,Disclaimer,Amount spent (USD),Number of ads in Library
675823195926658,Get Rid Ah Dem,Get Rid Ah Dem,≤100,1
335129206031,New Democratic Party,New Democratic Party,≤100,1
200480966638039,Supremacy 1914,These ads ran without a disclaimer,≤100,3
1102199946478493,Spotlight,These ads ran without a disclaimer,≤100,2
110463704610731,Cute Kiwi,These ads ran without a disclaimer,≤100,1
462848513792011,国家大剧院National Centre for the Performing Arts,These ads ran without a disclaimer,≤100,1